-- MySQL dump 10.13  Distrib 8.0.44, for Win64 (x86_64)
--
-- Host: localhost    Database: water_quality
-- ------------------------------------------------------
-- Server version	8.0.44

/*!40101 SET @OLD_CHARACTER_SET_CLIENT=@@CHARACTER_SET_CLIENT */;
/*!40101 SET @OLD_CHARACTER_SET_RESULTS=@@CHARACTER_SET_RESULTS */;
/*!40101 SET @OLD_COLLATION_CONNECTION=@@COLLATION_CONNECTION */;
/*!50503 SET NAMES utf8 */;
/*!40103 SET @OLD_TIME_ZONE=@@TIME_ZONE */;
/*!40103 SET TIME_ZONE='+00:00' */;
/*!40014 SET @OLD_UNIQUE_CHECKS=@@UNIQUE_CHECKS, UNIQUE_CHECKS=0 */;
/*!40014 SET @OLD_FOREIGN_KEY_CHECKS=@@FOREIGN_KEY_CHECKS, FOREIGN_KEY_CHECKS=0 */;
/*!40101 SET @OLD_SQL_MODE=@@SQL_MODE, SQL_MODE='NO_AUTO_VALUE_ON_ZERO' */;
/*!40111 SET @OLD_SQL_NOTES=@@SQL_NOTES, SQL_NOTES=0 */;

--
-- Table structure for table `clean_water_quality`
--

DROP TABLE IF EXISTS `clean_water_quality`;
/*!40101 SET @saved_cs_client     = @@character_set_client */;
/*!50503 SET character_set_client = utf8mb4 */;
CREATE TABLE `clean_water_quality` (
  `FIPS` int DEFAULT NULL,
  `EventId` int DEFAULT NULL,
  `Cruise` text,
  `Program` text,
  `Project` text,
  `Agency` text,
  `Source` text,
  `Station` int DEFAULT NULL,
  `SampleDate` text,
  `SampleTime` text,
  `TotalDepth` text,
  `UpperPycnocline` text,
  `LowerPycnocline` text,
  `Depth` int DEFAULT NULL,
  `Layer` text,
  `SampleType` text,
  `SampleReplicateType` text,
  `Parameter` text,
  `Qualifier` text,
  `MeasureValue` double DEFAULT NULL,
  `Unit` text,
  `Method` text,
  `Lab` text,
  `Problem` text,
  `PrecisionPC` text,
  `BiasPC` text,
  `Details` text,
  `Latitude` double DEFAULT NULL,
  `Longitude` double DEFAULT NULL,
  `TierLevel` text,
  `SampleDate_fixed` date DEFAULT NULL
) ENGINE=InnoDB DEFAULT CHARSET=utf8mb4 COLLATE=utf8mb4_0900_ai_ci;
/*!40101 SET character_set_client = @saved_cs_client */;

--
-- Dumping data for table `clean_water_quality`
--

LOCK TABLES `clean_water_quality` WRITE;
/*!40000 ALTER TABLE `clean_water_quality` DISABLE KEYS */;
INSERT INTO `clean_water_quality` VALUES (10001,610432,'NTN021','NTWQM','NTN','DEDNREC  ','DEDNREC',302031,'1/28/2021','10:36:00',NULL,'','',0,'S ','HVIC','S1','CHLA','',2.0336,'UG/L','L03','DEDNREC','','','','nan',38.84972,-75.67333,'T3','2021-01-28'),(10001,610433,'NTN021','NTWQM','NTN','DEDNREC  ','DEDNREC',302031,'2/2/2021','10:15:00',NULL,'','',0,'S ','HVIC','S1','CHLA','',3.7036,'UG/L','L03','DEDNREC','','','','nan',38.84972,-75.67333,'T3','2021-02-02'),(10001,610434,'NTN021','NTWQM','NTN','DEDNREC  ','DEDNREC',302031,'2/24/2021','9:17:00',NULL,'','',0,'S ','HVIC','S1','CHLA','',1.971,'UG/L','L03','DEDNREC','','','','nan',38.84972,-75.67333,'T3','2021-02-24'),(10001,610435,'NTN021','NTWQM','NTN','DEDNREC  ','DEDNREC',302031,'3/10/2021','9:03:00',NULL,'','',0,'S ','HVIC','S1','CHLA','',0.9905,'UG/L','L03','DEDNREC','','','','nan',38.84972,-75.67333,'T3','2021-03-10'),(10001,610436,'NTN021','NTWQM','NTN','DEDNREC  ','DEDNREC',302031,'4/20/2021','8:41:00',NULL,'','',0,'S ','HVIC','S1','CHLA','',12.3134,'UG/L','L03','DEDNREC','','','','nan',38.84972,-75.67333,'T3','2021-04-20'),(10001,610437,'NTN021','NTWQM','NTN','DEDNREC  ','DEDNREC',302031,'5/24/2021','8:29:00',NULL,'','',0,'S ','HVIC','S1','CHLA','',1.5218,'UG/L','L03','DEDNREC','','','','nan',38.84972,-75.67333,'T3','2021-05-24'),(10001,610438,'NTN021','NTWQM','NTN','DEDNREC  ','DEDNREC',302031,'6/15/2021','9:44:00',NULL,'','',0,'S ','HVIC','S1','CHLA','',1.7169,'UG/L','L03','DEDNREC','','','','nan',38.84972,-75.67333,'T3','2021-06-15'),(10001,610439,'NTN021','NTWQM','NTN','DEDNREC  ','DEDNREC',302031,'7/19/2021','8:24:00',NULL,'','',0,'S ','HVIC','S1','CHLA','',17.6588,'UG/L','L03','DEDNREC','','','','nan',38.84972,-75.67333,'T3','2021-07-19'),(10001,610440,'NTN021','NTWQM','NTN','DEDNREC  ','DEDNREC',302031,'8/25/2021','8:02:00',NULL,'','',0,'S ','HVIC','S1','CHLA','',1.9688,'UG/L','L03','DEDNREC','','','','nan',38.84972,-75.67333,'T3','2021-08-25'),(10001,610441,'NTN021','NTWQM','NTN','DEDNREC  ','DEDNREC',302031,'9/2/2021','8:04:00',NULL,'','',0,'S ','HVIC','S1','CHLA','',8.2509,'UG/L','L03','DEDNREC','','','','nan',38.84972,-75.67333,'T3','2021-09-02'),(10001,610442,'NTN021','NTWQM','NTN','DEDNREC  ','DEDNREC',302031,'9/22/2021','9:14:00',NULL,'','',0,'S ','HVIC','FS1','CHLA','',1.5396,'UG/L','L03','DEDNREC','','','','nan',38.84972,-75.67333,'T3','2021-09-22'),(10001,610442,'NTN021','NTWQM','NTN','DEDNREC  ','DEDNREC',302031,'9/22/2021','9:14:00',NULL,'','',0,'S ','HVIC','FS2','CHLA','',6.4483,'UG/L','L03','DEDNREC','','','','nan',38.84972,-75.67333,'T3','2021-09-22'),(10001,621707,'NTN022','NTWQM','NTN','DEDNREC  ','DEDNREC',302031,'10/18/2021','9:37:00',NULL,'','',0,'S ','HVIC','S1','CHLA','',4.2731,'UG/L','L03','DEDNREC','','','','nan',38.84972,-75.67333,'T3','2021-10-18'),(10001,621708,'NTN022','NTWQM','NTN','DEDNREC  ','DEDNREC',302031,'11/8/2021','7:25:00',NULL,'','',0,'S ','HVIC','S1','CHLA','',0.7233,'UG/L','L03','DEDNREC','','','','nan',38.84972,-75.67333,'T3','2021-11-08'),(10001,621709,'NTN022','NTWQM','NTN','DEDNREC  ','DEDNREC',302031,'12/15/2021','8:44:00',NULL,'','',0,'S ','HVIC','S1','CHLA','',2.609,'UG/L','L03','DEDNREC','','','','nan',38.84972,-75.67333,'T3','2021-12-15'),(10001,621710,'NTN022','NTWQM','NTN','DEDNREC  ','DEDNREC',302031,'1/26/2022','9:44:00',NULL,'','',0,'S ','HVIC','S1','CHLA','',1.5729,'UG/L','L03','DEDNREC','','','','nan',38.84972,-75.67333,'T3','2022-01-26'),(10001,621711,'NTN022','NTWQM','NTN','DEDNREC  ','DEDNREC',302031,'2/23/2022','8:10:00',NULL,'','',0,'S ','HVIC','S1','CHLA','',14.1708,'UG/L','L03','DEDNREC','','','','nan',38.84972,-75.67333,'T3','2022-02-23'),(10001,621712,'NTN022','NTWQM','NTN','DEDNREC  ','DEDNREC',302031,'3/21/2022','7:52:00',NULL,'','',0,'S ','HVIC','FS1','CHLA','',2.0075,'UG/L','L03','DEDNREC','','','','nan',38.84972,-75.67333,'T3','2022-03-21'),(10001,621712,'NTN022','NTWQM','NTN','DEDNREC  ','DEDNREC',302031,'3/21/2022','7:52:00',NULL,'','',0,'S ','HVIC','FS2','CHLA','',2.3209,'UG/L','L03','DEDNREC','','','','nan',38.84972,-75.67333,'T3','2022-03-21'),(10001,621713,'NTN022','NTWQM','NTN','DEDNREC  ','DEDNREC',302031,'4/7/2022','8:14:00',NULL,'','',0,'S ','HVIC','S1','CHLA','',4.6451,'UG/L','L03','DEDNREC','','','','nan',38.84972,-75.67333,'T3','2022-04-07'),(10001,621714,'NTN022','NTWQM','NTN','DEDNREC  ','DEDNREC',302031,'4/27/2022','8:30:00',NULL,'','',0,'S ','HVIC','S1','CHLA','',2.4521,'UG/L','L03','DEDNREC','','','','nan',38.84972,-75.67333,'T3','2022-04-27'),(10001,621715,'NTN022','NTWQM','NTN','DEDNREC  ','DEDNREC',302031,'5/18/2022','8:02:00',NULL,'','',0,'S ','HVIC','S1','CHLA','',1.532,'UG/L','L03','DEDNREC','','','','nan',38.84972,-75.67333,'T3','2022-05-18'),(10001,621716,'NTN022','NTWQM','NTN','DEDNREC  ','DEDNREC',302031,'6/15/2022','8:18:00',NULL,'','',0,'S ','HVIC','S1','CHLA','',5.6378,'UG/L','L03','DEDNREC','','','','nan',38.84972,-75.67333,'T3','2022-06-15'),(10001,621717,'NTN022','NTWQM','NTN','DEDNREC  ','DEDNREC',302031,'7/27/2022','11:45:00',NULL,'','',0,'S ','HVIC','S1','CHLA','',1.8727,'UG/L','L03','DEDNREC','','','','nan',38.84972,-75.67333,'T3','2022-07-27'),(10001,621718,'NTN022','NTWQM','NTN','DEDNREC  ','DEDNREC',302031,'8/24/2022','7:35:00',NULL,'','',0,'S ','HVIC','S1','CHLA','',5.565,'UG/L','L03','DEDNREC','','','','nan',38.84972,-75.67333,'T3','2022-08-24'),(10001,621719,'NTN022','NTWQM','NTN','DEDNREC  ','DEDNREC',302031,'9/29/2022','9:43:00',NULL,'','',0,'S ','HVIC','S1','CHLA','',2.4251,'UG/L','L03','DEDNREC','','','','nan',38.84972,-75.67333,'T3','2022-09-29'),(10001,610442,'NTN021','NTWQM','NTN','DEDNREC  ','DEDNREC',302031,'9/22/2021','9:14:00',NULL,'','',0,'S ','HVIC','FS1','CLW','',14.117,'MG/L','L02','DEDNREC','','','','nan',38.84972,-75.67333,'T3','2021-09-22'),(10001,610442,'NTN021','NTWQM','NTN','DEDNREC  ','DEDNREC',302031,'9/22/2021','9:14:00',NULL,'','',0,'S ','HVIC','FS2','CLW','',13.954,'MG/L','L02','DEDNREC','','','','nan',38.84972,-75.67333,'T3','2021-09-22'),(10001,610441,'NTN021','NTWQM','NTN','DEDNREC  ','DEDNREC',302031,'9/2/2021','8:04:00',NULL,'','',0,'S ','HVIC','S1','CLW','',5.754,'MG/L','L02','DEDNREC','','','','nan',38.84972,-75.67333,'T3','2021-09-02'),(10001,610440,'NTN021','NTWQM','NTN','DEDNREC  ','DEDNREC',302031,'8/25/2021','8:02:00',NULL,'','',0,'S ','HVIC','S1','CLW','',10.81,'MG/L','L02','DEDNREC','','','','nan',38.84972,-75.67333,'T3','2021-08-25'),(10001,610439,'NTN021','NTWQM','NTN','DEDNREC  ','DEDNREC',302031,'7/19/2021','8:24:00',NULL,'','',0,'S ','HVIC','S1','CLW','',24.414,'MG/L','L02','DEDNREC','','','','nan',38.84972,-75.67333,'T3','2021-07-19'),(10001,610436,'NTN021','NTWQM','NTN','DEDNREC  ','DEDNREC',302031,'4/20/2021','8:41:00',NULL,'','',0,'S ','HVIC','S1','CLW','',13.673,'MG/L','L02','DEDNREC','','','','nan',38.84972,-75.67333,'T3','2021-04-20'),(10001,610437,'NTN021','NTWQM','NTN','DEDNREC  ','DEDNREC',302031,'5/24/2021','8:29:00',NULL,'','',0,'S ','HVIC','S1','CLW','',14.254,'MG/L','L02','DEDNREC','','','','nan',38.84972,-75.67333,'T3','2021-05-24'),(10001,610438,'NTN021','NTWQM','NTN','DEDNREC  ','DEDNREC',302031,'6/15/2021','9:44:00',NULL,'','',0,'S ','HVIC','S1','CLW','',14.739,'MG/L','L02','DEDNREC','','','','nan',38.84972,-75.67333,'T3','2021-06-15'),(10001,610435,'NTN021','NTWQM','NTN','DEDNREC  ','DEDNREC',302031,'3/10/2021','9:03:00',NULL,'','',0,'S ','HVIC','S1','CLW','',13.697,'MG/L','L02','DEDNREC','','','','nan',38.84972,-75.67333,'T3','2021-03-10'),(10001,610434,'NTN021','NTWQM','NTN','DEDNREC  ','DEDNREC',302031,'2/24/2021','9:17:00',NULL,'','',0,'S ','HVIC','S1','CLW','',9.461,'MG/L','L02','DEDNREC','','','','nan',38.84972,-75.67333,'T3','2021-02-24'),(10001,610433,'NTN021','NTWQM','NTN','DEDNREC  ','DEDNREC',302031,'2/2/2021','10:15:00',NULL,'','',0,'S ','HVIC','S1','CLW','',16.753,'MG/L','L02','DEDNREC','','','','nan',38.84972,-75.67333,'T3','2021-02-02'),(10001,610432,'NTN021','NTWQM','NTN','DEDNREC  ','DEDNREC',302031,'1/28/2021','10:36:00',NULL,'','',0,'S ','HVIC','S1','CLW','',14.705,'MG/L','L02','DEDNREC','','','','nan',38.84972,-75.67333,'T3','2021-01-28'),(10001,621718,'NTN022','NTWQM','NTN','DEDNREC  ','DEDNREC',302031,'8/24/2022','7:35:00',NULL,'','',0,'S ','HVIC','S1','CLW','',15.295,'MG/L','L02','DEDNREC','','','','nan',38.84972,-75.67333,'T3','2022-08-24'),(10001,621717,'NTN022','NTWQM','NTN','DEDNREC  ','DEDNREC',302031,'7/27/2022','11:45:00',NULL,'','',0,'S ','HVIC','S1','CLW','',14.632,'MG/L','L02','DEDNREC','','','','nan',38.84972,-75.67333,'T3','2022-07-27'),(10001,621716,'NTN022','NTWQM','NTN','DEDNREC  ','DEDNREC',302031,'6/15/2022','8:18:00',NULL,'','',0,'S ','HVIC','S1','CLW','',8.533,'MG/L','L02','DEDNREC','','','','nan',38.84972,-75.67333,'T3','2022-06-15'),(10001,621715,'NTN022','NTWQM','NTN','DEDNREC  ','DEDNREC',302031,'5/18/2022','8:02:00',NULL,'','',0,'S ','HVIC','S1','CLW','',14.442,'MG/L','L02','DEDNREC','','','','nan',38.84972,-75.67333,'T3','2022-05-18'),(10001,621714,'NTN022','NTWQM','NTN','DEDNREC  ','DEDNREC',302031,'4/27/2022','8:30:00',NULL,'','',0,'S ','HVIC','S1','CLW','',13.781,'MG/L','L02','DEDNREC','','','','nan',38.84972,-75.67333,'T3','2022-04-27'),(10001,621713,'NTN022','NTWQM','NTN','DEDNREC  ','DEDNREC',302031,'4/7/2022','8:14:00',NULL,'','',0,'S ','HVIC','S1','CLW','',10.844,'MG/L','L02','DEDNREC','','','','nan',38.84972,-75.67333,'T3','2022-04-07'),(10001,621712,'NTN022','NTWQM','NTN','DEDNREC  ','DEDNREC',302031,'3/21/2022','7:52:00',NULL,'','',0,'S ','HVIC','FS2','CLW','',14.254,'MG/L','L02','DEDNREC','','','','nan',38.84972,-75.67333,'T3','2022-03-21'),(10001,621712,'NTN022','NTWQM','NTN','DEDNREC  ','DEDNREC',302031,'3/21/2022','7:52:00',NULL,'','',0,'S ','HVIC','FS1','CLW','',14.306,'MG/L','L02','DEDNREC','','','','nan',38.84972,-75.67333,'T3','2022-03-21'),(10001,621711,'NTN022','NTWQM','NTN','DEDNREC  ','DEDNREC',302031,'2/23/2022','8:10:00',NULL,'','',0,'S ','HVIC','S1','CLW','',15.37,'MG/L','L02','DEDNREC','','','','nan',38.84972,-75.67333,'T3','2022-02-23'),(10001,621710,'NTN022','NTWQM','NTN','DEDNREC  ','DEDNREC',302031,'1/26/2022','9:44:00',NULL,'','',0,'S ','HVIC','S1','CLW','',14.245,'MG/L','L02','DEDNREC','','','','nan',38.84972,-75.67333,'T3','2022-01-26'),(10001,621709,'NTN022','NTWQM','NTN','DEDNREC  ','DEDNREC',302031,'12/15/2021','8:44:00',NULL,'','',0,'S ','HVIC','S1','CLW','',11.469,'MG/L','L02','DEDNREC','','','','nan',38.84972,-75.67333,'T3','2021-12-15'),(10001,621708,'NTN022','NTWQM','NTN','DEDNREC  ','DEDNREC',302031,'11/8/2021','7:25:00',NULL,'','',0,'S ','HVIC','S1','CLW','',15.858,'MG/L','L02','DEDNREC','','','','nan',38.84972,-75.67333,'T3','2021-11-08'),(10001,621707,'NTN022','NTWQM','NTN','DEDNREC  ','DEDNREC',302031,'10/18/2021','9:37:00',NULL,'','',0,'S ','HVIC','S1','CLW','',16.054,'MG/L','L02','DEDNREC','','','','nan',38.84972,-75.67333,'T3','2021-10-18'),(10001,621719,'NTN022','NTWQM','NTN','DEDNREC  ','DEDNREC',302031,'9/29/2022','9:43:00',NULL,'','',0,'S ','HVIC','S1','CLW','',16.095,'MG/L','L02','DEDNREC','','','','nan',38.84972,-75.67333,'T3','2022-09-29'),(10001,610432,'NTN021','NTWQM','NTN','DEDNREC  ','DEDNREC',302031,'1/28/2021','10:36:00',NULL,'','',0,'S ','ISM','M1','DO','',11.8,'MG/L','F02','','','','','nan',38.84972,-75.67333,'T3','2021-01-28'),(10001,610433,'NTN021','NTWQM','NTN','DEDNREC  ','DEDNREC',302031,'2/2/2021','10:15:00',NULL,'','',0,'S ','ISM','M1','DO','',11.27,'MG/L','F02','','','','','nan',38.84972,-75.67333,'T3','2021-02-02'),(10001,610434,'NTN021','NTWQM','NTN','DEDNREC  ','DEDNREC',302031,'2/24/2021','9:17:00',NULL,'','',0,'S ','ISM','M1','DO','',10.97,'MG/L','F02','','','','','nan',38.84972,-75.67333,'T3','2021-02-24'),(10001,610435,'NTN021','NTWQM','NTN','DEDNREC  ','DEDNREC',302031,'3/10/2021','9:03:00',NULL,'','',0,'S ','ISM','M1','DO','',10.48,'MG/L','F02','','','','','nan',38.84972,-75.67333,'T3','2021-03-10'),(10001,610438,'NTN021','NTWQM','NTN','DEDNREC  ','DEDNREC',302031,'6/15/2021','9:44:00',NULL,'','',0,'S ','ISM','M1','DO','',8.55,'MG/L','F02','','','','','nan',38.84972,-75.67333,'T3','2021-06-15'),(10001,610437,'NTN021','NTWQM','NTN','DEDNREC  ','DEDNREC',302031,'5/24/2021','8:29:00',NULL,'','',0,'S ','ISM','M1','DO','',7.7,'MG/L','F02','','','','','nan',38.84972,-75.67333,'T3','2021-05-24'),(10001,610436,'NTN021','NTWQM','NTN','DEDNREC  ','DEDNREC',302031,'4/20/2021','8:41:00',NULL,'','',0,'S ','ISM','M1','DO','',10.39,'MG/L','F02','','','','','nan',38.84972,-75.67333,'T3','2021-04-20'),(10001,610439,'NTN021','NTWQM','NTN','DEDNREC  ','DEDNREC',302031,'7/19/2021','8:24:00',NULL,'','',0,'S ','ISM','M1','DO','',8.2,'MG/L','F02','','','','','nan',38.84972,-75.67333,'T3','2021-07-19'),(10001,610440,'NTN021','NTWQM','NTN','DEDNREC  ','DEDNREC',302031,'8/25/2021','8:02:00',NULL,'','',0,'S ','ISM','M1','DO','',7.51,'MG/L','F02','','','','','nan',38.84972,-75.67333,'T3','2021-08-25'),(10001,610441,'NTN021','NTWQM','NTN','DEDNREC  ','DEDNREC',302031,'9/2/2021','8:04:00',NULL,'','',0,'S ','ISM','M1','DO','',5.49,'MG/L','F02','','','','','nan',38.84972,-75.67333,'T3','2021-09-02'),(10001,610442,'NTN021','NTWQM','NTN','DEDNREC  ','DEDNREC',302031,'9/22/2021','9:14:00',NULL,'','',0,'S ','ISM','M1','DO','',8.81,'MG/L','F02','','','','','nan',38.84972,-75.67333,'T3','2021-09-22'),(10001,610442,'NTN021','NTWQM','NTN','DEDNREC  ','DEDNREC',302031,'9/22/2021','9:14:00',NULL,'','',0,'S ','ISM','M2','DO','',8.81,'MG/L','F02','','','','','nan',38.84972,-75.67333,'T3','2021-09-22'),(10001,621707,'NTN022','NTWQM','NTN','DEDNREC  ','DEDNREC',302031,'10/18/2021','9:37:00',NULL,'','',0,'S ','ISM','M1','DO','',8.68,'MG/L','F02','','','','','nan',38.84972,-75.67333,'T3','2021-10-18'),(10001,621708,'NTN022','NTWQM','NTN','DEDNREC  ','DEDNREC',302031,'11/8/2021','7:25:00',NULL,'','',0,'S ','ISM','M1','DO','',10.06,'MG/L','F02','','','','','nan',38.84972,-75.67333,'T3','2021-11-08'),(10001,621709,'NTN022','NTWQM','NTN','DEDNREC  ','DEDNREC',302031,'12/15/2021','8:44:00',NULL,'','',0,'S ','ISM','M1','DO','',11.32,'MG/L','F02','','','','','nan',38.84972,-75.67333,'T3','2021-12-15'),(10001,621710,'NTN022','NTWQM','NTN','DEDNREC  ','DEDNREC',302031,'1/26/2022','9:44:00',NULL,'','',0,'S ','ISM','M1','DO','',12.13,'MG/L','F02','','','','','nan',38.84972,-75.67333,'T3','2022-01-26'),(10001,621711,'NTN022','NTWQM','NTN','DEDNREC  ','DEDNREC',302031,'2/23/2022','8:10:00',NULL,'','',0,'S ','ISM','M1','DO','',9.53,'MG/L','F02','','','','','nan',38.84972,-75.67333,'T3','2022-02-23'),(10001,621712,'NTN022','NTWQM','NTN','DEDNREC  ','DEDNREC',302031,'3/21/2022','7:52:00',NULL,'','',0,'S ','ISM','M1','DO','',10.55,'MG/L','F02','','','','','nan',38.84972,-75.67333,'T3','2022-03-21'),(10001,621713,'NTN022','NTWQM','NTN','DEDNREC  ','DEDNREC',302031,'4/7/2022','8:14:00',NULL,'','',0,'S ','ISM','M1','DO','',8.59,'MG/L','F02','','','','','nan',38.84972,-75.67333,'T3','2022-04-07'),(10001,621712,'NTN022','NTWQM','NTN','DEDNREC  ','DEDNREC',302031,'3/21/2022','7:52:00',NULL,'','',0,'S ','ISM','M2','DO','',10.55,'MG/L','F02','','','','','nan',38.84972,-75.67333,'T3','2022-03-21'),(10001,621714,'NTN022','NTWQM','NTN','DEDNREC  ','DEDNREC',302031,'4/27/2022','8:30:00',NULL,'','',0,'S ','ISM','M1','DO','',9.26,'MG/L','F02','','','','','nan',38.84972,-75.67333,'T3','2022-04-27'),(10001,621715,'NTN022','NTWQM','NTN','DEDNREC  ','DEDNREC',302031,'5/18/2022','8:02:00',NULL,'','',0,'S ','ISM','M1','DO','',8.91,'MG/L','F02','','','','','nan',38.84972,-75.67333,'T3','2022-05-18'),(10001,621716,'NTN022','NTWQM','NTN','DEDNREC  ','DEDNREC',302031,'6/15/2022','8:18:00',NULL,'','',0,'S ','ISM','M1','DO','',7.17,'MG/L','F02','','','','','nan',38.84972,-75.67333,'T3','2022-06-15'),(10001,621717,'NTN022','NTWQM','NTN','DEDNREC  ','DEDNREC',302031,'7/27/2022','11:45:00',NULL,'','',0,'S ','ISM','M1','DO','',9.37,'MG/L','F02','','','','','nan',38.84972,-75.67333,'T3','2022-07-27'),(10001,621719,'NTN022','NTWQM','NTN','DEDNREC  ','DEDNREC',302031,'9/29/2022','9:43:00',NULL,'','',0,'S ','ISM','M1','DO','',8.95,'MG/L','F02','','','','','nan',38.84972,-75.67333,'T3','2022-09-29'),(10001,621718,'NTN022','NTWQM','NTN','DEDNREC  ','DEDNREC',302031,'8/24/2022','7:35:00',NULL,'','',0,'S ','ISM','M1','DO','',6.86,'MG/L','F02','','','','','nan',38.84972,-75.67333,'T3','2022-08-24'),(10001,610442,'NTN021','NTWQM','NTN','DEDNREC  ','DEDNREC',302031,'9/22/2021','9:14:00',NULL,'','',0,'S ','ISM','M2','DO_SAT_P','',100.8,'PCT','F01','','','','','nan',38.84972,-75.67333,'T3','2021-09-22'),(10001,610442,'NTN021','NTWQM','NTN','DEDNREC  ','DEDNREC',302031,'9/22/2021','9:14:00',NULL,'','',0,'S ','ISM','M1','DO_SAT_P','',100.8,'PCT','F01','','','','','nan',38.84972,-75.67333,'T3','2021-09-22'),(10001,610441,'NTN021','NTWQM','NTN','DEDNREC  ','DEDNREC',302031,'9/2/2021','8:04:00',NULL,'','',0,'S ','ISM','M1','DO_SAT_P','',62.6,'PCT','F01','','','','','nan',38.84972,-75.67333,'T3','2021-09-02'),(10001,610440,'NTN021','NTWQM','NTN','DEDNREC  ','DEDNREC',302031,'8/25/2021','8:02:00',NULL,'','',0,'S ','ISM','M1','DO_SAT_P','',91.4,'PCT','F01','','','','','nan',38.84972,-75.67333,'T3','2021-08-25'),(10001,610439,'NTN021','NTWQM','NTN','DEDNREC  ','DEDNREC',302031,'7/19/2021','8:24:00',NULL,'','',0,'S ','ISM','M1','DO_SAT_P','',95.8,'PCT','F01','','','','','nan',38.84972,-75.67333,'T3','2021-07-19'),(10001,610436,'NTN021','NTWQM','NTN','DEDNREC  ','DEDNREC',302031,'4/20/2021','8:41:00',NULL,'','',0,'S ','ISM','M1','DO_SAT_P','',99.4,'PCT','F01','','','','','nan',38.84972,-75.67333,'T3','2021-04-20'),(10001,610437,'NTN021','NTWQM','NTN','DEDNREC  ','DEDNREC',302031,'5/24/2021','8:29:00',NULL,'','',0,'S ','ISM','M1','DO_SAT_P','',83.9,'PCT','F01','','','','','nan',38.84972,-75.67333,'T3','2021-05-24'),(10001,610438,'NTN021','NTWQM','NTN','DEDNREC  ','DEDNREC',302031,'6/15/2021','9:44:00',NULL,'','',0,'S ','ISM','M1','DO_SAT_P','',98.4,'PCT','F01','','','','','nan',38.84972,-75.67333,'T3','2021-06-15'),(10001,610435,'NTN021','NTWQM','NTN','DEDNREC  ','DEDNREC',302031,'3/10/2021','9:03:00',NULL,'','',0,'S ','ISM','M1','DO_SAT_P','',93.1,'PCT','F01','','','','','nan',38.84972,-75.67333,'T3','2021-03-10'),(10001,610434,'NTN021','NTWQM','NTN','DEDNREC  ','DEDNREC',302031,'2/24/2021','9:17:00',NULL,'','',0,'S ','ISM','M1','DO_SAT_P','',87.8,'PCT','F01','','','','','nan',38.84972,-75.67333,'T3','2021-02-24'),(10001,610433,'NTN021','NTWQM','NTN','DEDNREC  ','DEDNREC',302031,'2/2/2021','10:15:00',NULL,'','',0,'S ','ISM','M1','DO_SAT_P','',87.9,'PCT','F01','','','','','nan',38.84972,-75.67333,'T3','2021-02-02'),(10001,610432,'NTN021','NTWQM','NTN','DEDNREC  ','DEDNREC',302031,'1/28/2021','10:36:00',NULL,'','',0,'S ','ISM','M1','DO_SAT_P','',88.7,'PCT','F01','','','','','nan',38.84972,-75.67333,'T3','2021-01-28'),(10001,621718,'NTN022','NTWQM','NTN','DEDNREC  ','DEDNREC',302031,'8/24/2022','7:35:00',NULL,'','',0,'S ','ISM','M1','DO_SAT_P','',77.4,'PCT','F01','','','','','nan',38.84972,-75.67333,'T3','2022-08-24'),(10001,621717,'NTN022','NTWQM','NTN','DEDNREC  ','DEDNREC',302031,'7/27/2022','11:45:00',NULL,'','',0,'S ','ISM','M1','DO_SAT_P','',109.8,'PCT','F01','','','','','nan',38.84972,-75.67333,'T3','2022-07-27'),(10001,621716,'NTN022','NTWQM','NTN','DEDNREC  ','DEDNREC',302031,'6/15/2022','8:18:00',NULL,'','',0,'S ','ISM','M1','DO_SAT_P','',82.1,'PCT','F01','','','','','nan',38.84972,-75.67333,'T3','2022-06-15'),(10001,621714,'NTN022','NTWQM','NTN','DEDNREC  ','DEDNREC',302031,'4/27/2022','8:30:00',NULL,'','',0,'S ','ISM','M1','DO_SAT_P','',90.3,'PCT','F01','','','','','nan',38.84972,-75.67333,'T3','2022-04-27'),(10001,621715,'NTN022','NTWQM','NTN','DEDNREC  ','DEDNREC',302031,'5/18/2022','8:02:00',NULL,'','',0,'S ','ISM','M1','DO_SAT_P','',93.6,'PCT','F01','','','','','nan',38.84972,-75.67333,'T3','2022-05-18'),(10001,621713,'NTN022','NTWQM','NTN','DEDNREC  ','DEDNREC',302031,'4/7/2022','8:14:00',NULL,'','',0,'S ','ISM','M1','DO_SAT_P','',78.3,'PCT','F01','','','','','nan',38.84972,-75.67333,'T3','2022-04-07'),(10001,621712,'NTN022','NTWQM','NTN','DEDNREC  ','DEDNREC',302031,'3/21/2022','7:52:00',NULL,'','',0,'S ','ISM','M1','DO_SAT_P','',93.3,'PCT','F01','','','','','nan',38.84972,-75.67333,'T3','2022-03-21'),(10001,621712,'NTN022','NTWQM','NTN','DEDNREC  ','DEDNREC',302031,'3/21/2022','7:52:00',NULL,'','',0,'S ','ISM','M2','DO_SAT_P','',93.3,'PCT','F01','','','','','nan',38.84972,-75.67333,'T3','2022-03-21'),(10001,621711,'NTN022','NTWQM','NTN','DEDNREC  ','DEDNREC',302031,'2/23/2022','8:10:00',NULL,'','',0,'S ','ISM','M1','DO_SAT_P','',94.6,'PCT','F01','','','','','nan',38.84972,-75.67333,'T3','2022-02-23'),(10001,621710,'NTN022','NTWQM','NTN','DEDNREC  ','DEDNREC',302031,'1/26/2022','9:44:00',NULL,'','',0,'S ','ISM','M1','DO_SAT_P','',90.8,'PCT','F01','','','','','nan',38.84972,-75.67333,'T3','2022-01-26'),(10001,621709,'NTN022','NTWQM','NTN','DEDNREC  ','DEDNREC',302031,'12/15/2021','8:44:00',NULL,'','',0,'S ','ISM','M1','DO_SAT_P','',91,'PCT','F01','','','','','nan',38.84972,-75.67333,'T3','2021-12-15'),(10001,621708,'NTN022','NTWQM','NTN','DEDNREC  ','DEDNREC',302031,'11/8/2021','7:25:00',NULL,'','',0,'S ','ISM','M1','DO_SAT_P','',88.8,'PCT','F01','','','','','nan',38.84972,-75.67333,'T3','2021-11-08'),(10001,621707,'NTN022','NTWQM','NTN','DEDNREC  ','DEDNREC',302031,'10/18/2021','9:37:00',NULL,'','',0,'S ','ISM','M1','DO_SAT_P','',87.5,'PCT','F01','','','','','nan',38.84972,-75.67333,'T3','2021-10-18'),(10001,621719,'NTN022','NTWQM','NTN','DEDNREC  ','DEDNREC',302031,'9/29/2022','9:43:00',NULL,'','',0,'S ','ISM','M1','DO_SAT_P','',87.3,'PCT','F01','','','','','nan',38.84972,-75.67333,'T3','2022-09-29'),(10001,610432,'NTN021','NTWQM','NTN','DEDNREC  ','DEDNREC',302031,'1/28/2021','10:36:00',NULL,'','',0,'S ','HVIC','S1','DOC','',1.601,'MG/L','L01','DEDNREC','','','','nan',38.84972,-75.67333,'T3','2021-01-28'),(10001,610434,'NTN021','NTWQM','NTN','DEDNREC  ','DEDNREC',302031,'2/24/2021','9:17:00',NULL,'','',0,'S ','HVIC','S1','DOC','',8.599,'MG/L','L01','DEDNREC','GG','','','Analysis performed after holding time expired.',38.84972,-75.67333,'T3','2021-02-24'),(10001,610433,'NTN021','NTWQM','NTN','DEDNREC  ','DEDNREC',302031,'2/2/2021','10:15:00',NULL,'','',0,'S ','HVIC','S1','DOC','',6.427,'MG/L','L01','DEDNREC','','','','nan',38.84972,-75.67333,'T3','2021-02-02'),(10001,610435,'NTN021','NTWQM','NTN','DEDNREC  ','DEDNREC',302031,'3/10/2021','9:03:00',NULL,'','',0,'S ','HVIC','S1','DOC','',2.224,'MG/L','L01','DEDNREC','','','','nan',38.84972,-75.67333,'T3','2021-03-10'),(10001,610438,'NTN021','NTWQM','NTN','DEDNREC  ','DEDNREC',302031,'6/15/2021','9:44:00',NULL,'','',0,'S ','HVIC','S1','DOC','',2.74,'MG/L','L01','DEDNREC','','','','nan',38.84972,-75.67333,'T3','2021-06-15'),(10001,610437,'NTN021','NTWQM','NTN','DEDNREC  ','DEDNREC',302031,'5/24/2021','8:29:00',NULL,'','',0,'S ','HVIC','S1','DOC','',2.274,'MG/L','L01','DEDNREC','','','','nan',38.84972,-75.67333,'T3','2021-05-24'),(10001,610436,'NTN021','NTWQM','NTN','DEDNREC  ','DEDNREC',302031,'4/20/2021','8:41:00',NULL,'','',0,'S ','HVIC','S1','DOC','',1.975,'MG/L','L01','DEDNREC','','','','nan',38.84972,-75.67333,'T3','2021-04-20'),(10001,610439,'NTN021','NTWQM','NTN','DEDNREC  ','DEDNREC',302031,'7/19/2021','8:24:00',NULL,'','',0,'S ','HVIC','S1','DOC','',2.759,'MG/L','L01','DEDNREC','','','','nan',38.84972,-75.67333,'T3','2021-07-19'),(10001,610440,'NTN021','NTWQM','NTN','DEDNREC  ','DEDNREC',302031,'8/25/2021','8:02:00',NULL,'','',0,'S ','HVIC','S1','DOC','',6.736,'MG/L','L01','DEDNREC','','','','nan',38.84972,-75.67333,'T3','2021-08-25'),(10001,610441,'NTN021','NTWQM','NTN','DEDNREC  ','DEDNREC',302031,'9/2/2021','8:04:00',NULL,'','',0,'S ','HVIC','S1','DOC','',12.58,'MG/L','L01','DEDNREC','','','','nan',38.84972,-75.67333,'T3','2021-09-02'),(10001,610442,'NTN021','NTWQM','NTN','DEDNREC  ','DEDNREC',302031,'9/22/2021','9:14:00',NULL,'','',0,'S ','HVIC','FS1','DOC','',3.181,'MG/L','L01','DEDNREC','QQ','','','nan',38.84972,-75.67333,'T3','2021-09-22'),(10001,610442,'NTN021','NTWQM','NTN','DEDNREC  ','DEDNREC',302031,'9/22/2021','9:14:00',NULL,'','',0,'S ','HVIC','FS2','DOC','',3.073,'MG/L','L01','DEDNREC','QQ','','','nan',38.84972,-75.67333,'T3','2021-09-22'),(10001,621719,'NTN022','NTWQM','NTN','DEDNREC  ','DEDNREC',302031,'9/29/2022','9:43:00',NULL,'','',0,'S ','HVIC','S1','DOC','',1.688,'MG/L','L01','DEDNREC','','','','nan',38.84972,-75.67333,'T3','2022-09-29'),(10001,621708,'NTN022','NTWQM','NTN','DEDNREC  ','DEDNREC',302031,'11/8/2021','7:25:00',NULL,'','',0,'S ','HVIC','S1','DOC','',2.013,'MG/L','L01','DEDNREC','','','','nan',38.84972,-75.67333,'T3','2021-11-08'),(10001,621707,'NTN022','NTWQM','NTN','DEDNREC  ','DEDNREC',302031,'10/18/2021','9:37:00',NULL,'','',0,'S ','HVIC','S1','DOC','',2.58,'MG/L','L01','DEDNREC','','','','nan',38.84972,-75.67333,'T3','2021-10-18'),(10001,621709,'NTN022','NTWQM','NTN','DEDNREC  ','DEDNREC',302031,'12/15/2021','8:44:00',NULL,'','',0,'S ','HVIC','S1','DOC','',1.371,'MG/L','L01','DEDNREC','','','','nan',38.84972,-75.67333,'T3','2021-12-15'),(10001,621710,'NTN022','NTWQM','NTN','DEDNREC  ','DEDNREC',302031,'1/26/2022','9:44:00',NULL,'','',0,'S ','HVIC','S1','DOC','',1.927,'MG/L','L01','DEDNREC','','','','nan',38.84972,-75.67333,'T3','2022-01-26'),(10001,621711,'NTN022','NTWQM','NTN','DEDNREC  ','DEDNREC',302031,'2/23/2022','8:10:00',NULL,'','',0,'S ','HVIC','S1','DOC','',2.496,'MG/L','L01','DEDNREC','','','','nan',38.84972,-75.67333,'T3','2022-02-23'),(10001,621712,'NTN022','NTWQM','NTN','DEDNREC  ','DEDNREC',302031,'3/21/2022','7:52:00',NULL,'','',0,'S ','HVIC','FS1','DOC','',2.341,'MG/L','L01','DEDNREC','','','','nan',38.84972,-75.67333,'T3','2022-03-21'),(10001,621712,'NTN022','NTWQM','NTN','DEDNREC  ','DEDNREC',302031,'3/21/2022','7:52:00',NULL,'','',0,'S ','HVIC','FS2','DOC','',2.393,'MG/L','L01','DEDNREC','','','','nan',38.84972,-75.67333,'T3','2022-03-21'),(10001,621713,'NTN022','NTWQM','NTN','DEDNREC  ','DEDNREC',302031,'4/7/2022','8:14:00',NULL,'','',0,'S ','HVIC','S1','DOC','',15.81,'MG/L','L01','DEDNREC','','','','nan',38.84972,-75.67333,'T3','2022-04-07'),(10001,621714,'NTN022','NTWQM','NTN','DEDNREC  ','DEDNREC',302031,'4/27/2022','8:30:00',NULL,'','',0,'S ','HVIC','S1','DOC','',2.25,'MG/L','L01','DEDNREC','','','','nan',38.84972,-75.67333,'T3','2022-04-27'),(10001,621715,'NTN022','NTWQM','NTN','DEDNREC  ','DEDNREC',302031,'5/18/2022','8:02:00',NULL,'','',0,'S ','HVIC','S1','DOC','',2.498,'MG/L','L01','DEDNREC','','','','nan',38.84972,-75.67333,'T3','2022-05-18'),(10001,621716,'NTN022','NTWQM','NTN','DEDNREC  ','DEDNREC',302031,'6/15/2022','8:18:00',NULL,'','',0,'S ','HVIC','S1','DOC','',8.357,'MG/L','L01','DEDNREC','','','','nan',38.84972,-75.67333,'T3','2022-06-15'),(10001,621717,'NTN022','NTWQM','NTN','DEDNREC  ','DEDNREC',302031,'7/27/2022','11:45:00',NULL,'','',0,'S ','HVIC','S1','DOC','',2.203,'MG/L','L01','DEDNREC','','','','nan',38.84972,-75.67333,'T3','2022-07-27'),(10001,621718,'NTN022','NTWQM','NTN','DEDNREC  ','DEDNREC',302031,'8/24/2022','7:35:00',NULL,'','',0,'S ','HVIC','S1','DOC','',2.461,'MG/L','L01','DEDNREC','QQ','','','nan',38.84972,-75.67333,'T3','2022-08-24'),(10001,610442,'NTN021','NTWQM','NTN','DEDNREC  ','DEDNREC',302031,'9/22/2021','9:14:00',NULL,'','',0,'S ','HVIC','FS1','FSS','<',1,'MG/L','L01','DEDNREC','','','','nan',38.84972,-75.67333,'T3','2021-09-22'),(10001,610442,'NTN021','NTWQM','NTN','DEDNREC  ','DEDNREC',302031,'9/22/2021','9:14:00',NULL,'','',0,'S ','HVIC','FS2','FSS','<',1,'MG/L','L01','DEDNREC','','','','nan',38.84972,-75.67333,'T3','2021-09-22'),(10001,610441,'NTN021','NTWQM','NTN','DEDNREC  ','DEDNREC',302031,'9/2/2021','8:04:00',NULL,'','',0,'S ','HVIC','S1','FSS','',10.56,'MG/L','L01','DEDNREC','','','','nan',38.84972,-75.67333,'T3','2021-09-02'),(10001,610440,'NTN021','NTWQM','NTN','DEDNREC  ','DEDNREC',302031,'8/25/2021','8:02:00',NULL,'','',0,'S ','HVIC','S1','FSS','<',1,'MG/L','L01','DEDNREC','','','','nan',38.84972,-75.67333,'T3','2021-08-25'),(10001,610439,'NTN021','NTWQM','NTN','DEDNREC  ','DEDNREC',302031,'7/19/2021','8:24:00',NULL,'','',0,'S ','HVIC','S1','FSS','',4.09,'MG/L','L01','DEDNREC','','','','nan',38.84972,-75.67333,'T3','2021-07-19'),(10001,610438,'NTN021','NTWQM','NTN','DEDNREC  ','DEDNREC',302031,'6/15/2021','9:44:00',NULL,'','',0,'S ','HVIC','S1','FSS','G',1.89,'MG/L','L01','DEDNREC','','','','nan',38.84972,-75.67333,'T3','2021-06-15'),(10001,610436,'NTN021','NTWQM','NTN','DEDNREC  ','DEDNREC',302031,'4/20/2021','8:41:00',NULL,'','',0,'S ','HVIC','S1','FSS','G',2.7167,'MG/L','L01','DEDNREC','','','','nan',38.84972,-75.67333,'T3','2021-04-20'),(10001,610437,'NTN021','NTWQM','NTN','DEDNREC  ','DEDNREC',302031,'5/24/2021','8:29:00',NULL,'','',0,'S ','HVIC','S1','FSS','',2.68,'MG/L','L01','DEDNREC','','','','nan',38.84972,-75.67333,'T3','2021-05-24'),(10001,610435,'NTN021','NTWQM','NTN','DEDNREC  ','DEDNREC',302031,'3/10/2021','9:03:00',NULL,'','',0,'S ','HVIC','S1','FSS','',4.9556,'MG/L','L01','DEDNREC','','','','nan',38.84972,-75.67333,'T3','2021-03-10'),(10001,621718,'NTN022','NTWQM','NTN','DEDNREC  ','DEDNREC',302031,'8/24/2022','7:35:00',NULL,'','',0,'S ','HVIC','S1','FSS','',2.85,'MG/L','L01','DEDNREC','','','','nan',38.84972,-75.67333,'T3','2022-08-24'),(10001,621717,'NTN022','NTWQM','NTN','DEDNREC  ','DEDNREC',302031,'7/27/2022','11:45:00',NULL,'','',0,'S ','HVIC','S1','FSS','<',1,'MG/L','L01','DEDNREC','','','','nan',38.84972,-75.67333,'T3','2022-07-27'),(10001,621715,'NTN022','NTWQM','NTN','DEDNREC  ','DEDNREC',302031,'5/18/2022','8:02:00',NULL,'','',0,'S ','HVIC','S1','FSS','',3.14,'MG/L','L01','DEDNREC','','','','nan',38.84972,-75.67333,'T3','2022-05-18'),(10001,621716,'NTN022','NTWQM','NTN','DEDNREC  ','DEDNREC',302031,'6/15/2022','8:18:00',NULL,'','',0,'S ','HVIC','S1','FSS','',18.6333,'MG/L','L01','DEDNREC','','','','nan',38.84972,-75.67333,'T3','2022-06-15'),(10001,621714,'NTN022','NTWQM','NTN','DEDNREC  ','DEDNREC',302031,'4/27/2022','8:30:00',NULL,'','',0,'S ','HVIC','S1','FSS','G',2.1875,'MG/L','L01','DEDNREC','','','','nan',38.84972,-75.67333,'T3','2022-04-27'),(10001,621712,'NTN022','NTWQM','NTN','DEDNREC  ','DEDNREC',302031,'3/21/2022','7:52:00',NULL,'','',0,'S ','HVIC','FS2','FSS','G',3.32,'MG/L','L01','DEDNREC','','','','nan',38.84972,-75.67333,'T3','2022-03-21'),(10001,621713,'NTN022','NTWQM','NTN','DEDNREC  ','DEDNREC',302031,'4/7/2022','8:14:00',NULL,'','',0,'S ','HVIC','S1','FSS','',21.25,'MG/L','L01','DEDNREC','','','','nan',38.84972,-75.67333,'T3','2022-04-07'),(10001,621711,'NTN022','NTWQM','NTN','DEDNREC  ','DEDNREC',302031,'2/23/2022','8:10:00',NULL,'','',0,'S ','HVIC','S1','FSS','',7.2167,'MG/L','L01','DEDNREC','','','','nan',38.84972,-75.67333,'T3','2022-02-23'),(10001,621712,'NTN022','NTWQM','NTN','DEDNREC  ','DEDNREC',302031,'3/21/2022','7:52:00',NULL,'','',0,'S ','HVIC','FS1','FSS','G',4.16,'MG/L','L01','DEDNREC','','','','nan',38.84972,-75.67333,'T3','2022-03-21'),(10001,621709,'NTN022','NTWQM','NTN','DEDNREC  ','DEDNREC',302031,'12/15/2021','8:44:00',NULL,'','',0,'S ','HVIC','S1','FSS','',5.28,'MG/L','L01','DEDNREC','','','','nan',38.84972,-75.67333,'T3','2021-12-15'),(10001,621710,'NTN022','NTWQM','NTN','DEDNREC  ','DEDNREC',302031,'1/26/2022','9:44:00',NULL,'','',0,'S ','HVIC','S1','FSS','',7.225,'MG/L','L01','DEDNREC','','','','nan',38.84972,-75.67333,'T3','2022-01-26'),(10001,621708,'NTN022','NTWQM','NTN','DEDNREC  ','DEDNREC',302031,'11/8/2021','7:25:00',NULL,'','',0,'S ','HVIC','S1','FSS','G',2.6778,'MG/L','L01','DEDNREC','','','','nan',38.84972,-75.67333,'T3','2021-11-08'),(10001,621707,'NTN022','NTWQM','NTN','DEDNREC  ','DEDNREC',302031,'10/18/2021','9:37:00',NULL,'','',0,'S ','HVIC','S1','FSS','<',1,'MG/L','L01','DEDNREC','','','','nan',38.84972,-75.67333,'T3','2021-10-18'),(10001,621719,'NTN022','NTWQM','NTN','DEDNREC  ','DEDNREC',302031,'9/29/2022','9:43:00',NULL,'','',0,'S ','HVIC','S1','FSS','<',2.5,'MG/L','L01','DEDNREC','','','','nan',38.84972,-75.67333,'T3','2022-09-29'),(10001,621719,'NTN022','NTWQM','NTN','DEDNREC  ','DEDNREC',302031,'9/29/2022','9:43:00',NULL,'','',0,'S ','HVIC','S1','HARDNESS','',53.4982,'MG/L','L02','DEDNREC','','','','Standard Method 2340-B (calculated from Ca and Mg)',38.84972,-75.67333,'T3','2022-09-29'),(10001,621707,'NTN022','NTWQM','NTN','DEDNREC  ','DEDNREC',302031,'10/18/2021','9:37:00',NULL,'','',0,'S ','HVIC','S1','HARDNESS','',51.9281,'MG/L','L02','DEDNREC','','','','nan',38.84972,-75.67333,'T3','2021-10-18'),(10001,621708,'NTN022','NTWQM','NTN','DEDNREC  ','DEDNREC',302031,'11/8/2021','7:25:00',NULL,'','',0,'S ','HVIC','S1','HARDNESS','',44.5349,'MG/L','L02','DEDNREC','','','','nan',38.84972,-75.67333,'T3','2021-11-08'),(10001,621710,'NTN022','NTWQM','NTN','DEDNREC  ','DEDNREC',302031,'1/26/2022','9:44:00',NULL,'','',0,'S ','HVIC','S1','HARDNESS','',47.6453,'MG/L','L02','DEDNREC','','','','nan',38.84972,-75.67333,'T3','2022-01-26'),(10001,621709,'NTN022','NTWQM','NTN','DEDNREC  ','DEDNREC',302031,'12/15/2021','8:44:00',NULL,'','',0,'S ','HVIC','S1','HARDNESS','',45.5213,'MG/L','L02','DEDNREC','','','','nan',38.84972,-75.67333,'T3','2021-12-15'),(10001,621711,'NTN022','NTWQM','NTN','DEDNREC  ','DEDNREC',302031,'2/23/2022','8:10:00',NULL,'','',0,'S ','HVIC','S1','HARDNESS','',45.6557,'MG/L','L02','DEDNREC','','','','nan',38.84972,-75.67333,'T3','2022-02-23'),(10001,621713,'NTN022','NTWQM','NTN','DEDNREC  ','DEDNREC',302031,'4/7/2022','8:14:00',NULL,'','',0,'S ','HVIC','S1','HARDNESS','<',50,'MG/L','L02','DEDNREC','','','','nan',38.84972,-75.67333,'T3','2022-04-07'),(10001,621712,'NTN022','NTWQM','NTN','DEDNREC  ','DEDNREC',302031,'3/21/2022','7:52:00',NULL,'','',0,'S ','HVIC','FS2','HARDNESS','',48.5909,'MG/L','L02','DEDNREC','','','','nan',38.84972,-75.67333,'T3','2022-03-21'),(10001,621712,'NTN022','NTWQM','NTN','DEDNREC  ','DEDNREC',302031,'3/21/2022','7:52:00',NULL,'','',0,'S ','HVIC','FS1','HARDNESS','',41.4949,'MG/L','L02','DEDNREC','','','','nan',38.84972,-75.67333,'T3','2022-03-21'),(10001,621714,'NTN022','NTWQM','NTN','DEDNREC  ','DEDNREC',302031,'4/27/2022','8:30:00',NULL,'','',0,'S ','HVIC','S1','HARDNESS','',46.8359,'MG/L','L02','DEDNREC','','','','nan',38.84972,-75.67333,'T3','2022-04-27'),(10001,621716,'NTN022','NTWQM','NTN','DEDNREC  ','DEDNREC',302031,'6/15/2022','8:18:00',NULL,'','',0,'S ','HVIC','S1','HARDNESS','',40.2933,'MG/L','L02','DEDNREC','','','','nan',38.84972,-75.67333,'T3','2022-06-15'),(10001,621715,'NTN022','NTWQM','NTN','DEDNREC  ','DEDNREC',302031,'5/18/2022','8:02:00',NULL,'','',0,'S ','HVIC','S1','HARDNESS','',46.17998,'MG/L','L02','DEDNREC','','','','nan',38.84972,-75.67333,'T3','2022-05-18'),(10001,621717,'NTN022','NTWQM','NTN','DEDNREC  ','DEDNREC',302031,'7/27/2022','11:45:00',NULL,'','',0,'S ','HVIC','S1','HARDNESS','',51.9062,'MG/L','L02','DEDNREC','','','','Standard Method 2340-B (calculated from Ca and Mg)',38.84972,-75.67333,'T3','2022-07-27'),(10001,621718,'NTN022','NTWQM','NTN','DEDNREC  ','DEDNREC',302031,'8/24/2022','7:35:00',NULL,'','',0,'S ','HVIC','S1','HARDNESS','',51.482,'MG/L','L02','DEDNREC','','','','Standard Method 2340-B (calculated from Ca and Mg)',38.84972,-75.67333,'T3','2022-08-24'),(10001,610435,'NTN021','NTWQM','NTN','DEDNREC  ','DEDNREC',302031,'3/10/2021','9:03:00',NULL,'','',0,'S ','HVIC','S1','IBOD5W','<',2.4,'MG/L','L01','DEDNREC','','','','nan',38.84972,-75.67333,'T3','2021-03-10'),(10001,610433,'NTN021','NTWQM','NTN','DEDNREC  ','DEDNREC',302031,'2/2/2021','10:15:00',NULL,'','',0,'S ','HVIC','S1','IBOD5W','<',2.4,'MG/L','L01','DEDNREC','','','','nan',38.84972,-75.67333,'T3','2021-02-02'),(10001,610434,'NTN021','NTWQM','NTN','DEDNREC  ','DEDNREC',302031,'2/24/2021','9:17:00',NULL,'','',0,'S ','HVIC','S1','IBOD5W','<',2.4,'MG/L','L01','DEDNREC','','','','nan',38.84972,-75.67333,'T3','2021-02-24'),(10001,610438,'NTN021','NTWQM','NTN','DEDNREC  ','DEDNREC',302031,'6/15/2021','9:44:00',NULL,'','',0,'S ','HVIC','S1','IBOD5W','<',2.4,'MG/L','L01','DEDNREC','','','','nan',38.84972,-75.67333,'T3','2021-06-15'),(10001,610437,'NTN021','NTWQM','NTN','DEDNREC  ','DEDNREC',302031,'5/24/2021','8:29:00',NULL,'','',0,'S ','HVIC','S1','IBOD5W','<',2.4,'MG/L','L01','DEDNREC','','','','nan',38.84972,-75.67333,'T3','2021-05-24'),(10001,610436,'NTN021','NTWQM','NTN','DEDNREC  ','DEDNREC',302031,'4/20/2021','8:41:00',NULL,'','',0,'S ','HVIC','S1','IBOD5W','<',2.4,'MG/L','L01','DEDNREC','','','','nan',38.84972,-75.67333,'T3','2021-04-20'),(10001,610439,'NTN021','NTWQM','NTN','DEDNREC  ','DEDNREC',302031,'7/19/2021','8:24:00',NULL,'','',0,'S ','HVIC','S1','IBOD5W','<',2.4,'MG/L','L01','DEDNREC','','','','nan',38.84972,-75.67333,'T3','2021-07-19'),(10001,610441,'NTN021','NTWQM','NTN','DEDNREC  ','DEDNREC',302031,'9/2/2021','8:04:00',NULL,'','',0,'S ','HVIC','S1','IBOD5W','',4.07,'MG/L','L01','DEDNREC','','','','nan',38.84972,-75.67333,'T3','2021-09-02'),(10001,610440,'NTN021','NTWQM','NTN','DEDNREC  ','DEDNREC',302031,'8/25/2021','8:02:00',NULL,'','',0,'S ','HVIC','S1','IBOD5W','<',2.4,'MG/L','L01','DEDNREC','','','','nan',38.84972,-75.67333,'T3','2021-08-25'),(10001,610442,'NTN021','NTWQM','NTN','DEDNREC  ','DEDNREC',302031,'9/22/2021','9:14:00',NULL,'','',0,'S ','HVIC','FS1','IBOD5W','<',2.4,'MG/L','L01','DEDNREC','','','','nan',38.84972,-75.67333,'T3','2021-09-22'),(10001,610442,'NTN021','NTWQM','NTN','DEDNREC  ','DEDNREC',302031,'9/22/2021','9:14:00',NULL,'','',0,'S ','HVIC','FS2','IBOD5W','<',2.4,'MG/L','L01','DEDNREC','','','','nan',38.84972,-75.67333,'T3','2021-09-22'),(10001,610432,'NTN021','NTWQM','NTN','DEDNREC  ','DEDNREC',302031,'1/28/2021','10:36:00',NULL,'','',0,'S ','HVIC','S1','IBOD5W','<',2.4,'MG/L','L01','DEDNREC','','','','nan',38.84972,-75.67333,'T3','2021-01-28'),(10001,621718,'NTN022','NTWQM','NTN','DEDNREC  ','DEDNREC',302031,'8/24/2022','7:35:00',NULL,'','',0,'S ','HVIC','S1','IBOD5W','<',2.4,'MG/L','L01','DEDNREC','','','','nan',38.84972,-75.67333,'T3','2022-08-24'),(10001,621717,'NTN022','NTWQM','NTN','DEDNREC  ','DEDNREC',302031,'7/27/2022','11:45:00',NULL,'','',0,'S ','HVIC','S1','IBOD5W','<',2.4,'MG/L','L01','DEDNREC','','','','nan',38.84972,-75.67333,'T3','2022-07-27'),(10001,621715,'NTN022','NTWQM','NTN','DEDNREC  ','DEDNREC',302031,'5/18/2022','8:02:00',NULL,'','',0,'S ','HVIC','S1','IBOD5W','<',2.4,'MG/L','L01','DEDNREC','','','','nan',38.84972,-75.67333,'T3','2022-05-18'),(10001,621716,'NTN022','NTWQM','NTN','DEDNREC  ','DEDNREC',302031,'6/15/2022','8:18:00',NULL,'','',0,'S ','HVIC','S1','IBOD5W','<',2.4,'MG/L','L01','DEDNREC','','','','nan',38.84972,-75.67333,'T3','2022-06-15'),(10001,621714,'NTN022','NTWQM','NTN','DEDNREC  ','DEDNREC',302031,'4/27/2022','8:30:00',NULL,'','',0,'S ','HVIC','S1','IBOD5W','<',2.4,'MG/L','L01','DEDNREC','','','','nan',38.84972,-75.67333,'T3','2022-04-27'),(10001,621712,'NTN022','NTWQM','NTN','DEDNREC  ','DEDNREC',302031,'3/21/2022','7:52:00',NULL,'','',0,'S ','HVIC','FS1','IBOD5W','<',2.4,'MG/L','L01','DEDNREC','','','','nan',38.84972,-75.67333,'T3','2022-03-21'),(10001,621712,'NTN022','NTWQM','NTN','DEDNREC  ','DEDNREC',302031,'3/21/2022','7:52:00',NULL,'','',0,'S ','HVIC','FS2','IBOD5W','<',2.4,'MG/L','L01','DEDNREC','','','','nan',38.84972,-75.67333,'T3','2022-03-21'),(10001,621713,'NTN022','NTWQM','NTN','DEDNREC  ','DEDNREC',302031,'4/7/2022','8:14:00',NULL,'','',0,'S ','HVIC','S1','IBOD5W','<',2.4,'MG/L','L01','DEDNREC','','','','nan',38.84972,-75.67333,'T3','2022-04-07'),(10001,621711,'NTN022','NTWQM','NTN','DEDNREC  ','DEDNREC',302031,'2/23/2022','8:10:00',NULL,'','',0,'S ','HVIC','S1','IBOD5W','<',2.4,'MG/L','L01','DEDNREC','','','','nan',38.84972,-75.67333,'T3','2022-02-23'),(10001,621709,'NTN022','NTWQM','NTN','DEDNREC  ','DEDNREC',302031,'12/15/2021','8:44:00',NULL,'','',0,'S ','HVIC','S1','IBOD5W','<',2.4,'MG/L','L01','DEDNREC','','','','nan',38.84972,-75.67333,'T3','2021-12-15'),(10001,621710,'NTN022','NTWQM','NTN','DEDNREC  ','DEDNREC',302031,'1/26/2022','9:44:00',NULL,'','',0,'S ','HVIC','S1','IBOD5W','<',2.4,'MG/L','L01','DEDNREC','','','','nan',38.84972,-75.67333,'T3','2022-01-26'),(10001,621708,'NTN022','NTWQM','NTN','DEDNREC  ','DEDNREC',302031,'11/8/2021','7:25:00',NULL,'','',0,'S ','HVIC','S1','IBOD5W','<',2.4,'MG/L','L01','DEDNREC','','','','nan',38.84972,-75.67333,'T3','2021-11-08'),(10001,621707,'NTN022','NTWQM','NTN','DEDNREC  ','DEDNREC',302031,'10/18/2021','9:37:00',NULL,'','',0,'S ','HVIC','S1','IBOD5W','<',2.4,'MG/L','L01','DEDNREC','','','','nan',38.84972,-75.67333,'T3','2021-10-18'),(10001,621719,'NTN022','NTWQM','NTN','DEDNREC  ','DEDNREC',302031,'9/29/2022','9:43:00',NULL,'','',0,'S ','HVIC','S1','IBOD5W','<',2.4,'MG/L','L01','DEDNREC','','','','nan',38.84972,-75.67333,'T3','2022-09-29'),(10001,610442,'NTN021','NTWQM','NTN','DEDNREC  ','DEDNREC',302031,'9/22/2021','9:14:00',NULL,'','',0,'S ','HVIC','FS2','NH4F','G',0.01,'MG/L','L01','DEDNREC','','','','nan',38.84972,-75.67333,'T3','2021-09-22'),(10001,610442,'NTN021','NTWQM','NTN','DEDNREC  ','DEDNREC',302031,'9/22/2021','9:14:00',NULL,'','',0,'S ','HVIC','FS1','NH4F','G',0.01,'MG/L','L01','DEDNREC','','','','nan',38.84972,-75.67333,'T3','2021-09-22'),(10001,610440,'NTN021','NTWQM','NTN','DEDNREC  ','DEDNREC',302031,'8/25/2021','8:02:00',NULL,'','',0,'S ','HVIC','S1','NH4F','<',0.01,'MG/L','L01','DEDNREC','','','','nan',38.84972,-75.67333,'T3','2021-08-25'),(10001,610441,'NTN021','NTWQM','NTN','DEDNREC  ','DEDNREC',302031,'9/2/2021','8:04:00',NULL,'','',0,'S ','HVIC','S1','NH4F','',0.0253,'MG/L','L01','DEDNREC','','','','nan',38.84972,-75.67333,'T3','2021-09-02'),(10001,610439,'NTN021','NTWQM','NTN','DEDNREC  ','DEDNREC',302031,'7/19/2021','8:24:00',NULL,'','',0,'S ','HVIC','S1','NH4F','<',0.01,'MG/L','L01','DEDNREC','','','','nan',38.84972,-75.67333,'T3','2021-07-19'),(10001,610436,'NTN021','NTWQM','NTN','DEDNREC  ','DEDNREC',302031,'4/20/2021','8:41:00',NULL,'','',0,'S ','HVIC','S1','NH4F','<',0.01,'MG/L','L01','DEDNREC','','','','nan',38.84972,-75.67333,'T3','2021-04-20'),(10001,610438,'NTN021','NTWQM','NTN','DEDNREC  ','DEDNREC',302031,'6/15/2021','9:44:00',NULL,'','',0,'S ','HVIC','S1','NH4F','',0.0201,'MG/L','L01','DEDNREC','','','','nan',38.84972,-75.67333,'T3','2021-06-15'),(10001,610437,'NTN021','NTWQM','NTN','DEDNREC  ','DEDNREC',302031,'5/24/2021','8:29:00',NULL,'','',0,'S ','HVIC','S1','NH4F','',0.0412,'MG/L','L01','DEDNREC','GG','','','Analysis performed after holding time expired.',38.84972,-75.67333,'T3','2021-05-24'),(10001,610435,'NTN021','NTWQM','NTN','DEDNREC  ','DEDNREC',302031,'3/10/2021','9:03:00',NULL,'','',0,'S ','HVIC','S1','NH4F','',0.0373,'MG/L','L01','DEDNREC','','','','nan',38.84972,-75.67333,'T3','2021-03-10'),(10001,621719,'NTN022','NTWQM','NTN','DEDNREC  ','DEDNREC',302031,'9/29/2022','9:43:00',NULL,'','',0,'S ','HVIC','S1','NH4F','G',0.0159,'MG/L','L01','DEDNREC','','','','nan',38.84972,-75.67333,'T3','2022-09-29'),(10001,621707,'NTN022','NTWQM','NTN','DEDNREC  ','DEDNREC',302031,'10/18/2021','9:37:00',NULL,'','',0,'S ','HVIC','S1','NH4F','G',0.0185,'MG/L','L01','DEDNREC','','','','nan',38.84972,-75.67333,'T3','2021-10-18'),(10001,621708,'NTN022','NTWQM','NTN','DEDNREC  ','DEDNREC',302031,'11/8/2021','7:25:00',NULL,'','',0,'S ','HVIC','S1','NH4F','',0.0876,'MG/L','L01','DEDNREC','','','','nan',38.84972,-75.67333,'T3','2021-11-08'),(10001,621709,'NTN022','NTWQM','NTN','DEDNREC  ','DEDNREC',302031,'12/15/2021','8:44:00',NULL,'','',0,'S ','HVIC','S1','NH4F','',0.1032,'MG/L','L01','DEDNREC','','','','nan',38.84972,-75.67333,'T3','2021-12-15'),(10001,621710,'NTN022','NTWQM','NTN','DEDNREC  ','DEDNREC',302031,'1/26/2022','9:44:00',NULL,'','',0,'S ','HVIC','S1','NH4F','',0.0755,'MG/L','L01','DEDNREC','','','','nan',38.84972,-75.67333,'T3','2022-01-26'),(10001,621711,'NTN022','NTWQM','NTN','DEDNREC  ','DEDNREC',302031,'2/23/2022','8:10:00',NULL,'','',0,'S ','HVIC','S1','NH4F','',0.0573,'MG/L','L01','DEDNREC','','','','nan',38.84972,-75.67333,'T3','2022-02-23'),(10001,621713,'NTN022','NTWQM','NTN','DEDNREC  ','DEDNREC',302031,'4/7/2022','8:14:00',NULL,'','',0,'S ','HVIC','S1','NH4F','',0.5874,'MG/L','L01','DEDNREC','','','','nan',38.84972,-75.67333,'T3','2022-04-07'),(10001,621712,'NTN022','NTWQM','NTN','DEDNREC  ','DEDNREC',302031,'3/21/2022','7:52:00',NULL,'','',0,'S ','HVIC','FS2','NH4F','',0.0385,'MG/L','L01','DEDNREC','','','','nan',38.84972,-75.67333,'T3','2022-03-21'),(10001,621712,'NTN022','NTWQM','NTN','DEDNREC  ','DEDNREC',302031,'3/21/2022','7:52:00',NULL,'','',0,'S ','HVIC','FS1','NH4F','',0.0385,'MG/L','L01','DEDNREC','','','','nan',38.84972,-75.67333,'T3','2022-03-21'),(10001,621714,'NTN022','NTWQM','NTN','DEDNREC  ','DEDNREC',302031,'4/27/2022','8:30:00',NULL,'','',0,'S ','HVIC','S1','NH4F','G',0.014,'MG/L','L01','DEDNREC','','','','nan',38.84972,-75.67333,'T3','2022-04-27'),(10001,621716,'NTN022','NTWQM','NTN','DEDNREC  ','DEDNREC',302031,'6/15/2022','8:18:00',NULL,'','',0,'S ','HVIC','S1','NH4F','',0.5927,'MG/L','L01','DEDNREC','','','','nan',38.84972,-75.67333,'T3','2022-06-15'),(10001,621715,'NTN022','NTWQM','NTN','DEDNREC  ','DEDNREC',302031,'5/18/2022','8:02:00',NULL,'','',0,'S ','HVIC','S1','NH4F','',0.0668,'MG/L','L01','DEDNREC','','','','nan',38.84972,-75.67333,'T3','2022-05-18'),(10001,621718,'NTN022','NTWQM','NTN','DEDNREC  ','DEDNREC',302031,'8/24/2022','7:35:00',NULL,'','',0,'S ','HVIC','S1','NH4F','',0.0457,'MG/L','L01','DEDNREC','QQ','','','nan',38.84972,-75.67333,'T3','2022-08-24'),(10001,621717,'NTN022','NTWQM','NTN','DEDNREC  ','DEDNREC',302031,'7/27/2022','11:45:00',NULL,'','',0,'S ','HVIC','S1','NH4F','',0.0299,'MG/L','L01','DEDNREC','QQ','','','nan',38.84972,-75.67333,'T3','2022-07-27'),(10001,610435,'NTN021','NTWQM','NTN','DEDNREC  ','DEDNREC',302031,'3/10/2021','9:03:00',NULL,'','',0,'S ','HVIC','S1','NH4W','',0.0417,'MG/L','L01','DEDNREC','','','','nan',38.84972,-75.67333,'T3','2021-03-10'),(10001,610434,'NTN021','NTWQM','NTN','DEDNREC  ','DEDNREC',302031,'2/24/2021','9:17:00',NULL,'','',0,'S ','HVIC','S1','NH4W','',0.0723,'MG/L','L01','DEDNREC','','','','nan',38.84972,-75.67333,'T3','2021-02-24'),(10001,610433,'NTN021','NTWQM','NTN','DEDNREC  ','DEDNREC',302031,'2/2/2021','10:15:00',NULL,'','',0,'S ','HVIC','S1','NH4W','',0.1878,'MG/L','L01','DEDNREC','','','','nan',38.84972,-75.67333,'T3','2021-02-02'),(10001,610437,'NTN021','NTWQM','NTN','DEDNREC  ','DEDNREC',302031,'5/24/2021','8:29:00',NULL,'','',0,'S ','HVIC','S1','NH4W','',0.0543,'MG/L','L01','DEDNREC','GG','','','Analysis performed after holding time expired.',38.84972,-75.67333,'T3','2021-05-24'),(10001,610438,'NTN021','NTWQM','NTN','DEDNREC  ','DEDNREC',302031,'6/15/2021','9:44:00',NULL,'','',0,'S ','HVIC','S1','NH4W','',0.0258,'MG/L','L01','DEDNREC','','','','nan',38.84972,-75.67333,'T3','2021-06-15'),(10001,610436,'NTN021','NTWQM','NTN','DEDNREC  ','DEDNREC',302031,'4/20/2021','8:41:00',NULL,'','',0,'S ','HVIC','S1','NH4W','G',0.0147,'MG/L','L01','DEDNREC','','','','nan',38.84972,-75.67333,'T3','2021-04-20'),(10001,610439,'NTN021','NTWQM','NTN','DEDNREC  ','DEDNREC',302031,'7/19/2021','8:24:00',NULL,'','',0,'S ','HVIC','S1','NH4W','<',0.01,'MG/L','L01','DEDNREC','','','','nan',38.84972,-75.67333,'T3','2021-07-19'),(10001,610441,'NTN021','NTWQM','NTN','DEDNREC  ','DEDNREC',302031,'9/2/2021','8:04:00',NULL,'','',0,'S ','HVIC','S1','NH4W','',0.0509,'MG/L','L01','DEDNREC','','','','nan',38.84972,-75.67333,'T3','2021-09-02'),(10001,610440,'NTN021','NTWQM','NTN','DEDNREC  ','DEDNREC',302031,'8/25/2021','8:02:00',NULL,'','',0,'S ','HVIC','S1','NH4W','G',0.0105,'MG/L','L01','DEDNREC','','','','nan',38.84972,-75.67333,'T3','2021-08-25'),(10001,610442,'NTN021','NTWQM','NTN','DEDNREC  ','DEDNREC',302031,'9/22/2021','9:14:00',NULL,'','',0,'S ','HVIC','FS1','NH4W','G',0.01,'MG/L','L01','DEDNREC','','','','nan',38.84972,-75.67333,'T3','2021-09-22'),(10001,610442,'NTN021','NTWQM','NTN','DEDNREC  ','DEDNREC',302031,'9/22/2021','9:14:00',NULL,'','',0,'S ','HVIC','FS2','NH4W','G',0.0115,'MG/L','L01','DEDNREC','','','','nan',38.84972,-75.67333,'T3','2021-09-22'),(10001,610432,'NTN021','NTWQM','NTN','DEDNREC  ','DEDNREC',302031,'1/28/2021','10:36:00',NULL,'','',0,'S ','HVIC','S1','NH4W','',0.0563,'MG/L','L01','DEDNREC','','','','nan',38.84972,-75.67333,'T3','2021-01-28'),(10001,621718,'NTN022','NTWQM','NTN','DEDNREC  ','DEDNREC',302031,'8/24/2022','7:35:00',NULL,'','',0,'S ','HVIC','S1','NH4W','',0.0467,'MG/L','L01','DEDNREC','','','','nan',38.84972,-75.67333,'T3','2022-08-24'),(10001,621717,'NTN022','NTWQM','NTN','DEDNREC  ','DEDNREC',302031,'7/27/2022','11:45:00',NULL,'','',0,'S ','HVIC','S1','NH4W','',0.0274,'MG/L','L01','DEDNREC','','','','nan',38.84972,-75.67333,'T3','2022-07-27'),(10001,621716,'NTN022','NTWQM','NTN','DEDNREC  ','DEDNREC',302031,'6/15/2022','8:18:00',NULL,'','',0,'S ','HVIC','S1','NH4W','',0.652,'MG/L','L01','DEDNREC','','','','nan',38.84972,-75.67333,'T3','2022-06-15'),(10001,621715,'NTN022','NTWQM','NTN','DEDNREC  ','DEDNREC',302031,'5/18/2022','8:02:00',NULL,'','',0,'S ','HVIC','S1','NH4W','',0.0737,'MG/L','L01','DEDNREC','','','','nan',38.84972,-75.67333,'T3','2022-05-18'),(10001,621714,'NTN022','NTWQM','NTN','DEDNREC  ','DEDNREC',302031,'4/27/2022','8:30:00',NULL,'','',0,'S ','HVIC','S1','NH4W','',0.0435,'MG/L','L01','DEDNREC','QQ','','','nan',38.84972,-75.67333,'T3','2022-04-27'),(10001,621712,'NTN022','NTWQM','NTN','DEDNREC  ','DEDNREC',302031,'3/21/2022','7:52:00',NULL,'','',0,'S ','HVIC','FS2','NH4W','',0.0357,'MG/L','L01','DEDNREC','','','','nan',38.84972,-75.67333,'T3','2022-03-21'),(10001,621713,'NTN022','NTWQM','NTN','DEDNREC  ','DEDNREC',302031,'4/7/2022','8:14:00',NULL,'','',0,'S ','HVIC','S1','NH4W','',0.6462,'MG/L','L01','DEDNREC','','','','nan',38.84972,-75.67333,'T3','2022-04-07'),(10001,621710,'NTN022','NTWQM','NTN','DEDNREC  ','DEDNREC',302031,'1/26/2022','9:44:00',NULL,'','',0,'S ','HVIC','S1','NH4W','',0.0877,'MG/L','L01','DEDNREC','','','','nan',38.84972,-75.67333,'T3','2022-01-26'),(10001,621712,'NTN022','NTWQM','NTN','DEDNREC  ','DEDNREC',302031,'3/21/2022','7:52:00',NULL,'','',0,'S ','HVIC','FS1','NH4W','',0.0368,'MG/L','L01','DEDNREC','','','','nan',38.84972,-75.67333,'T3','2022-03-21'),(10001,621711,'NTN022','NTWQM','NTN','DEDNREC  ','DEDNREC',302031,'2/23/2022','8:10:00',NULL,'','',0,'S ','HVIC','S1','NH4W','',0.0593,'MG/L','L01','DEDNREC','','','','nan',38.84972,-75.67333,'T3','2022-02-23'),(10001,621709,'NTN022','NTWQM','NTN','DEDNREC  ','DEDNREC',302031,'12/15/2021','8:44:00',NULL,'','',0,'S ','HVIC','S1','NH4W','',0.1078,'MG/L','L01','DEDNREC','','','','nan',38.84972,-75.67333,'T3','2021-12-15'),(10001,621707,'NTN022','NTWQM','NTN','DEDNREC  ','DEDNREC',302031,'10/18/2021','9:37:00',NULL,'','',0,'S ','HVIC','S1','NH4W','G',0.019,'MG/L','L01','DEDNREC','','','','nan',38.84972,-75.67333,'T3','2021-10-18'),(10001,621708,'NTN022','NTWQM','NTN','DEDNREC  ','DEDNREC',302031,'11/8/2021','7:25:00',NULL,'','',0,'S ','HVIC','S1','NH4W','',0.0858,'MG/L','L01','DEDNREC','','','','nan',38.84972,-75.67333,'T3','2021-11-08'),(10001,621719,'NTN022','NTWQM','NTN','DEDNREC  ','DEDNREC',302031,'9/29/2022','9:43:00',NULL,'','',0,'S ','HVIC','S1','NH4W','G',0.0169,'MG/L','L01','DEDNREC','','','','nan',38.84972,-75.67333,'T3','2022-09-29'),(10001,610442,'NTN021','NTWQM','NTN','DEDNREC  ','DEDNREC',302031,'9/22/2021','9:14:00',NULL,'','',0,'S ','HVIC','FS2','NO23F','',2.419,'MG/L','L01','DEDNREC','','','','nan',38.84972,-75.67333,'T3','2021-09-22'),(10001,610442,'NTN021','NTWQM','NTN','DEDNREC  ','DEDNREC',302031,'9/22/2021','9:14:00',NULL,'','',0,'S ','HVIC','FS1','NO23F','',2.403,'MG/L','L01','DEDNREC','','','','nan',38.84972,-75.67333,'T3','2021-09-22'),(10001,610440,'NTN021','NTWQM','NTN','DEDNREC  ','DEDNREC',302031,'8/25/2021','8:02:00',NULL,'','',0,'S ','HVIC','S1','NO23F','',4.047,'MG/L','L01','DEDNREC','NQ','','','nan',38.84972,-75.67333,'T3','2021-08-25'),(10001,610441,'NTN021','NTWQM','NTN','DEDNREC  ','DEDNREC',302031,'9/2/2021','8:04:00',NULL,'','',0,'S ','HVIC','S1','NO23F','',0.677,'MG/L','L01','DEDNREC','','','','nan',38.84972,-75.67333,'T3','2021-09-02'),(10001,610439,'NTN021','NTWQM','NTN','DEDNREC  ','DEDNREC',302031,'7/19/2021','8:24:00',NULL,'','',0,'S ','HVIC','S1','NO23F','',2.85,'MG/L','L01','DEDNREC','','','','nan',38.84972,-75.67333,'T3','2021-07-19'),(10001,610436,'NTN021','NTWQM','NTN','DEDNREC  ','DEDNREC',302031,'4/20/2021','8:41:00',NULL,'','',0,'S ','HVIC','S1','NO23F','',3.495,'MG/L','L01','DEDNREC','GG','','','Analysis performed after holding time expired.',38.84972,-75.67333,'T3','2021-04-20'),(10001,610438,'NTN021','NTWQM','NTN','DEDNREC  ','DEDNREC',302031,'6/15/2021','9:44:00',NULL,'','',0,'S ','HVIC','S1','NO23F','',3.273,'MG/L','L01','DEDNREC','','','','nan',38.84972,-75.67333,'T3','2021-06-15'),(10001,610437,'NTN021','NTWQM','NTN','DEDNREC  ','DEDNREC',302031,'5/24/2021','8:29:00',NULL,'','',0,'S ','HVIC','S1','NO23F','',3.935,'MG/L','L01','DEDNREC','B ','','','Result is likely underestimated due to matrix effect.',38.84972,-75.67333,'T3','2021-05-24'),(10001,610435,'NTN021','NTWQM','NTN','DEDNREC  ','DEDNREC',302031,'3/10/2021','9:03:00',NULL,'','',0,'S ','HVIC','S1','NO23F','',4.135,'MG/L','L01','DEDNREC','','','','nan',38.84972,-75.67333,'T3','2021-03-10'),(10001,621707,'NTN022','NTWQM','NTN','DEDNREC  ','DEDNREC',302031,'10/18/2021','9:37:00',NULL,'','',0,'S ','HVIC','S1','NO23F','',3.483,'MG/L','L01','DEDNREC','','','','nan',38.84972,-75.67333,'T3','2021-10-18'),(10001,621708,'NTN022','NTWQM','NTN','DEDNREC  ','DEDNREC',302031,'11/8/2021','7:25:00',NULL,'','',0,'S ','HVIC','S1','NO23F','',3.557,'MG/L','L01','DEDNREC','','','','nan',38.84972,-75.67333,'T3','2021-11-08'),(10001,621711,'NTN022','NTWQM','NTN','DEDNREC  ','DEDNREC',302031,'2/23/2022','8:10:00',NULL,'','',0,'S ','HVIC','S1','NO23F','',3.121,'MG/L','L01','DEDNREC','','','','nan',38.84972,-75.67333,'T3','2022-02-23'),(10001,621709,'NTN022','NTWQM','NTN','DEDNREC  ','DEDNREC',302031,'12/15/2021','8:44:00',NULL,'','',0,'S ','HVIC','S1','NO23F','',4.02,'MG/L','L01','DEDNREC','','','','nan',38.84972,-75.67333,'T3','2021-12-15'),(10001,621710,'NTN022','NTWQM','NTN','DEDNREC  ','DEDNREC',302031,'1/26/2022','9:44:00',NULL,'','',0,'S ','HVIC','S1','NO23F','',3.617,'MG/L','L01','DEDNREC','','','','nan',38.84972,-75.67333,'T3','2022-01-26'),(10001,621713,'NTN022','NTWQM','NTN','DEDNREC  ','DEDNREC',302031,'4/7/2022','8:14:00',NULL,'','',0,'S ','HVIC','S1','NO23F','',1.345,'MG/L','L01','DEDNREC','','','','nan',38.84972,-75.67333,'T3','2022-04-07'),(10001,621712,'NTN022','NTWQM','NTN','DEDNREC  ','DEDNREC',302031,'3/21/2022','7:52:00',NULL,'','',0,'S ','HVIC','FS2','NO23F','',3.203,'MG/L','L01','DEDNREC','','','','nan',38.84972,-75.67333,'T3','2022-03-21'),(10001,621712,'NTN022','NTWQM','NTN','DEDNREC  ','DEDNREC',302031,'3/21/2022','7:52:00',NULL,'','',0,'S ','HVIC','FS1','NO23F','',2.985,'MG/L','L01','DEDNREC','','','','nan',38.84972,-75.67333,'T3','2022-03-21'),(10001,621714,'NTN022','NTWQM','NTN','DEDNREC  ','DEDNREC',302031,'4/27/2022','8:30:00',NULL,'','',0,'S ','HVIC','S1','NO23F','',3.035,'MG/L','L01','DEDNREC','','','','nan',38.84972,-75.67333,'T3','2022-04-27'),(10001,621715,'NTN022','NTWQM','NTN','DEDNREC  ','DEDNREC',302031,'5/18/2022','8:02:00',NULL,'','',0,'S ','HVIC','S1','NO23F','',2.633,'MG/L','L01','DEDNREC','B ','','','Result is likely overestimated due to matrix effect.',38.84972,-75.67333,'T3','2022-05-18'),(10001,621716,'NTN022','NTWQM','NTN','DEDNREC  ','DEDNREC',302031,'6/15/2022','8:18:00',NULL,'','',0,'S ','HVIC','S1','NO23F','',2.173,'MG/L','L01','DEDNREC','','','','nan',38.84972,-75.67333,'T3','2022-06-15'),(10001,621717,'NTN022','NTWQM','NTN','DEDNREC  ','DEDNREC',302031,'7/27/2022','11:45:00',NULL,'','',0,'S ','HVIC','S1','NO23F','',3.513,'MG/L','L01','DEDNREC','QQ','','','nan',38.84972,-75.67333,'T3','2022-07-27'),(10001,621718,'NTN022','NTWQM','NTN','DEDNREC  ','DEDNREC',302031,'8/24/2022','7:35:00',NULL,'','',0,'S ','HVIC','S1','NO23F','',3.584,'MG/L','L01','DEDNREC','QQ','','','nan',38.84972,-75.67333,'T3','2022-08-24'),(10001,621719,'NTN022','NTWQM','NTN','DEDNREC  ','DEDNREC',302031,'9/29/2022','9:43:00',NULL,'','',0,'S ','HVIC','S1','NO23F','',4.429,'MG/L','L01','DEDNREC','','','','nan',38.84972,-75.67333,'T3','2022-09-29'),(10001,610435,'NTN021','NTWQM','NTN','DEDNREC  ','DEDNREC',302031,'3/10/2021','9:03:00',NULL,'','',0,'S ','HVIC','S1','NO23W','',4.123,'MG/L','L01','DEDNREC','','','','nan',38.84972,-75.67333,'T3','2021-03-10'),(10001,610434,'NTN021','NTWQM','NTN','DEDNREC  ','DEDNREC',302031,'2/24/2021','9:17:00',NULL,'','',0,'S ','HVIC','S1','NO23W','',2.382,'MG/L','L01','DEDNREC','','','','nan',38.84972,-75.67333,'T3','2021-02-24'),(10001,610433,'NTN021','NTWQM','NTN','DEDNREC  ','DEDNREC',302031,'2/2/2021','10:15:00',NULL,'','',0,'S ','HVIC','S1','NO23W','',3.432,'MG/L','L01','DEDNREC','QQ','','','nan',38.84972,-75.67333,'T3','2021-02-02'),(10001,610437,'NTN021','NTWQM','NTN','DEDNREC  ','DEDNREC',302031,'5/24/2021','8:29:00',NULL,'','',0,'S ','HVIC','S1','NO23W','',4.054,'MG/L','L01','DEDNREC','','','','nan',38.84972,-75.67333,'T3','2021-05-24'),(10001,610438,'NTN021','NTWQM','NTN','DEDNREC  ','DEDNREC',302031,'6/15/2021','9:44:00',NULL,'','',0,'S ','HVIC','S1','NO23W','',3.395,'MG/L','L01','DEDNREC','','','','nan',38.84972,-75.67333,'T3','2021-06-15'),(10001,610436,'NTN021','NTWQM','NTN','DEDNREC  ','DEDNREC',302031,'4/20/2021','8:41:00',NULL,'','',0,'S ','HVIC','S1','NO23W','',3.355,'MG/L','L01','DEDNREC','','','','nan',38.84972,-75.67333,'T3','2021-04-20'),(10001,610439,'NTN021','NTWQM','NTN','DEDNREC  ','DEDNREC',302031,'7/19/2021','8:24:00',NULL,'','',0,'S ','HVIC','S1','NO23W','',3.001,'MG/L','L01','DEDNREC','','','','nan',38.84972,-75.67333,'T3','2021-07-19'),(10001,610441,'NTN021','NTWQM','NTN','DEDNREC  ','DEDNREC',302031,'9/2/2021','8:04:00',NULL,'','',0,'S ','HVIC','S1','NO23W','',0.633,'MG/L','L01','DEDNREC','','','','nan',38.84972,-75.67333,'T3','2021-09-02'),(10001,610440,'NTN021','NTWQM','NTN','DEDNREC  ','DEDNREC',302031,'8/25/2021','8:02:00',NULL,'','',0,'S ','HVIC','S1','NO23W','',3.951,'MG/L','L01','DEDNREC','NQ','','','nan',38.84972,-75.67333,'T3','2021-08-25'),(10001,610442,'NTN021','NTWQM','NTN','DEDNREC  ','DEDNREC',302031,'9/22/2021','9:14:00',NULL,'','',0,'S ','HVIC','FS1','NO23W','',2.682,'MG/L','L01','DEDNREC','','','','nan',38.84972,-75.67333,'T3','2021-09-22'),(10001,610442,'NTN021','NTWQM','NTN','DEDNREC  ','DEDNREC',302031,'9/22/2021','9:14:00',NULL,'','',0,'S ','HVIC','FS2','NO23W','',2.395,'MG/L','L01','DEDNREC','','','','nan',38.84972,-75.67333,'T3','2021-09-22'),(10001,610432,'NTN021','NTWQM','NTN','DEDNREC  ','DEDNREC',302031,'1/28/2021','10:36:00',NULL,'','',0,'S ','HVIC','S1','NO23W','',4.284,'MG/L','L01','DEDNREC','','','','nan',38.84972,-75.67333,'T3','2021-01-28'),(10001,621718,'NTN022','NTWQM','NTN','DEDNREC  ','DEDNREC',302031,'8/24/2022','7:35:00',NULL,'','',0,'S ','HVIC','S1','NO23W','',3.474,'MG/L','L01','DEDNREC','','','','nan',38.84972,-75.67333,'T3','2022-08-24'),(10001,621717,'NTN022','NTWQM','NTN','DEDNREC  ','DEDNREC',302031,'7/27/2022','11:45:00',NULL,'','',0,'S ','HVIC','S1','NO23W','',3.497,'MG/L','L01','DEDNREC','','','','nan',38.84972,-75.67333,'T3','2022-07-27'),(10001,621716,'NTN022','NTWQM','NTN','DEDNREC  ','DEDNREC',302031,'6/15/2022','8:18:00',NULL,'','',0,'S ','HVIC','S1','NO23W','',2.165,'MG/L','L01','DEDNREC','','','','nan',38.84972,-75.67333,'T3','2022-06-15'),(10001,621715,'NTN022','NTWQM','NTN','DEDNREC  ','DEDNREC',302031,'5/18/2022','8:02:00',NULL,'','',0,'S ','HVIC','S1','NO23W','',2.941,'MG/L','L01','DEDNREC','','','','nan',38.84972,-75.67333,'T3','2022-05-18'),(10001,621714,'NTN022','NTWQM','NTN','DEDNREC  ','DEDNREC',302031,'4/27/2022','8:30:00',NULL,'','',0,'S ','HVIC','S1','NO23W','',3.269,'MG/L','L01','DEDNREC','QQ','','','nan',38.84972,-75.67333,'T3','2022-04-27'),(10001,621712,'NTN022','NTWQM','NTN','DEDNREC  ','DEDNREC',302031,'3/21/2022','7:52:00',NULL,'','',0,'S ','HVIC','FS1','NO23W','',3.194,'MG/L','L01','DEDNREC','','','','nan',38.84972,-75.67333,'T3','2022-03-21'),(10001,621712,'NTN022','NTWQM','NTN','DEDNREC  ','DEDNREC',302031,'3/21/2022','7:52:00',NULL,'','',0,'S ','HVIC','FS2','NO23W','',3.176,'MG/L','L01','DEDNREC','','','','nan',38.84972,-75.67333,'T3','2022-03-21'),(10001,621713,'NTN022','NTWQM','NTN','DEDNREC  ','DEDNREC',302031,'4/7/2022','8:14:00',NULL,'','',0,'S ','HVIC','S1','NO23W','',1.451,'MG/L','L01','DEDNREC','','','','nan',38.84972,-75.67333,'T3','2022-04-07'),(10001,621710,'NTN022','NTWQM','NTN','DEDNREC  ','DEDNREC',302031,'1/26/2022','9:44:00',NULL,'','',0,'S ','HVIC','S1','NO23W','',3.52,'MG/L','L01','DEDNREC','','','','nan',38.84972,-75.67333,'T3','2022-01-26'),(10001,621711,'NTN022','NTWQM','NTN','DEDNREC  ','DEDNREC',302031,'2/23/2022','8:10:00',NULL,'','',0,'S ','HVIC','S1','NO23W','',3.152,'MG/L','L01','DEDNREC','','','','nan',38.84972,-75.67333,'T3','2022-02-23'),(10001,621708,'NTN022','NTWQM','NTN','DEDNREC  ','DEDNREC',302031,'11/8/2021','7:25:00',NULL,'','',0,'S ','HVIC','S1','NO23W','',3.831,'MG/L','L01','DEDNREC','','','','nan',38.84972,-75.67333,'T3','2021-11-08'),(10001,621709,'NTN022','NTWQM','NTN','DEDNREC  ','DEDNREC',302031,'12/15/2021','8:44:00',NULL,'','',0,'S ','HVIC','S1','NO23W','',4.203,'MG/L','L01','DEDNREC','','','','nan',38.84972,-75.67333,'T3','2021-12-15'),(10001,621707,'NTN022','NTWQM','NTN','DEDNREC  ','DEDNREC',302031,'10/18/2021','9:37:00',NULL,'','',0,'S ','HVIC','S1','NO23W','',3.783,'MG/L','L01','DEDNREC','','','','nan',38.84972,-75.67333,'T3','2021-10-18'),(10001,621719,'NTN022','NTWQM','NTN','DEDNREC  ','DEDNREC',302031,'9/29/2022','9:43:00',NULL,'','',0,'S ','HVIC','S1','NO23W','',4.488,'MG/L','L01','DEDNREC','','','','nan',38.84972,-75.67333,'T3','2022-09-29'),(10001,610432,'NTN021','NTWQM','NTN','DEDNREC  ','DEDNREC',302031,'1/28/2021','10:36:00',NULL,'','',0,'S ','ISM','M1','PH','',6.39,'SU','F02','','','','','nan',38.84972,-75.67333,'T3','2021-01-28'),(10001,610442,'NTN021','NTWQM','NTN','DEDNREC  ','DEDNREC',302031,'9/22/2021','9:14:00',NULL,'','',0,'S ','ISM','M2','PH','',7.28,'SU','F02','','','','','nan',38.84972,-75.67333,'T3','2021-09-22'),(10001,610442,'NTN021','NTWQM','NTN','DEDNREC  ','DEDNREC',302031,'9/22/2021','9:14:00',NULL,'','',0,'S ','ISM','M1','PH','',7.28,'SU','F02','','','','','nan',38.84972,-75.67333,'T3','2021-09-22'),(10001,610441,'NTN021','NTWQM','NTN','DEDNREC  ','DEDNREC',302031,'9/2/2021','8:04:00',NULL,'','',0,'S ','ISM','M1','PH','',6.53,'SU','F02','','','','','nan',38.84972,-75.67333,'T3','2021-09-02'),(10001,610440,'NTN021','NTWQM','NTN','DEDNREC  ','DEDNREC',302031,'8/25/2021','8:02:00',NULL,'','',0,'S ','ISM','M1','PH','',6.82,'SU','F02','','','','','nan',38.84972,-75.67333,'T3','2021-08-25'),(10001,610439,'NTN021','NTWQM','NTN','DEDNREC  ','DEDNREC',302031,'7/19/2021','8:24:00',NULL,'','',0,'S ','ISM','M1','PH','',7.43,'SU','F02','','','','','nan',38.84972,-75.67333,'T3','2021-07-19'),(10001,610436,'NTN021','NTWQM','NTN','DEDNREC  ','DEDNREC',302031,'4/20/2021','8:41:00',NULL,'','',0,'S ','ISM','M1','PH','',6.49,'SU','F02','','','','','nan',38.84972,-75.67333,'T3','2021-04-20'),(10001,610438,'NTN021','NTWQM','NTN','DEDNREC  ','DEDNREC',302031,'6/15/2021','9:44:00',NULL,'','',0,'S ','ISM','M1','PH','',6.68,'SU','F02','','','','','nan',38.84972,-75.67333,'T3','2021-06-15'),(10001,610437,'NTN021','NTWQM','NTN','DEDNREC  ','DEDNREC',302031,'5/24/2021','8:29:00',NULL,'','',0,'S ','ISM','M1','PH','',6.34,'SU','F02','','','','','nan',38.84972,-75.67333,'T3','2021-05-24'),(10001,610433,'NTN021','NTWQM','NTN','DEDNREC  ','DEDNREC',302031,'2/2/2021','10:15:00',NULL,'','',0,'S ','ISM','M1','PH','',6.13,'SU','F02','','','','','nan',38.84972,-75.67333,'T3','2021-02-02'),(10001,610434,'NTN021','NTWQM','NTN','DEDNREC  ','DEDNREC',302031,'2/24/2021','9:17:00',NULL,'','',0,'S ','ISM','M1','PH','',5.65,'SU','F02','','','','','nan',38.84972,-75.67333,'T3','2021-02-24'),(10001,610435,'NTN021','NTWQM','NTN','DEDNREC  ','DEDNREC',302031,'3/10/2021','9:03:00',NULL,'','',0,'S ','ISM','M1','PH','',6.17,'SU','F02','','','','','nan',38.84972,-75.67333,'T3','2021-03-10'),(10001,621707,'NTN022','NTWQM','NTN','DEDNREC  ','DEDNREC',302031,'10/18/2021','9:37:00',NULL,'','',0,'S ','ISM','M1','PH','',6.21,'SU','F02','','','','','nan',38.84972,-75.67333,'T3','2021-10-18'),(10001,621709,'NTN022','NTWQM','NTN','DEDNREC  ','DEDNREC',302031,'12/15/2021','8:44:00',NULL,'','',0,'S ','ISM','M1','PH','',6.62,'SU','F02','','','','','nan',38.84972,-75.67333,'T3','2021-12-15'),(10001,621708,'NTN022','NTWQM','NTN','DEDNREC  ','DEDNREC',302031,'11/8/2021','7:25:00',NULL,'','',0,'S ','ISM','M1','PH','',7.44,'SU','F02','','','','','nan',38.84972,-75.67333,'T3','2021-11-08'),(10001,621711,'NTN022','NTWQM','NTN','DEDNREC  ','DEDNREC',302031,'2/23/2022','8:10:00',NULL,'','',0,'S ','ISM','M1','PH','',6.21,'SU','F02','','','','','nan',38.84972,-75.67333,'T3','2022-02-23'),(10001,621710,'NTN022','NTWQM','NTN','DEDNREC  ','DEDNREC',302031,'1/26/2022','9:44:00',NULL,'','',0,'S ','ISM','M1','PH','',5.72,'SU','F02','','','','','nan',38.84972,-75.67333,'T3','2022-01-26'),(10001,621713,'NTN022','NTWQM','NTN','DEDNREC  ','DEDNREC',302031,'4/7/2022','8:14:00',NULL,'','',0,'S ','ISM','M1','PH','',5.72,'SU','F02','','','','','nan',38.84972,-75.67333,'T3','2022-04-07'),(10001,621712,'NTN022','NTWQM','NTN','DEDNREC  ','DEDNREC',302031,'3/21/2022','7:52:00',NULL,'','',0,'S ','ISM','M2','PH','',6.86,'SU','F02','','','','','nan',38.84972,-75.67333,'T3','2022-03-21'),(10001,621712,'NTN022','NTWQM','NTN','DEDNREC  ','DEDNREC',302031,'3/21/2022','7:52:00',NULL,'','',0,'S ','ISM','M1','PH','',6.86,'SU','F02','','','','','nan',38.84972,-75.67333,'T3','2022-03-21'),(10001,621714,'NTN022','NTWQM','NTN','DEDNREC  ','DEDNREC',302031,'4/27/2022','8:30:00',NULL,'','',0,'S ','ISM','M1','PH','',6.52,'SU','F02','','','','','nan',38.84972,-75.67333,'T3','2022-04-27'),(10001,621715,'NTN022','NTWQM','NTN','DEDNREC  ','DEDNREC',302031,'5/18/2022','8:02:00',NULL,'','',0,'S ','ISM','M1','PH','',6.68,'SU','F02','','','','','nan',38.84972,-75.67333,'T3','2022-05-18'),(10001,621716,'NTN022','NTWQM','NTN','DEDNREC  ','DEDNREC',302031,'6/15/2022','8:18:00',NULL,'','',0,'S ','ISM','M1','PH','',6.21,'SU','F02','','','','','nan',38.84972,-75.67333,'T3','2022-06-15'),(10001,621717,'NTN022','NTWQM','NTN','DEDNREC  ','DEDNREC',302031,'7/27/2022','11:45:00',NULL,'','',0,'S ','ISM','M1','PH','',6.95,'SU','F02','','','','','nan',38.84972,-75.67333,'T3','2022-07-27'),(10001,621718,'NTN022','NTWQM','NTN','DEDNREC  ','DEDNREC',302031,'8/24/2022','7:35:00',NULL,'','',0,'S ','ISM','M1','PH','',7.01,'SU','F02','','','','','nan',38.84972,-75.67333,'T3','2022-08-24'),(10001,621719,'NTN022','NTWQM','NTN','DEDNREC  ','DEDNREC',302031,'9/29/2022','9:43:00',NULL,'','',0,'S ','ISM','M1','PH','',6.46,'SU','F02','','','','','nan',38.84972,-75.67333,'T3','2022-09-29'),(10001,610434,'NTN021','NTWQM','NTN','DEDNREC  ','DEDNREC',302031,'2/24/2021','9:17:00',NULL,'','',0,'S ','HVIC','S1','PO4F','',0.0206,'MG/L','L01','DEDNREC','','','','nan',38.84972,-75.67333,'T3','2021-02-24'),(10001,610433,'NTN021','NTWQM','NTN','DEDNREC  ','DEDNREC',302031,'2/2/2021','10:15:00',NULL,'','',0,'S ','HVIC','S1','PO4F','',0.0389,'MG/L','L01','DEDNREC','','','','nan',38.84972,-75.67333,'T3','2021-02-02'),(10001,610432,'NTN021','NTWQM','NTN','DEDNREC  ','DEDNREC',302031,'1/28/2021','10:36:00',NULL,'','',0,'S ','HVIC','S1','PO4F','G',0.0066,'MG/L','L01','DEDNREC','','','','nan',38.84972,-75.67333,'T3','2021-01-28'),(10001,610437,'NTN021','NTWQM','NTN','DEDNREC  ','DEDNREC',302031,'5/24/2021','8:29:00',NULL,'','',0,'S ','HVIC','S1','PO4F','G',0.0089,'MG/L','L01','DEDNREC','','','','nan',38.84972,-75.67333,'T3','2021-05-24'),(10001,610436,'NTN021','NTWQM','NTN','DEDNREC  ','DEDNREC',302031,'4/20/2021','8:41:00',NULL,'','',0,'S ','HVIC','S1','PO4F','G',0.0057,'MG/L','L01','DEDNREC','','','','nan',38.84972,-75.67333,'T3','2021-04-20'),(10001,610435,'NTN021','NTWQM','NTN','DEDNREC  ','DEDNREC',302031,'3/10/2021','9:03:00',NULL,'','',0,'S ','HVIC','S1','PO4F','G',0.0079,'MG/L','L01','DEDNREC','','','','nan',38.84972,-75.67333,'T3','2021-03-10'),(10001,610439,'NTN021','NTWQM','NTN','DEDNREC  ','DEDNREC',302031,'7/19/2021','8:24:00',NULL,'','',0,'S ','HVIC','S1','PO4F','G',0.0042,'MG/L','L01','DEDNREC','','','','nan',38.84972,-75.67333,'T3','2021-07-19'),(10001,610438,'NTN021','NTWQM','NTN','DEDNREC  ','DEDNREC',302031,'6/15/2021','9:44:00',NULL,'','',0,'S ','HVIC','S1','PO4F','',0.0119,'MG/L','L01','DEDNREC','','','','nan',38.84972,-75.67333,'T3','2021-06-15'),(10001,610440,'NTN021','NTWQM','NTN','DEDNREC  ','DEDNREC',302031,'8/25/2021','8:02:00',NULL,'','',0,'S ','HVIC','S1','PO4F','',0.0525,'MG/L','L01','DEDNREC','','','','nan',38.84972,-75.67333,'T3','2021-08-25'),(10001,610441,'NTN021','NTWQM','NTN','DEDNREC  ','DEDNREC',302031,'9/2/2021','8:04:00',NULL,'','',0,'S ','HVIC','S1','PO4F','',0.3039,'MG/L','L01','DEDNREC','','','','nan',38.84972,-75.67333,'T3','2021-09-02'),(10001,610442,'NTN021','NTWQM','NTN','DEDNREC  ','DEDNREC',302031,'9/22/2021','9:14:00',NULL,'','',0,'S ','HVIC','FS1','PO4F','<',0.004,'MG/L','L01','DEDNREC','','','','nan',38.84972,-75.67333,'T3','2021-09-22'),(10001,610442,'NTN021','NTWQM','NTN','DEDNREC  ','DEDNREC',302031,'9/22/2021','9:14:00',NULL,'','',0,'S ','HVIC','FS2','PO4F','<',0.004,'MG/L','L01','DEDNREC','','','','nan',38.84972,-75.67333,'T3','2021-09-22'),(10001,621718,'NTN022','NTWQM','NTN','DEDNREC  ','DEDNREC',302031,'8/24/2022','7:35:00',NULL,'','',0,'S ','HVIC','S1','PO4F','<',0.004,'MG/L','L01','DEDNREC','','','','nan',38.84972,-75.67333,'T3','2022-08-24'),(10001,621716,'NTN022','NTWQM','NTN','DEDNREC  ','DEDNREC',302031,'6/15/2022','8:18:00',NULL,'','',0,'S ','HVIC','S1','PO4F','',0.2097,'MG/L','L01','DEDNREC','','','','nan',38.84972,-75.67333,'T3','2022-06-15'),(10001,621717,'NTN022','NTWQM','NTN','DEDNREC  ','DEDNREC',302031,'7/27/2022','11:45:00',NULL,'','',0,'S ','HVIC','S1','PO4F','G',0.0054,'MG/L','L01','DEDNREC','','','','nan',38.84972,-75.67333,'T3','2022-07-27'),(10001,621714,'NTN022','NTWQM','NTN','DEDNREC  ','DEDNREC',302031,'4/27/2022','8:30:00',NULL,'','',0,'S ','HVIC','S1','PO4F','',0.0124,'MG/L','L01','DEDNREC','','','','nan',38.84972,-75.67333,'T3','2022-04-27'),(10001,621713,'NTN022','NTWQM','NTN','DEDNREC  ','DEDNREC',302031,'4/7/2022','8:14:00',NULL,'','',0,'S ','HVIC','S1','PO4F','',0.276,'MG/L','L01','DEDNREC','','','','nan',38.84972,-75.67333,'T3','2022-04-07'),(10001,621715,'NTN022','NTWQM','NTN','DEDNREC  ','DEDNREC',302031,'5/18/2022','8:02:00',NULL,'','',0,'S ','HVIC','S1','PO4F','G',0.0064,'MG/L','L01','DEDNREC','','','','nan',38.84972,-75.67333,'T3','2022-05-18'),(10001,621712,'NTN022','NTWQM','NTN','DEDNREC  ','DEDNREC',302031,'3/21/2022','7:52:00',NULL,'','',0,'S ','HVIC','FS2','PO4F','G',0.0093,'MG/L','L01','DEDNREC','','','','nan',38.84972,-75.67333,'T3','2022-03-21'),(10001,621712,'NTN022','NTWQM','NTN','DEDNREC  ','DEDNREC',302031,'3/21/2022','7:52:00',NULL,'','',0,'S ','HVIC','FS1','PO4F','',0.0103,'MG/L','L01','DEDNREC','','','','nan',38.84972,-75.67333,'T3','2022-03-21'),(10001,621710,'NTN022','NTWQM','NTN','DEDNREC  ','DEDNREC',302031,'1/26/2022','9:44:00',NULL,'','',0,'S ','HVIC','S1','PO4F','',0.0127,'MG/L','L01','DEDNREC','','','','nan',38.84972,-75.67333,'T3','2022-01-26'),(10001,621711,'NTN022','NTWQM','NTN','DEDNREC  ','DEDNREC',302031,'2/23/2022','8:10:00',NULL,'','',0,'S ','HVIC','S1','PO4F','',0.0099,'MG/L','L01','DEDNREC','','','','nan',38.84972,-75.67333,'T3','2022-02-23'),(10001,621709,'NTN022','NTWQM','NTN','DEDNREC  ','DEDNREC',302031,'12/15/2021','8:44:00',NULL,'','',0,'S ','HVIC','S1','PO4F','<',0.004,'MG/L','L01','DEDNREC','','','','nan',38.84972,-75.67333,'T3','2021-12-15'),(10001,621708,'NTN022','NTWQM','NTN','DEDNREC  ','DEDNREC',302031,'11/8/2021','7:25:00',NULL,'','',0,'S ','HVIC','S1','PO4F','G',0.0053,'MG/L','L01','DEDNREC','','','','nan',38.84972,-75.67333,'T3','2021-11-08'),(10001,621707,'NTN022','NTWQM','NTN','DEDNREC  ','DEDNREC',302031,'10/18/2021','9:37:00',NULL,'','',0,'S ','HVIC','S1','PO4F','<',0.004,'MG/L','L01','DEDNREC','','','','nan',38.84972,-75.67333,'T3','2021-10-18'),(10001,621719,'NTN022','NTWQM','NTN','DEDNREC  ','DEDNREC',302031,'9/29/2022','9:43:00',NULL,'','',0,'S ','HVIC','S1','PO4F','<',0.004,'MG/L','L01','DEDNREC','','','','nan',38.84972,-75.67333,'T3','2022-09-29'),(10001,610432,'NTN021','NTWQM','NTN','DEDNREC  ','DEDNREC',302031,'1/28/2021','10:36:00',NULL,'','',0,'S ','HVIC','S1','POC','',0.245,'MG/L','D01','DEDNREC','','','','nan',38.84972,-75.67333,'T3','2021-01-28'),(10001,610442,'NTN021','NTWQM','NTN','DEDNREC  ','DEDNREC',302031,'9/22/2021','9:14:00',NULL,'','',0,'S ','HVIC','FS1','POC','',-0.03,'MG/L','D01','DEDNREC','NV','','','nan',38.84972,-75.67333,'T3','2021-09-22'),(10001,610442,'NTN021','NTWQM','NTN','DEDNREC  ','DEDNREC',302031,'9/22/2021','9:14:00',NULL,'','',0,'S ','HVIC','FS2','POC','',-0.125,'MG/L','D01','DEDNREC','NV','','','nan',38.84972,-75.67333,'T3','2021-09-22'),(10001,610441,'NTN021','NTWQM','NTN','DEDNREC  ','DEDNREC',302031,'9/2/2021','8:04:00',NULL,'','',0,'S ','HVIC','S1','POC','',0.56,'MG/L','D01','DEDNREC','','','','nan',38.84972,-75.67333,'T3','2021-09-02'),(10001,610439,'NTN021','NTWQM','NTN','DEDNREC  ','DEDNREC',302031,'7/19/2021','8:24:00',NULL,'','',0,'S ','HVIC','S1','POC','',0.061,'MG/L','D01','DEDNREC','','','','nan',38.84972,-75.67333,'T3','2021-07-19'),(10001,610440,'NTN021','NTWQM','NTN','DEDNREC  ','DEDNREC',302031,'8/25/2021','8:02:00',NULL,'','',0,'S ','HVIC','S1','POC','',0.709,'MG/L','D01','DEDNREC','','','','nan',38.84972,-75.67333,'T3','2021-08-25'),(10001,610436,'NTN021','NTWQM','NTN','DEDNREC  ','DEDNREC',302031,'4/20/2021','8:41:00',NULL,'','',0,'S ','HVIC','S1','POC','',0.381,'MG/L','D01','DEDNREC','','','','nan',38.84972,-75.67333,'T3','2021-04-20'),(10001,610437,'NTN021','NTWQM','NTN','DEDNREC  ','DEDNREC',302031,'5/24/2021','8:29:00',NULL,'','',0,'S ','HVIC','S1','POC','',0.197,'MG/L','D01','DEDNREC','','','','nan',38.84972,-75.67333,'T3','2021-05-24'),(10001,610438,'NTN021','NTWQM','NTN','DEDNREC  ','DEDNREC',302031,'6/15/2021','9:44:00',NULL,'','',0,'S ','HVIC','S1','POC','',0.135,'MG/L','D01','DEDNREC','','','','nan',38.84972,-75.67333,'T3','2021-06-15'),(10001,610433,'NTN021','NTWQM','NTN','DEDNREC  ','DEDNREC',302031,'2/2/2021','10:15:00',NULL,'','',0,'S ','HVIC','S1','POC','',0.481,'MG/L','D01','DEDNREC','','','','nan',38.84972,-75.67333,'T3','2021-02-02'),(10001,610434,'NTN021','NTWQM','NTN','DEDNREC  ','DEDNREC',302031,'2/24/2021','9:17:00',NULL,'','',0,'S ','HVIC','S1','POC','',0.082,'MG/L','D01','DEDNREC','GG','','','Analysis performed after holding time expired.',38.84972,-75.67333,'T3','2021-02-24'),(10001,610435,'NTN021','NTWQM','NTN','DEDNREC  ','DEDNREC',302031,'3/10/2021','9:03:00',NULL,'','',0,'S ','HVIC','S1','POC','',0.476,'MG/L','D01','DEDNREC','','','','nan',38.84972,-75.67333,'T3','2021-03-10'),(10001,621719,'NTN022','NTWQM','NTN','DEDNREC  ','DEDNREC',302031,'9/29/2022','9:43:00',NULL,'','',0,'S ','HVIC','S1','POC','',0.087,'MG/L','D01','DEDNREC','','','','nan',38.84972,-75.67333,'T3','2022-09-29'),(10001,621707,'NTN022','NTWQM','NTN','DEDNREC  ','DEDNREC',302031,'10/18/2021','9:37:00',NULL,'','',0,'S ','HVIC','S1','POC','',0.127,'MG/L','D01','DEDNREC','','','','nan',38.84972,-75.67333,'T3','2021-10-18'),(10001,621708,'NTN022','NTWQM','NTN','DEDNREC  ','DEDNREC',302031,'11/8/2021','7:25:00',NULL,'','',0,'S ','HVIC','S1','POC','',0.284,'MG/L','D01','DEDNREC','','','','nan',38.84972,-75.67333,'T3','2021-11-08'),(10001,621711,'NTN022','NTWQM','NTN','DEDNREC  ','DEDNREC',302031,'2/23/2022','8:10:00',NULL,'','',0,'S ','HVIC','S1','POC','',0.146,'MG/L','D01','DEDNREC','','','','nan',38.84972,-75.67333,'T3','2022-02-23'),(10001,621710,'NTN022','NTWQM','NTN','DEDNREC  ','DEDNREC',302031,'1/26/2022','9:44:00',NULL,'','',0,'S ','HVIC','S1','POC','',0.448,'MG/L','D01','DEDNREC','','','','nan',38.84972,-75.67333,'T3','2022-01-26'),(10001,621709,'NTN022','NTWQM','NTN','DEDNREC  ','DEDNREC',302031,'12/15/2021','8:44:00',NULL,'','',0,'S ','HVIC','S1','POC','',0.326,'MG/L','D01','DEDNREC','','','','nan',38.84972,-75.67333,'T3','2021-12-15'),(10001,621712,'NTN022','NTWQM','NTN','DEDNREC  ','DEDNREC',302031,'3/21/2022','7:52:00',NULL,'','',0,'S ','HVIC','FS1','POC','',0.427,'MG/L','D01','DEDNREC','','','','nan',38.84972,-75.67333,'T3','2022-03-21'),(10001,621712,'NTN022','NTWQM','NTN','DEDNREC  ','DEDNREC',302031,'3/21/2022','7:52:00',NULL,'','',0,'S ','HVIC','FS2','POC','',0.373,'MG/L','D01','DEDNREC','','','','nan',38.84972,-75.67333,'T3','2022-03-21'),(10001,621713,'NTN022','NTWQM','NTN','DEDNREC  ','DEDNREC',302031,'4/7/2022','8:14:00',NULL,'','',0,'S ','HVIC','S1','POC','',0.13,'MG/L','D01','DEDNREC','','','','nan',38.84972,-75.67333,'T3','2022-04-07'),(10001,621716,'NTN022','NTWQM','NTN','DEDNREC  ','DEDNREC',302031,'6/15/2022','8:18:00',NULL,'','',0,'S ','HVIC','S1','POC','',0.217,'MG/L','D01','DEDNREC','','','','nan',38.84972,-75.67333,'T3','2022-06-15'),(10001,621714,'NTN022','NTWQM','NTN','DEDNREC  ','DEDNREC',302031,'4/27/2022','8:30:00',NULL,'','',0,'S ','HVIC','S1','POC','',0.356,'MG/L','D01','DEDNREC','','','','nan',38.84972,-75.67333,'T3','2022-04-27'),(10001,621715,'NTN022','NTWQM','NTN','DEDNREC  ','DEDNREC',302031,'5/18/2022','8:02:00',NULL,'','',0,'S ','HVIC','S1','POC','',0.362,'MG/L','D01','DEDNREC','','','','nan',38.84972,-75.67333,'T3','2022-05-18'),(10001,621717,'NTN022','NTWQM','NTN','DEDNREC  ','DEDNREC',302031,'7/27/2022','11:45:00',NULL,'','',0,'S ','HVIC','S1','POC','',0.074,'MG/L','D01','DEDNREC','','','','nan',38.84972,-75.67333,'T3','2022-07-27'),(10001,621718,'NTN022','NTWQM','NTN','DEDNREC  ','DEDNREC',302031,'8/24/2022','7:35:00',NULL,'','',0,'S ','HVIC','S1','POC','',-0.062,'MG/L','D01','DEDNREC','NV','','','nan',38.84972,-75.67333,'T3','2022-08-24'),(10001,610434,'NTN021','NTWQM','NTN','DEDNREC  ','DEDNREC',302031,'2/24/2021','9:17:00',NULL,'','',0,'S ','ISM','M1','SALINITY','<',0.1,'PPT','F01','','','','','nan',38.84972,-75.67333,'T3','2021-02-24'),(10001,610435,'NTN021','NTWQM','NTN','DEDNREC  ','DEDNREC',302031,'3/10/2021','9:03:00',NULL,'','',0,'S ','ISM','M1','SALINITY','<',0.1,'PPT','F01','','','','','nan',38.84972,-75.67333,'T3','2021-03-10'),(10001,610433,'NTN021','NTWQM','NTN','DEDNREC  ','DEDNREC',302031,'2/2/2021','10:15:00',NULL,'','',0,'S ','ISM','M1','SALINITY','<',0.1,'PPT','F01','','','','','nan',38.84972,-75.67333,'T3','2021-02-02'),(10001,610437,'NTN021','NTWQM','NTN','DEDNREC  ','DEDNREC',302031,'5/24/2021','8:29:00',NULL,'','',0,'S ','ISM','M1','SALINITY','<',0.1,'PPT','F01','','','','','nan',38.84972,-75.67333,'T3','2021-05-24'),(10001,610436,'NTN021','NTWQM','NTN','DEDNREC  ','DEDNREC',302031,'4/20/2021','8:41:00',NULL,'','',0,'S ','ISM','M1','SALINITY','<',0.1,'PPT','F01','','','','','nan',38.84972,-75.67333,'T3','2021-04-20'),(10001,610439,'NTN021','NTWQM','NTN','DEDNREC  ','DEDNREC',302031,'7/19/2021','8:24:00',NULL,'','',0,'S ','ISM','M1','SALINITY','',0.13,'PPT','F01','','','','','nan',38.84972,-75.67333,'T3','2021-07-19'),(10001,610438,'NTN021','NTWQM','NTN','DEDNREC  ','DEDNREC',302031,'6/15/2021','9:44:00',NULL,'','',0,'S ','ISM','M1','SALINITY','<',0.1,'PPT','F01','','','','','nan',38.84972,-75.67333,'T3','2021-06-15'),(10001,610440,'NTN021','NTWQM','NTN','DEDNREC  ','DEDNREC',302031,'8/25/2021','8:02:00',NULL,'','',0,'S ','ISM','M1','SALINITY','<',0.1,'PPT','F01','','','','','nan',38.84972,-75.67333,'T3','2021-08-25'),(10001,610441,'NTN021','NTWQM','NTN','DEDNREC  ','DEDNREC',302031,'9/2/2021','8:04:00',NULL,'','',0,'S ','ISM','M1','SALINITY','<',0.1,'PPT','F01','','','','','nan',38.84972,-75.67333,'T3','2021-09-02'),(10001,610442,'NTN021','NTWQM','NTN','DEDNREC  ','DEDNREC',302031,'9/22/2021','9:14:00',NULL,'','',0,'S ','ISM','M1','SALINITY','',0.1,'PPT','F01','','','','','nan',38.84972,-75.67333,'T3','2021-09-22'),(10001,610442,'NTN021','NTWQM','NTN','DEDNREC  ','DEDNREC',302031,'9/22/2021','9:14:00',NULL,'','',0,'S ','ISM','M2','SALINITY','',0.1,'PPT','F01','','','','','nan',38.84972,-75.67333,'T3','2021-09-22'),(10001,610432,'NTN021','NTWQM','NTN','DEDNREC  ','DEDNREC',302031,'1/28/2021','10:36:00',NULL,'','',0,'S ','ISM','M1','SALINITY','<',0.1,'PPT','F01','','','','','nan',38.84972,-75.67333,'T3','2021-01-28'),(10001,621718,'NTN022','NTWQM','NTN','DEDNREC  ','DEDNREC',302031,'8/24/2022','7:35:00',NULL,'','',0,'S ','ISM','M1','SALINITY','<',0.1,'PPT','F01','','','','','nan',38.84972,-75.67333,'T3','2022-08-24'),(10001,621717,'NTN022','NTWQM','NTN','DEDNREC  ','DEDNREC',302031,'7/27/2022','11:45:00',NULL,'','',0,'S ','ISM','M1','SALINITY','<',0.1,'PPT','F01','','','','','nan',38.84972,-75.67333,'T3','2022-07-27'),(10001,621716,'NTN022','NTWQM','NTN','DEDNREC  ','DEDNREC',302031,'6/15/2022','8:18:00',NULL,'','',0,'S ','ISM','M1','SALINITY','<',0.1,'PPT','F01','','','','','nan',38.84972,-75.67333,'T3','2022-06-15'),(10001,621715,'NTN022','NTWQM','NTN','DEDNREC  ','DEDNREC',302031,'5/18/2022','8:02:00',NULL,'','',0,'S ','ISM','M1','SALINITY','<',0.1,'PPT','F01','','','','','nan',38.84972,-75.67333,'T3','2022-05-18'),(10001,621713,'NTN022','NTWQM','NTN','DEDNREC  ','DEDNREC',302031,'4/7/2022','8:14:00',NULL,'','',0,'S ','ISM','M1','SALINITY','<',0.1,'PPT','F01','','','','','nan',38.84972,-75.67333,'T3','2022-04-07'),(10001,621714,'NTN022','NTWQM','NTN','DEDNREC  ','DEDNREC',302031,'4/27/2022','8:30:00',NULL,'','',0,'S ','ISM','M1','SALINITY','<',0.1,'PPT','F01','','','','','nan',38.84972,-75.67333,'T3','2022-04-27'),(10001,621712,'NTN022','NTWQM','NTN','DEDNREC  ','DEDNREC',302031,'3/21/2022','7:52:00',NULL,'','',0,'S ','ISM','M2','SALINITY','',0.23,'PPT','F01','','','','','nan',38.84972,-75.67333,'T3','2022-03-21'),(10001,621709,'NTN022','NTWQM','NTN','DEDNREC  ','DEDNREC',302031,'12/15/2021','8:44:00',NULL,'','',0,'S ','ISM','M1','SALINITY','<',0.1,'PPT','F01','','','','','nan',38.84972,-75.67333,'T3','2021-12-15'),(10001,621710,'NTN022','NTWQM','NTN','DEDNREC  ','DEDNREC',302031,'1/26/2022','9:44:00',NULL,'','',0,'S ','ISM','M1','SALINITY','<',0.1,'PPT','F01','','','','','nan',38.84972,-75.67333,'T3','2022-01-26'),(10001,621712,'NTN022','NTWQM','NTN','DEDNREC  ','DEDNREC',302031,'3/21/2022','7:52:00',NULL,'','',0,'S ','ISM','M1','SALINITY','',0.23,'PPT','F01','','','','','nan',38.84972,-75.67333,'T3','2022-03-21'),(10001,621711,'NTN022','NTWQM','NTN','DEDNREC  ','DEDNREC',302031,'2/23/2022','8:10:00',NULL,'','',0,'S ','ISM','M1','SALINITY','<',0.1,'PPT','F01','','','','','nan',38.84972,-75.67333,'T3','2022-02-23'),(10001,621708,'NTN022','NTWQM','NTN','DEDNREC  ','DEDNREC',302031,'11/8/2021','7:25:00',NULL,'','',0,'S ','ISM','M1','SALINITY','<',0.1,'PPT','F01','','','','','nan',38.84972,-75.67333,'T3','2021-11-08'),(10001,621707,'NTN022','NTWQM','NTN','DEDNREC  ','DEDNREC',302031,'10/18/2021','9:37:00',NULL,'','',0,'S ','ISM','M1','SALINITY','<',0.1,'PPT','F01','','','','','nan',38.84972,-75.67333,'T3','2021-10-18'),(10001,621719,'NTN022','NTWQM','NTN','DEDNREC  ','DEDNREC',302031,'9/29/2022','9:43:00',NULL,'','',0,'S ','ISM','M1','SALINITY','<',0.1,'PPT','F01','','','','','nan',38.84972,-75.67333,'T3','2022-09-29'),(10001,610432,'NTN021','NTWQM','NTN','DEDNREC  ','DEDNREC',302031,'1/28/2021','10:36:00',NULL,'','',0,'S ','ISM','M1','SPCOND','',165,'UMHOS/CM','F02','','','','','nan',38.84972,-75.67333,'T3','2021-01-28'),(10001,610442,'NTN021','NTWQM','NTN','DEDNREC  ','DEDNREC',302031,'9/22/2021','9:14:00',NULL,'','',0,'S ','ISM','M2','SPCOND','',202.60001,'UMHOS/CM','F02','','','','','nan',38.84972,-75.67333,'T3','2021-09-22'),(10001,610441,'NTN021','NTWQM','NTN','DEDNREC  ','DEDNREC',302031,'9/2/2021','8:04:00',NULL,'','',0,'S ','ISM','M1','SPCOND','',87.7,'UMHOS/CM','F02','','','','','nan',38.84972,-75.67333,'T3','2021-09-02'),(10001,610442,'NTN021','NTWQM','NTN','DEDNREC  ','DEDNREC',302031,'9/22/2021','9:14:00',NULL,'','',0,'S ','ISM','M1','SPCOND','',202.5,'UMHOS/CM','F02','','','','','nan',38.84972,-75.67333,'T3','2021-09-22'),(10001,610440,'NTN021','NTWQM','NTN','DEDNREC  ','DEDNREC',302031,'8/25/2021','8:02:00',NULL,'','',0,'S ','ISM','M1','SPCOND','',147.89999,'UMHOS/CM','F02','','','','','nan',38.84972,-75.67333,'T3','2021-08-25'),(10001,610438,'NTN021','NTWQM','NTN','DEDNREC  ','DEDNREC',302031,'6/15/2021','9:44:00',NULL,'','',0,'S ','ISM','M1','SPCOND','',158.60001,'UMHOS/CM','F02','','','','','nan',38.84972,-75.67333,'T3','2021-06-15'),(10001,610439,'NTN021','NTWQM','NTN','DEDNREC  ','DEDNREC',302031,'7/19/2021','8:24:00',NULL,'','',0,'S ','ISM','M1','SPCOND','',278.79999,'UMHOS/CM','F02','','','','','nan',38.84972,-75.67333,'T3','2021-07-19'),(10001,610437,'NTN021','NTWQM','NTN','DEDNREC  ','DEDNREC',302031,'5/24/2021','8:29:00',NULL,'','',0,'S ','ISM','M1','SPCOND','',159,'UMHOS/CM','F02','','','','','nan',38.84972,-75.67333,'T3','2021-05-24'),(10001,610436,'NTN021','NTWQM','NTN','DEDNREC  ','DEDNREC',302031,'4/20/2021','8:41:00',NULL,'','',0,'S ','ISM','M1','SPCOND','',153.10001,'UMHOS/CM','F02','','','','','nan',38.84972,-75.67333,'T3','2021-04-20'),(10001,610434,'NTN021','NTWQM','NTN','DEDNREC  ','DEDNREC',302031,'2/24/2021','9:17:00',NULL,'','',0,'S ','ISM','M1','SPCOND','',96.7,'UMHOS/CM','F02','','','','','nan',38.84972,-75.67333,'T3','2021-02-24'),(10001,610433,'NTN021','NTWQM','NTN','DEDNREC  ','DEDNREC',302031,'2/2/2021','10:15:00',NULL,'','',0,'S ','ISM','M1','SPCOND','',138.7,'UMHOS/CM','F02','','','','','nan',38.84972,-75.67333,'T3','2021-02-02'),(10001,610435,'NTN021','NTWQM','NTN','DEDNREC  ','DEDNREC',302031,'3/10/2021','9:03:00',NULL,'','',0,'S ','ISM','M1','SPCOND','',150.7,'UMHOS/CM','F02','','','','','nan',38.84972,-75.67333,'T3','2021-03-10'),(10001,621719,'NTN022','NTWQM','NTN','DEDNREC  ','DEDNREC',302031,'9/29/2022','9:43:00',NULL,'','',0,'S ','ISM','M1','SPCOND','',178.3,'UMHOS/CM','F02','','','','','nan',38.84972,-75.67333,'T3','2022-09-29'),(10001,621707,'NTN022','NTWQM','NTN','DEDNREC  ','DEDNREC',302031,'10/18/2021','9:37:00',NULL,'','',0,'S ','ISM','M1','SPCOND','',170,'UMHOS/CM','F02','','','','','nan',38.84972,-75.67333,'T3','2021-10-18'),(10001,621708,'NTN022','NTWQM','NTN','DEDNREC  ','DEDNREC',302031,'11/8/2021','7:25:00',NULL,'','',0,'S ','ISM','M1','SPCOND','',182.60001,'UMHOS/CM','F02','','','','','nan',38.84972,-75.67333,'T3','2021-11-08'),(10001,621711,'NTN022','NTWQM','NTN','DEDNREC  ','DEDNREC',302031,'2/23/2022','8:10:00',NULL,'','',0,'S ','ISM','M1','SPCOND','',151.60001,'UMHOS/CM','F02','','','','','nan',38.84972,-75.67333,'T3','2022-02-23'),(10001,621709,'NTN022','NTWQM','NTN','DEDNREC  ','DEDNREC',302031,'12/15/2021','8:44:00',NULL,'','',0,'S ','ISM','M1','SPCOND','',188.2,'UMHOS/CM','F02','','','','','nan',38.84972,-75.67333,'T3','2021-12-15'),(10001,621710,'NTN022','NTWQM','NTN','DEDNREC  ','DEDNREC',302031,'1/26/2022','9:44:00',NULL,'','',0,'S ','ISM','M1','SPCOND','',152.5,'UMHOS/CM','F02','','','','','nan',38.84972,-75.67333,'T3','2022-01-26'),(10001,621713,'NTN022','NTWQM','NTN','DEDNREC  ','DEDNREC',302031,'4/7/2022','8:14:00',NULL,'','',0,'S ','ISM','M1','SPCOND','',114.3,'UMHOS/CM','F02','','','','','nan',38.84972,-75.67333,'T3','2022-04-07'),(10001,621712,'NTN022','NTWQM','NTN','DEDNREC  ','DEDNREC',302031,'3/21/2022','7:52:00',NULL,'','',0,'S ','ISM','M2','SPCOND','',474,'UMHOS/CM','F02','','','','','nan',38.84972,-75.67333,'T3','2022-03-21'),(10001,621712,'NTN022','NTWQM','NTN','DEDNREC  ','DEDNREC',302031,'3/21/2022','7:52:00',NULL,'','',0,'S ','ISM','M1','SPCOND','',474.60001,'UMHOS/CM','F02','','','','','nan',38.84972,-75.67333,'T3','2022-03-21'),(10001,621714,'NTN022','NTWQM','NTN','DEDNREC  ','DEDNREC',302031,'4/27/2022','8:30:00',NULL,'','',0,'S ','ISM','M1','SPCOND','',150.10001,'UMHOS/CM','F02','','','','','nan',38.84972,-75.67333,'T3','2022-04-27'),(10001,621716,'NTN022','NTWQM','NTN','DEDNREC  ','DEDNREC',302031,'6/15/2022','8:18:00',NULL,'','',0,'S ','ISM','M1','SPCOND','',105.2,'UMHOS/CM','F02','','','','','nan',38.84972,-75.67333,'T3','2022-06-15'),(10001,621715,'NTN022','NTWQM','NTN','DEDNREC  ','DEDNREC',302031,'5/18/2022','8:02:00',NULL,'','',0,'S ','ISM','M1','SPCOND','',152.10001,'UMHOS/CM','F02','','','','','nan',38.84972,-75.67333,'T3','2022-05-18'),(10001,621717,'NTN022','NTWQM','NTN','DEDNREC  ','DEDNREC',302031,'7/27/2022','11:45:00',NULL,'','',0,'S ','ISM','M1','SPCOND','',182.60001,'UMHOS/CM','F02','','','','','nan',38.84972,-75.67333,'T3','2022-07-27'),(10001,621718,'NTN022','NTWQM','NTN','DEDNREC  ','DEDNREC',302031,'8/24/2022','7:35:00',NULL,'','',0,'S ','ISM','M1','SPCOND','',198,'UMHOS/CM','F02','','','','','nan',38.84972,-75.67333,'T3','2022-08-24'),(10001,610433,'NTN021','NTWQM','NTN','DEDNREC  ','DEDNREC',302031,'2/2/2021','10:15:00',NULL,'','',0,'S ','HVIC','S1','SSC_%FINE','',96.7,'PCT','D01','USGS-KDSL','','','','nan',38.84972,-75.67333,'T3','2021-02-02'),(10001,610441,'NTN021','NTWQM','NTN','DEDNREC  ','DEDNREC',302031,'9/2/2021','8:04:00',NULL,'','',0,'S ','HVIC','S1','SSC_%FINE','',80.3,'PCT','D01','USGS-KDSL','','','','nan',38.84972,-75.67333,'T3','2021-09-02'),(10001,621713,'NTN022','NTWQM','NTN','DEDNREC  ','DEDNREC',302031,'4/7/2022','8:14:00',NULL,'','',0,'S ','HVIC','S1','SSC_%FINE','',99,'PCT','D01','USGS-KDSL','','','','nan',38.84972,-75.67333,'T3','2022-04-07'),(10001,610441,'NTN021','NTWQM','NTN','DEDNREC  ','DEDNREC',302031,'9/2/2021','8:04:00',NULL,'','',0,'S ','HVIC','S1','SSC_TOTAL','',28,'MG/L','L02','USGS-KDSL','','','','nan',38.84972,-75.67333,'T3','2021-09-02'),(10001,610433,'NTN021','NTWQM','NTN','DEDNREC  ','DEDNREC',302031,'2/2/2021','10:15:00',NULL,'','',0,'S ','HVIC','S1','SSC_TOTAL','',26,'MG/L','L02','USGS-KDSL','','','','nan',38.84972,-75.67333,'T3','2021-02-02'),(10001,621713,'NTN022','NTWQM','NTN','DEDNREC  ','DEDNREC',302031,'4/7/2022','8:14:00',NULL,'','',0,'S ','HVIC','S1','SSC_TOTAL','',15,'MG/L','L02','USGS-KDSL','','','','nan',38.84972,-75.67333,'T3','2022-04-07'),(10001,610433,'NTN021','NTWQM','NTN','DEDNREC  ','DEDNREC',302031,'2/2/2021','10:15:00',NULL,'','',0,'S ','HVIC','S1','TALK','',12.0037,'MG/L','L01','DEDNREC','','','','nan',38.84972,-75.67333,'T3','2021-02-02'),(10001,610434,'NTN021','NTWQM','NTN','DEDNREC  ','DEDNREC',302031,'2/24/2021','9:17:00',NULL,'','',0,'S ','HVIC','S1','TALK','',8.7654,'MG/L','L01','DEDNREC','','','','nan',38.84972,-75.67333,'T3','2021-02-24'),(10001,610435,'NTN021','NTWQM','NTN','DEDNREC  ','DEDNREC',302031,'3/10/2021','9:03:00',NULL,'','',0,'S ','HVIC','S1','TALK','',13.6559,'MG/L','L01','DEDNREC','','','','nan',38.84972,-75.67333,'T3','2021-03-10'),(10001,610436,'NTN021','NTWQM','NTN','DEDNREC  ','DEDNREC',302031,'4/20/2021','8:41:00',NULL,'','',0,'S ','HVIC','S1','TALK','',16.1229,'MG/L','L01','DEDNREC','','','','nan',38.84972,-75.67333,'T3','2021-04-20'),(10001,610437,'NTN021','NTWQM','NTN','DEDNREC  ','DEDNREC',302031,'5/24/2021','8:29:00',NULL,'','',0,'S ','HVIC','S1','TALK','',16.4097,'MG/L','L01','DEDNREC','','','','nan',38.84972,-75.67333,'T3','2021-05-24'),(10001,610438,'NTN021','NTWQM','NTN','DEDNREC  ','DEDNREC',302031,'6/15/2021','9:44:00',NULL,'','',0,'S ','HVIC','S1','TALK','',17.271,'MG/L','L01','DEDNREC','','','','nan',38.84972,-75.67333,'T3','2021-06-15'),(10001,610442,'NTN021','NTWQM','NTN','DEDNREC  ','DEDNREC',302031,'9/22/2021','9:14:00',NULL,'','',0,'S ','HVIC','FS1','TALK','',22.5845,'MG/L','L01','DEDNREC','','','','nan',38.84972,-75.67333,'T3','2021-09-22'),(10001,610442,'NTN021','NTWQM','NTN','DEDNREC  ','DEDNREC',302031,'9/22/2021','9:14:00',NULL,'','',0,'S ','HVIC','FS2','TALK','',22.9136,'MG/L','L01','DEDNREC','','','','nan',38.84972,-75.67333,'T3','2021-09-22'),(10001,610440,'NTN021','NTWQM','NTN','DEDNREC  ','DEDNREC',302031,'8/25/2021','8:02:00',NULL,'','',0,'S ','HVIC','S1','TALK','',22.3106,'MG/L','L01','DEDNREC','','','','nan',38.84972,-75.67333,'T3','2021-08-25'),(10001,610439,'NTN021','NTWQM','NTN','DEDNREC  ','DEDNREC',302031,'7/19/2021','8:24:00',NULL,'','',0,'S ','HVIC','S1','TALK','',25.5069,'MG/L','L01','DEDNREC','','','','nan',38.84972,-75.67333,'T3','2021-07-19'),(10001,610441,'NTN021','NTWQM','NTN','DEDNREC  ','DEDNREC',302031,'9/2/2021','8:04:00',NULL,'','',0,'S ','HVIC','S1','TALK','',19.7403,'MG/L','L01','DEDNREC','','','','nan',38.84972,-75.67333,'T3','2021-09-02'),(10001,610432,'NTN021','NTWQM','NTN','DEDNREC  ','DEDNREC',302031,'1/28/2021','10:36:00',NULL,'','',0,'S ','HVIC','S1','TALK','',14.7659,'MG/L','L01','DEDNREC','','','','nan',38.84972,-75.67333,'T3','2021-01-28'),(10001,621714,'NTN022','NTWQM','NTN','DEDNREC  ','DEDNREC',302031,'4/27/2022','8:30:00',NULL,'','',0,'S ','HVIC','S1','TALK','',18.0681,'MG/L','L01','DEDNREC','','','','nan',38.84972,-75.67333,'T3','2022-04-27'),(10001,621715,'NTN022','NTWQM','NTN','DEDNREC  ','DEDNREC',302031,'5/18/2022','8:02:00',NULL,'','',0,'S ','HVIC','S1','TALK','',17.6346,'MG/L','L01','DEDNREC','','','','nan',38.84972,-75.67333,'T3','2022-05-18'),(10001,621716,'NTN022','NTWQM','NTN','DEDNREC  ','DEDNREC',302031,'6/15/2022','8:18:00',NULL,'','',0,'S ','HVIC','S1','TALK','',11.794,'MG/L','L01','DEDNREC','','','','nan',38.84972,-75.67333,'T3','2022-06-15'),(10001,621717,'NTN022','NTWQM','NTN','DEDNREC  ','DEDNREC',302031,'7/27/2022','11:45:00',NULL,'','',0,'S ','HVIC','S1','TALK','',24.3161,'MG/L','L01','DEDNREC','','','','nan',38.84972,-75.67333,'T3','2022-07-27'),(10001,621718,'NTN022','NTWQM','NTN','DEDNREC  ','DEDNREC',302031,'8/24/2022','7:35:00',NULL,'','',0,'S ','HVIC','S1','TALK','',27.3449,'MG/L','L01','DEDNREC','','','','nan',38.84972,-75.67333,'T3','2022-08-24'),(10001,621712,'NTN022','NTWQM','NTN','DEDNREC  ','DEDNREC',302031,'3/21/2022','7:52:00',NULL,'','',0,'S ','HVIC','FS1','TALK','',16.6995,'MG/L','L01','DEDNREC','','','','nan',38.84972,-75.67333,'T3','2022-03-21'),(10001,621712,'NTN022','NTWQM','NTN','DEDNREC  ','DEDNREC',302031,'3/21/2022','7:52:00',NULL,'','',0,'S ','HVIC','FS2','TALK','',16.6118,'MG/L','L01','DEDNREC','','','','nan',38.84972,-75.67333,'T3','2022-03-21'),(10001,621713,'NTN022','NTWQM','NTN','DEDNREC  ','DEDNREC',302031,'4/7/2022','8:14:00',NULL,'','',0,'S ','HVIC','S1','TALK','',13.9063,'MG/L','L01','DEDNREC','','','','nan',38.84972,-75.67333,'T3','2022-04-07'),(10001,621710,'NTN022','NTWQM','NTN','DEDNREC  ','DEDNREC',302031,'1/26/2022','9:44:00',NULL,'','',0,'S ','HVIC','S1','TALK','',14.6486,'MG/L','L01','DEDNREC','','','','nan',38.84972,-75.67333,'T3','2022-01-26'),(10001,621711,'NTN022','NTWQM','NTN','DEDNREC  ','DEDNREC',302031,'2/23/2022','8:10:00',NULL,'','',0,'S ','HVIC','S1','TALK','',15.5975,'MG/L','L01','DEDNREC','','','','nan',38.84972,-75.67333,'T3','2022-02-23'),(10001,621709,'NTN022','NTWQM','NTN','DEDNREC  ','DEDNREC',302031,'12/15/2021','8:44:00',NULL,'','',0,'S ','HVIC','S1','TALK','',16.2635,'MG/L','L01','DEDNREC','','','','nan',38.84972,-75.67333,'T3','2021-12-15'),(10001,621707,'NTN022','NTWQM','NTN','DEDNREC  ','DEDNREC',302031,'10/18/2021','9:37:00',NULL,'','',0,'S ','HVIC','S1','TALK','',22.4724,'MG/L','L01','DEDNREC','','','','nan',38.84972,-75.67333,'T3','2021-10-18'),(10001,621708,'NTN022','NTWQM','NTN','DEDNREC  ','DEDNREC',302031,'11/8/2021','7:25:00',NULL,'','',0,'S ','HVIC','S1','TALK','',16.3931,'MG/L','L01','DEDNREC','','','','nan',38.84972,-75.67333,'T3','2021-11-08'),(10001,621719,'NTN022','NTWQM','NTN','DEDNREC  ','DEDNREC',302031,'9/29/2022','9:43:00',NULL,'','',0,'S ','HVIC','S1','TALK','',25.832,'MG/L','L01','DEDNREC','','','','nan',38.84972,-75.67333,'T3','2022-09-29'),(10001,610441,'NTN021','NTWQM','NTN','DEDNREC  ','DEDNREC',302031,'9/2/2021','8:04:00',NULL,'','',0,'S ','HVIC','S1','TDN','',1.73,'MG/L','L01','DEDNREC','','','','nan',38.84972,-75.67333,'T3','2021-09-02'),(10001,610440,'NTN021','NTWQM','NTN','DEDNREC  ','DEDNREC',302031,'8/25/2021','8:02:00',NULL,'','',0,'S ','HVIC','S1','TDN','',2.76,'MG/L','L01','DEDNREC','NQ','','','nan',38.84972,-75.67333,'T3','2021-08-25'),(10001,610439,'NTN021','NTWQM','NTN','DEDNREC  ','DEDNREC',302031,'7/19/2021','8:24:00',NULL,'','',0,'S ','HVIC','S1','TDN','',3.33,'MG/L','L01','DEDNREC','','','','nan',38.84972,-75.67333,'T3','2021-07-19'),(10001,610442,'NTN021','NTWQM','NTN','DEDNREC  ','DEDNREC',302031,'9/22/2021','9:14:00',NULL,'','',0,'S ','HVIC','FS2','TDN','',2.82,'MG/L','L01','DEDNREC','','','','nan',38.84972,-75.67333,'T3','2021-09-22'),(10001,610442,'NTN021','NTWQM','NTN','DEDNREC  ','DEDNREC',302031,'9/22/2021','9:14:00',NULL,'','',0,'S ','HVIC','FS1','TDN','',2.86,'MG/L','L01','DEDNREC','','','','nan',38.84972,-75.67333,'T3','2021-09-22'),(10001,610438,'NTN021','NTWQM','NTN','DEDNREC  ','DEDNREC',302031,'6/15/2021','9:44:00',NULL,'','',0,'S ','HVIC','S1','TDN','',3.65,'MG/L','L01','DEDNREC','','','','nan',38.84972,-75.67333,'T3','2021-06-15'),(10001,610437,'NTN021','NTWQM','NTN','DEDNREC  ','DEDNREC',302031,'5/24/2021','8:29:00',NULL,'','',0,'S ','HVIC','S1','TDN','',4.33,'MG/L','L01','DEDNREC','','','','nan',38.84972,-75.67333,'T3','2021-05-24'),(10001,610436,'NTN021','NTWQM','NTN','DEDNREC  ','DEDNREC',302031,'4/20/2021','8:41:00',NULL,'','',0,'S ','HVIC','S1','TDN','',3.81,'MG/L','L01','DEDNREC','GG','','','Analysis performed after holding time expired.',38.84972,-75.67333,'T3','2021-04-20'),(10001,610435,'NTN021','NTWQM','NTN','DEDNREC  ','DEDNREC',302031,'3/10/2021','9:03:00',NULL,'','',0,'S ','HVIC','S1','TDN','',4.37,'MG/L','L01','DEDNREC','','','','nan',38.84972,-75.67333,'T3','2021-03-10'),(10001,621719,'NTN022','NTWQM','NTN','DEDNREC  ','DEDNREC',302031,'9/29/2022','9:43:00',NULL,'','',0,'S ','HVIC','S1','TDN','',4.59,'MG/L','L01','DEDNREC','','','','nan',38.84972,-75.67333,'T3','2022-09-29'),(10001,621707,'NTN022','NTWQM','NTN','DEDNREC  ','DEDNREC',302031,'10/18/2021','9:37:00',NULL,'','',0,'S ','HVIC','S1','TDN','',3.79,'MG/L','L01','DEDNREC','','','','nan',38.84972,-75.67333,'T3','2021-10-18'),(10001,621709,'NTN022','NTWQM','NTN','DEDNREC  ','DEDNREC',302031,'12/15/2021','8:44:00',NULL,'','',0,'S ','HVIC','S1','TDN','',4.54,'MG/L','L01','DEDNREC','','','','nan',38.84972,-75.67333,'T3','2021-12-15'),(10001,621708,'NTN022','NTWQM','NTN','DEDNREC  ','DEDNREC',302031,'11/8/2021','7:25:00',NULL,'','',0,'S ','HVIC','S1','TDN','',4.11,'MG/L','L01','DEDNREC','','','','nan',38.84972,-75.67333,'T3','2021-11-08'),(10001,621711,'NTN022','NTWQM','NTN','DEDNREC  ','DEDNREC',302031,'2/23/2022','8:10:00',NULL,'','',0,'S ','HVIC','S1','TDN','',3.41,'MG/L','L01','DEDNREC','','','','nan',38.84972,-75.67333,'T3','2022-02-23'),(10001,621710,'NTN022','NTWQM','NTN','DEDNREC  ','DEDNREC',302031,'1/26/2022','9:44:00',NULL,'','',0,'S ','HVIC','S1','TDN','',3.79,'MG/L','L01','DEDNREC','','','','nan',38.84972,-75.67333,'T3','2022-01-26'),(10001,621713,'NTN022','NTWQM','NTN','DEDNREC  ','DEDNREC',302031,'4/7/2022','8:14:00',NULL,'','',0,'S ','HVIC','S1','TDN','',3.16,'MG/L','L01','DEDNREC','','','','nan',38.84972,-75.67333,'T3','2022-04-07'),(10001,621712,'NTN022','NTWQM','NTN','DEDNREC  ','DEDNREC',302031,'3/21/2022','7:52:00',NULL,'','',0,'S ','HVIC','FS2','TDN','',3.41,'MG/L','L01','DEDNREC','','','','nan',38.84972,-75.67333,'T3','2022-03-21'),(10001,621712,'NTN022','NTWQM','NTN','DEDNREC  ','DEDNREC',302031,'3/21/2022','7:52:00',NULL,'','',0,'S ','HVIC','FS1','TDN','',3.39,'MG/L','L01','DEDNREC','','','','nan',38.84972,-75.67333,'T3','2022-03-21'),(10001,621717,'NTN022','NTWQM','NTN','DEDNREC  ','DEDNREC',302031,'7/27/2022','11:45:00',NULL,'','',0,'S ','HVIC','S1','TDN','',3.41,'MG/L','L01','DEDNREC','QQ','','','nan',38.84972,-75.67333,'T3','2022-07-27'),(10001,621718,'NTN022','NTWQM','NTN','DEDNREC  ','DEDNREC',302031,'8/24/2022','7:35:00',NULL,'','',0,'S ','HVIC','S1','TDN','',3.56,'MG/L','L01','DEDNREC','QQ','','','nan',38.84972,-75.67333,'T3','2022-08-24'),(10001,621716,'NTN022','NTWQM','NTN','DEDNREC  ','DEDNREC',302031,'6/15/2022','8:18:00',NULL,'','',0,'S ','HVIC','S1','TDN','',3.46,'MG/L','L01','DEDNREC','','','','nan',38.84972,-75.67333,'T3','2022-06-15'),(10001,621715,'NTN022','NTWQM','NTN','DEDNREC  ','DEDNREC',302031,'5/18/2022','8:02:00',NULL,'','',0,'S ','HVIC','S1','TDN','',3.2,'MG/L','L01','DEDNREC','','','','nan',38.84972,-75.67333,'T3','2022-05-18'),(10001,621714,'NTN022','NTWQM','NTN','DEDNREC  ','DEDNREC',302031,'4/27/2022','8:30:00',NULL,'','',0,'S ','HVIC','S1','TDN','',3.29,'MG/L','L01','DEDNREC','','','','nan',38.84972,-75.67333,'T3','2022-04-27'),(10001,610435,'NTN021','NTWQM','NTN','DEDNREC  ','DEDNREC',302031,'3/10/2021','9:03:00',NULL,'','',0,'S ','HVIC','S1','TDP','',0.0196,'MG/L','L01','DEDNREC','','','','nan',38.84972,-75.67333,'T3','2021-03-10'),(10001,610436,'NTN021','NTWQM','NTN','DEDNREC  ','DEDNREC',302031,'4/20/2021','8:41:00',NULL,'','',0,'S ','HVIC','S1','TDP','',0.0212,'MG/L','L01','DEDNREC','GG','','','Analysis performed after holding time expired.',38.84972,-75.67333,'T3','2021-04-20'),(10001,610437,'NTN021','NTWQM','NTN','DEDNREC  ','DEDNREC',302031,'5/24/2021','8:29:00',NULL,'','',0,'S ','HVIC','S1','TDP','',0.0198,'MG/L','L01','DEDNREC','','','','nan',38.84972,-75.67333,'T3','2021-05-24'),(10001,610438,'NTN021','NTWQM','NTN','DEDNREC  ','DEDNREC',302031,'6/15/2021','9:44:00',NULL,'','',0,'S ','HVIC','S1','TDP','',0.0265,'MG/L','L01','DEDNREC','','','','nan',38.84972,-75.67333,'T3','2021-06-15'),(10001,610442,'NTN021','NTWQM','NTN','DEDNREC  ','DEDNREC',302031,'9/22/2021','9:14:00',NULL,'','',0,'S ','HVIC','FS1','TDP','',0.0169,'MG/L','L01','DEDNREC','','','','nan',38.84972,-75.67333,'T3','2021-09-22'),(10001,610441,'NTN021','NTWQM','NTN','DEDNREC  ','DEDNREC',302031,'9/2/2021','8:04:00',NULL,'','',0,'S ','HVIC','S1','TDP','',0.352,'MG/L','L01','DEDNREC','','','','nan',38.84972,-75.67333,'T3','2021-09-02'),(10001,610442,'NTN021','NTWQM','NTN','DEDNREC  ','DEDNREC',302031,'9/22/2021','9:14:00',NULL,'','',0,'S ','HVIC','FS2','TDP','',0.0157,'MG/L','L01','DEDNREC','','','','nan',38.84972,-75.67333,'T3','2021-09-22'),(10001,610439,'NTN021','NTWQM','NTN','DEDNREC  ','DEDNREC',302031,'7/19/2021','8:24:00',NULL,'','',0,'S ','HVIC','S1','TDP','',0.0129,'MG/L','L01','DEDNREC','','','','nan',38.84972,-75.67333,'T3','2021-07-19'),(10001,610440,'NTN021','NTWQM','NTN','DEDNREC  ','DEDNREC',302031,'8/25/2021','8:02:00',NULL,'','',0,'S ','HVIC','S1','TDP','',0.0718,'MG/L','L01','DEDNREC','','','','nan',38.84972,-75.67333,'T3','2021-08-25'),(10001,621714,'NTN022','NTWQM','NTN','DEDNREC  ','DEDNREC',302031,'4/27/2022','8:30:00',NULL,'','',0,'S ','HVIC','S1','TDP','',0.0176,'MG/L','L01','DEDNREC','','','','nan',38.84972,-75.67333,'T3','2022-04-27'),(10001,621715,'NTN022','NTWQM','NTN','DEDNREC  ','DEDNREC',302031,'5/18/2022','8:02:00',NULL,'','',0,'S ','HVIC','S1','TDP','',0.0137,'MG/L','L01','DEDNREC','','','','nan',38.84972,-75.67333,'T3','2022-05-18'),(10001,621716,'NTN022','NTWQM','NTN','DEDNREC  ','DEDNREC',302031,'6/15/2022','8:18:00',NULL,'','',0,'S ','HVIC','S1','TDP','',0.237,'MG/L','L01','DEDNREC','','','','nan',38.84972,-75.67333,'T3','2022-06-15'),(10001,621717,'NTN022','NTWQM','NTN','DEDNREC  ','DEDNREC',302031,'7/27/2022','11:45:00',NULL,'','',0,'S ','HVIC','S1','TDP','',0.0107,'MG/L','L01','DEDNREC','','','','nan',38.84972,-75.67333,'T3','2022-07-27'),(10001,621718,'NTN022','NTWQM','NTN','DEDNREC  ','DEDNREC',302031,'8/24/2022','7:35:00',NULL,'','',0,'S ','HVIC','S1','TDP','',0.0166,'MG/L','L01','DEDNREC','','','','nan',38.84972,-75.67333,'T3','2022-08-24'),(10001,621712,'NTN022','NTWQM','NTN','DEDNREC  ','DEDNREC',302031,'3/21/2022','7:52:00',NULL,'','',0,'S ','HVIC','FS1','TDP','',0.0144,'MG/L','L01','DEDNREC','','','','nan',38.84972,-75.67333,'T3','2022-03-21'),(10001,621713,'NTN022','NTWQM','NTN','DEDNREC  ','DEDNREC',302031,'4/7/2022','8:14:00',NULL,'','',0,'S ','HVIC','S1','TDP','',0.276,'MG/L','L01','DEDNREC','','','','nan',38.84972,-75.67333,'T3','2022-04-07'),(10001,621712,'NTN022','NTWQM','NTN','DEDNREC  ','DEDNREC',302031,'3/21/2022','7:52:00',NULL,'','',0,'S ','HVIC','FS2','TDP','',0.0153,'MG/L','L01','DEDNREC','','','','nan',38.84972,-75.67333,'T3','2022-03-21'),(10001,621710,'NTN022','NTWQM','NTN','DEDNREC  ','DEDNREC',302031,'1/26/2022','9:44:00',NULL,'','',0,'S ','HVIC','S1','TDP','',0.0264,'MG/L','L01','DEDNREC','','','','nan',38.84972,-75.67333,'T3','2022-01-26'),(10001,621709,'NTN022','NTWQM','NTN','DEDNREC  ','DEDNREC',302031,'12/15/2021','8:44:00',NULL,'','',0,'S ','HVIC','S1','TDP','',0.0121,'MG/L','L01','DEDNREC','','','','nan',38.84972,-75.67333,'T3','2021-12-15'),(10001,621711,'NTN022','NTWQM','NTN','DEDNREC  ','DEDNREC',302031,'2/23/2022','8:10:00',NULL,'','',0,'S ','HVIC','S1','TDP','',0.0214,'MG/L','L01','DEDNREC','','','','nan',38.84972,-75.67333,'T3','2022-02-23'),(10001,621708,'NTN022','NTWQM','NTN','DEDNREC  ','DEDNREC',302031,'11/8/2021','7:25:00',NULL,'','',0,'S ','HVIC','S1','TDP','',0.0172,'MG/L','L01','DEDNREC','','','','nan',38.84972,-75.67333,'T3','2021-11-08'),(10001,621707,'NTN022','NTWQM','NTN','DEDNREC  ','DEDNREC',302031,'10/18/2021','9:37:00',NULL,'','',0,'S ','HVIC','S1','TDP','',0.0099,'MG/L','L01','DEDNREC','','','','nan',38.84972,-75.67333,'T3','2021-10-18'),(10001,621719,'NTN022','NTWQM','NTN','DEDNREC  ','DEDNREC',302031,'9/29/2022','9:43:00',NULL,'','',0,'S ','HVIC','S1','TDP','',0.0139,'MG/L','L01','DEDNREC','','','','nan',38.84972,-75.67333,'T3','2022-09-29'),(10001,610441,'NTN021','NTWQM','NTN','DEDNREC  ','DEDNREC',302031,'9/2/2021','8:04:00',NULL,'','',0,'S ','HVIC','S1','TKNW','',1.317,'MG/L','D01','DEDNREC','','','','nan',38.84972,-75.67333,'T3','2021-09-02'),(10001,610440,'NTN021','NTWQM','NTN','DEDNREC  ','DEDNREC',302031,'8/25/2021','8:02:00',NULL,'','',0,'S ','HVIC','S1','TKNW','',-1.121,'MG/L','D01','DEDNREC','NV','','','nan',38.84972,-75.67333,'T3','2021-08-25'),(10001,610439,'NTN021','NTWQM','NTN','DEDNREC  ','DEDNREC',302031,'7/19/2021','8:24:00',NULL,'','',0,'S ','HVIC','S1','TKNW','',0.439,'MG/L','D01','DEDNREC','','','','nan',38.84972,-75.67333,'T3','2021-07-19'),(10001,610442,'NTN021','NTWQM','NTN','DEDNREC  ','DEDNREC',302031,'9/22/2021','9:14:00',NULL,'','',0,'S ','HVIC','FS1','TKNW','',0.188,'MG/L','D01','DEDNREC','','','','nan',38.84972,-75.67333,'T3','2021-09-22'),(10001,610442,'NTN021','NTWQM','NTN','DEDNREC  ','DEDNREC',302031,'9/22/2021','9:14:00',NULL,'','',0,'S ','HVIC','FS2','TKNW','',0.455,'MG/L','D01','DEDNREC','','','','nan',38.84972,-75.67333,'T3','2021-09-22'),(10001,610438,'NTN021','NTWQM','NTN','DEDNREC  ','DEDNREC',302031,'6/15/2021','9:44:00',NULL,'','',0,'S ','HVIC','S1','TKNW','',0.345,'MG/L','D01','DEDNREC','','','','nan',38.84972,-75.67333,'T3','2021-06-15'),(10001,610437,'NTN021','NTWQM','NTN','DEDNREC  ','DEDNREC',302031,'5/24/2021','8:29:00',NULL,'','',0,'S ','HVIC','S1','TKNW','',0.326,'MG/L','D01','DEDNREC','','','','nan',38.84972,-75.67333,'T3','2021-05-24'),(10001,610436,'NTN021','NTWQM','NTN','DEDNREC  ','DEDNREC',302031,'4/20/2021','8:41:00',NULL,'','',0,'S ','HVIC','S1','TKNW','',0.565,'MG/L','D01','DEDNREC','','','','nan',38.84972,-75.67333,'T3','2021-04-20'),(10001,610435,'NTN021','NTWQM','NTN','DEDNREC  ','DEDNREC',302031,'3/10/2021','9:03:00',NULL,'','',0,'S ','HVIC','S1','TKNW','',0.397,'MG/L','D01','DEDNREC','','','','nan',38.84972,-75.67333,'T3','2021-03-10'),(10001,610434,'NTN021','NTWQM','NTN','DEDNREC  ','DEDNREC',302031,'2/24/2021','9:17:00',NULL,'','',0,'S ','HVIC','S1','TKNW','',0.398,'MG/L','D01','DEDNREC','','','','nan',38.84972,-75.67333,'T3','2021-02-24'),(10001,610433,'NTN021','NTWQM','NTN','DEDNREC  ','DEDNREC',302031,'2/2/2021','10:15:00',NULL,'','',0,'S ','HVIC','S1','TKNW','',-0.062,'MG/L','D01','DEDNREC','NV','','','nan',38.84972,-75.67333,'T3','2021-02-02'),(10001,610432,'NTN021','NTWQM','NTN','DEDNREC  ','DEDNREC',302031,'1/28/2021','10:36:00',NULL,'','',0,'S ','HVIC','S1','TKNW','',0.666,'MG/L','D01','DEDNREC','','','','nan',38.84972,-75.67333,'T3','2021-01-28'),(10001,621719,'NTN022','NTWQM','NTN','DEDNREC  ','DEDNREC',302031,'9/29/2022','9:43:00',NULL,'','',0,'S ','HVIC','S1','TKNW','',0.102,'MG/L','D01','DEDNREC','','','','nan',38.84972,-75.67333,'T3','2022-09-29'),(10001,621707,'NTN022','NTWQM','NTN','DEDNREC  ','DEDNREC',302031,'10/18/2021','9:37:00',NULL,'','',0,'S ','HVIC','S1','TKNW','',0.047,'MG/L','D01','DEDNREC','','','','nan',38.84972,-75.67333,'T3','2021-10-18'),(10001,621708,'NTN022','NTWQM','NTN','DEDNREC  ','DEDNREC',302031,'11/8/2021','7:25:00',NULL,'','',0,'S ','HVIC','S1','TKNW','',0.289,'MG/L','D01','DEDNREC','','','','nan',38.84972,-75.67333,'T3','2021-11-08'),(10001,621710,'NTN022','NTWQM','NTN','DEDNREC  ','DEDNREC',302031,'1/26/2022','9:44:00',NULL,'','',0,'S ','HVIC','S1','TKNW','',0.36,'MG/L','D01','DEDNREC','','','','nan',38.84972,-75.67333,'T3','2022-01-26'),(10001,621711,'NTN022','NTWQM','NTN','DEDNREC  ','DEDNREC',302031,'2/23/2022','8:10:00',NULL,'','',0,'S ','HVIC','S1','TKNW','',0.368,'MG/L','D01','DEDNREC','','','','nan',38.84972,-75.67333,'T3','2022-02-23'),(10001,621709,'NTN022','NTWQM','NTN','DEDNREC  ','DEDNREC',302031,'12/15/2021','8:44:00',NULL,'','',0,'S ','HVIC','S1','TKNW','',0.497,'MG/L','D01','DEDNREC','','','','nan',38.84972,-75.67333,'T3','2021-12-15'),(10001,621712,'NTN022','NTWQM','NTN','DEDNREC  ','DEDNREC',302031,'3/21/2022','7:52:00',NULL,'','',0,'S ','HVIC','FS1','TKNW','',0.256,'MG/L','D01','DEDNREC','','','','nan',38.84972,-75.67333,'T3','2022-03-21'),(10001,621712,'NTN022','NTWQM','NTN','DEDNREC  ','DEDNREC',302031,'3/21/2022','7:52:00',NULL,'','',0,'S ','HVIC','FS2','TKNW','',0.324,'MG/L','D01','DEDNREC','','','','nan',38.84972,-75.67333,'T3','2022-03-21'),(10001,621713,'NTN022','NTWQM','NTN','DEDNREC  ','DEDNREC',302031,'4/7/2022','8:14:00',NULL,'','',0,'S ','HVIC','S1','TKNW','',2.059,'MG/L','D01','DEDNREC','','','','nan',38.84972,-75.67333,'T3','2022-04-07'),(10001,621718,'NTN022','NTWQM','NTN','DEDNREC  ','DEDNREC',302031,'8/24/2022','7:35:00',NULL,'','',0,'S ','HVIC','S1','TKNW','',0.126,'MG/L','D01','DEDNREC','','','','nan',38.84972,-75.67333,'T3','2022-08-24'),(10001,621717,'NTN022','NTWQM','NTN','DEDNREC  ','DEDNREC',302031,'7/27/2022','11:45:00',NULL,'','',0,'S ','HVIC','S1','TKNW','',0.043,'MG/L','D01','DEDNREC','','','','nan',38.84972,-75.67333,'T3','2022-07-27'),(10001,621716,'NTN022','NTWQM','NTN','DEDNREC  ','DEDNREC',302031,'6/15/2022','8:18:00',NULL,'','',0,'S ','HVIC','S1','TKNW','',1.715,'MG/L','D01','DEDNREC','','','','nan',38.84972,-75.67333,'T3','2022-06-15'),(10001,621715,'NTN022','NTWQM','NTN','DEDNREC  ','DEDNREC',302031,'5/18/2022','8:02:00',NULL,'','',0,'S ','HVIC','S1','TKNW','',0.279,'MG/L','D01','DEDNREC','','','','nan',38.84972,-75.67333,'T3','2022-05-18'),(10001,621714,'NTN022','NTWQM','NTN','DEDNREC  ','DEDNREC',302031,'4/27/2022','8:30:00',NULL,'','',0,'S ','HVIC','S1','TKNW','',0.011,'MG/L','D01','DEDNREC','QQ','','','nan',38.84972,-75.67333,'T3','2022-04-27'),(10001,610432,'NTN021','NTWQM','NTN','DEDNREC  ','DEDNREC',302031,'1/28/2021','10:36:00',NULL,'','',0,'S ','HVIC','S1','TN','',4.95,'MG/L','L01','DEDNREC','','','','nan',38.84972,-75.67333,'T3','2021-01-28'),(10001,610433,'NTN021','NTWQM','NTN','DEDNREC  ','DEDNREC',302031,'2/2/2021','10:15:00',NULL,'','',0,'S ','HVIC','S1','TN','',3.37,'MG/L','L01','DEDNREC','QQ','','','nan',38.84972,-75.67333,'T3','2021-02-02'),(10001,610434,'NTN021','NTWQM','NTN','DEDNREC  ','DEDNREC',302031,'2/24/2021','9:17:00',NULL,'','',0,'S ','HVIC','S1','TN','',2.78,'MG/L','L01','DEDNREC','','','','nan',38.84972,-75.67333,'T3','2021-02-24'),(10001,610435,'NTN021','NTWQM','NTN','DEDNREC  ','DEDNREC',302031,'3/10/2021','9:03:00',NULL,'','',0,'S ','HVIC','S1','TN','',4.52,'MG/L','L01','DEDNREC','','','','nan',38.84972,-75.67333,'T3','2021-03-10'),(10001,610436,'NTN021','NTWQM','NTN','DEDNREC  ','DEDNREC',302031,'4/20/2021','8:41:00',NULL,'','',0,'S ','HVIC','S1','TN','',3.92,'MG/L','L01','DEDNREC','','','','nan',38.84972,-75.67333,'T3','2021-04-20'),(10001,610437,'NTN021','NTWQM','NTN','DEDNREC  ','DEDNREC',302031,'5/24/2021','8:29:00',NULL,'','',0,'S ','HVIC','S1','TN','',4.38,'MG/L','L01','DEDNREC','','','','nan',38.84972,-75.67333,'T3','2021-05-24'),(10001,610438,'NTN021','NTWQM','NTN','DEDNREC  ','DEDNREC',302031,'6/15/2021','9:44:00',NULL,'','',0,'S ','HVIC','S1','TN','',3.74,'MG/L','L01','DEDNREC','','','','nan',38.84972,-75.67333,'T3','2021-06-15'),(10001,610442,'NTN021','NTWQM','NTN','DEDNREC  ','DEDNREC',302031,'9/22/2021','9:14:00',NULL,'','',0,'S ','HVIC','FS1','TN','',2.87,'MG/L','L01','DEDNREC','','','','nan',38.84972,-75.67333,'T3','2021-09-22'),(10001,610442,'NTN021','NTWQM','NTN','DEDNREC  ','DEDNREC',302031,'9/22/2021','9:14:00',NULL,'','',0,'S ','HVIC','FS2','TN','',2.85,'MG/L','L01','DEDNREC','','','','nan',38.84972,-75.67333,'T3','2021-09-22'),(10001,610439,'NTN021','NTWQM','NTN','DEDNREC  ','DEDNREC',302031,'7/19/2021','8:24:00',NULL,'','',0,'S ','HVIC','S1','TN','',3.44,'MG/L','L01','DEDNREC','','','','nan',38.84972,-75.67333,'T3','2021-07-19'),(10001,610441,'NTN021','NTWQM','NTN','DEDNREC  ','DEDNREC',302031,'9/2/2021','8:04:00',NULL,'','',0,'S ','HVIC','S1','TN','',1.95,'MG/L','L01','DEDNREC','','','','nan',38.84972,-75.67333,'T3','2021-09-02'),(10001,610440,'NTN021','NTWQM','NTN','DEDNREC  ','DEDNREC',302031,'8/25/2021','8:02:00',NULL,'','',0,'S ','HVIC','S1','TN','',2.83,'MG/L','L01','DEDNREC','NQ','','','nan',38.84972,-75.67333,'T3','2021-08-25'),(10001,621715,'NTN022','NTWQM','NTN','DEDNREC  ','DEDNREC',302031,'5/18/2022','8:02:00',NULL,'','',0,'S ','HVIC','S1','TN','',3.22,'MG/L','L01','DEDNREC','','','','nan',38.84972,-75.67333,'T3','2022-05-18'),(10001,621714,'NTN022','NTWQM','NTN','DEDNREC  ','DEDNREC',302031,'4/27/2022','8:30:00',NULL,'','',0,'S ','HVIC','S1','TN','',3.28,'MG/L','L01','DEDNREC','QQ','','','nan',38.84972,-75.67333,'T3','2022-04-27'),(10001,621717,'NTN022','NTWQM','NTN','DEDNREC  ','DEDNREC',302031,'7/27/2022','11:45:00',NULL,'','',0,'S ','HVIC','S1','TN','',3.54,'MG/L','L01','DEDNREC','','','','nan',38.84972,-75.67333,'T3','2022-07-27'),(10001,621716,'NTN022','NTWQM','NTN','DEDNREC  ','DEDNREC',302031,'6/15/2022','8:18:00',NULL,'','',0,'S ','HVIC','S1','TN','',3.88,'MG/L','L01','DEDNREC','','','','nan',38.84972,-75.67333,'T3','2022-06-15'),(10001,621718,'NTN022','NTWQM','NTN','DEDNREC  ','DEDNREC',302031,'8/24/2022','7:35:00',NULL,'','',0,'S ','HVIC','S1','TN','',3.6,'MG/L','L01','DEDNREC','','','','nan',38.84972,-75.67333,'T3','2022-08-24'),(10001,621713,'NTN022','NTWQM','NTN','DEDNREC  ','DEDNREC',302031,'4/7/2022','8:14:00',NULL,'','',0,'S ','HVIC','S1','TN','',3.51,'MG/L','L01','DEDNREC','','','','nan',38.84972,-75.67333,'T3','2022-04-07'),(10001,621712,'NTN022','NTWQM','NTN','DEDNREC  ','DEDNREC',302031,'3/21/2022','7:52:00',NULL,'','',0,'S ','HVIC','FS1','TN','',3.45,'MG/L','L01','DEDNREC','','','','nan',38.84972,-75.67333,'T3','2022-03-21'),(10001,621712,'NTN022','NTWQM','NTN','DEDNREC  ','DEDNREC',302031,'3/21/2022','7:52:00',NULL,'','',0,'S ','HVIC','FS2','TN','',3.5,'MG/L','L01','DEDNREC','','','','nan',38.84972,-75.67333,'T3','2022-03-21'),(10001,621710,'NTN022','NTWQM','NTN','DEDNREC  ','DEDNREC',302031,'1/26/2022','9:44:00',NULL,'','',0,'S ','HVIC','S1','TN','',3.88,'MG/L','L01','DEDNREC','','','','nan',38.84972,-75.67333,'T3','2022-01-26'),(10001,621711,'NTN022','NTWQM','NTN','DEDNREC  ','DEDNREC',302031,'2/23/2022','8:10:00',NULL,'','',0,'S ','HVIC','S1','TN','',3.52,'MG/L','L01','DEDNREC','','','','nan',38.84972,-75.67333,'T3','2022-02-23'),(10001,621709,'NTN022','NTWQM','NTN','DEDNREC  ','DEDNREC',302031,'12/15/2021','8:44:00',NULL,'','',0,'S ','HVIC','S1','TN','',4.7,'MG/L','L01','DEDNREC','','','','nan',38.84972,-75.67333,'T3','2021-12-15'),(10001,621708,'NTN022','NTWQM','NTN','DEDNREC  ','DEDNREC',302031,'11/8/2021','7:25:00',NULL,'','',0,'S ','HVIC','S1','TN','',4.12,'MG/L','L01','DEDNREC','','','','nan',38.84972,-75.67333,'T3','2021-11-08'),(10001,621707,'NTN022','NTWQM','NTN','DEDNREC  ','DEDNREC',302031,'10/18/2021','9:37:00',NULL,'','',0,'S ','HVIC','S1','TN','',3.83,'MG/L','L01','DEDNREC','','','','nan',38.84972,-75.67333,'T3','2021-10-18'),(10001,621719,'NTN022','NTWQM','NTN','DEDNREC  ','DEDNREC',302031,'9/29/2022','9:43:00',NULL,'','',0,'S ','HVIC','S1','TN','',4.59,'MG/L','L01','DEDNREC','','','','nan',38.84972,-75.67333,'T3','2022-09-29'),(10001,610440,'NTN021','NTWQM','NTN','DEDNREC  ','DEDNREC',302031,'8/25/2021','8:02:00',NULL,'','',0,'S ','HVIC','S1','TOC','',7.445,'MG/L','L01','DEDNREC','','','','nan',38.84972,-75.67333,'T3','2021-08-25'),(10001,610441,'NTN021','NTWQM','NTN','DEDNREC  ','DEDNREC',302031,'9/2/2021','8:04:00',NULL,'','',0,'S ','HVIC','S1','TOC','',13.14,'MG/L','L01','DEDNREC','','','','nan',38.84972,-75.67333,'T3','2021-09-02'),(10001,610439,'NTN021','NTWQM','NTN','DEDNREC  ','DEDNREC',302031,'7/19/2021','8:24:00',NULL,'','',0,'S ','HVIC','S1','TOC','',2.82,'MG/L','L01','DEDNREC','','','','nan',38.84972,-75.67333,'T3','2021-07-19'),(10001,610442,'NTN021','NTWQM','NTN','DEDNREC  ','DEDNREC',302031,'9/22/2021','9:14:00',NULL,'','',0,'S ','HVIC','FS2','TOC','',2.948,'MG/L','L01','DEDNREC','QQ','','','nan',38.84972,-75.67333,'T3','2021-09-22'),(10001,610442,'NTN021','NTWQM','NTN','DEDNREC  ','DEDNREC',302031,'9/22/2021','9:14:00',NULL,'','',0,'S ','HVIC','FS1','TOC','',3.151,'MG/L','L01','DEDNREC','QQ','','','nan',38.84972,-75.67333,'T3','2021-09-22'),(10001,610438,'NTN021','NTWQM','NTN','DEDNREC  ','DEDNREC',302031,'6/15/2021','9:44:00',NULL,'','',0,'S ','HVIC','S1','TOC','',2.875,'MG/L','L01','DEDNREC','','','','nan',38.84972,-75.67333,'T3','2021-06-15'),(10001,610436,'NTN021','NTWQM','NTN','DEDNREC  ','DEDNREC',302031,'4/20/2021','8:41:00',NULL,'','',0,'S ','HVIC','S1','TOC','',2.356,'MG/L','L01','DEDNREC','','','','nan',38.84972,-75.67333,'T3','2021-04-20'),(10001,610437,'NTN021','NTWQM','NTN','DEDNREC  ','DEDNREC',302031,'5/24/2021','8:29:00',NULL,'','',0,'S ','HVIC','S1','TOC','',2.471,'MG/L','L01','DEDNREC','','','','nan',38.84972,-75.67333,'T3','2021-05-24'),(10001,610435,'NTN021','NTWQM','NTN','DEDNREC  ','DEDNREC',302031,'3/10/2021','9:03:00',NULL,'','',0,'S ','HVIC','S1','TOC','',2.7,'MG/L','L01','DEDNREC','','','','nan',38.84972,-75.67333,'T3','2021-03-10'),(10001,610433,'NTN021','NTWQM','NTN','DEDNREC  ','DEDNREC',302031,'2/2/2021','10:15:00',NULL,'','',0,'S ','HVIC','S1','TOC','',6.908,'MG/L','L01','DEDNREC','','','','nan',38.84972,-75.67333,'T3','2021-02-02'),(10001,610434,'NTN021','NTWQM','NTN','DEDNREC  ','DEDNREC',302031,'2/24/2021','9:17:00',NULL,'','',0,'S ','HVIC','S1','TOC','',8.681,'MG/L','L01','DEDNREC','GG','','','Analysis performed after holding time expired.',38.84972,-75.67333,'T3','2021-02-24'),(10001,610432,'NTN021','NTWQM','NTN','DEDNREC  ','DEDNREC',302031,'1/28/2021','10:36:00',NULL,'','',0,'S ','HVIC','S1','TOC','',1.846,'MG/L','L01','DEDNREC','','','','nan',38.84972,-75.67333,'T3','2021-01-28'),(10001,621719,'NTN022','NTWQM','NTN','DEDNREC  ','DEDNREC',302031,'9/29/2022','9:43:00',NULL,'','',0,'S ','HVIC','S1','TOC','',1.775,'MG/L','L01','DEDNREC','','','','nan',38.84972,-75.67333,'T3','2022-09-29'),(10001,621707,'NTN022','NTWQM','NTN','DEDNREC  ','DEDNREC',302031,'10/18/2021','9:37:00',NULL,'','',0,'S ','HVIC','S1','TOC','',2.707,'MG/L','L01','DEDNREC','','','','nan',38.84972,-75.67333,'T3','2021-10-18'),(10001,621708,'NTN022','NTWQM','NTN','DEDNREC  ','DEDNREC',302031,'11/8/2021','7:25:00',NULL,'','',0,'S ','HVIC','S1','TOC','',2.297,'MG/L','L01','DEDNREC','','','','nan',38.84972,-75.67333,'T3','2021-11-08'),(10001,621711,'NTN022','NTWQM','NTN','DEDNREC  ','DEDNREC',302031,'2/23/2022','8:10:00',NULL,'','',0,'S ','HVIC','S1','TOC','',2.642,'MG/L','L01','DEDNREC','','','','nan',38.84972,-75.67333,'T3','2022-02-23'),(10001,621710,'NTN022','NTWQM','NTN','DEDNREC  ','DEDNREC',302031,'1/26/2022','9:44:00',NULL,'','',0,'S ','HVIC','S1','TOC','',2.375,'MG/L','L01','DEDNREC','','','','nan',38.84972,-75.67333,'T3','2022-01-26'),(10001,621709,'NTN022','NTWQM','NTN','DEDNREC  ','DEDNREC',302031,'12/15/2021','8:44:00',NULL,'','',0,'S ','HVIC','S1','TOC','',1.697,'MG/L','L01','DEDNREC','','','','nan',38.84972,-75.67333,'T3','2021-12-15'),(10001,621712,'NTN022','NTWQM','NTN','DEDNREC  ','DEDNREC',302031,'3/21/2022','7:52:00',NULL,'','',0,'S ','HVIC','FS2','TOC','',2.766,'MG/L','L01','DEDNREC','','','','nan',38.84972,-75.67333,'T3','2022-03-21'),(10001,621712,'NTN022','NTWQM','NTN','DEDNREC  ','DEDNREC',302031,'3/21/2022','7:52:00',NULL,'','',0,'S ','HVIC','FS1','TOC','',2.768,'MG/L','L01','DEDNREC','','','','nan',38.84972,-75.67333,'T3','2022-03-21'),(10001,621713,'NTN022','NTWQM','NTN','DEDNREC  ','DEDNREC',302031,'4/7/2022','8:14:00',NULL,'','',0,'S ','HVIC','S1','TOC','',15.94,'MG/L','L01','DEDNREC','','','','nan',38.84972,-75.67333,'T3','2022-04-07'),(10001,621718,'NTN022','NTWQM','NTN','DEDNREC  ','DEDNREC',302031,'8/24/2022','7:35:00',NULL,'','',0,'S ','HVIC','S1','TOC','',2.399,'MG/L','L01','DEDNREC','QQ','','','nan',38.84972,-75.67333,'T3','2022-08-24'),(10001,621716,'NTN022','NTWQM','NTN','DEDNREC  ','DEDNREC',302031,'6/15/2022','8:18:00',NULL,'','',0,'S ','HVIC','S1','TOC','',8.574,'MG/L','L01','DEDNREC','','','','nan',38.84972,-75.67333,'T3','2022-06-15'),(10001,621717,'NTN022','NTWQM','NTN','DEDNREC  ','DEDNREC',302031,'7/27/2022','11:45:00',NULL,'','',0,'S ','HVIC','S1','TOC','',2.277,'MG/L','L01','DEDNREC','','','','nan',38.84972,-75.67333,'T3','2022-07-27'),(10001,621714,'NTN022','NTWQM','NTN','DEDNREC  ','DEDNREC',302031,'4/27/2022','8:30:00',NULL,'','',0,'S ','HVIC','S1','TOC','',2.606,'MG/L','L01','DEDNREC','','','','nan',38.84972,-75.67333,'T3','2022-04-27'),(10001,621715,'NTN022','NTWQM','NTN','DEDNREC  ','DEDNREC',302031,'5/18/2022','8:02:00',NULL,'','',0,'S ','HVIC','S1','TOC','',2.86,'MG/L','L01','DEDNREC','','','','nan',38.84972,-75.67333,'T3','2022-05-18'),(10001,610432,'NTN021','NTWQM','NTN','DEDNREC  ','DEDNREC',302031,'1/28/2021','10:36:00',NULL,'','',0,'S ','HVIC','S1','TP','',0.0674,'MG/L','L01','DEDNREC','','','','nan',38.84972,-75.67333,'T3','2021-01-28'),(10001,610433,'NTN021','NTWQM','NTN','DEDNREC  ','DEDNREC',302031,'2/2/2021','10:15:00',NULL,'','',0,'S ','HVIC','S1','TP','',0.182,'MG/L','L01','DEDNREC','','','','nan',38.84972,-75.67333,'T3','2021-02-02'),(10001,610435,'NTN021','NTWQM','NTN','DEDNREC  ','DEDNREC',302031,'3/10/2021','9:03:00',NULL,'','',0,'S ','HVIC','S1','TP','',0.0693,'MG/L','L01','DEDNREC','','','','nan',38.84972,-75.67333,'T3','2021-03-10'),(10001,610434,'NTN021','NTWQM','NTN','DEDNREC  ','DEDNREC',302031,'2/24/2021','9:17:00',NULL,'','',0,'S ','HVIC','S1','TP','',0.103,'MG/L','L01','DEDNREC','','','','nan',38.84972,-75.67333,'T3','2021-02-24'),(10001,610436,'NTN021','NTWQM','NTN','DEDNREC  ','DEDNREC',302031,'4/20/2021','8:41:00',NULL,'','',0,'S ','HVIC','S1','TP','',0.0606,'MG/L','L01','DEDNREC','','','','nan',38.84972,-75.67333,'T3','2021-04-20'),(10001,610438,'NTN021','NTWQM','NTN','DEDNREC  ','DEDNREC',302031,'6/15/2021','9:44:00',NULL,'','',0,'S ','HVIC','S1','TP','',0.0919,'MG/L','L01','DEDNREC','','','','nan',38.84972,-75.67333,'T3','2021-06-15'),(10001,610437,'NTN021','NTWQM','NTN','DEDNREC  ','DEDNREC',302031,'5/24/2021','8:29:00',NULL,'','',0,'S ','HVIC','S1','TP','',0.0579,'MG/L','L01','DEDNREC','','','','nan',38.84972,-75.67333,'T3','2021-05-24'),(10001,610442,'NTN021','NTWQM','NTN','DEDNREC  ','DEDNREC',302031,'9/22/2021','9:14:00',NULL,'','',0,'S ','HVIC','FS1','TP','',0.022,'MG/L','L01','DEDNREC','','','','nan',38.84972,-75.67333,'T3','2021-09-22'),(10001,610441,'NTN021','NTWQM','NTN','DEDNREC  ','DEDNREC',302031,'9/2/2021','8:04:00',NULL,'','',0,'S ','HVIC','S1','TP','',0.503,'MG/L','L01','DEDNREC','','','','nan',38.84972,-75.67333,'T3','2021-09-02'),(10001,610442,'NTN021','NTWQM','NTN','DEDNREC  ','DEDNREC',302031,'9/22/2021','9:14:00',NULL,'','',0,'S ','HVIC','FS2','TP','',0.0212,'MG/L','L01','DEDNREC','','','','nan',38.84972,-75.67333,'T3','2021-09-22'),(10001,610439,'NTN021','NTWQM','NTN','DEDNREC  ','DEDNREC',302031,'7/19/2021','8:24:00',NULL,'','',0,'S ','HVIC','S1','TP','',0.0423,'MG/L','L01','DEDNREC','','','','nan',38.84972,-75.67333,'T3','2021-07-19'),(10001,610440,'NTN021','NTWQM','NTN','DEDNREC  ','DEDNREC',302031,'8/25/2021','8:02:00',NULL,'','',0,'S ','HVIC','S1','TP','',0.162,'MG/L','L01','DEDNREC','','','','nan',38.84972,-75.67333,'T3','2021-08-25'),(10001,621714,'NTN022','NTWQM','NTN','DEDNREC  ','DEDNREC',302031,'4/27/2022','8:30:00',NULL,'','',0,'S ','HVIC','S1','TP','',0.0631,'MG/L','L01','DEDNREC','','','','nan',38.84972,-75.67333,'T3','2022-04-27'),(10001,621715,'NTN022','NTWQM','NTN','DEDNREC  ','DEDNREC',302031,'5/18/2022','8:02:00',NULL,'','',0,'S ','HVIC','S1','TP','',0.0928,'MG/L','L01','DEDNREC','','','','nan',38.84972,-75.67333,'T3','2022-05-18'),(10001,621716,'NTN022','NTWQM','NTN','DEDNREC  ','DEDNREC',302031,'6/15/2022','8:18:00',NULL,'','',0,'S ','HVIC','S1','TP','',0.477,'MG/L','L01','DEDNREC','','','','nan',38.84972,-75.67333,'T3','2022-06-15'),(10001,621718,'NTN022','NTWQM','NTN','DEDNREC  ','DEDNREC',302031,'8/24/2022','7:35:00',NULL,'','',0,'S ','HVIC','S1','TP','',0.0492,'MG/L','L01','DEDNREC','','','','nan',38.84972,-75.67333,'T3','2022-08-24'),(10001,621717,'NTN022','NTWQM','NTN','DEDNREC  ','DEDNREC',302031,'7/27/2022','11:45:00',NULL,'','',0,'S ','HVIC','S1','TP','',0.0308,'MG/L','L01','DEDNREC','','','','nan',38.84972,-75.67333,'T3','2022-07-27'),(10001,621713,'NTN022','NTWQM','NTN','DEDNREC  ','DEDNREC',302031,'4/7/2022','8:14:00',NULL,'','',0,'S ','HVIC','S1','TP','',0.501,'MG/L','L01','DEDNREC','','','','nan',38.84972,-75.67333,'T3','2022-04-07'),(10001,621712,'NTN022','NTWQM','NTN','DEDNREC  ','DEDNREC',302031,'3/21/2022','7:52:00',NULL,'','',0,'S ','HVIC','FS2','TP','',0.0728,'MG/L','L01','DEDNREC','','','','nan',38.84972,-75.67333,'T3','2022-03-21'),(10001,621712,'NTN022','NTWQM','NTN','DEDNREC  ','DEDNREC',302031,'3/21/2022','7:52:00',NULL,'','',0,'S ','HVIC','FS1','TP','',0.0655,'MG/L','L01','DEDNREC','','','','nan',38.84972,-75.67333,'T3','2022-03-21'),(10001,621710,'NTN022','NTWQM','NTN','DEDNREC  ','DEDNREC',302031,'1/26/2022','9:44:00',NULL,'','',0,'S ','HVIC','S1','TP','',0.0947,'MG/L','L01','DEDNREC','','','','nan',38.84972,-75.67333,'T3','2022-01-26'),(10001,621711,'NTN022','NTWQM','NTN','DEDNREC  ','DEDNREC',302031,'2/23/2022','8:10:00',NULL,'','',0,'S ','HVIC','S1','TP','',0.1,'MG/L','L01','DEDNREC','','','','nan',38.84972,-75.67333,'T3','2022-02-23'),(10001,621708,'NTN022','NTWQM','NTN','DEDNREC  ','DEDNREC',302031,'11/8/2021','7:25:00',NULL,'','',0,'S ','HVIC','S1','TP','',0.0554,'MG/L','L01','DEDNREC','','','','nan',38.84972,-75.67333,'T3','2021-11-08'),(10001,621709,'NTN022','NTWQM','NTN','DEDNREC  ','DEDNREC',302031,'12/15/2021','8:44:00',NULL,'','',0,'S ','HVIC','S1','TP','',0.0617,'MG/L','L01','DEDNREC','','','','nan',38.84972,-75.67333,'T3','2021-12-15'),(10001,621707,'NTN022','NTWQM','NTN','DEDNREC  ','DEDNREC',302031,'10/18/2021','9:37:00',NULL,'','',0,'S ','HVIC','S1','TP','',0.0199,'MG/L','L01','DEDNREC','','','','nan',38.84972,-75.67333,'T3','2021-10-18'),(10001,621719,'NTN022','NTWQM','NTN','DEDNREC  ','DEDNREC',302031,'9/29/2022','9:43:00',NULL,'','',0,'S ','HVIC','S1','TP','',0.0281,'MG/L','L01','DEDNREC','','','','nan',38.84972,-75.67333,'T3','2022-09-29'),(10001,610440,'NTN021','NTWQM','NTN','DEDNREC  ','DEDNREC',302031,'8/25/2021','8:02:00',NULL,'','',0,'S ','HVIC','S1','TSS','G',1.92,'MG/L','L01','DEDNREC','','','','nan',38.84972,-75.67333,'T3','2021-08-25'),(10001,610439,'NTN021','NTWQM','NTN','DEDNREC  ','DEDNREC',302031,'7/19/2021','8:24:00',NULL,'','',0,'S ','HVIC','S1','TSS','',6.08,'MG/L','L01','DEDNREC','','','','nan',38.84972,-75.67333,'T3','2021-07-19'),(10001,610442,'NTN021','NTWQM','NTN','DEDNREC  ','DEDNREC',302031,'9/22/2021','9:14:00',NULL,'','',0,'S ','HVIC','FS2','TSS','<',1,'MG/L','L01','DEDNREC','','','','nan',38.84972,-75.67333,'T3','2021-09-22'),(10001,610441,'NTN021','NTWQM','NTN','DEDNREC  ','DEDNREC',302031,'9/2/2021','8:04:00',NULL,'','',0,'S ','HVIC','S1','TSS','',16.84,'MG/L','L01','DEDNREC','','','','nan',38.84972,-75.67333,'T3','2021-09-02'),(10001,610442,'NTN021','NTWQM','NTN','DEDNREC  ','DEDNREC',302031,'9/22/2021','9:14:00',NULL,'','',0,'S ','HVIC','FS1','TSS','<',1,'MG/L','L01','DEDNREC','','','','nan',38.84972,-75.67333,'T3','2021-09-22'),(10001,610437,'NTN021','NTWQM','NTN','DEDNREC  ','DEDNREC',302031,'5/24/2021','8:29:00',NULL,'','',0,'S ','HVIC','S1','TSS','',4.41,'MG/L','L01','DEDNREC','','','','nan',38.84972,-75.67333,'T3','2021-05-24'),(10001,610438,'NTN021','NTWQM','NTN','DEDNREC  ','DEDNREC',302031,'6/15/2021','9:44:00',NULL,'','',0,'S ','HVIC','S1','TSS','',3.15,'MG/L','L01','DEDNREC','','','','nan',38.84972,-75.67333,'T3','2021-06-15'),(10001,610436,'NTN021','NTWQM','NTN','DEDNREC  ','DEDNREC',302031,'4/20/2021','8:41:00',NULL,'','',0,'S ','HVIC','S1','TSS','',4.6833,'MG/L','L01','DEDNREC','','','','nan',38.84972,-75.67333,'T3','2021-04-20'),(10001,610434,'NTN021','NTWQM','NTN','DEDNREC  ','DEDNREC',302031,'2/24/2021','9:17:00',NULL,'','',0,'S ','HVIC','S1','TSS','',12.8,'MG/L','L01','DEDNREC','','','','nan',38.84972,-75.67333,'T3','2021-02-24'),(10001,610435,'NTN021','NTWQM','NTN','DEDNREC  ','DEDNREC',302031,'3/10/2021','9:03:00',NULL,'','',0,'S ','HVIC','S1','TSS','',7.5778,'MG/L','L01','DEDNREC','','','','nan',38.84972,-75.67333,'T3','2021-03-10'),(10001,610433,'NTN021','NTWQM','NTN','DEDNREC  ','DEDNREC',302031,'2/2/2021','10:15:00',NULL,'','',0,'S ','HVIC','S1','TSS','',18.6,'MG/L','L01','DEDNREC','','','','nan',38.84972,-75.67333,'T3','2021-02-02'),(10001,610432,'NTN021','NTWQM','NTN','DEDNREC  ','DEDNREC',302031,'1/28/2021','10:36:00',NULL,'','',0,'S ','HVIC','S1','TSS','',6.4,'MG/L','L01','DEDNREC','','','','nan',38.84972,-75.67333,'T3','2021-01-28'),(10001,621719,'NTN022','NTWQM','NTN','DEDNREC  ','DEDNREC',302031,'9/29/2022','9:43:00',NULL,'','',0,'S ','HVIC','S1','TSS','<',2.5,'MG/L','L01','DEDNREC','','','','nan',38.84972,-75.67333,'T3','2022-09-29'),(10001,621707,'NTN022','NTWQM','NTN','DEDNREC  ','DEDNREC',302031,'10/18/2021','9:37:00',NULL,'','',0,'S ','HVIC','S1','TSS','G',1.57,'MG/L','L01','DEDNREC','','','','nan',38.84972,-75.67333,'T3','2021-10-18'),(10001,621709,'NTN022','NTWQM','NTN','DEDNREC  ','DEDNREC',302031,'12/15/2021','8:44:00',NULL,'','',0,'S ','HVIC','S1','TSS','',8.06,'MG/L','L01','DEDNREC','','','','nan',38.84972,-75.67333,'T3','2021-12-15'),(10001,621708,'NTN022','NTWQM','NTN','DEDNREC  ','DEDNREC',302031,'11/8/2021','7:25:00',NULL,'','',0,'S ','HVIC','S1','TSS','',4.2444,'MG/L','L01','DEDNREC','','','','nan',38.84972,-75.67333,'T3','2021-11-08'),(10001,621711,'NTN022','NTWQM','NTN','DEDNREC  ','DEDNREC',302031,'2/23/2022','8:10:00',NULL,'','',0,'S ','HVIC','S1','TSS','',10.7833,'MG/L','L01','DEDNREC','','','','nan',38.84972,-75.67333,'T3','2022-02-23'),(10001,621710,'NTN022','NTWQM','NTN','DEDNREC  ','DEDNREC',302031,'1/26/2022','9:44:00',NULL,'','',0,'S ','HVIC','S1','TSS','',10.875,'MG/L','L01','DEDNREC','','','','nan',38.84972,-75.67333,'T3','2022-01-26'),(10001,621712,'NTN022','NTWQM','NTN','DEDNREC  ','DEDNREC',302031,'3/21/2022','7:52:00',NULL,'','',0,'S ','HVIC','FS1','TSS','',6.52,'MG/L','L01','DEDNREC','','','','nan',38.84972,-75.67333,'T3','2022-03-21'),(10001,621712,'NTN022','NTWQM','NTN','DEDNREC  ','DEDNREC',302031,'3/21/2022','7:52:00',NULL,'','',0,'S ','HVIC','FS2','TSS','',5.88,'MG/L','L01','DEDNREC','','','','nan',38.84972,-75.67333,'T3','2022-03-21'),(10001,621713,'NTN022','NTWQM','NTN','DEDNREC  ','DEDNREC',302031,'4/7/2022','8:14:00',NULL,'','',0,'S ','HVIC','S1','TSS','',30.6,'MG/L','L01','DEDNREC','','','','nan',38.84972,-75.67333,'T3','2022-04-07'),(10001,621718,'NTN022','NTWQM','NTN','DEDNREC  ','DEDNREC',302031,'8/24/2022','7:35:00',NULL,'','',0,'S ','HVIC','S1','TSS','',4.72,'MG/L','L01','DEDNREC','','','','nan',38.84972,-75.67333,'T3','2022-08-24'),(10001,621716,'NTN022','NTWQM','NTN','DEDNREC  ','DEDNREC',302031,'6/15/2022','8:18:00',NULL,'','',0,'S ','HVIC','S1','TSS','',25.6333,'MG/L','L01','DEDNREC','','','','nan',38.84972,-75.67333,'T3','2022-06-15'),(10001,621717,'NTN022','NTWQM','NTN','DEDNREC  ','DEDNREC',302031,'7/27/2022','11:45:00',NULL,'','',0,'S ','HVIC','S1','TSS','G',1.8,'MG/L','L01','DEDNREC','','','','nan',38.84972,-75.67333,'T3','2022-07-27'),(10001,621715,'NTN022','NTWQM','NTN','DEDNREC  ','DEDNREC',302031,'5/18/2022','8:02:00',NULL,'','',0,'S ','HVIC','S1','TSS','',4.55,'MG/L','L01','DEDNREC','','','','nan',38.84972,-75.67333,'T3','2022-05-18'),(10001,621714,'NTN022','NTWQM','NTN','DEDNREC  ','DEDNREC',302031,'4/27/2022','8:30:00',NULL,'','',0,'S ','HVIC','S1','TSS','',3.8125,'MG/L','L01','DEDNREC','','','','nan',38.84972,-75.67333,'T3','2022-04-27'),(10001,610433,'NTN021','NTWQM','NTN','DEDNREC  ','DEDNREC',302031,'2/2/2021','10:15:00',NULL,'','',0,'S ','HVIC','S1','TURB_NTU','',28.3,'NTU','L01','DEDNREC','','','','nan',38.84972,-75.67333,'T3','2021-02-02'),(10001,610432,'NTN021','NTWQM','NTN','DEDNREC  ','DEDNREC',302031,'1/28/2021','10:36:00',NULL,'','',0,'S ','HVIC','S1','TURB_NTU','',11.1,'NTU','L01','DEDNREC','','','','nan',38.84972,-75.67333,'T3','2021-01-28'),(10001,610434,'NTN021','NTWQM','NTN','DEDNREC  ','DEDNREC',302031,'2/24/2021','9:17:00',NULL,'','',0,'S ','HVIC','S1','TURB_NTU','',20.3,'NTU','L01','DEDNREC','','','','nan',38.84972,-75.67333,'T3','2021-02-24'),(10001,610436,'NTN021','NTWQM','NTN','DEDNREC  ','DEDNREC',302031,'4/20/2021','8:41:00',NULL,'','',0,'S ','HVIC','S1','TURB_NTU','',6.34,'NTU','L01','DEDNREC','','','','nan',38.84972,-75.67333,'T3','2021-04-20'),(10001,610435,'NTN021','NTWQM','NTN','DEDNREC  ','DEDNREC',302031,'3/10/2021','9:03:00',NULL,'','',0,'S ','HVIC','S1','TURB_NTU','',12.3,'NTU','L01','DEDNREC','','','','nan',38.84972,-75.67333,'T3','2021-03-10'),(10001,610437,'NTN021','NTWQM','NTN','DEDNREC  ','DEDNREC',302031,'5/24/2021','8:29:00',NULL,'','',0,'S ','HVIC','S1','TURB_NTU','',7.14,'NTU','L01','DEDNREC','','','','nan',38.84972,-75.67333,'T3','2021-05-24'),(10001,610441,'NTN021','NTWQM','NTN','DEDNREC  ','DEDNREC',302031,'9/2/2021','8:04:00',NULL,'','',0,'S ','HVIC','S1','TURB_NTU','',28.4,'NTU','L01','DEDNREC','','','','nan',38.84972,-75.67333,'T3','2021-09-02'),(10001,610442,'NTN021','NTWQM','NTN','DEDNREC  ','DEDNREC',302031,'9/22/2021','9:14:00',NULL,'','',0,'S ','HVIC','FS2','TURB_NTU','<',1,'NTU','L01','DEDNREC','','','','nan',38.84972,-75.67333,'T3','2021-09-22'),(10001,610442,'NTN021','NTWQM','NTN','DEDNREC  ','DEDNREC',302031,'9/22/2021','9:14:00',NULL,'','',0,'S ','HVIC','FS1','TURB_NTU','<',1,'NTU','L01','DEDNREC','','','','nan',38.84972,-75.67333,'T3','2021-09-22'),(10001,610439,'NTN021','NTWQM','NTN','DEDNREC  ','DEDNREC',302031,'7/19/2021','8:24:00',NULL,'','',0,'S ','HVIC','S1','TURB_NTU','',4.56,'NTU','L01','DEDNREC','','','','nan',38.84972,-75.67333,'T3','2021-07-19'),(10001,610438,'NTN021','NTWQM','NTN','DEDNREC  ','DEDNREC',302031,'6/15/2021','9:44:00',NULL,'','',0,'S ','HVIC','S1','TURB_NTU','',7.25,'NTU','L01','DEDNREC','','','','nan',38.84972,-75.67333,'T3','2021-06-15'),(10001,610440,'NTN021','NTWQM','NTN','DEDNREC  ','DEDNREC',302031,'8/25/2021','8:02:00',NULL,'','',0,'S ','HVIC','S1','TURB_NTU','',6.53,'NTU','L01','DEDNREC','','','','nan',38.84972,-75.67333,'T3','2021-08-25'),(10001,621713,'NTN022','NTWQM','NTN','DEDNREC  ','DEDNREC',302031,'4/7/2022','8:14:00',NULL,'','',0,'S ','HVIC','S1','TURB_NTU','',32.9,'NTU','L01','DEDNREC','','','','nan',38.84972,-75.67333,'T3','2022-04-07'),(10001,621715,'NTN022','NTWQM','NTN','DEDNREC  ','DEDNREC',302031,'5/18/2022','8:02:00',NULL,'','',0,'S ','HVIC','S1','TURB_NTU','',9.05,'NTU','L01','DEDNREC','','','','nan',38.84972,-75.67333,'T3','2022-05-18'),(10001,621714,'NTN022','NTWQM','NTN','DEDNREC  ','DEDNREC',302031,'4/27/2022','8:30:00',NULL,'','',0,'S ','HVIC','S1','TURB_NTU','',6.68,'NTU','L01','DEDNREC','','','','nan',38.84972,-75.67333,'T3','2022-04-27'),(10001,621716,'NTN022','NTWQM','NTN','DEDNREC  ','DEDNREC',302031,'6/15/2022','8:18:00',NULL,'','',0,'S ','HVIC','S1','TURB_NTU','',38.7,'NTU','L01','DEDNREC','','','','nan',38.84972,-75.67333,'T3','2022-06-15'),(10001,621717,'NTN022','NTWQM','NTN','DEDNREC  ','DEDNREC',302031,'7/27/2022','11:45:00',NULL,'','',0,'S ','HVIC','S1','TURB_NTU','',3.01,'NTU','L01','DEDNREC','','','','nan',38.84972,-75.67333,'T3','2022-07-27'),(10001,621718,'NTN022','NTWQM','NTN','DEDNREC  ','DEDNREC',302031,'8/24/2022','7:35:00',NULL,'','',0,'S ','HVIC','S1','TURB_NTU','',5.06,'NTU','L01','DEDNREC','','','','nan',38.84972,-75.67333,'T3','2022-08-24'),(10001,621712,'NTN022','NTWQM','NTN','DEDNREC  ','DEDNREC',302031,'3/21/2022','7:52:00',NULL,'','',0,'S ','HVIC','FS2','TURB_NTU','',10.3,'NTU','L01','DEDNREC','','','','nan',38.84972,-75.67333,'T3','2022-03-21'),(10001,621712,'NTN022','NTWQM','NTN','DEDNREC  ','DEDNREC',302031,'3/21/2022','7:52:00',NULL,'','',0,'S ','HVIC','FS1','TURB_NTU','',10.2,'NTU','L01','DEDNREC','','','','nan',38.84972,-75.67333,'T3','2022-03-21'),(10001,621710,'NTN022','NTWQM','NTN','DEDNREC  ','DEDNREC',302031,'1/26/2022','9:44:00',NULL,'','',0,'S ','HVIC','S1','TURB_NTU','',17.2,'NTU','L01','DEDNREC','','','','nan',38.84972,-75.67333,'T3','2022-01-26'),(10001,621709,'NTN022','NTWQM','NTN','DEDNREC  ','DEDNREC',302031,'12/15/2021','8:44:00',NULL,'','',0,'S ','HVIC','S1','TURB_NTU','',13.6,'NTU','L01','DEDNREC','','','','nan',38.84972,-75.67333,'T3','2021-12-15'),(10001,621711,'NTN022','NTWQM','NTN','DEDNREC  ','DEDNREC',302031,'2/23/2022','8:10:00',NULL,'','',0,'S ','HVIC','S1','TURB_NTU','',16.5,'NTU','L01','DEDNREC','','','','nan',38.84972,-75.67333,'T3','2022-02-23'),(10001,621708,'NTN022','NTWQM','NTN','DEDNREC  ','DEDNREC',302031,'11/8/2021','7:25:00',NULL,'','',0,'S ','HVIC','S1','TURB_NTU','',7.52,'NTU','L01','DEDNREC','','','','nan',38.84972,-75.67333,'T3','2021-11-08'),(10001,621707,'NTN022','NTWQM','NTN','DEDNREC  ','DEDNREC',302031,'10/18/2021','9:37:00',NULL,'','',0,'S ','HVIC','S1','TURB_NTU','',1.38,'NTU','L01','DEDNREC','','','','nan',38.84972,-75.67333,'T3','2021-10-18'),(10001,621719,'NTN022','NTWQM','NTN','DEDNREC  ','DEDNREC',302031,'9/29/2022','9:43:00',NULL,'','',0,'S ','HVIC','S1','TURB_NTU','',4.24,'NTU','L01','DEDNREC','','','','nan',38.84972,-75.67333,'T3','2022-09-29'),(10001,610440,'NTN021','NTWQM','NTN','DEDNREC  ','DEDNREC',302031,'8/25/2021','8:02:00',NULL,'','',0,'S ','ISM','M1','WTEMP','',25.31,'DEG C','F02','','','','','nan',38.84972,-75.67333,'T3','2021-08-25'),(10001,610438,'NTN021','NTWQM','NTN','DEDNREC  ','DEDNREC',302031,'6/15/2021','9:44:00',NULL,'','',0,'S ','ISM','M1','WTEMP','',22.293,'DEG C','F02','','','','','nan',38.84972,-75.67333,'T3','2021-06-15'),(10001,610439,'NTN021','NTWQM','NTN','DEDNREC  ','DEDNREC',302031,'7/19/2021','8:24:00',NULL,'','',0,'S ','ISM','M1','WTEMP','',23.055,'DEG C','F02','','','','','nan',38.84972,-75.67333,'T3','2021-07-19'),(10001,610442,'NTN021','NTWQM','NTN','DEDNREC  ','DEDNREC',302031,'9/22/2021','9:14:00',NULL,'','',0,'S ','ISM','M1','WTEMP','',21.979,'DEG C','F02','','','','','nan',38.84972,-75.67333,'T3','2021-09-22'),(10001,610442,'NTN021','NTWQM','NTN','DEDNREC  ','DEDNREC',302031,'9/22/2021','9:14:00',NULL,'','',0,'S ','ISM','M2','WTEMP','',21.983,'DEG C','F02','','','','','nan',38.84972,-75.67333,'T3','2021-09-22'),(10001,610441,'NTN021','NTWQM','NTN','DEDNREC  ','DEDNREC',302031,'9/2/2021','8:04:00',NULL,'','',0,'S ','ISM','M1','WTEMP','',21.864,'DEG C','F02','','','','','nan',38.84972,-75.67333,'T3','2021-09-02'),(10001,610437,'NTN021','NTWQM','NTN','DEDNREC  ','DEDNREC',302031,'5/24/2021','8:29:00',NULL,'','',0,'S ','ISM','M1','WTEMP','',19.565,'DEG C','F02','','','','','nan',38.84972,-75.67333,'T3','2021-05-24'),(10001,610436,'NTN021','NTWQM','NTN','DEDNREC  ','DEDNREC',302031,'4/20/2021','8:41:00',NULL,'','',0,'S ','ISM','M1','WTEMP','',13.329,'DEG C','F02','','','','','nan',38.84972,-75.67333,'T3','2021-04-20'),(10001,610434,'NTN021','NTWQM','NTN','DEDNREC  ','DEDNREC',302031,'2/24/2021','9:17:00',NULL,'','',0,'S ','ISM','M1','WTEMP','',5.823,'DEG C','F02','','','','','nan',38.84972,-75.67333,'T3','2021-02-24'),(10001,610435,'NTN021','NTWQM','NTN','DEDNREC  ','DEDNREC',302031,'3/10/2021','9:03:00',NULL,'','',0,'S ','ISM','M1','WTEMP','',10.106,'DEG C','F02','','','','','nan',38.84972,-75.67333,'T3','2021-03-10'),(10001,610433,'NTN021','NTWQM','NTN','DEDNREC  ','DEDNREC',302031,'2/2/2021','10:15:00',NULL,'','',0,'S ','ISM','M1','WTEMP','',4.849,'DEG C','F02','','','','','nan',38.84972,-75.67333,'T3','2021-02-02'),(10001,610432,'NTN021','NTWQM','NTN','DEDNREC  ','DEDNREC',302031,'1/28/2021','10:36:00',NULL,'','',0,'S ','ISM','M1','WTEMP','',3.436,'DEG C','F02','','','','','nan',38.84972,-75.67333,'T3','2021-01-28'),(10001,621707,'NTN022','NTWQM','NTN','DEDNREC  ','DEDNREC',302031,'10/18/2021','9:37:00',NULL,'','',0,'S ','ISM','M1','WTEMP','',15.757,'DEG C','F02','','','','','nan',38.84972,-75.67333,'T3','2021-10-18'),(10001,621708,'NTN022','NTWQM','NTN','DEDNREC  ','DEDNREC',302031,'11/8/2021','7:25:00',NULL,'','',0,'S ','ISM','M1','WTEMP','',9.796,'DEG C','F02','','','','','nan',38.84972,-75.67333,'T3','2021-11-08'),(10001,621711,'NTN022','NTWQM','NTN','DEDNREC  ','DEDNREC',302031,'2/23/2022','8:10:00',NULL,'','',0,'S ','ISM','M1','WTEMP','',15.039,'DEG C','F02','','','','','nan',38.84972,-75.67333,'T3','2022-02-23'),(10001,621712,'NTN022','NTWQM','NTN','DEDNREC  ','DEDNREC',302031,'3/21/2022','7:52:00',NULL,'','',0,'S ','ISM','M1','WTEMP','',9.877,'DEG C','F02','','','','','nan',38.84972,-75.67333,'T3','2022-03-21'),(10001,621709,'NTN022','NTWQM','NTN','DEDNREC  ','DEDNREC',302031,'12/15/2021','8:44:00',NULL,'','',0,'S ','ISM','M1','WTEMP','',6.018,'DEG C','F02','','','','','nan',38.84972,-75.67333,'T3','2021-12-15'),(10001,621710,'NTN022','NTWQM','NTN','DEDNREC  ','DEDNREC',302031,'1/26/2022','9:44:00',NULL,'','',0,'S ','ISM','M1','WTEMP','',3.274,'DEG C','F02','','','','','nan',38.84972,-75.67333,'T3','2022-01-26'),(10001,621712,'NTN022','NTWQM','NTN','DEDNREC  ','DEDNREC',302031,'3/21/2022','7:52:00',NULL,'','',0,'S ','ISM','M2','WTEMP','',9.865,'DEG C','F02','','','','','nan',38.84972,-75.67333,'T3','2022-03-21'),(10001,621718,'NTN022','NTWQM','NTN','DEDNREC  ','DEDNREC',302031,'8/24/2022','7:35:00',NULL,'','',0,'S ','ISM','M1','WTEMP','',21.273,'DEG C','F02','','','','','nan',38.84972,-75.67333,'T3','2022-08-24'),(10001,621719,'NTN022','NTWQM','NTN','DEDNREC  ','DEDNREC',302031,'9/29/2022','9:43:00',NULL,'','',0,'S ','ISM','M1','WTEMP','',14.204,'DEG C','F02','','','','','nan',38.84972,-75.67333,'T3','2022-09-29'),(10001,621717,'NTN022','NTWQM','NTN','DEDNREC  ','DEDNREC',302031,'7/27/2022','11:45:00',NULL,'','',0,'S ','ISM','M1','WTEMP','',23.212,'DEG C','F02','','','','','nan',38.84972,-75.67333,'T3','2022-07-27'),(10001,621715,'NTN022','NTWQM','NTN','DEDNREC  ','DEDNREC',302031,'5/18/2022','8:02:00',NULL,'','',0,'S ','ISM','M1','WTEMP','',17.7,'DEG C','F02','','','','','nan',38.84972,-75.67333,'T3','2022-05-18'),(10001,621716,'NTN022','NTWQM','NTN','DEDNREC  ','DEDNREC',302031,'6/15/2022','8:18:00',NULL,'','',0,'S ','ISM','M1','WTEMP','',22.023,'DEG C','F02','','','','','nan',38.84972,-75.67333,'T3','2022-06-15'),(10001,621714,'NTN022','NTWQM','NTN','DEDNREC  ','DEDNREC',302031,'4/27/2022','8:30:00',NULL,'','',0,'S ','ISM','M1','WTEMP','',14.213,'DEG C','F02','','','','','nan',38.84972,-75.67333,'T3','2022-04-27'),(10001,621713,'NTN022','NTWQM','NTN','DEDNREC  ','DEDNREC',302031,'4/7/2022','8:14:00',NULL,'','',0,'S ','ISM','M1','WTEMP','',11.219,'DEG C','F02','','','','','nan',38.84972,-75.67333,'T3','2022-04-07'),(10005,610447,'NTN021','NTWQM','NTN','DEDNREC  ','DEDNREC',304191,'1/28/2021','11:26:00',NULL,'','',0,'S ','HVIC','S1','CHLA','',2.367,'UG/L','L03','DEDNREC','','','','nan',38.72917,-75.56139,'T3','2021-01-28'),(10005,610448,'NTN021','NTWQM','NTN','DEDNREC  ','DEDNREC',304191,'2/2/2021','9:25:00',NULL,'','',0,'S ','HVIC','FS2','CHLA','',3.1817,'UG/L','L03','DEDNREC','','','','nan',38.72917,-75.56139,'T3','2021-02-02'),(10005,610448,'NTN021','NTWQM','NTN','DEDNREC  ','DEDNREC',304191,'2/2/2021','9:25:00',NULL,'','',0,'S ','HVIC','FS1','CHLA','',3.2819,'UG/L','L03','DEDNREC','','','','nan',38.72917,-75.56139,'T3','2021-02-02'),(10005,610449,'NTN021','NTWQM','NTN','DEDNREC  ','DEDNREC',304191,'2/24/2021','10:10:00',NULL,'','',0,'S ','HVIC','S1','CHLA','',2.3014,'UG/L','L03','DEDNREC','','','','nan',38.72917,-75.56139,'T3','2021-02-24'),(10005,610450,'NTN021','NTWQM','NTN','DEDNREC  ','DEDNREC',304191,'3/10/2021','8:01:00',NULL,'','',0,'S ','HVIC','FS1','CHLA','',1.225,'UG/L','L03','DEDNREC','','','','nan',38.72917,-75.56139,'T3','2021-03-10'),(10005,610450,'NTN021','NTWQM','NTN','DEDNREC  ','DEDNREC',304191,'3/10/2021','8:01:00',NULL,'','',0,'S ','HVIC','FS2','CHLA','',1.2835,'UG/L','L03','DEDNREC','','','','nan',38.72917,-75.56139,'T3','2021-03-10'),(10005,610451,'NTN021','NTWQM','NTN','DEDNREC  ','DEDNREC',304191,'4/20/2021','10:18:00',NULL,'','',0,'S ','HVIC','S1','CHLA','',1.9264,'UG/L','L03','DEDNREC','','','','nan',38.72917,-75.56139,'T3','2021-04-20'),(10005,610452,'NTN021','NTWQM','NTN','DEDNREC  ','DEDNREC',304191,'5/24/2021','7:28:00',NULL,'','',0,'S ','HVIC','S1','CHLA','',1.8118,'UG/L','L03','DEDNREC','','','','nan',38.72917,-75.56139,'T3','2021-05-24'),(10005,610453,'NTN021','NTWQM','NTN','DEDNREC  ','DEDNREC',304191,'6/15/2021','8:37:00',NULL,'','',0,'S ','HVIC','FS1','CHLA','',1.8398,'UG/L','L03','DEDNREC','','','','nan',38.72917,-75.56139,'T3','2021-06-15'),(10005,610453,'NTN021','NTWQM','NTN','DEDNREC  ','DEDNREC',304191,'6/15/2021','8:37:00',NULL,'','',0,'S ','HVIC','FS2','CHLA','',45.6468,'UG/L','L03','DEDNREC','','','','nan',38.72917,-75.56139,'T3','2021-06-15'),(10005,610454,'NTN021','NTWQM','NTN','DEDNREC  ','DEDNREC',304191,'7/19/2021','8:57:00',NULL,'','',0,'S ','HVIC','S1','CHLA','',3.676,'UG/L','L03','DEDNREC','','','','nan',38.72917,-75.56139,'T3','2021-07-19'),(10005,610455,'NTN021','NTWQM','NTN','DEDNREC  ','DEDNREC',304191,'8/25/2021','9:47:00',NULL,'','',0,'S ','HVIC','S1','CHLA','',2.0039,'UG/L','L03','DEDNREC','','','','nan',38.72917,-75.56139,'T3','2021-08-25'),(10005,610456,'NTN021','NTWQM','NTN','DEDNREC  ','DEDNREC',304191,'9/2/2021','8:32:00',NULL,'','',0,'S ','HVIC','S1','CHLA','',12.3828,'UG/L','L03','DEDNREC','','','','nan',38.72917,-75.56139,'T3','2021-09-02'),(10005,610457,'NTN021','NTWQM','NTN','DEDNREC  ','DEDNREC',304191,'9/22/2021','9:44:00',NULL,'','',0,'S ','HVIC','S1','CHLA','',1.8614,'UG/L','L03','DEDNREC','','','','nan',38.72917,-75.56139,'T3','2021-09-22'),(10005,621720,'NTN022','NTWQM','NTN','DEDNREC  ','DEDNREC',304191,'10/18/2021','10:05:00',NULL,'','',0,'S ','HVIC','S1','CHLA','',1.3582,'UG/L','L03','DEDNREC','','','','nan',38.72917,-75.56139,'T3','2021-10-18'),(10005,621721,'NTN022','NTWQM','NTN','DEDNREC  ','DEDNREC',304191,'11/8/2021','7:55:00',NULL,'','',0,'S ','HVIC','S1','CHLA','',0.5515,'UG/L','L03','DEDNREC','','','','nan',38.72917,-75.56139,'T3','2021-11-08'),(10005,621722,'NTN022','NTWQM','NTN','DEDNREC  ','DEDNREC',304191,'12/15/2021','9:14:00',NULL,'','',0,'S ','HVIC','S1','CHLA','',2.6656,'UG/L','L03','DEDNREC','','','','nan',38.72917,-75.56139,'T3','2021-12-15'),(10005,621723,'NTN022','NTWQM','NTN','DEDNREC  ','DEDNREC',304191,'1/26/2022','8:25:00',NULL,'','',0,'S ','HVIC','S1','CHLA','',1.757,'UG/L','L03','DEDNREC','','','','nan',38.72917,-75.56139,'T3','2022-01-26'),(10005,621724,'NTN022','NTWQM','NTN','DEDNREC  ','DEDNREC',304191,'2/23/2022','9:37:00',NULL,'','',0,'S ','HVIC','S1','CHLA','',3.9803,'UG/L','L03','DEDNREC','','','','nan',38.72917,-75.56139,'T3','2022-02-23'),(10005,621725,'NTN022','NTWQM','NTN','DEDNREC  ','DEDNREC',304191,'3/21/2022','8:21:00',NULL,'','',0,'S ','HVIC','S1','CHLA','',1.4419,'UG/L','L03','DEDNREC','','','','nan',38.72917,-75.56139,'T3','2022-03-21'),(10005,621726,'NTN022','NTWQM','NTN','DEDNREC  ','DEDNREC',304191,'4/7/2022','9:29:00',NULL,'','',0,'S ','HVIC','FS1','CHLA','',12.4387,'UG/L','L03','DEDNREC','','','','nan',38.72917,-75.56139,'T3','2022-04-07'),(10005,621726,'NTN022','NTWQM','NTN','DEDNREC  ','DEDNREC',304191,'4/7/2022','9:29:00',NULL,'','',0,'S ','HVIC','FS2','CHLA','',13.6965,'UG/L','L03','DEDNREC','','','','nan',38.72917,-75.56139,'T3','2022-04-07'),(10005,621727,'NTN022','NTWQM','NTN','DEDNREC  ','DEDNREC',304191,'4/27/2022','10:01:00',NULL,'','',0,'S ','HVIC','S1','CHLA','',2.9031,'UG/L','L03','DEDNREC','','','','nan',38.72917,-75.56139,'T3','2022-04-27'),(10005,621728,'NTN022','NTWQM','NTN','DEDNREC  ','DEDNREC',304191,'5/18/2022','9:47:00',NULL,'','',0,'S ','HVIC','S1','CHLA','',2.4797,'UG/L','L03','DEDNREC','','','','nan',38.72917,-75.56139,'T3','2022-05-18'),(10005,621729,'NTN022','NTWQM','NTN','DEDNREC  ','DEDNREC',304191,'6/15/2022','9:45:00',NULL,'','',0,'S ','HVIC','FS2','CHLA','',2.7499,'UG/L','L03','DEDNREC','','','','nan',38.72917,-75.56139,'T3','2022-06-15'),(10005,621729,'NTN022','NTWQM','NTN','DEDNREC  ','DEDNREC',304191,'6/15/2022','9:45:00',NULL,'','',0,'S ','HVIC','FS1','CHLA','',2.5357,'UG/L','L03','DEDNREC','','','','nan',38.72917,-75.56139,'T3','2022-06-15'),(10005,621730,'NTN022','NTWQM','NTN','DEDNREC  ','DEDNREC',304191,'7/27/2022','10:45:00',NULL,'','',0,'S ','HVIC','S1','CHLA','',1.5218,'UG/L','L03','DEDNREC','','','','nan',38.72917,-75.56139,'T3','2022-07-27'),(10005,621731,'NTN022','NTWQM','NTN','DEDNREC  ','DEDNREC',304191,'8/24/2022','8:45:00',NULL,'','',0,'S ','HVIC','S1','CHLA','',3.4602,'UG/L','L03','DEDNREC','','','','nan',38.72917,-75.56139,'T3','2022-08-24'),(10005,621732,'NTN022','NTWQM','NTN','DEDNREC  ','DEDNREC',304191,'9/29/2022','8:06:00',NULL,'','',0,'S ','HVIC','FS2','CHLA','',2.3392,'UG/L','L03','DEDNREC','','','','nan',38.72917,-75.56139,'T3','2022-09-29'),(10005,621732,'NTN022','NTWQM','NTN','DEDNREC  ','DEDNREC',304191,'9/29/2022','8:06:00',NULL,'','',0,'S ','HVIC','FS1','CHLA','',2.841,'UG/L','L03','DEDNREC','','','','nan',38.72917,-75.56139,'T3','2022-09-29'),(10005,610456,'NTN021','NTWQM','NTN','DEDNREC  ','DEDNREC',304191,'9/2/2021','8:32:00',NULL,'','',0,'S ','HVIC','S1','CLW','',6.719,'MG/L','L02','DEDNREC','','','','nan',38.72917,-75.56139,'T3','2021-09-02'),(10005,610455,'NTN021','NTWQM','NTN','DEDNREC  ','DEDNREC',304191,'8/25/2021','9:47:00',NULL,'','',0,'S ','HVIC','S1','CLW','',17,'MG/L','L02','DEDNREC','','','','nan',38.72917,-75.56139,'T3','2021-08-25'),(10005,610454,'NTN021','NTWQM','NTN','DEDNREC  ','DEDNREC',304191,'7/19/2021','8:57:00',NULL,'','',0,'S ','HVIC','S1','CLW','',18.302,'MG/L','L02','DEDNREC','','','','nan',38.72917,-75.56139,'T3','2021-07-19'),(10005,610453,'NTN021','NTWQM','NTN','DEDNREC  ','DEDNREC',304191,'6/15/2021','8:37:00',NULL,'','',0,'S ','HVIC','FS2','CLW','',14.302,'MG/L','L02','DEDNREC','','','','nan',38.72917,-75.56139,'T3','2021-06-15'),(10005,610453,'NTN021','NTWQM','NTN','DEDNREC  ','DEDNREC',304191,'6/15/2021','8:37:00',NULL,'','',0,'S ','HVIC','FS1','CLW','',14.834,'MG/L','L02','DEDNREC','','','','nan',38.72917,-75.56139,'T3','2021-06-15'),(10005,610452,'NTN021','NTWQM','NTN','DEDNREC  ','DEDNREC',304191,'5/24/2021','7:28:00',NULL,'','',0,'S ','HVIC','S1','CLW','',16.894,'MG/L','L02','DEDNREC','','','','nan',38.72917,-75.56139,'T3','2021-05-24'),(10005,610451,'NTN021','NTWQM','NTN','DEDNREC  ','DEDNREC',304191,'4/20/2021','10:18:00',NULL,'','',0,'S ','HVIC','S1','CLW','',14.811,'MG/L','L02','DEDNREC','','','','nan',38.72917,-75.56139,'T3','2021-04-20'),(10005,610450,'NTN021','NTWQM','NTN','DEDNREC  ','DEDNREC',304191,'3/10/2021','8:01:00',NULL,'','',0,'S ','HVIC','FS2','CLW','',14.494,'MG/L','L02','DEDNREC','','','','nan',38.72917,-75.56139,'T3','2021-03-10'),(10005,610450,'NTN021','NTWQM','NTN','DEDNREC  ','DEDNREC',304191,'3/10/2021','8:01:00',NULL,'','',0,'S ','HVIC','FS1','CLW','',14.313,'MG/L','L02','DEDNREC','','','','nan',38.72917,-75.56139,'T3','2021-03-10'),(10005,610449,'NTN021','NTWQM','NTN','DEDNREC  ','DEDNREC',304191,'2/24/2021','10:10:00',NULL,'','',0,'S ','HVIC','S1','CLW','',14.778,'MG/L','L02','DEDNREC','','','','nan',38.72917,-75.56139,'T3','2021-02-24'),(10005,610448,'NTN021','NTWQM','NTN','DEDNREC  ','DEDNREC',304191,'2/2/2021','9:25:00',NULL,'','',0,'S ','HVIC','FS1','CLW','',21.417,'MG/L','L02','DEDNREC','','','','nan',38.72917,-75.56139,'T3','2021-02-02'),(10005,610448,'NTN021','NTWQM','NTN','DEDNREC  ','DEDNREC',304191,'2/2/2021','9:25:00',NULL,'','',0,'S ','HVIC','FS2','CLW','',20.825,'MG/L','L02','DEDNREC','','','','nan',38.72917,-75.56139,'T3','2021-02-02'),(10005,610457,'NTN021','NTWQM','NTN','DEDNREC  ','DEDNREC',304191,'9/22/2021','9:44:00',NULL,'','',0,'S ','HVIC','S1','CLW','',18.172,'MG/L','L02','DEDNREC','','','','nan',38.72917,-75.56139,'T3','2021-09-22'),(10005,610447,'NTN021','NTWQM','NTN','DEDNREC  ','DEDNREC',304191,'1/28/2021','11:26:00',NULL,'','',0,'S ','HVIC','S1','CLW','',14.533,'MG/L','L02','DEDNREC','','','','nan',38.72917,-75.56139,'T3','2021-01-28'),(10005,621731,'NTN022','NTWQM','NTN','DEDNREC  ','DEDNREC',304191,'8/24/2022','8:45:00',NULL,'','',0,'S ','HVIC','S1','CLW','',16.995,'MG/L','L02','DEDNREC','','','','nan',38.72917,-75.56139,'T3','2022-08-24'),(10005,621730,'NTN022','NTWQM','NTN','DEDNREC  ','DEDNREC',304191,'7/27/2022','10:45:00',NULL,'','',0,'S ','HVIC','S1','CLW','',19.813,'MG/L','L02','DEDNREC','','','','nan',38.72917,-75.56139,'T3','2022-07-27'),(10005,621729,'NTN022','NTWQM','NTN','DEDNREC  ','DEDNREC',304191,'6/15/2022','9:45:00',NULL,'','',0,'S ','HVIC','FS1','CLW','',16.712,'MG/L','L02','DEDNREC','','','','nan',38.72917,-75.56139,'T3','2022-06-15'),(10005,621729,'NTN022','NTWQM','NTN','DEDNREC  ','DEDNREC',304191,'6/15/2022','9:45:00',NULL,'','',0,'S ','HVIC','FS2','CLW','',16.659,'MG/L','L02','DEDNREC','','','','nan',38.72917,-75.56139,'T3','2022-06-15'),(10005,621728,'NTN022','NTWQM','NTN','DEDNREC  ','DEDNREC',304191,'5/18/2022','9:47:00',NULL,'','',0,'S ','HVIC','S1','CLW','',15.067,'MG/L','L02','DEDNREC','','','','nan',38.72917,-75.56139,'T3','2022-05-18'),(10005,621727,'NTN022','NTWQM','NTN','DEDNREC  ','DEDNREC',304191,'4/27/2022','10:01:00',NULL,'','',0,'S ','HVIC','S1','CLW','',15.572,'MG/L','L02','DEDNREC','','','','nan',38.72917,-75.56139,'T3','2022-04-27'),(10005,621726,'NTN022','NTWQM','NTN','DEDNREC  ','DEDNREC',304191,'4/7/2022','9:29:00',NULL,'','',0,'S ','HVIC','FS2','CLW','',12.308,'MG/L','L02','DEDNREC','','','','nan',38.72917,-75.56139,'T3','2022-04-07'),(10005,621726,'NTN022','NTWQM','NTN','DEDNREC  ','DEDNREC',304191,'4/7/2022','9:29:00',NULL,'','',0,'S ','HVIC','FS1','CLW','',12.603,'MG/L','L02','DEDNREC','','','','nan',38.72917,-75.56139,'T3','2022-04-07'),(10005,621725,'NTN022','NTWQM','NTN','DEDNREC  ','DEDNREC',304191,'3/21/2022','8:21:00',NULL,'','',0,'S ','HVIC','S1','CLW','',15.206,'MG/L','L02','DEDNREC','','','','nan',38.72917,-75.56139,'T3','2022-03-21'),(10005,621724,'NTN022','NTWQM','NTN','DEDNREC  ','DEDNREC',304191,'2/23/2022','9:37:00',NULL,'','',0,'S ','HVIC','S1','CLW','',17.193,'MG/L','L02','DEDNREC','','','','nan',38.72917,-75.56139,'T3','2022-02-23'),(10005,621723,'NTN022','NTWQM','NTN','DEDNREC  ','DEDNREC',304191,'1/26/2022','8:25:00',NULL,'','',0,'S ','HVIC','S1','CLW','',14.921,'MG/L','L02','DEDNREC','','','','nan',38.72917,-75.56139,'T3','2022-01-26'),(10005,621722,'NTN022','NTWQM','NTN','DEDNREC  ','DEDNREC',304191,'12/15/2021','9:14:00',NULL,'','',0,'S ','HVIC','S1','CLW','',14.05,'MG/L','L02','DEDNREC','','','','nan',38.72917,-75.56139,'T3','2021-12-15'),(10005,621721,'NTN022','NTWQM','NTN','DEDNREC  ','DEDNREC',304191,'11/8/2021','7:55:00',NULL,'','',0,'S ','HVIC','S1','CLW','',19.542,'MG/L','L02','DEDNREC','','','','nan',38.72917,-75.56139,'T3','2021-11-08'),(10005,621720,'NTN022','NTWQM','NTN','DEDNREC  ','DEDNREC',304191,'10/18/2021','10:05:00',NULL,'','',0,'S ','HVIC','S1','CLW','',18.212,'MG/L','L02','DEDNREC','','','','nan',38.72917,-75.56139,'T3','2021-10-18'),(10005,621732,'NTN022','NTWQM','NTN','DEDNREC  ','DEDNREC',304191,'9/29/2022','8:06:00',NULL,'','',0,'S ','HVIC','FS2','CLW','',21.025,'MG/L','L02','DEDNREC','','','','nan',38.72917,-75.56139,'T3','2022-09-29'),(10005,621732,'NTN022','NTWQM','NTN','DEDNREC  ','DEDNREC',304191,'9/29/2022','8:06:00',NULL,'','',0,'S ','HVIC','FS1','CLW','',20.519,'MG/L','L02','DEDNREC','','','','nan',38.72917,-75.56139,'T3','2022-09-29'),(10005,610447,'NTN021','NTWQM','NTN','DEDNREC  ','DEDNREC',304191,'1/28/2021','11:26:00',NULL,'','',0,'S ','ISM','M1','DO','',11.39,'MG/L','F02','','','','','nan',38.72917,-75.56139,'T3','2021-01-28'),(10005,610448,'NTN021','NTWQM','NTN','DEDNREC  ','DEDNREC',304191,'2/2/2021','9:25:00',NULL,'','',0,'S ','ISM','M2','DO','',10.54,'MG/L','F02','','','','','nan',38.72917,-75.56139,'T3','2021-02-02'),(10005,610448,'NTN021','NTWQM','NTN','DEDNREC  ','DEDNREC',304191,'2/2/2021','9:25:00',NULL,'','',0,'S ','ISM','M1','DO','',10.54,'MG/L','F02','','','','','nan',38.72917,-75.56139,'T3','2021-02-02'),(10005,610457,'NTN021','NTWQM','NTN','DEDNREC  ','DEDNREC',304191,'9/22/2021','9:44:00',NULL,'','',0,'S ','ISM','M1','DO','',8.22,'MG/L','F02','','','','','nan',38.72917,-75.56139,'T3','2021-09-22'),(10005,610449,'NTN021','NTWQM','NTN','DEDNREC  ','DEDNREC',304191,'2/24/2021','10:10:00',NULL,'','',0,'S ','ISM','M1','DO','',10.77,'MG/L','F02','','','','','nan',38.72917,-75.56139,'T3','2021-02-24'),(10005,610450,'NTN021','NTWQM','NTN','DEDNREC  ','DEDNREC',304191,'3/10/2021','8:01:00',NULL,'','',0,'S ','ISM','M1','DO','',10.13,'MG/L','F02','','','','','nan',38.72917,-75.56139,'T3','2021-03-10'),(10005,610450,'NTN021','NTWQM','NTN','DEDNREC  ','DEDNREC',304191,'3/10/2021','8:01:00',NULL,'','',0,'S ','ISM','M2','DO','',10.15,'MG/L','F02','','','','','nan',38.72917,-75.56139,'T3','2021-03-10'),(10005,610452,'NTN021','NTWQM','NTN','DEDNREC  ','DEDNREC',304191,'5/24/2021','7:28:00',NULL,'','',0,'S ','ISM','M1','DO','',6.45,'MG/L','F02','','','','','nan',38.72917,-75.56139,'T3','2021-05-24'),(10005,610451,'NTN021','NTWQM','NTN','DEDNREC  ','DEDNREC',304191,'4/20/2021','10:18:00',NULL,'','',0,'S ','ISM','M1','DO','',9.87,'MG/L','F02','','','','','nan',38.72917,-75.56139,'T3','2021-04-20'),(10005,610453,'NTN021','NTWQM','NTN','DEDNREC  ','DEDNREC',304191,'6/15/2021','8:37:00',NULL,'','',0,'S ','ISM','M1','DO','',6.04,'MG/L','F02','','','','','nan',38.72917,-75.56139,'T3','2021-06-15'),(10005,610454,'NTN021','NTWQM','NTN','DEDNREC  ','DEDNREC',304191,'7/19/2021','8:57:00',NULL,'','',0,'S ','ISM','M1','DO','',8.13,'MG/L','F02','','','','','nan',38.72917,-75.56139,'T3','2021-07-19'),(10005,610453,'NTN021','NTWQM','NTN','DEDNREC  ','DEDNREC',304191,'6/15/2021','8:37:00',NULL,'','',0,'S ','ISM','M2','DO','',6.04,'MG/L','F02','','','','','nan',38.72917,-75.56139,'T3','2021-06-15'),(10005,610455,'NTN021','NTWQM','NTN','DEDNREC  ','DEDNREC',304191,'8/25/2021','9:47:00',NULL,'','',0,'S ','ISM','M1','DO','',7.2,'MG/L','F02','','','','','nan',38.72917,-75.56139,'T3','2021-08-25'),(10005,610456,'NTN021','NTWQM','NTN','DEDNREC  ','DEDNREC',304191,'9/2/2021','8:32:00',NULL,'','',0,'S ','ISM','M1','DO','',6.09,'MG/L','F02','','','','','nan',38.72917,-75.56139,'T3','2021-09-02'),(10005,621720,'NTN022','NTWQM','NTN','DEDNREC  ','DEDNREC',304191,'10/18/2021','10:05:00',NULL,'','',0,'S ','ISM','M1','DO','',9.19,'MG/L','F02','','','','','nan',38.72917,-75.56139,'T3','2021-10-18'),(10005,621722,'NTN022','NTWQM','NTN','DEDNREC  ','DEDNREC',304191,'12/15/2021','9:14:00',NULL,'','',0,'S ','ISM','M1','DO','',11,'MG/L','F02','','','','','nan',38.72917,-75.56139,'T3','2021-12-15'),(10005,621721,'NTN022','NTWQM','NTN','DEDNREC  ','DEDNREC',304191,'11/8/2021','7:55:00',NULL,'','',0,'S ','ISM','M1','DO','',10.15,'MG/L','F02','','','','','nan',38.72917,-75.56139,'T3','2021-11-08'),(10005,621723,'NTN022','NTWQM','NTN','DEDNREC  ','DEDNREC',304191,'1/26/2022','8:25:00',NULL,'','',0,'S ','ISM','M1','DO','',11.23,'MG/L','F02','','','','','nan',38.72917,-75.56139,'T3','2022-01-26'),(10005,621724,'NTN022','NTWQM','NTN','DEDNREC  ','DEDNREC',304191,'2/23/2022','9:37:00',NULL,'','',0,'S ','ISM','M1','DO','',9.3,'MG/L','F02','','','','','nan',38.72917,-75.56139,'T3','2022-02-23'),(10005,621725,'NTN022','NTWQM','NTN','DEDNREC  ','DEDNREC',304191,'3/21/2022','8:21:00',NULL,'','',0,'S ','ISM','M1','DO','',9.62,'MG/L','F02','','','','','nan',38.72917,-75.56139,'T3','2022-03-21'),(10005,621726,'NTN022','NTWQM','NTN','DEDNREC  ','DEDNREC',304191,'4/7/2022','9:29:00',NULL,'','',0,'S ','ISM','M1','DO','',9.14,'MG/L','F02','','','','','nan',38.72917,-75.56139,'T3','2022-04-07'),(10005,621726,'NTN022','NTWQM','NTN','DEDNREC  ','DEDNREC',304191,'4/7/2022','9:29:00',NULL,'','',0,'S ','ISM','M2','DO','',9.13,'MG/L','F02','','','','','nan',38.72917,-75.56139,'T3','2022-04-07'),(10005,621727,'NTN022','NTWQM','NTN','DEDNREC  ','DEDNREC',304191,'4/27/2022','10:01:00',NULL,'','',0,'S ','ISM','M1','DO','',8.28,'MG/L','F02','','','','','nan',38.72917,-75.56139,'T3','2022-04-27'),(10005,621728,'NTN022','NTWQM','NTN','DEDNREC  ','DEDNREC',304191,'5/18/2022','9:47:00',NULL,'','',0,'S ','ISM','M1','DO','',6.98,'MG/L','F02','','','','','nan',38.72917,-75.56139,'T3','2022-05-18'),(10005,621729,'NTN022','NTWQM','NTN','DEDNREC  ','DEDNREC',304191,'6/15/2022','9:45:00',NULL,'','',0,'S ','ISM','M2','DO','',6.33,'MG/L','F02','','','','','nan',38.72917,-75.56139,'T3','2022-06-15'),(10005,621729,'NTN022','NTWQM','NTN','DEDNREC  ','DEDNREC',304191,'6/15/2022','9:45:00',NULL,'','',0,'S ','ISM','M1','DO','',6.33,'MG/L','F02','','','','','nan',38.72917,-75.56139,'T3','2022-06-15'),(10005,621730,'NTN022','NTWQM','NTN','DEDNREC  ','DEDNREC',304191,'7/27/2022','10:45:00',NULL,'','',0,'S ','ISM','M1','DO','',7.97,'MG/L','F02','','','','','nan',38.72917,-75.56139,'T3','2022-07-27'),(10005,621731,'NTN022','NTWQM','NTN','DEDNREC  ','DEDNREC',304191,'8/24/2022','8:45:00',NULL,'','',0,'S ','ISM','M1','DO','',6.77,'MG/L','F02','','','','','nan',38.72917,-75.56139,'T3','2022-08-24'),(10005,621732,'NTN022','NTWQM','NTN','DEDNREC  ','DEDNREC',304191,'9/29/2022','8:06:00',NULL,'','',0,'S ','ISM','M1','DO','',9.26,'MG/L','F02','','','','','nan',38.72917,-75.56139,'T3','2022-09-29'),(10005,621732,'NTN022','NTWQM','NTN','DEDNREC  ','DEDNREC',304191,'9/29/2022','8:06:00',NULL,'','',0,'S ','ISM','M2','DO','',9.26,'MG/L','F02','','','','','nan',38.72917,-75.56139,'T3','2022-09-29'),(10005,610456,'NTN021','NTWQM','NTN','DEDNREC  ','DEDNREC',304191,'9/2/2021','8:32:00',NULL,'','',0,'S ','ISM','M1','DO_SAT_P','',68.8,'PCT','F01','','','','','nan',38.72917,-75.56139,'T3','2021-09-02'),(10005,610455,'NTN021','NTWQM','NTN','DEDNREC  ','DEDNREC',304191,'8/25/2021','9:47:00',NULL,'','',0,'S ','ISM','M1','DO_SAT_P','',85.5,'PCT','F01','','','','','nan',38.72917,-75.56139,'T3','2021-08-25'),(10005,610453,'NTN021','NTWQM','NTN','DEDNREC  ','DEDNREC',304191,'6/15/2021','8:37:00',NULL,'','',0,'S ','ISM','M2','DO_SAT_P','',68.5,'PCT','F01','','','','','nan',38.72917,-75.56139,'T3','2021-06-15'),(10005,610454,'NTN021','NTWQM','NTN','DEDNREC  ','DEDNREC',304191,'7/19/2021','8:57:00',NULL,'','',0,'S ','ISM','M1','DO_SAT_P','',91.8,'PCT','F01','','','','','nan',38.72917,-75.56139,'T3','2021-07-19'),(10005,610453,'NTN021','NTWQM','NTN','DEDNREC  ','DEDNREC',304191,'6/15/2021','8:37:00',NULL,'','',0,'S ','ISM','M1','DO_SAT_P','',68.5,'PCT','F01','','','','','nan',38.72917,-75.56139,'T3','2021-06-15'),(10005,610451,'NTN021','NTWQM','NTN','DEDNREC  ','DEDNREC',304191,'4/20/2021','10:18:00',NULL,'','',0,'S ','ISM','M1','DO_SAT_P','',94.2,'PCT','F01','','','','','nan',38.72917,-75.56139,'T3','2021-04-20'),(10005,610452,'NTN021','NTWQM','NTN','DEDNREC  ','DEDNREC',304191,'5/24/2021','7:28:00',NULL,'','',0,'S ','ISM','M1','DO_SAT_P','',72.3,'PCT','F01','','','','','nan',38.72917,-75.56139,'T3','2021-05-24'),(10005,610450,'NTN021','NTWQM','NTN','DEDNREC  ','DEDNREC',304191,'3/10/2021','8:01:00',NULL,'','',0,'S ','ISM','M2','DO_SAT_P','',93.5,'PCT','F01','','','','','nan',38.72917,-75.56139,'T3','2021-03-10'),(10005,610450,'NTN021','NTWQM','NTN','DEDNREC  ','DEDNREC',304191,'3/10/2021','8:01:00',NULL,'','',0,'S ','ISM','M1','DO_SAT_P','',93.4,'PCT','F01','','','','','nan',38.72917,-75.56139,'T3','2021-03-10'),(10005,610449,'NTN021','NTWQM','NTN','DEDNREC  ','DEDNREC',304191,'2/24/2021','10:10:00',NULL,'','',0,'S ','ISM','M1','DO_SAT_P','',91.5,'PCT','F01','','','','','nan',38.72917,-75.56139,'T3','2021-02-24'),(10005,610457,'NTN021','NTWQM','NTN','DEDNREC  ','DEDNREC',304191,'9/22/2021','9:44:00',NULL,'','',0,'S ','ISM','M1','DO_SAT_P','',90,'PCT','F01','','','','','nan',38.72917,-75.56139,'T3','2021-09-22'),(10005,610448,'NTN021','NTWQM','NTN','DEDNREC  ','DEDNREC',304191,'2/2/2021','9:25:00',NULL,'','',0,'S ','ISM','M1','DO_SAT_P','',87.8,'PCT','F01','','','','','nan',38.72917,-75.56139,'T3','2021-02-02'),(10005,610448,'NTN021','NTWQM','NTN','DEDNREC  ','DEDNREC',304191,'2/2/2021','9:25:00',NULL,'','',0,'S ','ISM','M2','DO_SAT_P','',87.8,'PCT','F01','','','','','nan',38.72917,-75.56139,'T3','2021-02-02'),(10005,610447,'NTN021','NTWQM','NTN','DEDNREC  ','DEDNREC',304191,'1/28/2021','11:26:00',NULL,'','',0,'S ','ISM','M1','DO_SAT_P','',85.8,'PCT','F01','','','','','nan',38.72917,-75.56139,'T3','2021-01-28'),(10005,621732,'NTN022','NTWQM','NTN','DEDNREC  ','DEDNREC',304191,'9/29/2022','8:06:00',NULL,'','',0,'S ','ISM','M2','DO_SAT_P','',91.9,'PCT','F01','','','','','nan',38.72917,-75.56139,'T3','2022-09-29'),(10005,621731,'NTN022','NTWQM','NTN','DEDNREC  ','DEDNREC',304191,'8/24/2022','8:45:00',NULL,'','',0,'S ','ISM','M1','DO_SAT_P','',76.3,'PCT','F01','','','','','nan',38.72917,-75.56139,'T3','2022-08-24'),(10005,621732,'NTN022','NTWQM','NTN','DEDNREC  ','DEDNREC',304191,'9/29/2022','8:06:00',NULL,'','',0,'S ','ISM','M1','DO_SAT_P','',91.9,'PCT','F01','','','','','nan',38.72917,-75.56139,'T3','2022-09-29'),(10005,621730,'NTN022','NTWQM','NTN','DEDNREC  ','DEDNREC',304191,'7/27/2022','10:45:00',NULL,'','',0,'S ','ISM','M1','DO_SAT_P','',92.2,'PCT','F01','','','','','nan',38.72917,-75.56139,'T3','2022-07-27'),(10005,621729,'NTN022','NTWQM','NTN','DEDNREC  ','DEDNREC',304191,'6/15/2022','9:45:00',NULL,'','',0,'S ','ISM','M1','DO_SAT_P','',72.9,'PCT','F01','','','','','nan',38.72917,-75.56139,'T3','2022-06-15'),(10005,621729,'NTN022','NTWQM','NTN','DEDNREC  ','DEDNREC',304191,'6/15/2022','9:45:00',NULL,'','',0,'S ','ISM','M2','DO_SAT_P','',73,'PCT','F01','','','','','nan',38.72917,-75.56139,'T3','2022-06-15'),(10005,621728,'NTN022','NTWQM','NTN','DEDNREC  ','DEDNREC',304191,'5/18/2022','9:47:00',NULL,'','',0,'S ','ISM','M1','DO_SAT_P','',74.2,'PCT','F01','','','','','nan',38.72917,-75.56139,'T3','2022-05-18'),(10005,621726,'NTN022','NTWQM','NTN','DEDNREC  ','DEDNREC',304191,'4/7/2022','9:29:00',NULL,'','',0,'S ','ISM','M2','DO_SAT_P','',85.6,'PCT','F01','','','','','nan',38.72917,-75.56139,'T3','2022-04-07'),(10005,621727,'NTN022','NTWQM','NTN','DEDNREC  ','DEDNREC',304191,'4/27/2022','10:01:00',NULL,'','',0,'S ','ISM','M1','DO_SAT_P','',82.4,'PCT','F01','','','','','nan',38.72917,-75.56139,'T3','2022-04-27'),(10005,621725,'NTN022','NTWQM','NTN','DEDNREC  ','DEDNREC',304191,'3/21/2022','8:21:00',NULL,'','',0,'S ','ISM','M1','DO_SAT_P','',88.4,'PCT','F01','','','','','nan',38.72917,-75.56139,'T3','2022-03-21'),(10005,621726,'NTN022','NTWQM','NTN','DEDNREC  ','DEDNREC',304191,'4/7/2022','9:29:00',NULL,'','',0,'S ','ISM','M1','DO_SAT_P','',85.6,'PCT','F01','','','','','nan',38.72917,-75.56139,'T3','2022-04-07'),(10005,621724,'NTN022','NTWQM','NTN','DEDNREC  ','DEDNREC',304191,'2/23/2022','9:37:00',NULL,'','',0,'S ','ISM','M1','DO_SAT_P','',91.3,'PCT','F01','','','','','nan',38.72917,-75.56139,'T3','2022-02-23'),(10005,621723,'NTN022','NTWQM','NTN','DEDNREC  ','DEDNREC',304191,'1/26/2022','8:25:00',NULL,'','',0,'S ','ISM','M1','DO_SAT_P','',88.5,'PCT','F01','','','','','nan',38.72917,-75.56139,'T3','2022-01-26'),(10005,621722,'NTN022','NTWQM','NTN','DEDNREC  ','DEDNREC',304191,'12/15/2021','9:14:00',NULL,'','',0,'S ','ISM','M1','DO_SAT_P','',93,'PCT','F01','','','','','nan',38.72917,-75.56139,'T3','2021-12-15'),(10005,621721,'NTN022','NTWQM','NTN','DEDNREC  ','DEDNREC',304191,'11/8/2021','7:55:00',NULL,'','',0,'S ','ISM','M1','DO_SAT_P','',91.2,'PCT','F01','','','','','nan',38.72917,-75.56139,'T3','2021-11-08'),(10005,621720,'NTN022','NTWQM','NTN','DEDNREC  ','DEDNREC',304191,'10/18/2021','10:05:00',NULL,'','',0,'S ','ISM','M1','DO_SAT_P','',90.8,'PCT','F01','','','','','nan',38.72917,-75.56139,'T3','2021-10-18'),(10005,610447,'NTN021','NTWQM','NTN','DEDNREC  ','DEDNREC',304191,'1/28/2021','11:26:00',NULL,'','',0,'S ','HVIC','S1','DOC','',1.592,'MG/L','L01','DEDNREC','','','','nan',38.72917,-75.56139,'T3','2021-01-28'),(10005,610448,'NTN021','NTWQM','NTN','DEDNREC  ','DEDNREC',304191,'2/2/2021','9:25:00',NULL,'','',0,'S ','HVIC','FS2','DOC','',3.741,'MG/L','L01','DEDNREC','','','','nan',38.72917,-75.56139,'T3','2021-02-02'),(10005,610449,'NTN021','NTWQM','NTN','DEDNREC  ','DEDNREC',304191,'2/24/2021','10:10:00',NULL,'','',0,'S ','HVIC','S1','DOC','',4.321,'MG/L','L01','DEDNREC','GG','','','Analysis performed after holding time expired.',38.72917,-75.56139,'T3','2021-02-24'),(10005,610448,'NTN021','NTWQM','NTN','DEDNREC  ','DEDNREC',304191,'2/2/2021','9:25:00',NULL,'','',0,'S ','HVIC','FS1','DOC','',3.789,'MG/L','L01','DEDNREC','','','','nan',38.72917,-75.56139,'T3','2021-02-02'),(10005,610450,'NTN021','NTWQM','NTN','DEDNREC  ','DEDNREC',304191,'3/10/2021','8:01:00',NULL,'','',0,'S ','HVIC','FS1','DOC','',2.12,'MG/L','L01','DEDNREC','','','','nan',38.72917,-75.56139,'T3','2021-03-10'),(10005,610450,'NTN021','NTWQM','NTN','DEDNREC  ','DEDNREC',304191,'3/10/2021','8:01:00',NULL,'','',0,'S ','HVIC','FS2','DOC','',2.082,'MG/L','L01','DEDNREC','','','','nan',38.72917,-75.56139,'T3','2021-03-10'),(10005,610451,'NTN021','NTWQM','NTN','DEDNREC  ','DEDNREC',304191,'4/20/2021','10:18:00',NULL,'','',0,'S ','HVIC','S1','DOC','',2.168,'MG/L','L01','DEDNREC','','','','nan',38.72917,-75.56139,'T3','2021-04-20'),(10005,610452,'NTN021','NTWQM','NTN','DEDNREC  ','DEDNREC',304191,'5/24/2021','7:28:00',NULL,'','',0,'S ','HVIC','S1','DOC','',2.122,'MG/L','L01','DEDNREC','','','','nan',38.72917,-75.56139,'T3','2021-05-24'),(10005,610453,'NTN021','NTWQM','NTN','DEDNREC  ','DEDNREC',304191,'6/15/2021','8:37:00',NULL,'','',0,'S ','HVIC','FS2','DOC','',3.261,'MG/L','L01','DEDNREC','','','','nan',38.72917,-75.56139,'T3','2021-06-15'),(10005,610453,'NTN021','NTWQM','NTN','DEDNREC  ','DEDNREC',304191,'6/15/2021','8:37:00',NULL,'','',0,'S ','HVIC','FS1','DOC','',3.264,'MG/L','L01','DEDNREC','','','','nan',38.72917,-75.56139,'T3','2021-06-15'),(10005,610454,'NTN021','NTWQM','NTN','DEDNREC  ','DEDNREC',304191,'7/19/2021','8:57:00',NULL,'','',0,'S ','HVIC','S1','DOC','',2.072,'MG/L','L01','DEDNREC','','','','nan',38.72917,-75.56139,'T3','2021-07-19'),(10005,610455,'NTN021','NTWQM','NTN','DEDNREC  ','DEDNREC',304191,'8/25/2021','9:47:00',NULL,'','',0,'S ','HVIC','S1','DOC','',3.359,'MG/L','L01','DEDNREC','','','','nan',38.72917,-75.56139,'T3','2021-08-25'),(10005,610456,'NTN021','NTWQM','NTN','DEDNREC  ','DEDNREC',304191,'9/2/2021','8:32:00',NULL,'','',0,'S ','HVIC','S1','DOC','',8.274,'MG/L','L01','DEDNREC','QQ','','','nan',38.72917,-75.56139,'T3','2021-09-02'),(10005,610457,'NTN021','NTWQM','NTN','DEDNREC  ','DEDNREC',304191,'9/22/2021','9:44:00',NULL,'','',0,'S ','HVIC','S1','DOC','',2.391,'MG/L','L01','DEDNREC','','','','nan',38.72917,-75.56139,'T3','2021-09-22'),(10005,621720,'NTN022','NTWQM','NTN','DEDNREC  ','DEDNREC',304191,'10/18/2021','10:05:00',NULL,'','',0,'S ','HVIC','S1','DOC','',2.028,'MG/L','L01','DEDNREC','','','','nan',38.72917,-75.56139,'T3','2021-10-18'),(10005,621722,'NTN022','NTWQM','NTN','DEDNREC  ','DEDNREC',304191,'12/15/2021','9:14:00',NULL,'','',0,'S ','HVIC','S1','DOC','',1.131,'MG/L','L01','DEDNREC','','','','nan',38.72917,-75.56139,'T3','2021-12-15'),(10005,621721,'NTN022','NTWQM','NTN','DEDNREC  ','DEDNREC',304191,'11/8/2021','7:55:00',NULL,'','',0,'S ','HVIC','S1','DOC','',1.782,'MG/L','L01','DEDNREC','','','','nan',38.72917,-75.56139,'T3','2021-11-08'),(10005,621723,'NTN022','NTWQM','NTN','DEDNREC  ','DEDNREC',304191,'1/26/2022','8:25:00',NULL,'','',0,'S ','HVIC','S1','DOC','',1.512,'MG/L','L01','DEDNREC','','','','nan',38.72917,-75.56139,'T3','2022-01-26'),(10005,621724,'NTN022','NTWQM','NTN','DEDNREC  ','DEDNREC',304191,'2/23/2022','9:37:00',NULL,'','',0,'S ','HVIC','S1','DOC','',1.461,'MG/L','L01','DEDNREC','','','','nan',38.72917,-75.56139,'T3','2022-02-23'),(10005,621726,'NTN022','NTWQM','NTN','DEDNREC  ','DEDNREC',304191,'4/7/2022','9:29:00',NULL,'','',0,'S ','HVIC','FS2','DOC','',7.761,'MG/L','L01','DEDNREC','QQ','','','nan',38.72917,-75.56139,'T3','2022-04-07'),(10005,621726,'NTN022','NTWQM','NTN','DEDNREC  ','DEDNREC',304191,'4/7/2022','9:29:00',NULL,'','',0,'S ','HVIC','FS1','DOC','',7.445,'MG/L','L01','DEDNREC','','','','nan',38.72917,-75.56139,'T3','2022-04-07'),(10005,621725,'NTN022','NTWQM','NTN','DEDNREC  ','DEDNREC',304191,'3/21/2022','8:21:00',NULL,'','',0,'S ','HVIC','S1','DOC','',1.916,'MG/L','L01','DEDNREC','','','','nan',38.72917,-75.56139,'T3','2022-03-21'),(10005,621727,'NTN022','NTWQM','NTN','DEDNREC  ','DEDNREC',304191,'4/27/2022','10:01:00',NULL,'','',0,'S ','HVIC','S1','DOC','',2.207,'MG/L','L01','DEDNREC','','','','nan',38.72917,-75.56139,'T3','2022-04-27'),(10005,621728,'NTN022','NTWQM','NTN','DEDNREC  ','DEDNREC',304191,'5/18/2022','9:47:00',NULL,'','',0,'S ','HVIC','S1','DOC','',2.492,'MG/L','L01','DEDNREC','','','','nan',38.72917,-75.56139,'T3','2022-05-18'),(10005,621729,'NTN022','NTWQM','NTN','DEDNREC  ','DEDNREC',304191,'6/15/2022','9:45:00',NULL,'','',0,'S ','HVIC','FS2','DOC','',2.423,'MG/L','L01','DEDNREC','','','','nan',38.72917,-75.56139,'T3','2022-06-15'),(10005,621729,'NTN022','NTWQM','NTN','DEDNREC  ','DEDNREC',304191,'6/15/2022','9:45:00',NULL,'','',0,'S ','HVIC','FS1','DOC','',2.284,'MG/L','L01','DEDNREC','','','','nan',38.72917,-75.56139,'T3','2022-06-15'),(10005,621730,'NTN022','NTWQM','NTN','DEDNREC  ','DEDNREC',304191,'7/27/2022','10:45:00',NULL,'','',0,'S ','HVIC','S1','DOC','',1.702,'MG/L','L01','DEDNREC','','','','nan',38.72917,-75.56139,'T3','2022-07-27'),(10005,621731,'NTN022','NTWQM','NTN','DEDNREC  ','DEDNREC',304191,'8/24/2022','8:45:00',NULL,'','',0,'S ','HVIC','S1','DOC','',2.117,'MG/L','L01','DEDNREC','','','','nan',38.72917,-75.56139,'T3','2022-08-24'),(10005,621732,'NTN022','NTWQM','NTN','DEDNREC  ','DEDNREC',304191,'9/29/2022','8:06:00',NULL,'','',0,'S ','HVIC','FS2','DOC','',1.404,'MG/L','L01','DEDNREC','','','','nan',38.72917,-75.56139,'T3','2022-09-29'),(10005,621732,'NTN022','NTWQM','NTN','DEDNREC  ','DEDNREC',304191,'9/29/2022','8:06:00',NULL,'','',0,'S ','HVIC','FS1','DOC','',1.496,'MG/L','L01','DEDNREC','','','','nan',38.72917,-75.56139,'T3','2022-09-29'),(10005,610456,'NTN021','NTWQM','NTN','DEDNREC  ','DEDNREC',304191,'9/2/2021','8:32:00',NULL,'','',0,'S ','HVIC','S1','FSS','',39.8,'MG/L','L01','DEDNREC','','','','nan',38.72917,-75.56139,'T3','2021-09-02'),(10005,610454,'NTN021','NTWQM','NTN','DEDNREC  ','DEDNREC',304191,'7/19/2021','8:57:00',NULL,'','',0,'S ','HVIC','S1','FSS','',11.16,'MG/L','L01','DEDNREC','','','','nan',38.72917,-75.56139,'T3','2021-07-19'),(10005,610455,'NTN021','NTWQM','NTN','DEDNREC  ','DEDNREC',304191,'8/25/2021','9:47:00',NULL,'','',0,'S ','HVIC','S1','FSS','',2.49,'MG/L','L01','DEDNREC','','','','nan',38.72917,-75.56139,'T3','2021-08-25'),(10005,610453,'NTN021','NTWQM','NTN','DEDNREC  ','DEDNREC',304191,'6/15/2021','8:37:00',NULL,'','',0,'S ','HVIC','FS2','FSS','',4.4375,'MG/L','L01','DEDNREC','','','','nan',38.72917,-75.56139,'T3','2021-06-15'),(10005,610453,'NTN021','NTWQM','NTN','DEDNREC  ','DEDNREC',304191,'6/15/2021','8:37:00',NULL,'','',0,'S ','HVIC','FS1','FSS','',4.025,'MG/L','L01','DEDNREC','','','','nan',38.72917,-75.56139,'T3','2021-06-15'),(10005,610451,'NTN021','NTWQM','NTN','DEDNREC  ','DEDNREC',304191,'4/20/2021','10:18:00',NULL,'','',0,'S ','HVIC','S1','FSS','G',1.21,'MG/L','L01','DEDNREC','','','','nan',38.72917,-75.56139,'T3','2021-04-20'),(10005,610452,'NTN021','NTWQM','NTN','DEDNREC  ','DEDNREC',304191,'5/24/2021','7:28:00',NULL,'','',0,'S ','HVIC','S1','FSS','',4.6875,'MG/L','L01','DEDNREC','','','','nan',38.72917,-75.56139,'T3','2021-05-24'),(10005,610450,'NTN021','NTWQM','NTN','DEDNREC  ','DEDNREC',304191,'3/10/2021','8:01:00',NULL,'','',0,'S ','HVIC','FS2','FSS','G',1.38,'MG/L','L01','DEDNREC','','','','nan',38.72917,-75.56139,'T3','2021-03-10'),(10005,610450,'NTN021','NTWQM','NTN','DEDNREC  ','DEDNREC',304191,'3/10/2021','8:01:00',NULL,'','',0,'S ','HVIC','FS1','FSS','G',1.38,'MG/L','L01','DEDNREC','','','','nan',38.72917,-75.56139,'T3','2021-03-10'),(10005,610457,'NTN021','NTWQM','NTN','DEDNREC  ','DEDNREC',304191,'9/22/2021','9:44:00',NULL,'','',0,'S ','HVIC','S1','FSS','G',1.7,'MG/L','L01','DEDNREC','','','','nan',38.72917,-75.56139,'T3','2021-09-22'),(10005,621732,'NTN022','NTWQM','NTN','DEDNREC  ','DEDNREC',304191,'9/29/2022','8:06:00',NULL,'','',0,'S ','HVIC','FS1','FSS','<',2,'MG/L','L01','DEDNREC','','','','nan',38.72917,-75.56139,'T3','2022-09-29'),(10005,621731,'NTN022','NTWQM','NTN','DEDNREC  ','DEDNREC',304191,'8/24/2022','8:45:00',NULL,'','',0,'S ','HVIC','S1','FSS','',4.04,'MG/L','L01','DEDNREC','','','','nan',38.72917,-75.56139,'T3','2022-08-24'),(10005,621732,'NTN022','NTWQM','NTN','DEDNREC  ','DEDNREC',304191,'9/29/2022','8:06:00',NULL,'','',0,'S ','HVIC','FS2','FSS','G',2.12,'MG/L','L01','DEDNREC','','','','nan',38.72917,-75.56139,'T3','2022-09-29'),(10005,621730,'NTN022','NTWQM','NTN','DEDNREC  ','DEDNREC',304191,'7/27/2022','10:45:00',NULL,'','',0,'S ','HVIC','S1','FSS','G',1.98,'MG/L','L01','DEDNREC','','','','nan',38.72917,-75.56139,'T3','2022-07-27'),(10005,621729,'NTN022','NTWQM','NTN','DEDNREC  ','DEDNREC',304191,'6/15/2022','9:45:00',NULL,'','',0,'S ','HVIC','FS2','FSS','G',2.01,'MG/L','L01','DEDNREC','','','','nan',38.72917,-75.56139,'T3','2022-06-15'),(10005,621729,'NTN022','NTWQM','NTN','DEDNREC  ','DEDNREC',304191,'6/15/2022','9:45:00',NULL,'','',0,'S ','HVIC','FS1','FSS','G',1.96,'MG/L','L01','DEDNREC','','','','nan',38.72917,-75.56139,'T3','2022-06-15'),(10005,621728,'NTN022','NTWQM','NTN','DEDNREC  ','DEDNREC',304191,'5/18/2022','9:47:00',NULL,'','',0,'S ','HVIC','S1','FSS','',2.64,'MG/L','L01','DEDNREC','','','','nan',38.72917,-75.56139,'T3','2022-05-18'),(10005,621727,'NTN022','NTWQM','NTN','DEDNREC  ','DEDNREC',304191,'4/27/2022','10:01:00',NULL,'','',0,'S ','HVIC','S1','FSS','',5.3111,'MG/L','L01','DEDNREC','','','','nan',38.72917,-75.56139,'T3','2022-04-27'),(10005,621726,'NTN022','NTWQM','NTN','DEDNREC  ','DEDNREC',304191,'4/7/2022','9:29:00',NULL,'','',0,'S ','HVIC','FS2','FSS','',6.14,'MG/L','L01','DEDNREC','','','','nan',38.72917,-75.56139,'T3','2022-04-07'),(10005,621725,'NTN022','NTWQM','NTN','DEDNREC  ','DEDNREC',304191,'3/21/2022','8:21:00',NULL,'','',0,'S ','HVIC','S1','FSS','<',1,'MG/L','L01','DEDNREC','','','','nan',38.72917,-75.56139,'T3','2022-03-21'),(10005,621726,'NTN022','NTWQM','NTN','DEDNREC  ','DEDNREC',304191,'4/7/2022','9:29:00',NULL,'','',0,'S ','HVIC','FS1','FSS','',5.96,'MG/L','L01','DEDNREC','','','','nan',38.72917,-75.56139,'T3','2022-04-07'),(10005,621724,'NTN022','NTWQM','NTN','DEDNREC  ','DEDNREC',304191,'2/23/2022','9:37:00',NULL,'','',0,'S ','HVIC','S1','FSS','G',1.88,'MG/L','L01','DEDNREC','','','','nan',38.72917,-75.56139,'T3','2022-02-23'),(10005,621723,'NTN022','NTWQM','NTN','DEDNREC  ','DEDNREC',304191,'1/26/2022','8:25:00',NULL,'','',0,'S ','HVIC','S1','FSS','G',1.38,'MG/L','L01','DEDNREC','','','','nan',38.72917,-75.56139,'T3','2022-01-26'),(10005,621722,'NTN022','NTWQM','NTN','DEDNREC  ','DEDNREC',304191,'12/15/2021','9:14:00',NULL,'','',0,'S ','HVIC','S1','FSS','<',2,'MG/L','L01','DEDNREC','','','','nan',38.72917,-75.56139,'T3','2021-12-15'),(10005,621721,'NTN022','NTWQM','NTN','DEDNREC  ','DEDNREC',304191,'11/8/2021','7:55:00',NULL,'','',0,'S ','HVIC','S1','FSS','<',1,'MG/L','L01','DEDNREC','','','','nan',38.72917,-75.56139,'T3','2021-11-08'),(10005,621720,'NTN022','NTWQM','NTN','DEDNREC  ','DEDNREC',304191,'10/18/2021','10:05:00',NULL,'','',0,'S ','HVIC','S1','FSS','<',2,'MG/L','L01','DEDNREC','','','','nan',38.72917,-75.56139,'T3','2021-10-18'),(10005,621720,'NTN022','NTWQM','NTN','DEDNREC  ','DEDNREC',304191,'10/18/2021','10:05:00',NULL,'','',0,'S ','HVIC','S1','HARDNESS','',46.2614,'MG/L','L02','DEDNREC','','','','nan',38.72917,-75.56139,'T3','2021-10-18'),(10005,621721,'NTN022','NTWQM','NTN','DEDNREC  ','DEDNREC',304191,'11/8/2021','7:55:00',NULL,'','',0,'S ','HVIC','S1','HARDNESS','',45.9871,'MG/L','L02','DEDNREC','','','','nan',38.72917,-75.56139,'T3','2021-11-08'),(10005,621722,'NTN022','NTWQM','NTN','DEDNREC  ','DEDNREC',304191,'12/15/2021','9:14:00',NULL,'','',0,'S ','HVIC','S1','HARDNESS','',46.5219,'MG/L','L02','DEDNREC','','','','nan',38.72917,-75.56139,'T3','2021-12-15'),(10005,621723,'NTN022','NTWQM','NTN','DEDNREC  ','DEDNREC',304191,'1/26/2022','8:25:00',NULL,'','',0,'S ','HVIC','S1','HARDNESS','',40.7783,'MG/L','L02','DEDNREC','','','','nan',38.72917,-75.56139,'T3','2022-01-26'),(10005,621724,'NTN022','NTWQM','NTN','DEDNREC  ','DEDNREC',304191,'2/23/2022','9:37:00',NULL,'','',0,'S ','HVIC','S1','HARDNESS','',41.1183,'MG/L','L02','DEDNREC','','','','nan',38.72917,-75.56139,'T3','2022-02-23'),(10005,621726,'NTN022','NTWQM','NTN','DEDNREC  ','DEDNREC',304191,'4/7/2022','9:29:00',NULL,'','',0,'S ','HVIC','FS1','HARDNESS','',30.8009,'MG/L','L02','DEDNREC','','','','nan',38.72917,-75.56139,'T3','2022-04-07'),(10005,621725,'NTN022','NTWQM','NTN','DEDNREC  ','DEDNREC',304191,'3/21/2022','8:21:00',NULL,'','',0,'S ','HVIC','S1','HARDNESS','',40.7187,'MG/L','L02','DEDNREC','','','','nan',38.72917,-75.56139,'T3','2022-03-21'),(10005,621726,'NTN022','NTWQM','NTN','DEDNREC  ','DEDNREC',304191,'4/7/2022','9:29:00',NULL,'','',0,'S ','HVIC','FS2','HARDNESS','<',50,'MG/L','L02','DEDNREC','','','','nan',38.72917,-75.56139,'T3','2022-04-07'),(10005,621727,'NTN022','NTWQM','NTN','DEDNREC  ','DEDNREC',304191,'4/27/2022','10:01:00',NULL,'','',0,'S ','HVIC','S1','HARDNESS','',46.1817,'MG/L','L02','DEDNREC','','','','nan',38.72917,-75.56139,'T3','2022-04-27'),(10005,621728,'NTN022','NTWQM','NTN','DEDNREC  ','DEDNREC',304191,'5/18/2022','9:47:00',NULL,'','',0,'S ','HVIC','S1','HARDNESS','',40.098,'MG/L','L02','DEDNREC','','','','nan',38.72917,-75.56139,'T3','2022-05-18'),(10005,621729,'NTN022','NTWQM','NTN','DEDNREC  ','DEDNREC',304191,'6/15/2022','9:45:00',NULL,'','',0,'S ','HVIC','FS2','HARDNESS','',43.2003,'MG/L','L02','DEDNREC','','','','nan',38.72917,-75.56139,'T3','2022-06-15'),(10005,621730,'NTN022','NTWQM','NTN','DEDNREC  ','DEDNREC',304191,'7/27/2022','10:45:00',NULL,'','',0,'S ','HVIC','S1','HARDNESS','',49.2599,'MG/L','L02','DEDNREC','','','','Standard Method 2340-B (calculated from Ca and Mg)',38.72917,-75.56139,'T3','2022-07-27'),(10005,621729,'NTN022','NTWQM','NTN','DEDNREC  ','DEDNREC',304191,'6/15/2022','9:45:00',NULL,'','',0,'S ','HVIC','FS1','HARDNESS','',44.2847,'MG/L','L02','DEDNREC','','','','nan',38.72917,-75.56139,'T3','2022-06-15'),(10005,621731,'NTN022','NTWQM','NTN','DEDNREC  ','DEDNREC',304191,'8/24/2022','8:45:00',NULL,'','',0,'S ','HVIC','S1','HARDNESS','',44.6486,'MG/L','L02','DEDNREC','','','','Standard Method 2340-B (calculated from Ca and Mg)',38.72917,-75.56139,'T3','2022-08-24'),(10005,621732,'NTN022','NTWQM','NTN','DEDNREC  ','DEDNREC',304191,'9/29/2022','8:06:00',NULL,'','',0,'S ','HVIC','FS1','HARDNESS','',47.3964,'MG/L','L02','DEDNREC','','','','Standard Method 2340-B (calculated from Ca and Mg)',38.72917,-75.56139,'T3','2022-09-29'),(10005,621732,'NTN022','NTWQM','NTN','DEDNREC  ','DEDNREC',304191,'9/29/2022','8:06:00',NULL,'','',0,'S ','HVIC','FS2','HARDNESS','',49.8382,'MG/L','L02','DEDNREC','','','','Standard Method 2340-B (calculated from Ca and Mg)',38.72917,-75.56139,'T3','2022-09-29'),(10005,610450,'NTN021','NTWQM','NTN','DEDNREC  ','DEDNREC',304191,'3/10/2021','8:01:00',NULL,'','',0,'S ','HVIC','FS2','IBOD5W','<',2.4,'MG/L','L01','DEDNREC','','','','nan',38.72917,-75.56139,'T3','2021-03-10'),(10005,610450,'NTN021','NTWQM','NTN','DEDNREC  ','DEDNREC',304191,'3/10/2021','8:01:00',NULL,'','',0,'S ','HVIC','FS1','IBOD5W','<',2.4,'MG/L','L01','DEDNREC','','','','nan',38.72917,-75.56139,'T3','2021-03-10'),(10005,610448,'NTN021','NTWQM','NTN','DEDNREC  ','DEDNREC',304191,'2/2/2021','9:25:00',NULL,'','',0,'S ','HVIC','FS1','IBOD5W','<',2.4,'MG/L','L01','DEDNREC','','','','nan',38.72917,-75.56139,'T3','2021-02-02'),(10005,610449,'NTN021','NTWQM','NTN','DEDNREC  ','DEDNREC',304191,'2/24/2021','10:10:00',NULL,'','',0,'S ','HVIC','S1','IBOD5W','<',2.4,'MG/L','L01','DEDNREC','','','','nan',38.72917,-75.56139,'T3','2021-02-24'),(10005,610451,'NTN021','NTWQM','NTN','DEDNREC  ','DEDNREC',304191,'4/20/2021','10:18:00',NULL,'','',0,'S ','HVIC','S1','IBOD5W','<',2.4,'MG/L','L01','DEDNREC','','','','nan',38.72917,-75.56139,'T3','2021-04-20'),(10005,610452,'NTN021','NTWQM','NTN','DEDNREC  ','DEDNREC',304191,'5/24/2021','7:28:00',NULL,'','',0,'S ','HVIC','S1','IBOD5W','<',2.4,'MG/L','L01','DEDNREC','','','','nan',38.72917,-75.56139,'T3','2021-05-24'),(10005,610453,'NTN021','NTWQM','NTN','DEDNREC  ','DEDNREC',304191,'6/15/2021','8:37:00',NULL,'','',0,'S ','HVIC','FS2','IBOD5W','<',2.4,'MG/L','L01','DEDNREC','','','','nan',38.72917,-75.56139,'T3','2021-06-15'),(10005,610453,'NTN021','NTWQM','NTN','DEDNREC  ','DEDNREC',304191,'6/15/2021','8:37:00',NULL,'','',0,'S ','HVIC','FS1','IBOD5W','<',2.4,'MG/L','L01','DEDNREC','','','','nan',38.72917,-75.56139,'T3','2021-06-15'),(10005,610454,'NTN021','NTWQM','NTN','DEDNREC  ','DEDNREC',304191,'7/19/2021','8:57:00',NULL,'','',0,'S ','HVIC','S1','IBOD5W','<',2.4,'MG/L','L01','DEDNREC','','','','nan',38.72917,-75.56139,'T3','2021-07-19'),(10005,610456,'NTN021','NTWQM','NTN','DEDNREC  ','DEDNREC',304191,'9/2/2021','8:32:00',NULL,'','',0,'S ','HVIC','S1','IBOD5W','',3.58,'MG/L','L01','DEDNREC','','','','nan',38.72917,-75.56139,'T3','2021-09-02'),(10005,610455,'NTN021','NTWQM','NTN','DEDNREC  ','DEDNREC',304191,'8/25/2021','9:47:00',NULL,'','',0,'S ','HVIC','S1','IBOD5W','<',2.4,'MG/L','L01','DEDNREC','','','','nan',38.72917,-75.56139,'T3','2021-08-25'),(10005,610457,'NTN021','NTWQM','NTN','DEDNREC  ','DEDNREC',304191,'9/22/2021','9:44:00',NULL,'','',0,'S ','HVIC','S1','IBOD5W','<',2.4,'MG/L','L01','DEDNREC','','','','nan',38.72917,-75.56139,'T3','2021-09-22'),(10005,610448,'NTN021','NTWQM','NTN','DEDNREC  ','DEDNREC',304191,'2/2/2021','9:25:00',NULL,'','',0,'S ','HVIC','FS2','IBOD5W','<',2.4,'MG/L','L01','DEDNREC','','','','nan',38.72917,-75.56139,'T3','2021-02-02'),(10005,610447,'NTN021','NTWQM','NTN','DEDNREC  ','DEDNREC',304191,'1/28/2021','11:26:00',NULL,'','',0,'S ','HVIC','S1','IBOD5W','<',2.4,'MG/L','L01','DEDNREC','','','','nan',38.72917,-75.56139,'T3','2021-01-28'),(10005,621732,'NTN022','NTWQM','NTN','DEDNREC  ','DEDNREC',304191,'9/29/2022','8:06:00',NULL,'','',0,'S ','HVIC','FS1','IBOD5W','<',2.4,'MG/L','L01','DEDNREC','','','','nan',38.72917,-75.56139,'T3','2022-09-29'),(10005,621732,'NTN022','NTWQM','NTN','DEDNREC  ','DEDNREC',304191,'9/29/2022','8:06:00',NULL,'','',0,'S ','HVIC','FS2','IBOD5W','<',2.4,'MG/L','L01','DEDNREC','','','','nan',38.72917,-75.56139,'T3','2022-09-29'),(10005,621731,'NTN022','NTWQM','NTN','DEDNREC  ','DEDNREC',304191,'8/24/2022','8:45:00',NULL,'','',0,'S ','HVIC','S1','IBOD5W','<',2.4,'MG/L','L01','DEDNREC','','','','nan',38.72917,-75.56139,'T3','2022-08-24'),(10005,621730,'NTN022','NTWQM','NTN','DEDNREC  ','DEDNREC',304191,'7/27/2022','10:45:00',NULL,'','',0,'S ','HVIC','S1','IBOD5W','<',2.4,'MG/L','L01','DEDNREC','','','','nan',38.72917,-75.56139,'T3','2022-07-27'),(10005,621729,'NTN022','NTWQM','NTN','DEDNREC  ','DEDNREC',304191,'6/15/2022','9:45:00',NULL,'','',0,'S ','HVIC','FS2','IBOD5W','<',2.4,'MG/L','L01','DEDNREC','','','','nan',38.72917,-75.56139,'T3','2022-06-15'),(10005,621729,'NTN022','NTWQM','NTN','DEDNREC  ','DEDNREC',304191,'6/15/2022','9:45:00',NULL,'','',0,'S ','HVIC','FS1','IBOD5W','<',2.4,'MG/L','L01','DEDNREC','','','','nan',38.72917,-75.56139,'T3','2022-06-15'),(10005,621728,'NTN022','NTWQM','NTN','DEDNREC  ','DEDNREC',304191,'5/18/2022','9:47:00',NULL,'','',0,'S ','HVIC','S1','IBOD5W','<',2.4,'MG/L','L01','DEDNREC','','','','nan',38.72917,-75.56139,'T3','2022-05-18'),(10005,621727,'NTN022','NTWQM','NTN','DEDNREC  ','DEDNREC',304191,'4/27/2022','10:01:00',NULL,'','',0,'S ','HVIC','S1','IBOD5W','<',2.4,'MG/L','L01','DEDNREC','','','','nan',38.72917,-75.56139,'T3','2022-04-27'),(10005,621725,'NTN022','NTWQM','NTN','DEDNREC  ','DEDNREC',304191,'3/21/2022','8:21:00',NULL,'','',0,'S ','HVIC','S1','IBOD5W','<',2.4,'MG/L','L01','DEDNREC','','','','nan',38.72917,-75.56139,'T3','2022-03-21'),(10005,621726,'NTN022','NTWQM','NTN','DEDNREC  ','DEDNREC',304191,'4/7/2022','9:29:00',NULL,'','',0,'S ','HVIC','FS1','IBOD5W','<',2.4,'MG/L','L01','DEDNREC','','','','nan',38.72917,-75.56139,'T3','2022-04-07'),(10005,621726,'NTN022','NTWQM','NTN','DEDNREC  ','DEDNREC',304191,'4/7/2022','9:29:00',NULL,'','',0,'S ','HVIC','FS2','IBOD5W','<',2.4,'MG/L','L01','DEDNREC','','','','nan',38.72917,-75.56139,'T3','2022-04-07'),(10005,621723,'NTN022','NTWQM','NTN','DEDNREC  ','DEDNREC',304191,'1/26/2022','8:25:00',NULL,'','',0,'S ','HVIC','S1','IBOD5W','<',2.4,'MG/L','L01','DEDNREC','','','','nan',38.72917,-75.56139,'T3','2022-01-26'),(10005,621724,'NTN022','NTWQM','NTN','DEDNREC  ','DEDNREC',304191,'2/23/2022','9:37:00',NULL,'','',0,'S ','HVIC','S1','IBOD5W','<',2.4,'MG/L','L01','DEDNREC','','','','nan',38.72917,-75.56139,'T3','2022-02-23'),(10005,621722,'NTN022','NTWQM','NTN','DEDNREC  ','DEDNREC',304191,'12/15/2021','9:14:00',NULL,'','',0,'S ','HVIC','S1','IBOD5W','<',2.4,'MG/L','L01','DEDNREC','','','','nan',38.72917,-75.56139,'T3','2021-12-15'),(10005,621721,'NTN022','NTWQM','NTN','DEDNREC  ','DEDNREC',304191,'11/8/2021','7:55:00',NULL,'','',0,'S ','HVIC','S1','IBOD5W','<',2.4,'MG/L','L01','DEDNREC','','','','nan',38.72917,-75.56139,'T3','2021-11-08'),(10005,621720,'NTN022','NTWQM','NTN','DEDNREC  ','DEDNREC',304191,'10/18/2021','10:05:00',NULL,'','',0,'S ','HVIC','S1','IBOD5W','<',2.4,'MG/L','L01','DEDNREC','','','','nan',38.72917,-75.56139,'T3','2021-10-18'),(10005,610457,'NTN021','NTWQM','NTN','DEDNREC  ','DEDNREC',304191,'9/22/2021','9:44:00',NULL,'','',0,'S ','HVIC','S1','NH4F','',0.0203,'MG/L','L01','DEDNREC','','','','nan',38.72917,-75.56139,'T3','2021-09-22'),(10005,610455,'NTN021','NTWQM','NTN','DEDNREC  ','DEDNREC',304191,'8/25/2021','9:47:00',NULL,'','',0,'S ','HVIC','S1','NH4F','',0.0314,'MG/L','L01','DEDNREC','','','','nan',38.72917,-75.56139,'T3','2021-08-25'),(10005,610456,'NTN021','NTWQM','NTN','DEDNREC  ','DEDNREC',304191,'9/2/2021','8:32:00',NULL,'','',0,'S ','HVIC','S1','NH4F','',0.0591,'MG/L','L01','DEDNREC','','','','nan',38.72917,-75.56139,'T3','2021-09-02'),(10005,610454,'NTN021','NTWQM','NTN','DEDNREC  ','DEDNREC',304191,'7/19/2021','8:57:00',NULL,'','',0,'S ','HVIC','S1','NH4F','',0.0533,'MG/L','L01','DEDNREC','','','','nan',38.72917,-75.56139,'T3','2021-07-19'),(10005,610453,'NTN021','NTWQM','NTN','DEDNREC  ','DEDNREC',304191,'6/15/2021','8:37:00',NULL,'','',0,'S ','HVIC','FS1','NH4F','',0.1257,'MG/L','L01','DEDNREC','','','','nan',38.72917,-75.56139,'T3','2021-06-15'),(10005,610453,'NTN021','NTWQM','NTN','DEDNREC  ','DEDNREC',304191,'6/15/2021','8:37:00',NULL,'','',0,'S ','HVIC','FS2','NH4F','',0.1258,'MG/L','L01','DEDNREC','','','','nan',38.72917,-75.56139,'T3','2021-06-15'),(10005,610452,'NTN021','NTWQM','NTN','DEDNREC  ','DEDNREC',304191,'5/24/2021','7:28:00',NULL,'','',0,'S ','HVIC','S1','NH4F','',0.0742,'MG/L','L01','DEDNREC','GG','','','Analysis performed after holding time expired.',38.72917,-75.56139,'T3','2021-05-24'),(10005,610451,'NTN021','NTWQM','NTN','DEDNREC  ','DEDNREC',304191,'4/20/2021','10:18:00',NULL,'','',0,'S ','HVIC','S1','NH4F','',0.023,'MG/L','L01','DEDNREC','','','','nan',38.72917,-75.56139,'T3','2021-04-20'),(10005,610450,'NTN021','NTWQM','NTN','DEDNREC  ','DEDNREC',304191,'3/10/2021','8:01:00',NULL,'','',0,'S ','HVIC','FS1','NH4F','G',0.0133,'MG/L','L01','DEDNREC','','','','nan',38.72917,-75.56139,'T3','2021-03-10'),(10005,610450,'NTN021','NTWQM','NTN','DEDNREC  ','DEDNREC',304191,'3/10/2021','8:01:00',NULL,'','',0,'S ','HVIC','FS2','NH4F','G',0.0145,'MG/L','L01','DEDNREC','','','','nan',38.72917,-75.56139,'T3','2021-03-10'),(10005,621721,'NTN022','NTWQM','NTN','DEDNREC  ','DEDNREC',304191,'11/8/2021','7:55:00',NULL,'','',0,'S ','HVIC','S1','NH4F','',0.0335,'MG/L','L01','DEDNREC','','','','nan',38.72917,-75.56139,'T3','2021-11-08'),(10005,621720,'NTN022','NTWQM','NTN','DEDNREC  ','DEDNREC',304191,'10/18/2021','10:05:00',NULL,'','',0,'S ','HVIC','S1','NH4F','',0.0227,'MG/L','L01','DEDNREC','','','','nan',38.72917,-75.56139,'T3','2021-10-18'),(10005,621722,'NTN022','NTWQM','NTN','DEDNREC  ','DEDNREC',304191,'12/15/2021','9:14:00',NULL,'','',0,'S ','HVIC','S1','NH4F','G',0.0387,'MG/L','L01','DEDNREC','','','','nan',38.72917,-75.56139,'T3','2021-12-15'),(10005,621723,'NTN022','NTWQM','NTN','DEDNREC  ','DEDNREC',304191,'1/26/2022','8:25:00',NULL,'','',0,'S ','HVIC','S1','NH4F','G',0.029,'MG/L','L01','DEDNREC','','','','nan',38.72917,-75.56139,'T3','2022-01-26'),(10005,621724,'NTN022','NTWQM','NTN','DEDNREC  ','DEDNREC',304191,'2/23/2022','9:37:00',NULL,'','',0,'S ','HVIC','S1','NH4F','',0.0282,'MG/L','L01','DEDNREC','','','','nan',38.72917,-75.56139,'T3','2022-02-23'),(10005,621726,'NTN022','NTWQM','NTN','DEDNREC  ','DEDNREC',304191,'4/7/2022','9:29:00',NULL,'','',0,'S ','HVIC','FS2','NH4F','',0.2929,'MG/L','L01','DEDNREC','','','','nan',38.72917,-75.56139,'T3','2022-04-07'),(10005,621726,'NTN022','NTWQM','NTN','DEDNREC  ','DEDNREC',304191,'4/7/2022','9:29:00',NULL,'','',0,'S ','HVIC','FS1','NH4F','',0.2914,'MG/L','L01','DEDNREC','','','','nan',38.72917,-75.56139,'T3','2022-04-07'),(10005,621725,'NTN022','NTWQM','NTN','DEDNREC  ','DEDNREC',304191,'3/21/2022','8:21:00',NULL,'','',0,'S ','HVIC','S1','NH4F','',0.0219,'MG/L','L01','DEDNREC','QQ','','','nan',38.72917,-75.56139,'T3','2022-03-21'),(10005,621727,'NTN022','NTWQM','NTN','DEDNREC  ','DEDNREC',304191,'4/27/2022','10:01:00',NULL,'','',0,'S ','HVIC','S1','NH4F','',0.0239,'MG/L','L01','DEDNREC','','','','nan',38.72917,-75.56139,'T3','2022-04-27'),(10005,621728,'NTN022','NTWQM','NTN','DEDNREC  ','DEDNREC',304191,'5/18/2022','9:47:00',NULL,'','',0,'S ','HVIC','S1','NH4F','',0.0735,'MG/L','L01','DEDNREC','','','','nan',38.72917,-75.56139,'T3','2022-05-18'),(10005,621729,'NTN022','NTWQM','NTN','DEDNREC  ','DEDNREC',304191,'6/15/2022','9:45:00',NULL,'','',0,'S ','HVIC','FS1','NH4F','',0.1114,'MG/L','L01','DEDNREC','','','','nan',38.72917,-75.56139,'T3','2022-06-15'),(10005,621729,'NTN022','NTWQM','NTN','DEDNREC  ','DEDNREC',304191,'6/15/2022','9:45:00',NULL,'','',0,'S ','HVIC','FS2','NH4F','',0.1084,'MG/L','L01','DEDNREC','','','','nan',38.72917,-75.56139,'T3','2022-06-15'),(10005,621730,'NTN022','NTWQM','NTN','DEDNREC  ','DEDNREC',304191,'7/27/2022','10:45:00',NULL,'','',0,'S ','HVIC','S1','NH4F','',0.0466,'MG/L','L01','DEDNREC','QQ','','','nan',38.72917,-75.56139,'T3','2022-07-27'),(10005,621731,'NTN022','NTWQM','NTN','DEDNREC  ','DEDNREC',304191,'8/24/2022','8:45:00',NULL,'','',0,'S ','HVIC','S1','NH4F','',0.0424,'MG/L','L01','DEDNREC','QQ','','','nan',38.72917,-75.56139,'T3','2022-08-24'),(10005,621732,'NTN022','NTWQM','NTN','DEDNREC  ','DEDNREC',304191,'9/29/2022','8:06:00',NULL,'','',0,'S ','HVIC','FS2','NH4F','',0.033,'MG/L','L01','DEDNREC','','','','nan',38.72917,-75.56139,'T3','2022-09-29'),(10005,621732,'NTN022','NTWQM','NTN','DEDNREC  ','DEDNREC',304191,'9/29/2022','8:06:00',NULL,'','',0,'S ','HVIC','FS1','NH4F','',0.0334,'MG/L','L01','DEDNREC','','','','nan',38.72917,-75.56139,'T3','2022-09-29'),(10005,610450,'NTN021','NTWQM','NTN','DEDNREC  ','DEDNREC',304191,'3/10/2021','8:01:00',NULL,'','',0,'S ','HVIC','FS2','NH4W','',0.0205,'MG/L','L01','DEDNREC','','','','nan',38.72917,-75.56139,'T3','2021-03-10'),(10005,610450,'NTN021','NTWQM','NTN','DEDNREC  ','DEDNREC',304191,'3/10/2021','8:01:00',NULL,'','',0,'S ','HVIC','FS1','NH4W','',0.0197,'MG/L','L01','DEDNREC','','','','nan',38.72917,-75.56139,'T3','2021-03-10'),(10005,610449,'NTN021','NTWQM','NTN','DEDNREC  ','DEDNREC',304191,'2/24/2021','10:10:00',NULL,'','',0,'S ','HVIC','S1','NH4W','',0.0549,'MG/L','L01','DEDNREC','','','','nan',38.72917,-75.56139,'T3','2021-02-24'),(10005,610448,'NTN021','NTWQM','NTN','DEDNREC  ','DEDNREC',304191,'2/2/2021','9:25:00',NULL,'','',0,'S ','HVIC','FS1','NH4W','',0.1262,'MG/L','L01','DEDNREC','','','','nan',38.72917,-75.56139,'T3','2021-02-02'),(10005,610451,'NTN021','NTWQM','NTN','DEDNREC  ','DEDNREC',304191,'4/20/2021','10:18:00',NULL,'','',0,'S ','HVIC','S1','NH4W','',0.0279,'MG/L','L01','DEDNREC','','','','nan',38.72917,-75.56139,'T3','2021-04-20'),(10005,610452,'NTN021','NTWQM','NTN','DEDNREC  ','DEDNREC',304191,'5/24/2021','7:28:00',NULL,'','',0,'S ','HVIC','S1','NH4W','',0.0847,'MG/L','L01','DEDNREC','GG','','','Analysis performed after holding time expired.',38.72917,-75.56139,'T3','2021-05-24'),(10005,610453,'NTN021','NTWQM','NTN','DEDNREC  ','DEDNREC',304191,'6/15/2021','8:37:00',NULL,'','',0,'S ','HVIC','FS2','NH4W','',0.1537,'MG/L','L01','DEDNREC','','','','nan',38.72917,-75.56139,'T3','2021-06-15'),(10005,610453,'NTN021','NTWQM','NTN','DEDNREC  ','DEDNREC',304191,'6/15/2021','8:37:00',NULL,'','',0,'S ','HVIC','FS1','NH4W','',0.1539,'MG/L','L01','DEDNREC','','','','nan',38.72917,-75.56139,'T3','2021-06-15'),(10005,610454,'NTN021','NTWQM','NTN','DEDNREC  ','DEDNREC',304191,'7/19/2021','8:57:00',NULL,'','',0,'S ','HVIC','S1','NH4W','',0.0616,'MG/L','L01','DEDNREC','','','','nan',38.72917,-75.56139,'T3','2021-07-19'),(10005,610456,'NTN021','NTWQM','NTN','DEDNREC  ','DEDNREC',304191,'9/2/2021','8:32:00',NULL,'','',0,'S ','HVIC','S1','NH4W','',0.1159,'MG/L','L01','DEDNREC','','','','nan',38.72917,-75.56139,'T3','2021-09-02'),(10005,610455,'NTN021','NTWQM','NTN','DEDNREC  ','DEDNREC',304191,'8/25/2021','9:47:00',NULL,'','',0,'S ','HVIC','S1','NH4W','',0.0329,'MG/L','L01','DEDNREC','','','','nan',38.72917,-75.56139,'T3','2021-08-25'),(10005,610457,'NTN021','NTWQM','NTN','DEDNREC  ','DEDNREC',304191,'9/22/2021','9:44:00',NULL,'','',0,'S ','HVIC','S1','NH4W','',0.022,'MG/L','L01','DEDNREC','','','','nan',38.72917,-75.56139,'T3','2021-09-22'),(10005,610447,'NTN021','NTWQM','NTN','DEDNREC  ','DEDNREC',304191,'1/28/2021','11:26:00',NULL,'','',0,'S ','HVIC','S1','NH4W','',0.0383,'MG/L','L01','DEDNREC','','','','nan',38.72917,-75.56139,'T3','2021-01-28'),(10005,610448,'NTN021','NTWQM','NTN','DEDNREC  ','DEDNREC',304191,'2/2/2021','9:25:00',NULL,'','',0,'S ','HVIC','FS2','NH4W','',0.1315,'MG/L','L01','DEDNREC','','','','nan',38.72917,-75.56139,'T3','2021-02-02'),(10005,621732,'NTN022','NTWQM','NTN','DEDNREC  ','DEDNREC',304191,'9/29/2022','8:06:00',NULL,'','',0,'S ','HVIC','FS1','NH4W','',0.0321,'MG/L','L01','DEDNREC','','','','nan',38.72917,-75.56139,'T3','2022-09-29'),(10005,621731,'NTN022','NTWQM','NTN','DEDNREC  ','DEDNREC',304191,'8/24/2022','8:45:00',NULL,'','',0,'S ','HVIC','S1','NH4W','',0.0413,'MG/L','L01','DEDNREC','','','','nan',38.72917,-75.56139,'T3','2022-08-24'),(10005,621730,'NTN022','NTWQM','NTN','DEDNREC  ','DEDNREC',304191,'7/27/2022','10:45:00',NULL,'','',0,'S ','HVIC','S1','NH4W','',0.0459,'MG/L','L01','DEDNREC','QQ','','','nan',38.72917,-75.56139,'T3','2022-07-27'),(10005,621729,'NTN022','NTWQM','NTN','DEDNREC  ','DEDNREC',304191,'6/15/2022','9:45:00',NULL,'','',0,'S ','HVIC','FS1','NH4W','',0.1131,'MG/L','L01','DEDNREC','','','','nan',38.72917,-75.56139,'T3','2022-06-15'),(10005,621728,'NTN022','NTWQM','NTN','DEDNREC  ','DEDNREC',304191,'5/18/2022','9:47:00',NULL,'','',0,'S ','HVIC','S1','NH4W','',0.0796,'MG/L','L01','DEDNREC','B ','','','Result is likely overestimated due to matrix effect.',38.72917,-75.56139,'T3','2022-05-18'),(10005,621729,'NTN022','NTWQM','NTN','DEDNREC  ','DEDNREC',304191,'6/15/2022','9:45:00',NULL,'','',0,'S ','HVIC','FS2','NH4W','',0.1139,'MG/L','L01','DEDNREC','','','','nan',38.72917,-75.56139,'T3','2022-06-15'),(10005,621727,'NTN022','NTWQM','NTN','DEDNREC  ','DEDNREC',304191,'4/27/2022','10:01:00',NULL,'','',0,'S ','HVIC','S1','NH4W','',0.0508,'MG/L','L01','DEDNREC','','','','nan',38.72917,-75.56139,'T3','2022-04-27'),(10005,621725,'NTN022','NTWQM','NTN','DEDNREC  ','DEDNREC',304191,'3/21/2022','8:21:00',NULL,'','',0,'S ','HVIC','S1','NH4W','',0.0207,'MG/L','L01','DEDNREC','','','','nan',38.72917,-75.56139,'T3','2022-03-21'),(10005,621726,'NTN022','NTWQM','NTN','DEDNREC  ','DEDNREC',304191,'4/7/2022','9:29:00',NULL,'','',0,'S ','HVIC','FS1','NH4W','',0.3332,'MG/L','L01','DEDNREC','','','','nan',38.72917,-75.56139,'T3','2022-04-07'),(10005,621726,'NTN022','NTWQM','NTN','DEDNREC  ','DEDNREC',304191,'4/7/2022','9:29:00',NULL,'','',0,'S ','HVIC','FS2','NH4W','',0.337,'MG/L','L01','DEDNREC','','','','nan',38.72917,-75.56139,'T3','2022-04-07'),(10005,621724,'NTN022','NTWQM','NTN','DEDNREC  ','DEDNREC',304191,'2/23/2022','9:37:00',NULL,'','',0,'S ','HVIC','S1','NH4W','',0.029,'MG/L','L01','DEDNREC','QQ','','','nan',38.72917,-75.56139,'T3','2022-02-23'),(10005,621723,'NTN022','NTWQM','NTN','DEDNREC  ','DEDNREC',304191,'1/26/2022','8:25:00',NULL,'','',0,'S ','HVIC','S1','NH4W','G',0.0336,'MG/L','L01','DEDNREC','','','','nan',38.72917,-75.56139,'T3','2022-01-26'),(10005,621722,'NTN022','NTWQM','NTN','DEDNREC  ','DEDNREC',304191,'12/15/2021','9:14:00',NULL,'','',0,'S ','HVIC','S1','NH4W','G',0.044,'MG/L','L01','DEDNREC','','','','nan',38.72917,-75.56139,'T3','2021-12-15'),(10005,621720,'NTN022','NTWQM','NTN','DEDNREC  ','DEDNREC',304191,'10/18/2021','10:05:00',NULL,'','',0,'S ','HVIC','S1','NH4W','',0.0226,'MG/L','L01','DEDNREC','','','','nan',38.72917,-75.56139,'T3','2021-10-18'),(10005,621721,'NTN022','NTWQM','NTN','DEDNREC  ','DEDNREC',304191,'11/8/2021','7:55:00',NULL,'','',0,'S ','HVIC','S1','NH4W','',0.03,'MG/L','L01','DEDNREC','','','','nan',38.72917,-75.56139,'T3','2021-11-08'),(10005,621732,'NTN022','NTWQM','NTN','DEDNREC  ','DEDNREC',304191,'9/29/2022','8:06:00',NULL,'','',0,'S ','HVIC','FS2','NH4W','',0.0318,'MG/L','L01','DEDNREC','','','','nan',38.72917,-75.56139,'T3','2022-09-29'),(10005,610457,'NTN021','NTWQM','NTN','DEDNREC  ','DEDNREC',304191,'9/22/2021','9:44:00',NULL,'','',0,'S ','HVIC','S1','NO23F','',5.283,'MG/L','L01','DEDNREC','','','','nan',38.72917,-75.56139,'T3','2021-09-22'),(10005,610456,'NTN021','NTWQM','NTN','DEDNREC  ','DEDNREC',304191,'9/2/2021','8:32:00',NULL,'','',0,'S ','HVIC','S1','NO23F','',0.845,'MG/L','L01','DEDNREC','','','','nan',38.72917,-75.56139,'T3','2021-09-02'),(10005,610455,'NTN021','NTWQM','NTN','DEDNREC  ','DEDNREC',304191,'8/25/2021','9:47:00',NULL,'','',0,'S ','HVIC','S1','NO23F','',6.602,'MG/L','L01','DEDNREC','NQ','','','nan',38.72917,-75.56139,'T3','2021-08-25'),(10005,610453,'NTN021','NTWQM','NTN','DEDNREC  ','DEDNREC',304191,'6/15/2021','8:37:00',NULL,'','',0,'S ','HVIC','FS2','NO23F','',4.501,'MG/L','L01','DEDNREC','','','','nan',38.72917,-75.56139,'T3','2021-06-15'),(10005,610454,'NTN021','NTWQM','NTN','DEDNREC  ','DEDNREC',304191,'7/19/2021','8:57:00',NULL,'','',0,'S ','HVIC','S1','NO23F','',5.047,'MG/L','L01','DEDNREC','','','','nan',38.72917,-75.56139,'T3','2021-07-19'),(10005,610453,'NTN021','NTWQM','NTN','DEDNREC  ','DEDNREC',304191,'6/15/2021','8:37:00',NULL,'','',0,'S ','HVIC','FS1','NO23F','',4.464,'MG/L','L01','DEDNREC','','','','nan',38.72917,-75.56139,'T3','2021-06-15'),(10005,610452,'NTN021','NTWQM','NTN','DEDNREC  ','DEDNREC',304191,'5/24/2021','7:28:00',NULL,'','',0,'S ','HVIC','S1','NO23F','',5.585,'MG/L','L01','DEDNREC','','','','nan',38.72917,-75.56139,'T3','2021-05-24'),(10005,610451,'NTN021','NTWQM','NTN','DEDNREC  ','DEDNREC',304191,'4/20/2021','10:18:00',NULL,'','',0,'S ','HVIC','S1','NO23F','',5.221,'MG/L','L01','DEDNREC','GG','','','Analysis performed after holding time expired.',38.72917,-75.56139,'T3','2021-04-20'),(10005,610450,'NTN021','NTWQM','NTN','DEDNREC  ','DEDNREC',304191,'3/10/2021','8:01:00',NULL,'','',0,'S ','HVIC','FS2','NO23F','',5.586,'MG/L','L01','DEDNREC','','','','nan',38.72917,-75.56139,'T3','2021-03-10'),(10005,610450,'NTN021','NTWQM','NTN','DEDNREC  ','DEDNREC',304191,'3/10/2021','8:01:00',NULL,'','',0,'S ','HVIC','FS1','NO23F','',5.419,'MG/L','L01','DEDNREC','','','','nan',38.72917,-75.56139,'T3','2021-03-10'),(10005,621720,'NTN022','NTWQM','NTN','DEDNREC  ','DEDNREC',304191,'10/18/2021','10:05:00',NULL,'','',0,'S ','HVIC','S1','NO23F','',5.875,'MG/L','L01','DEDNREC','','','','nan',38.72917,-75.56139,'T3','2021-10-18'),(10005,621721,'NTN022','NTWQM','NTN','DEDNREC  ','DEDNREC',304191,'11/8/2021','7:55:00',NULL,'','',0,'S ','HVIC','S1','NO23F','',6.346,'MG/L','L01','DEDNREC','','','','nan',38.72917,-75.56139,'T3','2021-11-08'),(10005,621723,'NTN022','NTWQM','NTN','DEDNREC  ','DEDNREC',304191,'1/26/2022','8:25:00',NULL,'','',0,'S ','HVIC','S1','NO23F','',6.531,'MG/L','L01','DEDNREC','NQ','','','nan',38.72917,-75.56139,'T3','2022-01-26'),(10005,621722,'NTN022','NTWQM','NTN','DEDNREC  ','DEDNREC',304191,'12/15/2021','9:14:00',NULL,'','',0,'S ','HVIC','S1','NO23F','',6.511,'MG/L','L01','DEDNREC','','','','nan',38.72917,-75.56139,'T3','2021-12-15'),(10005,621724,'NTN022','NTWQM','NTN','DEDNREC  ','DEDNREC',304191,'2/23/2022','9:37:00',NULL,'','',0,'S ','HVIC','S1','NO23F','',5.746,'MG/L','L01','DEDNREC','','','','nan',38.72917,-75.56139,'T3','2022-02-23'),(10005,621726,'NTN022','NTWQM','NTN','DEDNREC  ','DEDNREC',304191,'4/7/2022','9:29:00',NULL,'','',0,'S ','HVIC','FS1','NO23F','',2.899,'MG/L','L01','DEDNREC','','','','nan',38.72917,-75.56139,'T3','2022-04-07'),(10005,621725,'NTN022','NTWQM','NTN','DEDNREC  ','DEDNREC',304191,'3/21/2022','8:21:00',NULL,'','',0,'S ','HVIC','S1','NO23F','',5.058,'MG/L','L01','DEDNREC','','','','nan',38.72917,-75.56139,'T3','2022-03-21'),(10005,621726,'NTN022','NTWQM','NTN','DEDNREC  ','DEDNREC',304191,'4/7/2022','9:29:00',NULL,'','',0,'S ','HVIC','FS2','NO23F','',2.891,'MG/L','L01','DEDNREC','','','','nan',38.72917,-75.56139,'T3','2022-04-07'),(10005,621727,'NTN022','NTWQM','NTN','DEDNREC  ','DEDNREC',304191,'4/27/2022','10:01:00',NULL,'','',0,'S ','HVIC','S1','NO23F','',4.607,'MG/L','L01','DEDNREC','','','','nan',38.72917,-75.56139,'T3','2022-04-27'),(10005,621728,'NTN022','NTWQM','NTN','DEDNREC  ','DEDNREC',304191,'5/18/2022','9:47:00',NULL,'','',0,'S ','HVIC','S1','NO23F','',4.402,'MG/L','L01','DEDNREC','','','','nan',38.72917,-75.56139,'T3','2022-05-18'),(10005,621729,'NTN022','NTWQM','NTN','DEDNREC  ','DEDNREC',304191,'6/15/2022','9:45:00',NULL,'','',0,'S ','HVIC','FS2','NO23F','',4.433,'MG/L','L01','DEDNREC','','','','nan',38.72917,-75.56139,'T3','2022-06-15'),(10005,621729,'NTN022','NTWQM','NTN','DEDNREC  ','DEDNREC',304191,'6/15/2022','9:45:00',NULL,'','',0,'S ','HVIC','FS1','NO23F','',4.442,'MG/L','L01','DEDNREC','','','','nan',38.72917,-75.56139,'T3','2022-06-15'),(10005,621730,'NTN022','NTWQM','NTN','DEDNREC  ','DEDNREC',304191,'7/27/2022','10:45:00',NULL,'','',0,'S ','HVIC','S1','NO23F','',5.547,'MG/L','L01','DEDNREC','QQ','','','nan',38.72917,-75.56139,'T3','2022-07-27'),(10005,621731,'NTN022','NTWQM','NTN','DEDNREC  ','DEDNREC',304191,'8/24/2022','8:45:00',NULL,'','',0,'S ','HVIC','S1','NO23F','',4.869,'MG/L','L01','DEDNREC','QQ','','','nan',38.72917,-75.56139,'T3','2022-08-24'),(10005,621732,'NTN022','NTWQM','NTN','DEDNREC  ','DEDNREC',304191,'9/29/2022','8:06:00',NULL,'','',0,'S ','HVIC','FS1','NO23F','',6.439,'MG/L','L01','DEDNREC','','','','nan',38.72917,-75.56139,'T3','2022-09-29'),(10005,621732,'NTN022','NTWQM','NTN','DEDNREC  ','DEDNREC',304191,'9/29/2022','8:06:00',NULL,'','',0,'S ','HVIC','FS2','NO23F','',6.416,'MG/L','L01','DEDNREC','','','','nan',38.72917,-75.56139,'T3','2022-09-29'),(10005,610450,'NTN021','NTWQM','NTN','DEDNREC  ','DEDNREC',304191,'3/10/2021','8:01:00',NULL,'','',0,'S ','HVIC','FS1','NO23W','',7.327,'MG/L','L01','DEDNREC','NQ','','','nan',38.72917,-75.56139,'T3','2021-03-10'),(10005,610448,'NTN021','NTWQM','NTN','DEDNREC  ','DEDNREC',304191,'2/2/2021','9:25:00',NULL,'','',0,'S ','HVIC','FS1','NO23W','',5.297,'MG/L','L01','DEDNREC','','','','nan',38.72917,-75.56139,'T3','2021-02-02'),(10005,610449,'NTN021','NTWQM','NTN','DEDNREC  ','DEDNREC',304191,'2/24/2021','10:10:00',NULL,'','',0,'S ','HVIC','S1','NO23W','',5.026,'MG/L','L01','DEDNREC','','','','nan',38.72917,-75.56139,'T3','2021-02-24'),(10005,610450,'NTN021','NTWQM','NTN','DEDNREC  ','DEDNREC',304191,'3/10/2021','8:01:00',NULL,'','',0,'S ','HVIC','FS2','NO23W','',6.323,'MG/L','L01','DEDNREC','QQ','','','nan',38.72917,-75.56139,'T3','2021-03-10'),(10005,610451,'NTN021','NTWQM','NTN','DEDNREC  ','DEDNREC',304191,'4/20/2021','10:18:00',NULL,'','',0,'S ','HVIC','S1','NO23W','',5.26,'MG/L','L01','DEDNREC','','','','nan',38.72917,-75.56139,'T3','2021-04-20'),(10005,610452,'NTN021','NTWQM','NTN','DEDNREC  ','DEDNREC',304191,'5/24/2021','7:28:00',NULL,'','',0,'S ','HVIC','S1','NO23W','',5.655,'MG/L','L01','DEDNREC','','','','nan',38.72917,-75.56139,'T3','2021-05-24'),(10005,610453,'NTN021','NTWQM','NTN','DEDNREC  ','DEDNREC',304191,'6/15/2021','8:37:00',NULL,'','',0,'S ','HVIC','FS1','NO23W','',4.651,'MG/L','L01','DEDNREC','','','','nan',38.72917,-75.56139,'T3','2021-06-15'),(10005,610454,'NTN021','NTWQM','NTN','DEDNREC  ','DEDNREC',304191,'7/19/2021','8:57:00',NULL,'','',0,'S ','HVIC','S1','NO23W','',5.647,'MG/L','L01','DEDNREC','','','','nan',38.72917,-75.56139,'T3','2021-07-19'),(10005,610453,'NTN021','NTWQM','NTN','DEDNREC  ','DEDNREC',304191,'6/15/2021','8:37:00',NULL,'','',0,'S ','HVIC','FS2','NO23W','',4.657,'MG/L','L01','DEDNREC','','','','nan',38.72917,-75.56139,'T3','2021-06-15'),(10005,610455,'NTN021','NTWQM','NTN','DEDNREC  ','DEDNREC',304191,'8/25/2021','9:47:00',NULL,'','',0,'S ','HVIC','S1','NO23W','',4.665,'MG/L','L01','DEDNREC','','','','nan',38.72917,-75.56139,'T3','2021-08-25'),(10005,610456,'NTN021','NTWQM','NTN','DEDNREC  ','DEDNREC',304191,'9/2/2021','8:32:00',NULL,'','',0,'S ','HVIC','S1','NO23W','',0.819,'MG/L','L01','DEDNREC','','','','nan',38.72917,-75.56139,'T3','2021-09-02'),(10005,610457,'NTN021','NTWQM','NTN','DEDNREC  ','DEDNREC',304191,'9/22/2021','9:44:00',NULL,'','',0,'S ','HVIC','S1','NO23W','',5.987,'MG/L','L01','DEDNREC','B ','','','Result is likely estimated due to matrix effect.',38.72917,-75.56139,'T3','2021-09-22'),(10005,610448,'NTN021','NTWQM','NTN','DEDNREC  ','DEDNREC',304191,'2/2/2021','9:25:00',NULL,'','',0,'S ','HVIC','FS2','NO23W','',5.204,'MG/L','L01','DEDNREC','','','','nan',38.72917,-75.56139,'T3','2021-02-02'),(10005,610447,'NTN021','NTWQM','NTN','DEDNREC  ','DEDNREC',304191,'1/28/2021','11:26:00',NULL,'','',0,'S ','HVIC','S1','NO23W','',6.678,'MG/L','L01','DEDNREC','','','','nan',38.72917,-75.56139,'T3','2021-01-28'),(10005,621731,'NTN022','NTWQM','NTN','DEDNREC  ','DEDNREC',304191,'8/24/2022','8:45:00',NULL,'','',0,'S ','HVIC','S1','NO23W','',4.774,'MG/L','L01','DEDNREC','','','','nan',38.72917,-75.56139,'T3','2022-08-24'),(10005,621732,'NTN022','NTWQM','NTN','DEDNREC  ','DEDNREC',304191,'9/29/2022','8:06:00',NULL,'','',0,'S ','HVIC','FS1','NO23W','',6.589,'MG/L','L01','DEDNREC','','','','nan',38.72917,-75.56139,'T3','2022-09-29'),(10005,621732,'NTN022','NTWQM','NTN','DEDNREC  ','DEDNREC',304191,'9/29/2022','8:06:00',NULL,'','',0,'S ','HVIC','FS2','NO23W','',6.611,'MG/L','L01','DEDNREC','','','','nan',38.72917,-75.56139,'T3','2022-09-29'),(10005,621729,'NTN022','NTWQM','NTN','DEDNREC  ','DEDNREC',304191,'6/15/2022','9:45:00',NULL,'','',0,'S ','HVIC','FS1','NO23W','',4.686,'MG/L','L01','DEDNREC','','','','nan',38.72917,-75.56139,'T3','2022-06-15'),(10005,621730,'NTN022','NTWQM','NTN','DEDNREC  ','DEDNREC',304191,'7/27/2022','10:45:00',NULL,'','',0,'S ','HVIC','S1','NO23W','',5.545,'MG/L','L01','DEDNREC','QQ','','','nan',38.72917,-75.56139,'T3','2022-07-27'),(10005,621729,'NTN022','NTWQM','NTN','DEDNREC  ','DEDNREC',304191,'6/15/2022','9:45:00',NULL,'','',0,'S ','HVIC','FS2','NO23W','',4.676,'MG/L','L01','DEDNREC','','','','nan',38.72917,-75.56139,'T3','2022-06-15'),(10005,621728,'NTN022','NTWQM','NTN','DEDNREC  ','DEDNREC',304191,'5/18/2022','9:47:00',NULL,'','',0,'S ','HVIC','S1','NO23W','',4.704,'MG/L','L01','DEDNREC','','','','nan',38.72917,-75.56139,'T3','2022-05-18'),(10005,621727,'NTN022','NTWQM','NTN','DEDNREC  ','DEDNREC',304191,'4/27/2022','10:01:00',NULL,'','',0,'S ','HVIC','S1','NO23W','',5.064,'MG/L','L01','DEDNREC','','','','nan',38.72917,-75.56139,'T3','2022-04-27'),(10005,621725,'NTN022','NTWQM','NTN','DEDNREC  ','DEDNREC',304191,'3/21/2022','8:21:00',NULL,'','',0,'S ','HVIC','S1','NO23W','',5.297,'MG/L','L01','DEDNREC','QQ','','','nan',38.72917,-75.56139,'T3','2022-03-21'),(10005,621726,'NTN022','NTWQM','NTN','DEDNREC  ','DEDNREC',304191,'4/7/2022','9:29:00',NULL,'','',0,'S ','HVIC','FS1','NO23W','',3.109,'MG/L','L01','DEDNREC','','','','nan',38.72917,-75.56139,'T3','2022-04-07'),(10005,621726,'NTN022','NTWQM','NTN','DEDNREC  ','DEDNREC',304191,'4/7/2022','9:29:00',NULL,'','',0,'S ','HVIC','FS2','NO23W','',3.023,'MG/L','L01','DEDNREC','','','','nan',38.72917,-75.56139,'T3','2022-04-07'),(10005,621724,'NTN022','NTWQM','NTN','DEDNREC  ','DEDNREC',304191,'2/23/2022','9:37:00',NULL,'','',0,'S ','HVIC','S1','NO23W','',6.042,'MG/L','L01','DEDNREC','QQ','','','nan',38.72917,-75.56139,'T3','2022-02-23'),(10005,621722,'NTN022','NTWQM','NTN','DEDNREC  ','DEDNREC',304191,'12/15/2021','9:14:00',NULL,'','',0,'S ','HVIC','S1','NO23W','',7.123,'MG/L','L01','DEDNREC','','','','nan',38.72917,-75.56139,'T3','2021-12-15'),(10005,621723,'NTN022','NTWQM','NTN','DEDNREC  ','DEDNREC',304191,'1/26/2022','8:25:00',NULL,'','',0,'S ','HVIC','S1','NO23W','',6.103,'MG/L','L01','DEDNREC','','','','nan',38.72917,-75.56139,'T3','2022-01-26'),(10005,621721,'NTN022','NTWQM','NTN','DEDNREC  ','DEDNREC',304191,'11/8/2021','7:55:00',NULL,'','',0,'S ','HVIC','S1','NO23W','',6.847,'MG/L','L01','DEDNREC','','','','nan',38.72917,-75.56139,'T3','2021-11-08'),(10005,621720,'NTN022','NTWQM','NTN','DEDNREC  ','DEDNREC',304191,'10/18/2021','10:05:00',NULL,'','',0,'S ','HVIC','S1','NO23W','',5.899,'MG/L','L01','DEDNREC','','','','nan',38.72917,-75.56139,'T3','2021-10-18'),(10005,610447,'NTN021','NTWQM','NTN','DEDNREC  ','DEDNREC',304191,'1/28/2021','11:26:00',NULL,'','',0,'S ','ISM','M1','PH','',7.01,'SU','F02','','','','','nan',38.72917,-75.56139,'T3','2021-01-28'),(10005,610448,'NTN021','NTWQM','NTN','DEDNREC  ','DEDNREC',304191,'2/2/2021','9:25:00',NULL,'','',0,'S ','ISM','M1','PH','',6.86,'SU','F02','','','','','nan',38.72917,-75.56139,'T3','2021-02-02'),(10005,610448,'NTN021','NTWQM','NTN','DEDNREC  ','DEDNREC',304191,'2/2/2021','9:25:00',NULL,'','',0,'S ','ISM','M2','PH','',6.86,'SU','F02','','','','','nan',38.72917,-75.56139,'T3','2021-02-02'),(10005,610456,'NTN021','NTWQM','NTN','DEDNREC  ','DEDNREC',304191,'9/2/2021','8:32:00',NULL,'','',0,'S ','ISM','M1','PH','',6.28,'SU','F02','','','','','nan',38.72917,-75.56139,'T3','2021-09-02'),(10005,610455,'NTN021','NTWQM','NTN','DEDNREC  ','DEDNREC',304191,'8/25/2021','9:47:00',NULL,'','',0,'S ','ISM','M1','PH','',6.66,'SU','F02','','','','','nan',38.72917,-75.56139,'T3','2021-08-25'),(10005,610453,'NTN021','NTWQM','NTN','DEDNREC  ','DEDNREC',304191,'6/15/2021','8:37:00',NULL,'','',0,'S ','ISM','M2','PH','',6.52,'SU','F02','','','','','nan',38.72917,-75.56139,'T3','2021-06-15'),(10005,610454,'NTN021','NTWQM','NTN','DEDNREC  ','DEDNREC',304191,'7/19/2021','8:57:00',NULL,'','',0,'S ','ISM','M1','PH','',6.84,'SU','F02','','','','','nan',38.72917,-75.56139,'T3','2021-07-19'),(10005,610453,'NTN021','NTWQM','NTN','DEDNREC  ','DEDNREC',304191,'6/15/2021','8:37:00',NULL,'','',0,'S ','ISM','M1','PH','',6.52,'SU','F02','','','','','nan',38.72917,-75.56139,'T3','2021-06-15'),(10005,610452,'NTN021','NTWQM','NTN','DEDNREC  ','DEDNREC',304191,'5/24/2021','7:28:00',NULL,'','',0,'S ','ISM','M1','PH','',6.27,'SU','F02','','','','','nan',38.72917,-75.56139,'T3','2021-05-24'),(10005,610451,'NTN021','NTWQM','NTN','DEDNREC  ','DEDNREC',304191,'4/20/2021','10:18:00',NULL,'','',0,'S ','ISM','M1','PH','',6.19,'SU','F02','','','','','nan',38.72917,-75.56139,'T3','2021-04-20'),(10005,610450,'NTN021','NTWQM','NTN','DEDNREC  ','DEDNREC',304191,'3/10/2021','8:01:00',NULL,'','',0,'S ','ISM','M2','PH','',6.29,'SU','F02','','','','','nan',38.72917,-75.56139,'T3','2021-03-10'),(10005,610449,'NTN021','NTWQM','NTN','DEDNREC  ','DEDNREC',304191,'2/24/2021','10:10:00',NULL,'','',0,'S ','ISM','M1','PH','',5.8,'SU','F02','','','','','nan',38.72917,-75.56139,'T3','2021-02-24'),(10005,610450,'NTN021','NTWQM','NTN','DEDNREC  ','DEDNREC',304191,'3/10/2021','8:01:00',NULL,'','',0,'S ','ISM','M1','PH','',6.3,'SU','F02','','','','','nan',38.72917,-75.56139,'T3','2021-03-10'),(10005,610457,'NTN021','NTWQM','NTN','DEDNREC  ','DEDNREC',304191,'9/22/2021','9:44:00',NULL,'','',0,'S ','ISM','M1','PH','',6.64,'SU','F02','','','','','nan',38.72917,-75.56139,'T3','2021-09-22'),(10005,621720,'NTN022','NTWQM','NTN','DEDNREC  ','DEDNREC',304191,'10/18/2021','10:05:00',NULL,'','',0,'S ','ISM','M1','PH','',6.3,'SU','F02','','','','','nan',38.72917,-75.56139,'T3','2021-10-18'),(10005,621721,'NTN022','NTWQM','NTN','DEDNREC  ','DEDNREC',304191,'11/8/2021','7:55:00',NULL,'','',0,'S ','ISM','M1','PH','',7.12,'SU','F02','','','','','nan',38.72917,-75.56139,'T3','2021-11-08'),(10005,621723,'NTN022','NTWQM','NTN','DEDNREC  ','DEDNREC',304191,'1/26/2022','8:25:00',NULL,'','',0,'S ','ISM','M1','PH','',5.96,'SU','F02','','','','','nan',38.72917,-75.56139,'T3','2022-01-26'),(10005,621722,'NTN022','NTWQM','NTN','DEDNREC  ','DEDNREC',304191,'12/15/2021','9:14:00',NULL,'','',0,'S ','ISM','M1','PH','',6.48,'SU','F02','','','','','nan',38.72917,-75.56139,'T3','2021-12-15'),(10005,621724,'NTN022','NTWQM','NTN','DEDNREC  ','DEDNREC',304191,'2/23/2022','9:37:00',NULL,'','',0,'S ','ISM','M1','PH','',5.97,'SU','F02','','','','','nan',38.72917,-75.56139,'T3','2022-02-23'),(10005,621726,'NTN022','NTWQM','NTN','DEDNREC  ','DEDNREC',304191,'4/7/2022','9:29:00',NULL,'','',0,'S ','ISM','M1','PH','',5.8,'SU','F02','','','','','nan',38.72917,-75.56139,'T3','2022-04-07'),(10005,621725,'NTN022','NTWQM','NTN','DEDNREC  ','DEDNREC',304191,'3/21/2022','8:21:00',NULL,'','',0,'S ','ISM','M1','PH','',6.85,'SU','F02','','','','','nan',38.72917,-75.56139,'T3','2022-03-21'),(10005,621727,'NTN022','NTWQM','NTN','DEDNREC  ','DEDNREC',304191,'4/27/2022','10:01:00',NULL,'','',0,'S ','ISM','M1','PH','',6.46,'SU','F02','','','','','nan',38.72917,-75.56139,'T3','2022-04-27'),(10005,621726,'NTN022','NTWQM','NTN','DEDNREC  ','DEDNREC',304191,'4/7/2022','9:29:00',NULL,'','',0,'S ','ISM','M2','PH','',5.8,'SU','F02','','','','','nan',38.72917,-75.56139,'T3','2022-04-07'),(10005,621728,'NTN022','NTWQM','NTN','DEDNREC  ','DEDNREC',304191,'5/18/2022','9:47:00',NULL,'','',0,'S ','ISM','M1','PH','',6.42,'SU','F02','','','','','nan',38.72917,-75.56139,'T3','2022-05-18'),(10005,621729,'NTN022','NTWQM','NTN','DEDNREC  ','DEDNREC',304191,'6/15/2022','9:45:00',NULL,'','',0,'S ','ISM','M2','PH','',6.22,'SU','F02','','','','','nan',38.72917,-75.56139,'T3','2022-06-15'),(10005,621729,'NTN022','NTWQM','NTN','DEDNREC  ','DEDNREC',304191,'6/15/2022','9:45:00',NULL,'','',0,'S ','ISM','M1','PH','',6.22,'SU','F02','','','','','nan',38.72917,-75.56139,'T3','2022-06-15'),(10005,621730,'NTN022','NTWQM','NTN','DEDNREC  ','DEDNREC',304191,'7/27/2022','10:45:00',NULL,'','',0,'S ','ISM','M1','PH','',6.94,'SU','F02','','','','','nan',38.72917,-75.56139,'T3','2022-07-27'),(10005,621731,'NTN022','NTWQM','NTN','DEDNREC  ','DEDNREC',304191,'8/24/2022','8:45:00',NULL,'','',0,'S ','ISM','M1','PH','',6.76,'SU','F02','','','','','nan',38.72917,-75.56139,'T3','2022-08-24'),(10005,621732,'NTN022','NTWQM','NTN','DEDNREC  ','DEDNREC',304191,'9/29/2022','8:06:00',NULL,'','',0,'S ','ISM','M2','PH','',6.46,'SU','F02','','','','','nan',38.72917,-75.56139,'T3','2022-09-29'),(10005,621732,'NTN022','NTWQM','NTN','DEDNREC  ','DEDNREC',304191,'9/29/2022','8:06:00',NULL,'','',0,'S ','ISM','M1','PH','',6.46,'SU','F02','','','','','nan',38.72917,-75.56139,'T3','2022-09-29'),(10005,610457,'NTN021','NTWQM','NTN','DEDNREC  ','DEDNREC',304191,'9/22/2021','9:44:00',NULL,'','',0,'S ','HVIC','S1','PO4F','<',0.004,'MG/L','L01','DEDNREC','','','','nan',38.72917,-75.56139,'T3','2021-09-22'),(10005,610450,'NTN021','NTWQM','NTN','DEDNREC  ','DEDNREC',304191,'3/10/2021','8:01:00',NULL,'','',0,'S ','HVIC','FS1','PO4F','G',0.0049,'MG/L','L01','DEDNREC','','','','nan',38.72917,-75.56139,'T3','2021-03-10'),(10005,610449,'NTN021','NTWQM','NTN','DEDNREC  ','DEDNREC',304191,'2/24/2021','10:10:00',NULL,'','',0,'S ','HVIC','S1','PO4F','G',0.0087,'MG/L','L01','DEDNREC','','','','nan',38.72917,-75.56139,'T3','2021-02-24'),(10005,610448,'NTN021','NTWQM','NTN','DEDNREC  ','DEDNREC',304191,'2/2/2021','9:25:00',NULL,'','',0,'S ','HVIC','FS2','PO4F','',0.0162,'MG/L','L01','DEDNREC','','','','nan',38.72917,-75.56139,'T3','2021-02-02'),(10005,610450,'NTN021','NTWQM','NTN','DEDNREC  ','DEDNREC',304191,'3/10/2021','8:01:00',NULL,'','',0,'S ','HVIC','FS2','PO4F','G',0.0049,'MG/L','L01','DEDNREC','','','','nan',38.72917,-75.56139,'T3','2021-03-10'),(10005,610451,'NTN021','NTWQM','NTN','DEDNREC  ','DEDNREC',304191,'4/20/2021','10:18:00',NULL,'','',0,'S ','HVIC','S1','PO4F','<',0.004,'MG/L','L01','DEDNREC','','','','nan',38.72917,-75.56139,'T3','2021-04-20'),(10005,610452,'NTN021','NTWQM','NTN','DEDNREC  ','DEDNREC',304191,'5/24/2021','7:28:00',NULL,'','',0,'S ','HVIC','S1','PO4F','',0.0102,'MG/L','L01','DEDNREC','','','','nan',38.72917,-75.56139,'T3','2021-05-24'),(10005,610453,'NTN021','NTWQM','NTN','DEDNREC  ','DEDNREC',304191,'6/15/2021','8:37:00',NULL,'','',0,'S ','HVIC','FS1','PO4F','',0.0164,'MG/L','L01','DEDNREC','','','','nan',38.72917,-75.56139,'T3','2021-06-15'),(10005,610454,'NTN021','NTWQM','NTN','DEDNREC  ','DEDNREC',304191,'7/19/2021','8:57:00',NULL,'','',0,'S ','HVIC','S1','PO4F','G',0.0079,'MG/L','L01','DEDNREC','','','','nan',38.72917,-75.56139,'T3','2021-07-19'),(10005,610453,'NTN021','NTWQM','NTN','DEDNREC  ','DEDNREC',304191,'6/15/2021','8:37:00',NULL,'','',0,'S ','HVIC','FS2','PO4F','',0.0175,'MG/L','L01','DEDNREC','','','','nan',38.72917,-75.56139,'T3','2021-06-15'),(10005,610455,'NTN021','NTWQM','NTN','DEDNREC  ','DEDNREC',304191,'8/25/2021','9:47:00',NULL,'','',0,'S ','HVIC','S1','PO4F','',0.0256,'MG/L','L01','DEDNREC','','','','nan',38.72917,-75.56139,'T3','2021-08-25'),(10005,610456,'NTN021','NTWQM','NTN','DEDNREC  ','DEDNREC',304191,'9/2/2021','8:32:00',NULL,'','',0,'S ','HVIC','S1','PO4F','',0.1753,'MG/L','L01','DEDNREC','','','','nan',38.72917,-75.56139,'T3','2021-09-02'),(10005,610448,'NTN021','NTWQM','NTN','DEDNREC  ','DEDNREC',304191,'2/2/2021','9:25:00',NULL,'','',0,'S ','HVIC','FS1','PO4F','',0.0143,'MG/L','L01','DEDNREC','','','','nan',38.72917,-75.56139,'T3','2021-02-02'),(10005,610447,'NTN021','NTWQM','NTN','DEDNREC  ','DEDNREC',304191,'1/28/2021','11:26:00',NULL,'','',0,'S ','HVIC','S1','PO4F','G',0.0051,'MG/L','L01','DEDNREC','','','','nan',38.72917,-75.56139,'T3','2021-01-28'),(10005,621732,'NTN022','NTWQM','NTN','DEDNREC  ','DEDNREC',304191,'9/29/2022','8:06:00',NULL,'','',0,'S ','HVIC','FS2','PO4F','<',0.004,'MG/L','L01','DEDNREC','','','','nan',38.72917,-75.56139,'T3','2022-09-29'),(10005,621732,'NTN022','NTWQM','NTN','DEDNREC  ','DEDNREC',304191,'9/29/2022','8:06:00',NULL,'','',0,'S ','HVIC','FS1','PO4F','G',0.004,'MG/L','L01','DEDNREC','','','','nan',38.72917,-75.56139,'T3','2022-09-29'),(10005,621731,'NTN022','NTWQM','NTN','DEDNREC  ','DEDNREC',304191,'8/24/2022','8:45:00',NULL,'','',0,'S ','HVIC','S1','PO4F','<',0.004,'MG/L','L01','DEDNREC','','','','nan',38.72917,-75.56139,'T3','2022-08-24'),(10005,621730,'NTN022','NTWQM','NTN','DEDNREC  ','DEDNREC',304191,'7/27/2022','10:45:00',NULL,'','',0,'S ','HVIC','S1','PO4F','G',0.0064,'MG/L','L01','DEDNREC','','','','nan',38.72917,-75.56139,'T3','2022-07-27'),(10005,621729,'NTN022','NTWQM','NTN','DEDNREC  ','DEDNREC',304191,'6/15/2022','9:45:00',NULL,'','',0,'S ','HVIC','FS1','PO4F','',0.0143,'MG/L','L01','DEDNREC','','','','nan',38.72917,-75.56139,'T3','2022-06-15'),(10005,621729,'NTN022','NTWQM','NTN','DEDNREC  ','DEDNREC',304191,'6/15/2022','9:45:00',NULL,'','',0,'S ','HVIC','FS2','PO4F','',0.0151,'MG/L','L01','DEDNREC','','','','nan',38.72917,-75.56139,'T3','2022-06-15'),(10005,621728,'NTN022','NTWQM','NTN','DEDNREC  ','DEDNREC',304191,'5/18/2022','9:47:00',NULL,'','',0,'S ','HVIC','S1','PO4F','G',0.0069,'MG/L','L01','DEDNREC','','','','nan',38.72917,-75.56139,'T3','2022-05-18'),(10005,621727,'NTN022','NTWQM','NTN','DEDNREC  ','DEDNREC',304191,'4/27/2022','10:01:00',NULL,'','',0,'S ','HVIC','S1','PO4F','G',0.0068,'MG/L','L01','DEDNREC','','','','nan',38.72917,-75.56139,'T3','2022-04-27'),(10005,621725,'NTN022','NTWQM','NTN','DEDNREC  ','DEDNREC',304191,'3/21/2022','8:21:00',NULL,'','',0,'S ','HVIC','S1','PO4F','G',0.0056,'MG/L','L01','DEDNREC','','','','nan',38.72917,-75.56139,'T3','2022-03-21'),(10005,621726,'NTN022','NTWQM','NTN','DEDNREC  ','DEDNREC',304191,'4/7/2022','9:29:00',NULL,'','',0,'S ','HVIC','FS2','PO4F','',0.0951,'MG/L','L01','DEDNREC','','','','nan',38.72917,-75.56139,'T3','2022-04-07'),(10005,621726,'NTN022','NTWQM','NTN','DEDNREC  ','DEDNREC',304191,'4/7/2022','9:29:00',NULL,'','',0,'S ','HVIC','FS1','PO4F','',0.0937,'MG/L','L01','DEDNREC','','','','nan',38.72917,-75.56139,'T3','2022-04-07'),(10005,621724,'NTN022','NTWQM','NTN','DEDNREC  ','DEDNREC',304191,'2/23/2022','9:37:00',NULL,'','',0,'S ','HVIC','S1','PO4F','<',0.004,'MG/L','L01','DEDNREC','','','','nan',38.72917,-75.56139,'T3','2022-02-23'),(10005,621723,'NTN022','NTWQM','NTN','DEDNREC  ','DEDNREC',304191,'1/26/2022','8:25:00',NULL,'','',0,'S ','HVIC','S1','PO4F','G',0.0055,'MG/L','L01','DEDNREC','','','','nan',38.72917,-75.56139,'T3','2022-01-26'),(10005,621722,'NTN022','NTWQM','NTN','DEDNREC  ','DEDNREC',304191,'12/15/2021','9:14:00',NULL,'','',0,'S ','HVIC','S1','PO4F','<',0.004,'MG/L','L01','DEDNREC','','','','nan',38.72917,-75.56139,'T3','2021-12-15'),(10005,621721,'NTN022','NTWQM','NTN','DEDNREC  ','DEDNREC',304191,'11/8/2021','7:55:00',NULL,'','',0,'S ','HVIC','S1','PO4F','G',0.0047,'MG/L','L01','DEDNREC','','','','nan',38.72917,-75.56139,'T3','2021-11-08'),(10005,621720,'NTN022','NTWQM','NTN','DEDNREC  ','DEDNREC',304191,'10/18/2021','10:05:00',NULL,'','',0,'S ','HVIC','S1','PO4F','<',0.004,'MG/L','L01','DEDNREC','','','','nan',38.72917,-75.56139,'T3','2021-10-18'),(10005,610447,'NTN021','NTWQM','NTN','DEDNREC  ','DEDNREC',304191,'1/28/2021','11:26:00',NULL,'','',0,'S ','HVIC','S1','POC','',0.153,'MG/L','D01','DEDNREC','','','','nan',38.72917,-75.56139,'T3','2021-01-28'),(10005,610448,'NTN021','NTWQM','NTN','DEDNREC  ','DEDNREC',304191,'2/2/2021','9:25:00',NULL,'','',0,'S ','HVIC','FS1','POC','',0.137,'MG/L','D01','DEDNREC','','','','nan',38.72917,-75.56139,'T3','2021-02-02'),(10005,610448,'NTN021','NTWQM','NTN','DEDNREC  ','DEDNREC',304191,'2/2/2021','9:25:00',NULL,'','',0,'S ','HVIC','FS2','POC','',0.187,'MG/L','D01','DEDNREC','','','','nan',38.72917,-75.56139,'T3','2021-02-02'),(10005,610457,'NTN021','NTWQM','NTN','DEDNREC  ','DEDNREC',304191,'9/22/2021','9:44:00',NULL,'','',0,'S ','HVIC','S1','POC','',0.122,'MG/L','D01','DEDNREC','','','','nan',38.72917,-75.56139,'T3','2021-09-22'),(10005,610456,'NTN021','NTWQM','NTN','DEDNREC  ','DEDNREC',304191,'9/2/2021','8:32:00',NULL,'','',0,'S ','HVIC','S1','POC','',-0.129,'MG/L','D01','DEDNREC','NV','','','nan',38.72917,-75.56139,'T3','2021-09-02'),(10005,610455,'NTN021','NTWQM','NTN','DEDNREC  ','DEDNREC',304191,'8/25/2021','9:47:00',NULL,'','',0,'S ','HVIC','S1','POC','',0.1,'MG/L','D01','DEDNREC','','','','nan',38.72917,-75.56139,'T3','2021-08-25'),(10005,610454,'NTN021','NTWQM','NTN','DEDNREC  ','DEDNREC',304191,'7/19/2021','8:57:00',NULL,'','',0,'S ','HVIC','S1','POC','',0.153,'MG/L','D01','DEDNREC','','','','nan',38.72917,-75.56139,'T3','2021-07-19'),(10005,610453,'NTN021','NTWQM','NTN','DEDNREC  ','DEDNREC',304191,'6/15/2021','8:37:00',NULL,'','',0,'S ','HVIC','FS1','POC','',0.242,'MG/L','D01','DEDNREC','','','','nan',38.72917,-75.56139,'T3','2021-06-15'),(10005,610453,'NTN021','NTWQM','NTN','DEDNREC  ','DEDNREC',304191,'6/15/2021','8:37:00',NULL,'','',0,'S ','HVIC','FS2','POC','',0.168,'MG/L','D01','DEDNREC','','','','nan',38.72917,-75.56139,'T3','2021-06-15'),(10005,610452,'NTN021','NTWQM','NTN','DEDNREC  ','DEDNREC',304191,'5/24/2021','7:28:00',NULL,'','',0,'S ','HVIC','S1','POC','',0.269,'MG/L','D01','DEDNREC','','','','nan',38.72917,-75.56139,'T3','2021-05-24'),(10005,610451,'NTN021','NTWQM','NTN','DEDNREC  ','DEDNREC',304191,'4/20/2021','10:18:00',NULL,'','',0,'S ','HVIC','S1','POC','',0.276,'MG/L','D01','DEDNREC','','','','nan',38.72917,-75.56139,'T3','2021-04-20'),(10005,610449,'NTN021','NTWQM','NTN','DEDNREC  ','DEDNREC',304191,'2/24/2021','10:10:00',NULL,'','',0,'S ','HVIC','S1','POC','',0.224,'MG/L','D01','DEDNREC','GG','','','Analysis performed after holding time expired.',38.72917,-75.56139,'T3','2021-02-24'),(10005,610450,'NTN021','NTWQM','NTN','DEDNREC  ','DEDNREC',304191,'3/10/2021','8:01:00',NULL,'','',0,'S ','HVIC','FS1','POC','',0.248,'MG/L','D01','DEDNREC','','','','nan',38.72917,-75.56139,'T3','2021-03-10'),(10005,610450,'NTN021','NTWQM','NTN','DEDNREC  ','DEDNREC',304191,'3/10/2021','8:01:00',NULL,'','',0,'S ','HVIC','FS2','POC','',0.143,'MG/L','D01','DEDNREC','','','','nan',38.72917,-75.56139,'T3','2021-03-10'),(10005,621720,'NTN022','NTWQM','NTN','DEDNREC  ','DEDNREC',304191,'10/18/2021','10:05:00',NULL,'','',0,'S ','HVIC','S1','POC','',0.096,'MG/L','D01','DEDNREC','','','','nan',38.72917,-75.56139,'T3','2021-10-18'),(10005,621721,'NTN022','NTWQM','NTN','DEDNREC  ','DEDNREC',304191,'11/8/2021','7:55:00',NULL,'','',0,'S ','HVIC','S1','POC','',0.097,'MG/L','D01','DEDNREC','','','','nan',38.72917,-75.56139,'T3','2021-11-08'),(10005,621722,'NTN022','NTWQM','NTN','DEDNREC  ','DEDNREC',304191,'12/15/2021','9:14:00',NULL,'','',0,'S ','HVIC','S1','POC','',0.144,'MG/L','D01','DEDNREC','','','','nan',38.72917,-75.56139,'T3','2021-12-15'),(10005,621724,'NTN022','NTWQM','NTN','DEDNREC  ','DEDNREC',304191,'2/23/2022','9:37:00',NULL,'','',0,'S ','HVIC','S1','POC','',0.154,'MG/L','D01','DEDNREC','','','','nan',38.72917,-75.56139,'T3','2022-02-23'),(10005,621723,'NTN022','NTWQM','NTN','DEDNREC  ','DEDNREC',304191,'1/26/2022','8:25:00',NULL,'','',0,'S ','HVIC','S1','POC','',0.158,'MG/L','D01','DEDNREC','','','','nan',38.72917,-75.56139,'T3','2022-01-26'),(10005,621726,'NTN022','NTWQM','NTN','DEDNREC  ','DEDNREC',304191,'4/7/2022','9:29:00',NULL,'','',0,'S ','HVIC','FS1','POC','',0.074,'MG/L','D01','DEDNREC','','','','nan',38.72917,-75.56139,'T3','2022-04-07'),(10005,621726,'NTN022','NTWQM','NTN','DEDNREC  ','DEDNREC',304191,'4/7/2022','9:29:00',NULL,'','',0,'S ','HVIC','FS2','POC','',-0.258,'MG/L','D01','DEDNREC','NV','','','nan',38.72917,-75.56139,'T3','2022-04-07'),(10005,621725,'NTN022','NTWQM','NTN','DEDNREC  ','DEDNREC',304191,'3/21/2022','8:21:00',NULL,'','',0,'S ','HVIC','S1','POC','',0.282,'MG/L','D01','DEDNREC','','','','nan',38.72917,-75.56139,'T3','2022-03-21'),(10005,621727,'NTN022','NTWQM','NTN','DEDNREC  ','DEDNREC',304191,'4/27/2022','10:01:00',NULL,'','',0,'S ','HVIC','S1','POC','',0.271,'MG/L','D01','DEDNREC','','','','nan',38.72917,-75.56139,'T3','2022-04-27'),(10005,621728,'NTN022','NTWQM','NTN','DEDNREC  ','DEDNREC',304191,'5/18/2022','9:47:00',NULL,'','',0,'S ','HVIC','S1','POC','',0.061,'MG/L','D01','DEDNREC','','','','nan',38.72917,-75.56139,'T3','2022-05-18'),(10005,621729,'NTN022','NTWQM','NTN','DEDNREC  ','DEDNREC',304191,'6/15/2022','9:45:00',NULL,'','',0,'S ','HVIC','FS1','POC','',0.17,'MG/L','D01','DEDNREC','','','','nan',38.72917,-75.56139,'T3','2022-06-15'),(10005,621729,'NTN022','NTWQM','NTN','DEDNREC  ','DEDNREC',304191,'6/15/2022','9:45:00',NULL,'','',0,'S ','HVIC','FS2','POC','',0.119,'MG/L','D01','DEDNREC','','','','nan',38.72917,-75.56139,'T3','2022-06-15'),(10005,621730,'NTN022','NTWQM','NTN','DEDNREC  ','DEDNREC',304191,'7/27/2022','10:45:00',NULL,'','',0,'S ','HVIC','S1','POC','',0.106,'MG/L','D01','DEDNREC','','','','nan',38.72917,-75.56139,'T3','2022-07-27'),(10005,621731,'NTN022','NTWQM','NTN','DEDNREC  ','DEDNREC',304191,'8/24/2022','8:45:00',NULL,'','',0,'S ','HVIC','S1','POC','',0.099,'MG/L','D01','DEDNREC','','','','nan',38.72917,-75.56139,'T3','2022-08-24'),(10005,621732,'NTN022','NTWQM','NTN','DEDNREC  ','DEDNREC',304191,'9/29/2022','8:06:00',NULL,'','',0,'S ','HVIC','FS1','POC','',0.024,'MG/L','D01','DEDNREC','','','','nan',38.72917,-75.56139,'T3','2022-09-29'),(10005,621732,'NTN022','NTWQM','NTN','DEDNREC  ','DEDNREC',304191,'9/29/2022','8:06:00',NULL,'','',0,'S ','HVIC','FS2','POC','',0.094,'MG/L','D01','DEDNREC','','','','nan',38.72917,-75.56139,'T3','2022-09-29'),(10005,610449,'NTN021','NTWQM','NTN','DEDNREC  ','DEDNREC',304191,'2/24/2021','10:10:00',NULL,'','',0,'S ','ISM','M1','SALINITY','<',0.1,'PPT','F01','','','','','nan',38.72917,-75.56139,'T3','2021-02-24'),(10005,610450,'NTN021','NTWQM','NTN','DEDNREC  ','DEDNREC',304191,'3/10/2021','8:01:00',NULL,'','',0,'S ','ISM','M1','SALINITY','<',0.1,'PPT','F01','','','','','nan',38.72917,-75.56139,'T3','2021-03-10'),(10005,610448,'NTN021','NTWQM','NTN','DEDNREC  ','DEDNREC',304191,'2/2/2021','9:25:00',NULL,'','',0,'S ','ISM','M2','SALINITY','<',0.1,'PPT','F01','','','','','nan',38.72917,-75.56139,'T3','2021-02-02'),(10005,610450,'NTN021','NTWQM','NTN','DEDNREC  ','DEDNREC',304191,'3/10/2021','8:01:00',NULL,'','',0,'S ','ISM','M2','SALINITY','<',0.1,'PPT','F01','','','','','nan',38.72917,-75.56139,'T3','2021-03-10'),(10005,610451,'NTN021','NTWQM','NTN','DEDNREC  ','DEDNREC',304191,'4/20/2021','10:18:00',NULL,'','',0,'S ','ISM','M1','SALINITY','<',0.1,'PPT','F01','','','','','nan',38.72917,-75.56139,'T3','2021-04-20'),(10005,610452,'NTN021','NTWQM','NTN','DEDNREC  ','DEDNREC',304191,'5/24/2021','7:28:00',NULL,'','',0,'S ','ISM','M1','SALINITY','<',0.1,'PPT','F01','','','','','nan',38.72917,-75.56139,'T3','2021-05-24'),(10005,610453,'NTN021','NTWQM','NTN','DEDNREC  ','DEDNREC',304191,'6/15/2021','8:37:00',NULL,'','',0,'S ','ISM','M1','SALINITY','<',0.1,'PPT','F01','','','','','nan',38.72917,-75.56139,'T3','2021-06-15'),(10005,610453,'NTN021','NTWQM','NTN','DEDNREC  ','DEDNREC',304191,'6/15/2021','8:37:00',NULL,'','',0,'S ','ISM','M2','SALINITY','<',0.1,'PPT','F01','','','','','nan',38.72917,-75.56139,'T3','2021-06-15'),(10005,610454,'NTN021','NTWQM','NTN','DEDNREC  ','DEDNREC',304191,'7/19/2021','8:57:00',NULL,'','',0,'S ','ISM','M1','SALINITY','<',0.1,'PPT','F01','','','','','nan',38.72917,-75.56139,'T3','2021-07-19'),(10005,610455,'NTN021','NTWQM','NTN','DEDNREC  ','DEDNREC',304191,'8/25/2021','9:47:00',NULL,'','',0,'S ','ISM','M1','SALINITY','<',0.1,'PPT','F01','','','','','nan',38.72917,-75.56139,'T3','2021-08-25'),(10005,610456,'NTN021','NTWQM','NTN','DEDNREC  ','DEDNREC',304191,'9/2/2021','8:32:00',NULL,'','',0,'S ','ISM','M1','SALINITY','<',0.1,'PPT','F01','','','','','nan',38.72917,-75.56139,'T3','2021-09-02'),(10005,610457,'NTN021','NTWQM','NTN','DEDNREC  ','DEDNREC',304191,'9/22/2021','9:44:00',NULL,'','',0,'S ','ISM','M1','SALINITY','<',0.1,'PPT','F01','','','','','nan',38.72917,-75.56139,'T3','2021-09-22'),(10005,610447,'NTN021','NTWQM','NTN','DEDNREC  ','DEDNREC',304191,'1/28/2021','11:26:00',NULL,'','',0,'S ','ISM','M1','SALINITY','<',0.1,'PPT','F01','','','','','nan',38.72917,-75.56139,'T3','2021-01-28'),(10005,610448,'NTN021','NTWQM','NTN','DEDNREC  ','DEDNREC',304191,'2/2/2021','9:25:00',NULL,'','',0,'S ','ISM','M1','SALINITY','<',0.1,'PPT','F01','','','','','nan',38.72917,-75.56139,'T3','2021-02-02'),(10005,621731,'NTN022','NTWQM','NTN','DEDNREC  ','DEDNREC',304191,'8/24/2022','8:45:00',NULL,'','',0,'S ','ISM','M1','SALINITY','<',0.1,'PPT','F01','','','','','nan',38.72917,-75.56139,'T3','2022-08-24'),(10005,621732,'NTN022','NTWQM','NTN','DEDNREC  ','DEDNREC',304191,'9/29/2022','8:06:00',NULL,'','',0,'S ','ISM','M2','SALINITY','<',0.1,'PPT','F01','','','','','nan',38.72917,-75.56139,'T3','2022-09-29'),(10005,621730,'NTN022','NTWQM','NTN','DEDNREC  ','DEDNREC',304191,'7/27/2022','10:45:00',NULL,'','',0,'S ','ISM','M1','SALINITY','<',0.1,'PPT','F01','','','','','nan',38.72917,-75.56139,'T3','2022-07-27'),(10005,621729,'NTN022','NTWQM','NTN','DEDNREC  ','DEDNREC',304191,'6/15/2022','9:45:00',NULL,'','',0,'S ','ISM','M1','SALINITY','<',0.1,'PPT','F01','','','','','nan',38.72917,-75.56139,'T3','2022-06-15'),(10005,621729,'NTN022','NTWQM','NTN','DEDNREC  ','DEDNREC',304191,'6/15/2022','9:45:00',NULL,'','',0,'S ','ISM','M2','SALINITY','<',0.1,'PPT','F01','','','','','nan',38.72917,-75.56139,'T3','2022-06-15'),(10005,621728,'NTN022','NTWQM','NTN','DEDNREC  ','DEDNREC',304191,'5/18/2022','9:47:00',NULL,'','',0,'S ','ISM','M1','SALINITY','<',0.1,'PPT','F01','','','','','nan',38.72917,-75.56139,'T3','2022-05-18'),(10005,621726,'NTN022','NTWQM','NTN','DEDNREC  ','DEDNREC',304191,'4/7/2022','9:29:00',NULL,'','',0,'S ','ISM','M2','SALINITY','<',0.1,'PPT','F01','','','','','nan',38.72917,-75.56139,'T3','2022-04-07'),(10005,621727,'NTN022','NTWQM','NTN','DEDNREC  ','DEDNREC',304191,'4/27/2022','10:01:00',NULL,'','',0,'S ','ISM','M1','SALINITY','<',0.1,'PPT','F01','','','','','nan',38.72917,-75.56139,'T3','2022-04-27'),(10005,621725,'NTN022','NTWQM','NTN','DEDNREC  ','DEDNREC',304191,'3/21/2022','8:21:00',NULL,'','',0,'S ','ISM','M1','SALINITY','<',0.1,'PPT','F01','','','','','nan',38.72917,-75.56139,'T3','2022-03-21'),(10005,621726,'NTN022','NTWQM','NTN','DEDNREC  ','DEDNREC',304191,'4/7/2022','9:29:00',NULL,'','',0,'S ','ISM','M1','SALINITY','<',0.1,'PPT','F01','','','','','nan',38.72917,-75.56139,'T3','2022-04-07'),(10005,621723,'NTN022','NTWQM','NTN','DEDNREC  ','DEDNREC',304191,'1/26/2022','8:25:00',NULL,'','',0,'S ','ISM','M1','SALINITY','<',0.1,'PPT','F01','','','','','nan',38.72917,-75.56139,'T3','2022-01-26'),(10005,621724,'NTN022','NTWQM','NTN','DEDNREC  ','DEDNREC',304191,'2/23/2022','9:37:00',NULL,'','',0,'S ','ISM','M1','SALINITY','<',0.1,'PPT','F01','','','','','nan',38.72917,-75.56139,'T3','2022-02-23'),(10005,621722,'NTN022','NTWQM','NTN','DEDNREC  ','DEDNREC',304191,'12/15/2021','9:14:00',NULL,'','',0,'S ','ISM','M1','SALINITY','<',0.1,'PPT','F01','','','','','nan',38.72917,-75.56139,'T3','2021-12-15'),(10005,621721,'NTN022','NTWQM','NTN','DEDNREC  ','DEDNREC',304191,'11/8/2021','7:55:00',NULL,'','',0,'S ','ISM','M1','SALINITY','<',0.1,'PPT','F01','','','','','nan',38.72917,-75.56139,'T3','2021-11-08'),(10005,621720,'NTN022','NTWQM','NTN','DEDNREC  ','DEDNREC',304191,'10/18/2021','10:05:00',NULL,'','',0,'S ','ISM','M1','SALINITY','<',0.1,'PPT','F01','','','','','nan',38.72917,-75.56139,'T3','2021-10-18'),(10005,621732,'NTN022','NTWQM','NTN','DEDNREC  ','DEDNREC',304191,'9/29/2022','8:06:00',NULL,'','',0,'S ','ISM','M1','SALINITY','<',0.1,'PPT','F01','','','','','nan',38.72917,-75.56139,'T3','2022-09-29'),(10005,610447,'NTN021','NTWQM','NTN','DEDNREC  ','DEDNREC',304191,'1/28/2021','11:26:00',NULL,'','',0,'S ','ISM','M1','SPCOND','',191.60001,'UMHOS/CM','F02','','','','','nan',38.72917,-75.56139,'T3','2021-01-28'),(10005,610448,'NTN021','NTWQM','NTN','DEDNREC  ','DEDNREC',304191,'2/2/2021','9:25:00',NULL,'','',0,'S ','ISM','M2','SPCOND','',176.10001,'UMHOS/CM','F02','','','','','nan',38.72917,-75.56139,'T3','2021-02-02'),(10005,610456,'NTN021','NTWQM','NTN','DEDNREC  ','DEDNREC',304191,'9/2/2021','8:32:00',NULL,'','',0,'S ','ISM','M1','SPCOND','',74.4,'UMHOS/CM','F02','','','','','nan',38.72917,-75.56139,'T3','2021-09-02'),(10005,610457,'NTN021','NTWQM','NTN','DEDNREC  ','DEDNREC',304191,'9/22/2021','9:44:00',NULL,'','',0,'S ','ISM','M1','SPCOND','',184.3,'UMHOS/CM','F02','','','','','nan',38.72917,-75.56139,'T3','2021-09-22'),(10005,610455,'NTN021','NTWQM','NTN','DEDNREC  ','DEDNREC',304191,'8/25/2021','9:47:00',NULL,'','',0,'S ','ISM','M1','SPCOND','',168.3,'UMHOS/CM','F02','','','','','nan',38.72917,-75.56139,'T3','2021-08-25'),(10005,610454,'NTN021','NTWQM','NTN','DEDNREC  ','DEDNREC',304191,'7/19/2021','8:57:00',NULL,'','',0,'S ','ISM','M1','SPCOND','',197.8,'UMHOS/CM','F02','','','','','nan',38.72917,-75.56139,'T3','2021-07-19'),(10005,610453,'NTN021','NTWQM','NTN','DEDNREC  ','DEDNREC',304191,'6/15/2021','8:37:00',NULL,'','',0,'S ','ISM','M2','SPCOND','',159.39999,'UMHOS/CM','F02','','','','','nan',38.72917,-75.56139,'T3','2021-06-15'),(10005,610453,'NTN021','NTWQM','NTN','DEDNREC  ','DEDNREC',304191,'6/15/2021','8:37:00',NULL,'','',0,'S ','ISM','M1','SPCOND','',159.3,'UMHOS/CM','F02','','','','','nan',38.72917,-75.56139,'T3','2021-06-15'),(10005,610452,'NTN021','NTWQM','NTN','DEDNREC  ','DEDNREC',304191,'5/24/2021','7:28:00',NULL,'','',0,'S ','ISM','M1','SPCOND','',166.39999,'UMHOS/CM','F02','','','','','nan',38.72917,-75.56139,'T3','2021-05-24'),(10005,610450,'NTN021','NTWQM','NTN','DEDNREC  ','DEDNREC',304191,'3/10/2021','8:01:00',NULL,'','',0,'S ','ISM','M2','SPCOND','',179.2,'UMHOS/CM','F02','','','','','nan',38.72917,-75.56139,'T3','2021-03-10'),(10005,610451,'NTN021','NTWQM','NTN','DEDNREC  ','DEDNREC',304191,'4/20/2021','10:18:00',NULL,'','',0,'S ','ISM','M1','SPCOND','',152.39999,'UMHOS/CM','F02','','','','','nan',38.72917,-75.56139,'T3','2021-04-20'),(10005,610448,'NTN021','NTWQM','NTN','DEDNREC  ','DEDNREC',304191,'2/2/2021','9:25:00',NULL,'','',0,'S ','ISM','M1','SPCOND','',176.10001,'UMHOS/CM','F02','','','','','nan',38.72917,-75.56139,'T3','2021-02-02'),(10005,610449,'NTN021','NTWQM','NTN','DEDNREC  ','DEDNREC',304191,'2/24/2021','10:10:00',NULL,'','',0,'S ','ISM','M1','SPCOND','',133,'UMHOS/CM','F02','','','','','nan',38.72917,-75.56139,'T3','2021-02-24'),(10005,610450,'NTN021','NTWQM','NTN','DEDNREC  ','DEDNREC',304191,'3/10/2021','8:01:00',NULL,'','',0,'S ','ISM','M1','SPCOND','',179.5,'UMHOS/CM','F02','','','','','nan',38.72917,-75.56139,'T3','2021-03-10'),(10005,621732,'NTN022','NTWQM','NTN','DEDNREC  ','DEDNREC',304191,'9/29/2022','8:06:00',NULL,'','',0,'S ','ISM','M1','SPCOND','',185.8,'UMHOS/CM','F02','','','','','nan',38.72917,-75.56139,'T3','2022-09-29'),(10005,621720,'NTN022','NTWQM','NTN','DEDNREC  ','DEDNREC',304191,'10/18/2021','10:05:00',NULL,'','',0,'S ','ISM','M1','SPCOND','',172.39999,'UMHOS/CM','F02','','','','','nan',38.72917,-75.56139,'T3','2021-10-18'),(10005,621721,'NTN022','NTWQM','NTN','DEDNREC  ','DEDNREC',304191,'11/8/2021','7:55:00',NULL,'','',0,'S ','ISM','M1','SPCOND','',191.7,'UMHOS/CM','F02','','','','','nan',38.72917,-75.56139,'T3','2021-11-08'),(10005,621722,'NTN022','NTWQM','NTN','DEDNREC  ','DEDNREC',304191,'12/15/2021','9:14:00',NULL,'','',0,'S ','ISM','M1','SPCOND','',187.2,'UMHOS/CM','F02','','','','','nan',38.72917,-75.56139,'T3','2021-12-15'),(10005,621724,'NTN022','NTWQM','NTN','DEDNREC  ','DEDNREC',304191,'2/23/2022','9:37:00',NULL,'','',0,'S ','ISM','M1','SPCOND','',160.7,'UMHOS/CM','F02','','','','','nan',38.72917,-75.56139,'T3','2022-02-23'),(10005,621723,'NTN022','NTWQM','NTN','DEDNREC  ','DEDNREC',304191,'1/26/2022','8:25:00',NULL,'','',0,'S ','ISM','M1','SPCOND','',164.39999,'UMHOS/CM','F02','','','','','nan',38.72917,-75.56139,'T3','2022-01-26'),(10005,621726,'NTN022','NTWQM','NTN','DEDNREC  ','DEDNREC',304191,'4/7/2022','9:29:00',NULL,'','',0,'S ','ISM','M2','SPCOND','',121.4,'UMHOS/CM','F02','','','','','nan',38.72917,-75.56139,'T3','2022-04-07'),(10005,621725,'NTN022','NTWQM','NTN','DEDNREC  ','DEDNREC',304191,'3/21/2022','8:21:00',NULL,'','',0,'S ','ISM','M1','SPCOND','',187.60001,'UMHOS/CM','F02','','','','','nan',38.72917,-75.56139,'T3','2022-03-21'),(10005,621726,'NTN022','NTWQM','NTN','DEDNREC  ','DEDNREC',304191,'4/7/2022','9:29:00',NULL,'','',0,'S ','ISM','M1','SPCOND','',121.4,'UMHOS/CM','F02','','','','','nan',38.72917,-75.56139,'T3','2022-04-07'),(10005,621727,'NTN022','NTWQM','NTN','DEDNREC  ','DEDNREC',304191,'4/27/2022','10:01:00',NULL,'','',0,'S ','ISM','M1','SPCOND','',155.89999,'UMHOS/CM','F02','','','','','nan',38.72917,-75.56139,'T3','2022-04-27'),(10005,621728,'NTN022','NTWQM','NTN','DEDNREC  ','DEDNREC',304191,'5/18/2022','9:47:00',NULL,'','',0,'S ','ISM','M1','SPCOND','',150.3,'UMHOS/CM','F02','','','','','nan',38.72917,-75.56139,'T3','2022-05-18'),(10005,621729,'NTN022','NTWQM','NTN','DEDNREC  ','DEDNREC',304191,'6/15/2022','9:45:00',NULL,'','',0,'S ','ISM','M2','SPCOND','',155.2,'UMHOS/CM','F02','','','','','nan',38.72917,-75.56139,'T3','2022-06-15'),(10005,621729,'NTN022','NTWQM','NTN','DEDNREC  ','DEDNREC',304191,'6/15/2022','9:45:00',NULL,'','',0,'S ','ISM','M1','SPCOND','',155.2,'UMHOS/CM','F02','','','','','nan',38.72917,-75.56139,'T3','2022-06-15'),(10005,621730,'NTN022','NTWQM','NTN','DEDNREC  ','DEDNREC',304191,'7/27/2022','10:45:00',NULL,'','',0,'S ','ISM','M1','SPCOND','',196,'UMHOS/CM','F02','','','','','nan',38.72917,-75.56139,'T3','2022-07-27'),(10005,621731,'NTN022','NTWQM','NTN','DEDNREC  ','DEDNREC',304191,'8/24/2022','8:45:00',NULL,'','',0,'S ','ISM','M1','SPCOND','',188,'UMHOS/CM','F02','','','','','nan',38.72917,-75.56139,'T3','2022-08-24'),(10005,621732,'NTN022','NTWQM','NTN','DEDNREC  ','DEDNREC',304191,'9/29/2022','8:06:00',NULL,'','',0,'S ','ISM','M2','SPCOND','',185.89999,'UMHOS/CM','F02','','','','','nan',38.72917,-75.56139,'T3','2022-09-29'),(10005,610448,'NTN021','NTWQM','NTN','DEDNREC  ','DEDNREC',304191,'2/2/2021','9:25:00',NULL,'','',0,'S ','HVIC','FS2','SSC_%FINE','',98,'PCT','D01','USGS-KDSL','','','','nan',38.72917,-75.56139,'T3','2021-02-02'),(10005,610456,'NTN021','NTWQM','NTN','DEDNREC  ','DEDNREC',304191,'9/2/2021','8:32:00',NULL,'','',0,'S ','HVIC','S1','SSC_%FINE','',92.7,'PCT','D01','USGS-KDSL','','','','nan',38.72917,-75.56139,'T3','2021-09-02'),(10005,610448,'NTN021','NTWQM','NTN','DEDNREC  ','DEDNREC',304191,'2/2/2021','9:25:00',NULL,'','',0,'S ','HVIC','FS1','SSC_%FINE','',100,'PCT','D01','USGS-KDSL','','','','nan',38.72917,-75.56139,'T3','2021-02-02'),(10005,621726,'NTN022','NTWQM','NTN','DEDNREC  ','DEDNREC',304191,'4/7/2022','9:29:00',NULL,'','',0,'S ','HVIC','FS1','SSC_%FINE','',89.7,'PCT','D01','USGS-KDSL','','','','nan',38.72917,-75.56139,'T3','2022-04-07'),(10005,621726,'NTN022','NTWQM','NTN','DEDNREC  ','DEDNREC',304191,'4/7/2022','9:29:00',NULL,'','',0,'S ','HVIC','FS2','SSC_%FINE','',94.9,'PCT','D01','USGS-KDSL','','','','nan',38.72917,-75.56139,'T3','2022-04-07'),(10005,610448,'NTN021','NTWQM','NTN','DEDNREC  ','DEDNREC',304191,'2/2/2021','9:25:00',NULL,'','',0,'S ','HVIC','FS1','SSC_TOTAL','',12,'MG/L','L02','USGS-KDSL','','','','nan',38.72917,-75.56139,'T3','2021-02-02'),(10005,610456,'NTN021','NTWQM','NTN','DEDNREC  ','DEDNREC',304191,'9/2/2021','8:32:00',NULL,'','',0,'S ','HVIC','S1','SSC_TOTAL','',60,'MG/L','L02','USGS-KDSL','','','','nan',38.72917,-75.56139,'T3','2021-09-02'),(10005,610448,'NTN021','NTWQM','NTN','DEDNREC  ','DEDNREC',304191,'2/2/2021','9:25:00',NULL,'','',0,'S ','HVIC','FS2','SSC_TOTAL','',11,'MG/L','L02','USGS-KDSL','','','','nan',38.72917,-75.56139,'T3','2021-02-02'),(10005,621726,'NTN022','NTWQM','NTN','DEDNREC  ','DEDNREC',304191,'4/7/2022','9:29:00',NULL,'','',0,'S ','HVIC','FS2','SSC_TOTAL','',41,'MG/L','L02','USGS-KDSL','','','','nan',38.72917,-75.56139,'T3','2022-04-07'),(10005,621726,'NTN022','NTWQM','NTN','DEDNREC  ','DEDNREC',304191,'4/7/2022','9:29:00',NULL,'','',0,'S ','HVIC','FS1','SSC_TOTAL','',17,'MG/L','L02','USGS-KDSL','','','','nan',38.72917,-75.56139,'T3','2022-04-07'),(10005,610448,'NTN021','NTWQM','NTN','DEDNREC  ','DEDNREC',304191,'2/2/2021','9:25:00',NULL,'','',0,'S ','HVIC','FS1','TALK','',10.7293,'MG/L','L01','DEDNREC','','','','nan',38.72917,-75.56139,'T3','2021-02-02'),(10005,610449,'NTN021','NTWQM','NTN','DEDNREC  ','DEDNREC',304191,'2/24/2021','10:10:00',NULL,'','',0,'S ','HVIC','S1','TALK','',9.9863,'MG/L','L01','DEDNREC','','','','nan',38.72917,-75.56139,'T3','2021-02-24'),(10005,610450,'NTN021','NTWQM','NTN','DEDNREC  ','DEDNREC',304191,'3/10/2021','8:01:00',NULL,'','',0,'S ','HVIC','FS1','TALK','',11.2693,'MG/L','L01','DEDNREC','','','','nan',38.72917,-75.56139,'T3','2021-03-10'),(10005,610450,'NTN021','NTWQM','NTN','DEDNREC  ','DEDNREC',304191,'3/10/2021','8:01:00',NULL,'','',0,'S ','HVIC','FS2','TALK','',11.5767,'MG/L','L01','DEDNREC','','','','nan',38.72917,-75.56139,'T3','2021-03-10'),(10005,610451,'NTN021','NTWQM','NTN','DEDNREC  ','DEDNREC',304191,'4/20/2021','10:18:00',NULL,'','',0,'S ','HVIC','S1','TALK','',13.1807,'MG/L','L01','DEDNREC','','','','nan',38.72917,-75.56139,'T3','2021-04-20'),(10005,610452,'NTN021','NTWQM','NTN','DEDNREC  ','DEDNREC',304191,'5/24/2021','7:28:00',NULL,'','',0,'S ','HVIC','S1','TALK','',15.5544,'MG/L','L01','DEDNREC','','','','nan',38.72917,-75.56139,'T3','2021-05-24'),(10005,610457,'NTN021','NTWQM','NTN','DEDNREC  ','DEDNREC',304191,'9/22/2021','9:44:00',NULL,'','',0,'S ','HVIC','S1','TALK','',16.7122,'MG/L','L01','DEDNREC','','','','nan',38.72917,-75.56139,'T3','2021-09-22'),(10005,610456,'NTN021','NTWQM','NTN','DEDNREC  ','DEDNREC',304191,'9/2/2021','8:32:00',NULL,'','',0,'S ','HVIC','S1','TALK','',14.1492,'MG/L','L01','DEDNREC','','','','nan',38.72917,-75.56139,'T3','2021-09-02'),(10005,610455,'NTN021','NTWQM','NTN','DEDNREC  ','DEDNREC',304191,'8/25/2021','9:47:00',NULL,'','',0,'S ','HVIC','S1','TALK','',18.1271,'MG/L','L01','DEDNREC','','','','nan',38.72917,-75.56139,'T3','2021-08-25'),(10005,610453,'NTN021','NTWQM','NTN','DEDNREC  ','DEDNREC',304191,'6/15/2021','8:37:00',NULL,'','',0,'S ','HVIC','FS1','TALK','',15.9222,'MG/L','L01','DEDNREC','','','','nan',38.72917,-75.56139,'T3','2021-06-15'),(10005,610453,'NTN021','NTWQM','NTN','DEDNREC  ','DEDNREC',304191,'6/15/2021','8:37:00',NULL,'','',0,'S ','HVIC','FS2','TALK','',16.3087,'MG/L','L01','DEDNREC','','','','nan',38.72917,-75.56139,'T3','2021-06-15'),(10005,610454,'NTN021','NTWQM','NTN','DEDNREC  ','DEDNREC',304191,'7/19/2021','8:57:00',NULL,'','',0,'S ','HVIC','S1','TALK','',17.2233,'MG/L','L01','DEDNREC','','','','nan',38.72917,-75.56139,'T3','2021-07-19'),(10005,610448,'NTN021','NTWQM','NTN','DEDNREC  ','DEDNREC',304191,'2/2/2021','9:25:00',NULL,'','',0,'S ','HVIC','FS2','TALK','',10.6851,'MG/L','L01','DEDNREC','','','','nan',38.72917,-75.56139,'T3','2021-02-02'),(10005,610447,'NTN021','NTWQM','NTN','DEDNREC  ','DEDNREC',304191,'1/28/2021','11:26:00',NULL,'','',0,'S ','HVIC','S1','TALK','',10.3323,'MG/L','L01','DEDNREC','','','','nan',38.72917,-75.56139,'T3','2021-01-28'),(10005,621726,'NTN022','NTWQM','NTN','DEDNREC  ','DEDNREC',304191,'4/7/2022','9:29:00',NULL,'','',0,'S ','HVIC','FS1','TALK','',14.9144,'MG/L','L01','DEDNREC','','','','nan',38.72917,-75.56139,'T3','2022-04-07'),(10005,621726,'NTN022','NTWQM','NTN','DEDNREC  ','DEDNREC',304191,'4/7/2022','9:29:00',NULL,'','',0,'S ','HVIC','FS2','TALK','',14.8774,'MG/L','L01','DEDNREC','','','','nan',38.72917,-75.56139,'T3','2022-04-07'),(10005,621725,'NTN022','NTWQM','NTN','DEDNREC  ','DEDNREC',304191,'3/21/2022','8:21:00',NULL,'','',0,'S ','HVIC','S1','TALK','',15.5771,'MG/L','L01','DEDNREC','','','','nan',38.72917,-75.56139,'T3','2022-03-21'),(10005,621729,'NTN022','NTWQM','NTN','DEDNREC  ','DEDNREC',304191,'6/15/2022','9:45:00',NULL,'','',0,'S ','HVIC','FS2','TALK','',21.4482,'MG/L','L01','DEDNREC','','','','nan',38.72917,-75.56139,'T3','2022-06-15'),(10005,621728,'NTN022','NTWQM','NTN','DEDNREC  ','DEDNREC',304191,'5/18/2022','9:47:00',NULL,'','',0,'S ','HVIC','S1','TALK','',17.4409,'MG/L','L01','DEDNREC','','','','nan',38.72917,-75.56139,'T3','2022-05-18'),(10005,621727,'NTN022','NTWQM','NTN','DEDNREC  ','DEDNREC',304191,'4/27/2022','10:01:00',NULL,'','',0,'S ','HVIC','S1','TALK','',17.0625,'MG/L','L01','DEDNREC','','','','nan',38.72917,-75.56139,'T3','2022-04-27'),(10005,621732,'NTN022','NTWQM','NTN','DEDNREC  ','DEDNREC',304191,'9/29/2022','8:06:00',NULL,'','',0,'S ','HVIC','FS1','TALK','',17.7706,'MG/L','L01','DEDNREC','','','','nan',38.72917,-75.56139,'T3','2022-09-29'),(10005,621731,'NTN022','NTWQM','NTN','DEDNREC  ','DEDNREC',304191,'8/24/2022','8:45:00',NULL,'','',0,'S ','HVIC','S1','TALK','',21.5609,'MG/L','L01','DEDNREC','','','','nan',38.72917,-75.56139,'T3','2022-08-24'),(10005,621730,'NTN022','NTWQM','NTN','DEDNREC  ','DEDNREC',304191,'7/27/2022','10:45:00',NULL,'','',0,'S ','HVIC','S1','TALK','',21.1927,'MG/L','L01','DEDNREC','','','','nan',38.72917,-75.56139,'T3','2022-07-27'),(10005,621729,'NTN022','NTWQM','NTN','DEDNREC  ','DEDNREC',304191,'6/15/2022','9:45:00',NULL,'','',0,'S ','HVIC','FS1','TALK','',21.4776,'MG/L','L01','DEDNREC','','','','nan',38.72917,-75.56139,'T3','2022-06-15'),(10005,621724,'NTN022','NTWQM','NTN','DEDNREC  ','DEDNREC',304191,'2/23/2022','9:37:00',NULL,'','',0,'S ','HVIC','S1','TALK','',13.0453,'MG/L','L01','DEDNREC','','','','nan',38.72917,-75.56139,'T3','2022-02-23'),(10005,621723,'NTN022','NTWQM','NTN','DEDNREC  ','DEDNREC',304191,'1/26/2022','8:25:00',NULL,'','',0,'S ','HVIC','S1','TALK','',12.0929,'MG/L','L01','DEDNREC','','','','nan',38.72917,-75.56139,'T3','2022-01-26'),(10005,621721,'NTN022','NTWQM','NTN','DEDNREC  ','DEDNREC',304191,'11/8/2021','7:55:00',NULL,'','',0,'S ','HVIC','S1','TALK','',13.0592,'MG/L','L01','DEDNREC','','','','nan',38.72917,-75.56139,'T3','2021-11-08'),(10005,621722,'NTN022','NTWQM','NTN','DEDNREC  ','DEDNREC',304191,'12/15/2021','9:14:00',NULL,'','',0,'S ','HVIC','S1','TALK','',12.6994,'MG/L','L01','DEDNREC','','','','nan',38.72917,-75.56139,'T3','2021-12-15'),(10005,621720,'NTN022','NTWQM','NTN','DEDNREC  ','DEDNREC',304191,'10/18/2021','10:05:00',NULL,'','',0,'S ','HVIC','S1','TALK','',15.4574,'MG/L','L01','DEDNREC','','','','nan',38.72917,-75.56139,'T3','2021-10-18'),(10005,621732,'NTN022','NTWQM','NTN','DEDNREC  ','DEDNREC',304191,'9/29/2022','8:06:00',NULL,'','',0,'S ','HVIC','FS2','TALK','',20.4865,'MG/L','L01','DEDNREC','','','','nan',38.72917,-75.56139,'T3','2022-09-29'),(10005,610453,'NTN021','NTWQM','NTN','DEDNREC  ','DEDNREC',304191,'6/15/2021','8:37:00',NULL,'','',0,'S ','HVIC','FS2','TDN','',4.94,'MG/L','L01','DEDNREC','','','','nan',38.72917,-75.56139,'T3','2021-06-15'),(10005,610454,'NTN021','NTWQM','NTN','DEDNREC  ','DEDNREC',304191,'7/19/2021','8:57:00',NULL,'','',0,'S ','HVIC','S1','TDN','',5.95,'MG/L','L01','DEDNREC','','','','nan',38.72917,-75.56139,'T3','2021-07-19'),(10005,610453,'NTN021','NTWQM','NTN','DEDNREC  ','DEDNREC',304191,'6/15/2021','8:37:00',NULL,'','',0,'S ','HVIC','FS1','TDN','',4.97,'MG/L','L01','DEDNREC','','','','nan',38.72917,-75.56139,'T3','2021-06-15'),(10005,610455,'NTN021','NTWQM','NTN','DEDNREC  ','DEDNREC',304191,'8/25/2021','9:47:00',NULL,'','',0,'S ','HVIC','S1','TDN','',5.2,'MG/L','L01','DEDNREC','NQ','','','nan',38.72917,-75.56139,'T3','2021-08-25'),(10005,610457,'NTN021','NTWQM','NTN','DEDNREC  ','DEDNREC',304191,'9/22/2021','9:44:00',NULL,'','',0,'S ','HVIC','S1','TDN','',5.81,'MG/L','L01','DEDNREC','','','','nan',38.72917,-75.56139,'T3','2021-09-22'),(10005,610456,'NTN021','NTWQM','NTN','DEDNREC  ','DEDNREC',304191,'9/2/2021','8:32:00',NULL,'','',0,'S ','HVIC','S1','TDN','',1.45,'MG/L','L01','DEDNREC','','','','nan',38.72917,-75.56139,'T3','2021-09-02'),(10005,610452,'NTN021','NTWQM','NTN','DEDNREC  ','DEDNREC',304191,'5/24/2021','7:28:00',NULL,'','',0,'S ','HVIC','S1','TDN','',5.99,'MG/L','L01','DEDNREC','','','','nan',38.72917,-75.56139,'T3','2021-05-24'),(10005,610451,'NTN021','NTWQM','NTN','DEDNREC  ','DEDNREC',304191,'4/20/2021','10:18:00',NULL,'','',0,'S ','HVIC','S1','TDN','',5.49,'MG/L','L01','DEDNREC','GG','','','Analysis performed after holding time expired.',38.72917,-75.56139,'T3','2021-04-20'),(10005,610450,'NTN021','NTWQM','NTN','DEDNREC  ','DEDNREC',304191,'3/10/2021','8:01:00',NULL,'','',0,'S ','HVIC','FS2','TDN','',6.54,'MG/L','L01','DEDNREC','','','','nan',38.72917,-75.56139,'T3','2021-03-10'),(10005,610450,'NTN021','NTWQM','NTN','DEDNREC  ','DEDNREC',304191,'3/10/2021','8:01:00',NULL,'','',0,'S ','HVIC','FS1','TDN','',6.35,'MG/L','L01','DEDNREC','','','','nan',38.72917,-75.56139,'T3','2021-03-10'),(10005,621720,'NTN022','NTWQM','NTN','DEDNREC  ','DEDNREC',304191,'10/18/2021','10:05:00',NULL,'','',0,'S ','HVIC','S1','TDN','',6.27,'MG/L','L01','DEDNREC','','','','nan',38.72917,-75.56139,'T3','2021-10-18'),(10005,621722,'NTN022','NTWQM','NTN','DEDNREC  ','DEDNREC',304191,'12/15/2021','9:14:00',NULL,'','',0,'S ','HVIC','S1','TDN','',7.26,'MG/L','L01','DEDNREC','','','','nan',38.72917,-75.56139,'T3','2021-12-15'),(10005,621721,'NTN022','NTWQM','NTN','DEDNREC  ','DEDNREC',304191,'11/8/2021','7:55:00',NULL,'','',0,'S ','HVIC','S1','TDN','',7.02,'MG/L','L01','DEDNREC','','','','nan',38.72917,-75.56139,'T3','2021-11-08'),(10005,621724,'NTN022','NTWQM','NTN','DEDNREC  ','DEDNREC',304191,'2/23/2022','9:37:00',NULL,'','',0,'S ','HVIC','S1','TDN','',5.98,'MG/L','L01','DEDNREC','','','','nan',38.72917,-75.56139,'T3','2022-02-23'),(10005,621723,'NTN022','NTWQM','NTN','DEDNREC  ','DEDNREC',304191,'1/26/2022','8:25:00',NULL,'','',0,'S ','HVIC','S1','TDN','',6.2,'MG/L','L01','DEDNREC','','','','nan',38.72917,-75.56139,'T3','2022-01-26'),(10005,621729,'NTN022','NTWQM','NTN','DEDNREC  ','DEDNREC',304191,'6/15/2022','9:45:00',NULL,'','',0,'S ','HVIC','FS1','TDN','',4.84,'MG/L','L01','DEDNREC','','','','nan',38.72917,-75.56139,'T3','2022-06-15'),(10005,621729,'NTN022','NTWQM','NTN','DEDNREC  ','DEDNREC',304191,'6/15/2022','9:45:00',NULL,'','',0,'S ','HVIC','FS2','TDN','',4.81,'MG/L','L01','DEDNREC','','','','nan',38.72917,-75.56139,'T3','2022-06-15'),(10005,621730,'NTN022','NTWQM','NTN','DEDNREC  ','DEDNREC',304191,'7/27/2022','10:45:00',NULL,'','',0,'S ','HVIC','S1','TDN','',5.36,'MG/L','L01','DEDNREC','QQ','','','nan',38.72917,-75.56139,'T3','2022-07-27'),(10005,621731,'NTN022','NTWQM','NTN','DEDNREC  ','DEDNREC',304191,'8/24/2022','8:45:00',NULL,'','',0,'S ','HVIC','S1','TDN','',4.87,'MG/L','L01','DEDNREC','QQ','','','nan',38.72917,-75.56139,'T3','2022-08-24'),(10005,621732,'NTN022','NTWQM','NTN','DEDNREC  ','DEDNREC',304191,'9/29/2022','8:06:00',NULL,'','',0,'S ','HVIC','FS1','TDN','',6.69,'MG/L','L01','DEDNREC','','','','nan',38.72917,-75.56139,'T3','2022-09-29'),(10005,621732,'NTN022','NTWQM','NTN','DEDNREC  ','DEDNREC',304191,'9/29/2022','8:06:00',NULL,'','',0,'S ','HVIC','FS2','TDN','',6.73,'MG/L','L01','DEDNREC','GG','','','Analysis performed after holding time expired.',38.72917,-75.56139,'T3','2022-09-29'),(10005,621727,'NTN022','NTWQM','NTN','DEDNREC  ','DEDNREC',304191,'4/27/2022','10:01:00',NULL,'','',0,'S ','HVIC','S1','TDN','',4.99,'MG/L','L01','DEDNREC','','','','nan',38.72917,-75.56139,'T3','2022-04-27'),(10005,621728,'NTN022','NTWQM','NTN','DEDNREC  ','DEDNREC',304191,'5/18/2022','9:47:00',NULL,'','',0,'S ','HVIC','S1','TDN','',4.79,'MG/L','L01','DEDNREC','','','','nan',38.72917,-75.56139,'T3','2022-05-18'),(10005,621725,'NTN022','NTWQM','NTN','DEDNREC  ','DEDNREC',304191,'3/21/2022','8:21:00',NULL,'','',0,'S ','HVIC','S1','TDN','',5.18,'MG/L','L01','DEDNREC','','','','nan',38.72917,-75.56139,'T3','2022-03-21'),(10005,621726,'NTN022','NTWQM','NTN','DEDNREC  ','DEDNREC',304191,'4/7/2022','9:29:00',NULL,'','',0,'S ','HVIC','FS1','TDN','',3.73,'MG/L','L01','DEDNREC','','','','nan',38.72917,-75.56139,'T3','2022-04-07'),(10005,621726,'NTN022','NTWQM','NTN','DEDNREC  ','DEDNREC',304191,'4/7/2022','9:29:00',NULL,'','',0,'S ','HVIC','FS2','TDN','',3.71,'MG/L','L01','DEDNREC','','','','nan',38.72917,-75.56139,'T3','2022-04-07'),(10005,610450,'NTN021','NTWQM','NTN','DEDNREC  ','DEDNREC',304191,'3/10/2021','8:01:00',NULL,'','',0,'S ','HVIC','FS1','TDP','',0.016,'MG/L','L01','DEDNREC','','','','nan',38.72917,-75.56139,'T3','2021-03-10'),(10005,610450,'NTN021','NTWQM','NTN','DEDNREC  ','DEDNREC',304191,'3/10/2021','8:01:00',NULL,'','',0,'S ','HVIC','FS2','TDP','',0.0161,'MG/L','L01','DEDNREC','','','','nan',38.72917,-75.56139,'T3','2021-03-10'),(10005,610452,'NTN021','NTWQM','NTN','DEDNREC  ','DEDNREC',304191,'5/24/2021','7:28:00',NULL,'','',0,'S ','HVIC','S1','TDP','',0.0203,'MG/L','L01','DEDNREC','','','','nan',38.72917,-75.56139,'T3','2021-05-24'),(10005,610451,'NTN021','NTWQM','NTN','DEDNREC  ','DEDNREC',304191,'4/20/2021','10:18:00',NULL,'','',0,'S ','HVIC','S1','TDP','',0.0179,'MG/L','L01','DEDNREC','GG','','','Analysis performed after holding time expired.',38.72917,-75.56139,'T3','2021-04-20'),(10005,610456,'NTN021','NTWQM','NTN','DEDNREC  ','DEDNREC',304191,'9/2/2021','8:32:00',NULL,'','',0,'S ','HVIC','S1','TDP','',0.212,'MG/L','L01','DEDNREC','','','','nan',38.72917,-75.56139,'T3','2021-09-02'),(10005,610455,'NTN021','NTWQM','NTN','DEDNREC  ','DEDNREC',304191,'8/25/2021','9:47:00',NULL,'','',0,'S ','HVIC','S1','TDP','',0.0395,'MG/L','L01','DEDNREC','','','','nan',38.72917,-75.56139,'T3','2021-08-25'),(10005,610453,'NTN021','NTWQM','NTN','DEDNREC  ','DEDNREC',304191,'6/15/2021','8:37:00',NULL,'','',0,'S ','HVIC','FS1','TDP','',0.031,'MG/L','L01','DEDNREC','','','','nan',38.72917,-75.56139,'T3','2021-06-15'),(10005,610454,'NTN021','NTWQM','NTN','DEDNREC  ','DEDNREC',304191,'7/19/2021','8:57:00',NULL,'','',0,'S ','HVIC','S1','TDP','',0.0181,'MG/L','L01','DEDNREC','','','','nan',38.72917,-75.56139,'T3','2021-07-19'),(10005,610453,'NTN021','NTWQM','NTN','DEDNREC  ','DEDNREC',304191,'6/15/2021','8:37:00',NULL,'','',0,'S ','HVIC','FS2','TDP','',0.0305,'MG/L','L01','DEDNREC','','','','nan',38.72917,-75.56139,'T3','2021-06-15'),(10005,610457,'NTN021','NTWQM','NTN','DEDNREC  ','DEDNREC',304191,'9/22/2021','9:44:00',NULL,'','',0,'S ','HVIC','S1','TDP','',0.0169,'MG/L','L01','DEDNREC','','','','nan',38.72917,-75.56139,'T3','2021-09-22'),(10005,621726,'NTN022','NTWQM','NTN','DEDNREC  ','DEDNREC',304191,'4/7/2022','9:29:00',NULL,'','',0,'S ','HVIC','FS1','TDP','',0.114,'MG/L','L01','DEDNREC','','','','nan',38.72917,-75.56139,'T3','2022-04-07'),(10005,621725,'NTN022','NTWQM','NTN','DEDNREC  ','DEDNREC',304191,'3/21/2022','8:21:00',NULL,'','',0,'S ','HVIC','S1','TDP','',0.0098,'MG/L','L01','DEDNREC','','','','nan',38.72917,-75.56139,'T3','2022-03-21'),(10005,621728,'NTN022','NTWQM','NTN','DEDNREC  ','DEDNREC',304191,'5/18/2022','9:47:00',NULL,'','',0,'S ','HVIC','S1','TDP','',0.0146,'MG/L','L01','DEDNREC','','','','nan',38.72917,-75.56139,'T3','2022-05-18'),(10005,621727,'NTN022','NTWQM','NTN','DEDNREC  ','DEDNREC',304191,'4/27/2022','10:01:00',NULL,'','',0,'S ','HVIC','S1','TDP','G',0.0144,'MG/L','L01','DEDNREC','','','','nan',38.72917,-75.56139,'T3','2022-04-27'),(10005,621726,'NTN022','NTWQM','NTN','DEDNREC  ','DEDNREC',304191,'4/7/2022','9:29:00',NULL,'','',0,'S ','HVIC','FS2','TDP','',0.114,'MG/L','L01','DEDNREC','','','','nan',38.72917,-75.56139,'T3','2022-04-07'),(10005,621732,'NTN022','NTWQM','NTN','DEDNREC  ','DEDNREC',304191,'9/29/2022','8:06:00',NULL,'','',0,'S ','HVIC','FS2','TDP','',0.0148,'MG/L','L01','DEDNREC','','','','nan',38.72917,-75.56139,'T3','2022-09-29'),(10005,621732,'NTN022','NTWQM','NTN','DEDNREC  ','DEDNREC',304191,'9/29/2022','8:06:00',NULL,'','',0,'S ','HVIC','FS1','TDP','',0.0134,'MG/L','L01','DEDNREC','','','','nan',38.72917,-75.56139,'T3','2022-09-29'),(10005,621731,'NTN022','NTWQM','NTN','DEDNREC  ','DEDNREC',304191,'8/24/2022','8:45:00',NULL,'','',0,'S ','HVIC','S1','TDP','',0.0127,'MG/L','L01','DEDNREC','','','','nan',38.72917,-75.56139,'T3','2022-08-24'),(10005,621730,'NTN022','NTWQM','NTN','DEDNREC  ','DEDNREC',304191,'7/27/2022','10:45:00',NULL,'','',0,'S ','HVIC','S1','TDP','',0.0123,'MG/L','L01','DEDNREC','','','','nan',38.72917,-75.56139,'T3','2022-07-27'),(10005,621729,'NTN022','NTWQM','NTN','DEDNREC  ','DEDNREC',304191,'6/15/2022','9:45:00',NULL,'','',0,'S ','HVIC','FS1','TDP','',0.0261,'MG/L','L01','DEDNREC','','','','nan',38.72917,-75.56139,'T3','2022-06-15'),(10005,621729,'NTN022','NTWQM','NTN','DEDNREC  ','DEDNREC',304191,'6/15/2022','9:45:00',NULL,'','',0,'S ','HVIC','FS2','TDP','',0.0253,'MG/L','L01','DEDNREC','','','','nan',38.72917,-75.56139,'T3','2022-06-15'),(10005,621723,'NTN022','NTWQM','NTN','DEDNREC  ','DEDNREC',304191,'1/26/2022','8:25:00',NULL,'','',0,'S ','HVIC','S1','TDP','',0.0176,'MG/L','L01','DEDNREC','','','','nan',38.72917,-75.56139,'T3','2022-01-26'),(10005,621724,'NTN022','NTWQM','NTN','DEDNREC  ','DEDNREC',304191,'2/23/2022','9:37:00',NULL,'','',0,'S ','HVIC','S1','TDP','',0.0116,'MG/L','L01','DEDNREC','','','','nan',38.72917,-75.56139,'T3','2022-02-23'),(10005,621722,'NTN022','NTWQM','NTN','DEDNREC  ','DEDNREC',304191,'12/15/2021','9:14:00',NULL,'','',0,'S ','HVIC','S1','TDP','',0.0102,'MG/L','L01','DEDNREC','','','','nan',38.72917,-75.56139,'T3','2021-12-15'),(10005,621721,'NTN022','NTWQM','NTN','DEDNREC  ','DEDNREC',304191,'11/8/2021','7:55:00',NULL,'','',0,'S ','HVIC','S1','TDP','',0.0142,'MG/L','L01','DEDNREC','','','','nan',38.72917,-75.56139,'T3','2021-11-08'),(10005,621720,'NTN022','NTWQM','NTN','DEDNREC  ','DEDNREC',304191,'10/18/2021','10:05:00',NULL,'','',0,'S ','HVIC','S1','TDP','',0.0117,'MG/L','L01','DEDNREC','','','','nan',38.72917,-75.56139,'T3','2021-10-18'),(10005,610454,'NTN021','NTWQM','NTN','DEDNREC  ','DEDNREC',304191,'7/19/2021','8:57:00',NULL,'','',0,'S ','HVIC','S1','TKNW','',0.483,'MG/L','D01','DEDNREC','','','','nan',38.72917,-75.56139,'T3','2021-07-19'),(10005,610456,'NTN021','NTWQM','NTN','DEDNREC  ','DEDNREC',304191,'9/2/2021','8:32:00',NULL,'','',0,'S ','HVIC','S1','TKNW','',1.251,'MG/L','D01','DEDNREC','','','','nan',38.72917,-75.56139,'T3','2021-09-02'),(10005,610455,'NTN021','NTWQM','NTN','DEDNREC  ','DEDNREC',304191,'8/25/2021','9:47:00',NULL,'','',0,'S ','HVIC','S1','TKNW','',0.625,'MG/L','D01','DEDNREC','','','','nan',38.72917,-75.56139,'T3','2021-08-25'),(10005,610457,'NTN021','NTWQM','NTN','DEDNREC  ','DEDNREC',304191,'9/22/2021','9:44:00',NULL,'','',0,'S ','HVIC','S1','TKNW','',-0.137,'MG/L','D01','DEDNREC','NV','','','nan',38.72917,-75.56139,'T3','2021-09-22'),(10005,610452,'NTN021','NTWQM','NTN','DEDNREC  ','DEDNREC',304191,'5/24/2021','7:28:00',NULL,'','',0,'S ','HVIC','S1','TKNW','',0.335,'MG/L','D01','DEDNREC','','','','nan',38.72917,-75.56139,'T3','2021-05-24'),(10005,610453,'NTN021','NTWQM','NTN','DEDNREC  ','DEDNREC',304191,'6/15/2021','8:37:00',NULL,'','',0,'S ','HVIC','FS1','TKNW','',0.439,'MG/L','D01','DEDNREC','','','','nan',38.72917,-75.56139,'T3','2021-06-15'),(10005,610453,'NTN021','NTWQM','NTN','DEDNREC  ','DEDNREC',304191,'6/15/2021','8:37:00',NULL,'','',0,'S ','HVIC','FS2','TKNW','',0.413,'MG/L','D01','DEDNREC','','','','nan',38.72917,-75.56139,'T3','2021-06-15'),(10005,610451,'NTN021','NTWQM','NTN','DEDNREC  ','DEDNREC',304191,'4/20/2021','10:18:00',NULL,'','',0,'S ','HVIC','S1','TKNW','',0.64,'MG/L','D01','DEDNREC','','','','nan',38.72917,-75.56139,'T3','2021-04-20'),(10005,610450,'NTN021','NTWQM','NTN','DEDNREC  ','DEDNREC',304191,'3/10/2021','8:01:00',NULL,'','',0,'S ','HVIC','FS1','TKNW','',-0.837,'MG/L','D01','DEDNREC','NV','','','nan',38.72917,-75.56139,'T3','2021-03-10'),(10005,610450,'NTN021','NTWQM','NTN','DEDNREC  ','DEDNREC',304191,'3/10/2021','8:01:00',NULL,'','',0,'S ','HVIC','FS2','TKNW','',-0.073,'MG/L','D01','DEDNREC','NV','','','nan',38.72917,-75.56139,'T3','2021-03-10'),(10005,610449,'NTN021','NTWQM','NTN','DEDNREC  ','DEDNREC',304191,'2/24/2021','10:10:00',NULL,'','',0,'S ','HVIC','S1','TKNW','',0.154,'MG/L','D01','DEDNREC','','','','nan',38.72917,-75.56139,'T3','2021-02-24'),(10005,610447,'NTN021','NTWQM','NTN','DEDNREC  ','DEDNREC',304191,'1/28/2021','11:26:00',NULL,'','',0,'S ','HVIC','S1','TKNW','',0.192,'MG/L','D01','DEDNREC','','','','nan',38.72917,-75.56139,'T3','2021-01-28'),(10005,610448,'NTN021','NTWQM','NTN','DEDNREC  ','DEDNREC',304191,'2/2/2021','9:25:00',NULL,'','',0,'S ','HVIC','FS1','TKNW','',0.013,'MG/L','D01','DEDNREC','','','','nan',38.72917,-75.56139,'T3','2021-02-02'),(10005,610448,'NTN021','NTWQM','NTN','DEDNREC  ','DEDNREC',304191,'2/2/2021','9:25:00',NULL,'','',0,'S ','HVIC','FS2','TKNW','',0.076,'MG/L','D01','DEDNREC','','','','nan',38.72917,-75.56139,'T3','2021-02-02'),(10005,621720,'NTN022','NTWQM','NTN','DEDNREC  ','DEDNREC',304191,'10/18/2021','10:05:00',NULL,'','',0,'S ','HVIC','S1','TKNW','',0.391,'MG/L','D01','DEDNREC','','','','nan',38.72917,-75.56139,'T3','2021-10-18'),(10005,621721,'NTN022','NTWQM','NTN','DEDNREC  ','DEDNREC',304191,'11/8/2021','7:55:00',NULL,'','',0,'S ','HVIC','S1','TKNW','',0.123,'MG/L','D01','DEDNREC','','','','nan',38.72917,-75.56139,'T3','2021-11-08'),(10005,621722,'NTN022','NTWQM','NTN','DEDNREC  ','DEDNREC',304191,'12/15/2021','9:14:00',NULL,'','',0,'S ','HVIC','S1','TKNW','',0.237,'MG/L','D01','DEDNREC','','','','nan',38.72917,-75.56139,'T3','2021-12-15'),(10005,621724,'NTN022','NTWQM','NTN','DEDNREC  ','DEDNREC',304191,'2/23/2022','9:37:00',NULL,'','',0,'S ','HVIC','S1','TKNW','',-0.082,'MG/L','D01','DEDNREC','NV','','','nan',38.72917,-75.56139,'T3','2022-02-23'),(10005,621723,'NTN022','NTWQM','NTN','DEDNREC  ','DEDNREC',304191,'1/26/2022','8:25:00',NULL,'','',0,'S ','HVIC','S1','TKNW','',0.217,'MG/L','D01','DEDNREC','','','','nan',38.72917,-75.56139,'T3','2022-01-26'),(10005,621729,'NTN022','NTWQM','NTN','DEDNREC  ','DEDNREC',304191,'6/15/2022','9:45:00',NULL,'','',0,'S ','HVIC','FS1','TKNW','',0.154,'MG/L','D01','DEDNREC','','','','nan',38.72917,-75.56139,'T3','2022-06-15'),(10005,621729,'NTN022','NTWQM','NTN','DEDNREC  ','DEDNREC',304191,'6/15/2022','9:45:00',NULL,'','',0,'S ','HVIC','FS2','TKNW','',0.254,'MG/L','D01','DEDNREC','','','','nan',38.72917,-75.56139,'T3','2022-06-15'),(10005,621730,'NTN022','NTWQM','NTN','DEDNREC  ','DEDNREC',304191,'7/27/2022','10:45:00',NULL,'','',0,'S ','HVIC','S1','TKNW','',-0.095,'MG/L','D01','DEDNREC','NV','','','nan',38.72917,-75.56139,'T3','2022-07-27'),(10005,621731,'NTN022','NTWQM','NTN','DEDNREC  ','DEDNREC',304191,'8/24/2022','8:45:00',NULL,'','',0,'S ','HVIC','S1','TKNW','',0.126,'MG/L','D01','DEDNREC','','','','nan',38.72917,-75.56139,'T3','2022-08-24'),(10005,621732,'NTN022','NTWQM','NTN','DEDNREC  ','DEDNREC',304191,'9/29/2022','8:06:00',NULL,'','',0,'S ','HVIC','FS1','TKNW','',0.301,'MG/L','D01','DEDNREC','','','','nan',38.72917,-75.56139,'T3','2022-09-29'),(10005,621732,'NTN022','NTWQM','NTN','DEDNREC  ','DEDNREC',304191,'9/29/2022','8:06:00',NULL,'','',0,'S ','HVIC','FS2','TKNW','',0.309,'MG/L','D01','DEDNREC','GG','','','Analysis performed after holding time expired.',38.72917,-75.56139,'T3','2022-09-29'),(10005,621728,'NTN022','NTWQM','NTN','DEDNREC  ','DEDNREC',304191,'5/18/2022','9:47:00',NULL,'','',0,'S ','HVIC','S1','TKNW','',0.086,'MG/L','D01','DEDNREC','','','','nan',38.72917,-75.56139,'T3','2022-05-18'),(10005,621727,'NTN022','NTWQM','NTN','DEDNREC  ','DEDNREC',304191,'4/27/2022','10:01:00',NULL,'','',0,'S ','HVIC','S1','TKNW','',0.306,'MG/L','D01','DEDNREC','','','','nan',38.72917,-75.56139,'T3','2022-04-27'),(10005,621725,'NTN022','NTWQM','NTN','DEDNREC  ','DEDNREC',304191,'3/21/2022','8:21:00',NULL,'','',0,'S ','HVIC','S1','TKNW','',-0.007,'MG/L','D01','DEDNREC','NV','','','nan',38.72917,-75.56139,'T3','2022-03-21'),(10005,621726,'NTN022','NTWQM','NTN','DEDNREC  ','DEDNREC',304191,'4/7/2022','9:29:00',NULL,'','',0,'S ','HVIC','FS1','TKNW','',0.861,'MG/L','D01','DEDNREC','','','','nan',38.72917,-75.56139,'T3','2022-04-07'),(10005,621726,'NTN022','NTWQM','NTN','DEDNREC  ','DEDNREC',304191,'4/7/2022','9:29:00',NULL,'','',0,'S ','HVIC','FS2','TKNW','',0.947,'MG/L','D01','DEDNREC','','','','nan',38.72917,-75.56139,'T3','2022-04-07'),(10005,610447,'NTN021','NTWQM','NTN','DEDNREC  ','DEDNREC',304191,'1/28/2021','11:26:00',NULL,'','',0,'S ','HVIC','S1','TN','',6.87,'MG/L','L01','DEDNREC','','','','nan',38.72917,-75.56139,'T3','2021-01-28'),(10005,610448,'NTN021','NTWQM','NTN','DEDNREC  ','DEDNREC',304191,'2/2/2021','9:25:00',NULL,'','',0,'S ','HVIC','FS2','TN','',5.28,'MG/L','L01','DEDNREC','','','','nan',38.72917,-75.56139,'T3','2021-02-02'),(10005,610449,'NTN021','NTWQM','NTN','DEDNREC  ','DEDNREC',304191,'2/24/2021','10:10:00',NULL,'','',0,'S ','HVIC','S1','TN','',5.18,'MG/L','L01','DEDNREC','','','','nan',38.72917,-75.56139,'T3','2021-02-24'),(10005,610448,'NTN021','NTWQM','NTN','DEDNREC  ','DEDNREC',304191,'2/2/2021','9:25:00',NULL,'','',0,'S ','HVIC','FS1','TN','',5.31,'MG/L','L01','DEDNREC','','','','nan',38.72917,-75.56139,'T3','2021-02-02'),(10005,610450,'NTN021','NTWQM','NTN','DEDNREC  ','DEDNREC',304191,'3/10/2021','8:01:00',NULL,'','',0,'S ','HVIC','FS1','TN','',6.49,'MG/L','L01','DEDNREC','NQ','','','nan',38.72917,-75.56139,'T3','2021-03-10'),(10005,610451,'NTN021','NTWQM','NTN','DEDNREC  ','DEDNREC',304191,'4/20/2021','10:18:00',NULL,'','',0,'S ','HVIC','S1','TN','',5.9,'MG/L','L01','DEDNREC','','','','nan',38.72917,-75.56139,'T3','2021-04-20'),(10005,610450,'NTN021','NTWQM','NTN','DEDNREC  ','DEDNREC',304191,'3/10/2021','8:01:00',NULL,'','',0,'S ','HVIC','FS2','TN','',6.25,'MG/L','L01','DEDNREC','QQ','','','nan',38.72917,-75.56139,'T3','2021-03-10'),(10005,610452,'NTN021','NTWQM','NTN','DEDNREC  ','DEDNREC',304191,'5/24/2021','7:28:00',NULL,'','',0,'S ','HVIC','S1','TN','',5.99,'MG/L','L01','DEDNREC','','','','nan',38.72917,-75.56139,'T3','2021-05-24'),(10005,610457,'NTN021','NTWQM','NTN','DEDNREC  ','DEDNREC',304191,'9/22/2021','9:44:00',NULL,'','',0,'S ','HVIC','S1','TN','',5.85,'MG/L','L01','DEDNREC','QQ','','','nan',38.72917,-75.56139,'T3','2021-09-22'),(10005,610456,'NTN021','NTWQM','NTN','DEDNREC  ','DEDNREC',304191,'9/2/2021','8:32:00',NULL,'','',0,'S ','HVIC','S1','TN','',2.07,'MG/L','L01','DEDNREC','','','','nan',38.72917,-75.56139,'T3','2021-09-02'),(10005,610455,'NTN021','NTWQM','NTN','DEDNREC  ','DEDNREC',304191,'8/25/2021','9:47:00',NULL,'','',0,'S ','HVIC','S1','TN','',5.29,'MG/L','L01','DEDNREC','','','','nan',38.72917,-75.56139,'T3','2021-08-25'),(10005,610454,'NTN021','NTWQM','NTN','DEDNREC  ','DEDNREC',304191,'7/19/2021','8:57:00',NULL,'','',0,'S ','HVIC','S1','TN','',6.13,'MG/L','L01','DEDNREC','','','','nan',38.72917,-75.56139,'T3','2021-07-19'),(10005,610453,'NTN021','NTWQM','NTN','DEDNREC  ','DEDNREC',304191,'6/15/2021','8:37:00',NULL,'','',0,'S ','HVIC','FS2','TN','',5.07,'MG/L','L01','DEDNREC','','','','nan',38.72917,-75.56139,'T3','2021-06-15'),(10005,610453,'NTN021','NTWQM','NTN','DEDNREC  ','DEDNREC',304191,'6/15/2021','8:37:00',NULL,'','',0,'S ','HVIC','FS1','TN','',5.09,'MG/L','L01','DEDNREC','','','','nan',38.72917,-75.56139,'T3','2021-06-15'),(10005,621726,'NTN022','NTWQM','NTN','DEDNREC  ','DEDNREC',304191,'4/7/2022','9:29:00',NULL,'','',0,'S ','HVIC','FS2','TN','',3.97,'MG/L','L01','DEDNREC','','','','nan',38.72917,-75.56139,'T3','2022-04-07'),(10005,621726,'NTN022','NTWQM','NTN','DEDNREC  ','DEDNREC',304191,'4/7/2022','9:29:00',NULL,'','',0,'S ','HVIC','FS1','TN','',3.97,'MG/L','L01','DEDNREC','','','','nan',38.72917,-75.56139,'T3','2022-04-07'),(10005,621725,'NTN022','NTWQM','NTN','DEDNREC  ','DEDNREC',304191,'3/21/2022','8:21:00',NULL,'','',0,'S ','HVIC','S1','TN','',5.29,'MG/L','L01','DEDNREC','QQ','','','nan',38.72917,-75.56139,'T3','2022-03-21'),(10005,621728,'NTN022','NTWQM','NTN','DEDNREC  ','DEDNREC',304191,'5/18/2022','9:47:00',NULL,'','',0,'S ','HVIC','S1','TN','',4.79,'MG/L','L01','DEDNREC','','','','nan',38.72917,-75.56139,'T3','2022-05-18'),(10005,621727,'NTN022','NTWQM','NTN','DEDNREC  ','DEDNREC',304191,'4/27/2022','10:01:00',NULL,'','',0,'S ','HVIC','S1','TN','',5.37,'MG/L','L01','DEDNREC','','','','nan',38.72917,-75.56139,'T3','2022-04-27'),(10005,621731,'NTN022','NTWQM','NTN','DEDNREC  ','DEDNREC',304191,'8/24/2022','8:45:00',NULL,'','',0,'S ','HVIC','S1','TN','',4.9,'MG/L','L01','DEDNREC','','','','nan',38.72917,-75.56139,'T3','2022-08-24'),(10005,621732,'NTN022','NTWQM','NTN','DEDNREC  ','DEDNREC',304191,'9/29/2022','8:06:00',NULL,'','',0,'S ','HVIC','FS1','TN','',6.89,'MG/L','L01','DEDNREC','','','','nan',38.72917,-75.56139,'T3','2022-09-29'),(10005,621729,'NTN022','NTWQM','NTN','DEDNREC  ','DEDNREC',304191,'6/15/2022','9:45:00',NULL,'','',0,'S ','HVIC','FS1','TN','',4.84,'MG/L','L01','DEDNREC','','','','nan',38.72917,-75.56139,'T3','2022-06-15'),(10005,621730,'NTN022','NTWQM','NTN','DEDNREC  ','DEDNREC',304191,'7/27/2022','10:45:00',NULL,'','',0,'S ','HVIC','S1','TN','',5.45,'MG/L','L01','DEDNREC','QQ','','','nan',38.72917,-75.56139,'T3','2022-07-27'),(10005,621729,'NTN022','NTWQM','NTN','DEDNREC  ','DEDNREC',304191,'6/15/2022','9:45:00',NULL,'','',0,'S ','HVIC','FS2','TN','',4.93,'MG/L','L01','DEDNREC','','','','nan',38.72917,-75.56139,'T3','2022-06-15'),(10005,621723,'NTN022','NTWQM','NTN','DEDNREC  ','DEDNREC',304191,'1/26/2022','8:25:00',NULL,'','',0,'S ','HVIC','S1','TN','',6.32,'MG/L','L01','DEDNREC','','','','nan',38.72917,-75.56139,'T3','2022-01-26'),(10005,621724,'NTN022','NTWQM','NTN','DEDNREC  ','DEDNREC',304191,'2/23/2022','9:37:00',NULL,'','',0,'S ','HVIC','S1','TN','',5.96,'MG/L','L01','DEDNREC','QQ','','','nan',38.72917,-75.56139,'T3','2022-02-23'),(10005,621721,'NTN022','NTWQM','NTN','DEDNREC  ','DEDNREC',304191,'11/8/2021','7:55:00',NULL,'','',0,'S ','HVIC','S1','TN','',6.97,'MG/L','L01','DEDNREC','','','','nan',38.72917,-75.56139,'T3','2021-11-08'),(10005,621722,'NTN022','NTWQM','NTN','DEDNREC  ','DEDNREC',304191,'12/15/2021','9:14:00',NULL,'','',0,'S ','HVIC','S1','TN','',7.36,'MG/L','L01','DEDNREC','','','','nan',38.72917,-75.56139,'T3','2021-12-15'),(10005,621720,'NTN022','NTWQM','NTN','DEDNREC  ','DEDNREC',304191,'10/18/2021','10:05:00',NULL,'','',0,'S ','HVIC','S1','TN','',6.29,'MG/L','L01','DEDNREC','','','','nan',38.72917,-75.56139,'T3','2021-10-18'),(10005,621732,'NTN022','NTWQM','NTN','DEDNREC  ','DEDNREC',304191,'9/29/2022','8:06:00',NULL,'','',0,'S ','HVIC','FS2','TN','',6.92,'MG/L','L01','DEDNREC','GG','','','Analysis performed after holding time expired.',38.72917,-75.56139,'T3','2022-09-29'),(10005,610453,'NTN021','NTWQM','NTN','DEDNREC  ','DEDNREC',304191,'6/15/2021','8:37:00',NULL,'','',0,'S ','HVIC','FS1','TOC','',3.506,'MG/L','L01','DEDNREC','','','','nan',38.72917,-75.56139,'T3','2021-06-15'),(10005,610453,'NTN021','NTWQM','NTN','DEDNREC  ','DEDNREC',304191,'6/15/2021','8:37:00',NULL,'','',0,'S ','HVIC','FS2','TOC','',3.429,'MG/L','L01','DEDNREC','','','','nan',38.72917,-75.56139,'T3','2021-06-15'),(10005,610454,'NTN021','NTWQM','NTN','DEDNREC  ','DEDNREC',304191,'7/19/2021','8:57:00',NULL,'','',0,'S ','HVIC','S1','TOC','',2.225,'MG/L','L01','DEDNREC','','','','nan',38.72917,-75.56139,'T3','2021-07-19'),(10005,610455,'NTN021','NTWQM','NTN','DEDNREC  ','DEDNREC',304191,'8/25/2021','9:47:00',NULL,'','',0,'S ','HVIC','S1','TOC','',3.459,'MG/L','L01','DEDNREC','','','','nan',38.72917,-75.56139,'T3','2021-08-25'),(10005,610456,'NTN021','NTWQM','NTN','DEDNREC  ','DEDNREC',304191,'9/2/2021','8:32:00',NULL,'','',0,'S ','HVIC','S1','TOC','',8.145,'MG/L','L01','DEDNREC','QQ','','','nan',38.72917,-75.56139,'T3','2021-09-02'),(10005,610457,'NTN021','NTWQM','NTN','DEDNREC  ','DEDNREC',304191,'9/22/2021','9:44:00',NULL,'','',0,'S ','HVIC','S1','TOC','',2.513,'MG/L','L01','DEDNREC','','','','nan',38.72917,-75.56139,'T3','2021-09-22'),(10005,610452,'NTN021','NTWQM','NTN','DEDNREC  ','DEDNREC',304191,'5/24/2021','7:28:00',NULL,'','',0,'S ','HVIC','S1','TOC','',2.391,'MG/L','L01','DEDNREC','','','','nan',38.72917,-75.56139,'T3','2021-05-24'),(10005,610450,'NTN021','NTWQM','NTN','DEDNREC  ','DEDNREC',304191,'3/10/2021','8:01:00',NULL,'','',0,'S ','HVIC','FS2','TOC','',2.225,'MG/L','L01','DEDNREC','','','','nan',38.72917,-75.56139,'T3','2021-03-10'),(10005,610451,'NTN021','NTWQM','NTN','DEDNREC  ','DEDNREC',304191,'4/20/2021','10:18:00',NULL,'','',0,'S ','HVIC','S1','TOC','',2.444,'MG/L','L01','DEDNREC','','','','nan',38.72917,-75.56139,'T3','2021-04-20'),(10005,610450,'NTN021','NTWQM','NTN','DEDNREC  ','DEDNREC',304191,'3/10/2021','8:01:00',NULL,'','',0,'S ','HVIC','FS1','TOC','',2.368,'MG/L','L01','DEDNREC','','','','nan',38.72917,-75.56139,'T3','2021-03-10'),(10005,610448,'NTN021','NTWQM','NTN','DEDNREC  ','DEDNREC',304191,'2/2/2021','9:25:00',NULL,'','',0,'S ','HVIC','FS1','TOC','',3.926,'MG/L','L01','DEDNREC','','','','nan',38.72917,-75.56139,'T3','2021-02-02'),(10005,610449,'NTN021','NTWQM','NTN','DEDNREC  ','DEDNREC',304191,'2/24/2021','10:10:00',NULL,'','',0,'S ','HVIC','S1','TOC','',4.545,'MG/L','L01','DEDNREC','GG','','','Analysis performed after holding time expired.',38.72917,-75.56139,'T3','2021-02-24'),(10005,610447,'NTN021','NTWQM','NTN','DEDNREC  ','DEDNREC',304191,'1/28/2021','11:26:00',NULL,'','',0,'S ','HVIC','S1','TOC','',1.745,'MG/L','L01','DEDNREC','','','','nan',38.72917,-75.56139,'T3','2021-01-28'),(10005,610448,'NTN021','NTWQM','NTN','DEDNREC  ','DEDNREC',304191,'2/2/2021','9:25:00',NULL,'','',0,'S ','HVIC','FS2','TOC','',3.928,'MG/L','L01','DEDNREC','','','','nan',38.72917,-75.56139,'T3','2021-02-02'),(10005,621732,'NTN022','NTWQM','NTN','DEDNREC  ','DEDNREC',304191,'9/29/2022','8:06:00',NULL,'','',0,'S ','HVIC','FS2','TOC','',1.498,'MG/L','L01','DEDNREC','','','','nan',38.72917,-75.56139,'T3','2022-09-29'),(10005,621720,'NTN022','NTWQM','NTN','DEDNREC  ','DEDNREC',304191,'10/18/2021','10:05:00',NULL,'','',0,'S ','HVIC','S1','TOC','',2.124,'MG/L','L01','DEDNREC','','','','nan',38.72917,-75.56139,'T3','2021-10-18'),(10005,621721,'NTN022','NTWQM','NTN','DEDNREC  ','DEDNREC',304191,'11/8/2021','7:55:00',NULL,'','',0,'S ','HVIC','S1','TOC','',1.879,'MG/L','L01','DEDNREC','','','','nan',38.72917,-75.56139,'T3','2021-11-08'),(10005,621724,'NTN022','NTWQM','NTN','DEDNREC  ','DEDNREC',304191,'2/23/2022','9:37:00',NULL,'','',0,'S ','HVIC','S1','TOC','',1.615,'MG/L','L01','DEDNREC','','','','nan',38.72917,-75.56139,'T3','2022-02-23'),(10005,621722,'NTN022','NTWQM','NTN','DEDNREC  ','DEDNREC',304191,'12/15/2021','9:14:00',NULL,'','',0,'S ','HVIC','S1','TOC','',1.275,'MG/L','L01','DEDNREC','','','','nan',38.72917,-75.56139,'T3','2021-12-15'),(10005,621723,'NTN022','NTWQM','NTN','DEDNREC  ','DEDNREC',304191,'1/26/2022','8:25:00',NULL,'','',0,'S ','HVIC','S1','TOC','',1.67,'MG/L','L01','DEDNREC','','','','nan',38.72917,-75.56139,'T3','2022-01-26'),(10005,621729,'NTN022','NTWQM','NTN','DEDNREC  ','DEDNREC',304191,'6/15/2022','9:45:00',NULL,'','',0,'S ','HVIC','FS1','TOC','',2.454,'MG/L','L01','DEDNREC','','','','nan',38.72917,-75.56139,'T3','2022-06-15'),(10005,621730,'NTN022','NTWQM','NTN','DEDNREC  ','DEDNREC',304191,'7/27/2022','10:45:00',NULL,'','',0,'S ','HVIC','S1','TOC','',1.808,'MG/L','L01','DEDNREC','','','','nan',38.72917,-75.56139,'T3','2022-07-27'),(10005,621731,'NTN022','NTWQM','NTN','DEDNREC  ','DEDNREC',304191,'8/24/2022','8:45:00',NULL,'','',0,'S ','HVIC','S1','TOC','',2.216,'MG/L','L01','DEDNREC','','','','nan',38.72917,-75.56139,'T3','2022-08-24'),(10005,621732,'NTN022','NTWQM','NTN','DEDNREC  ','DEDNREC',304191,'9/29/2022','8:06:00',NULL,'','',0,'S ','HVIC','FS1','TOC','',1.52,'MG/L','L01','DEDNREC','','','','nan',38.72917,-75.56139,'T3','2022-09-29'),(10005,621727,'NTN022','NTWQM','NTN','DEDNREC  ','DEDNREC',304191,'4/27/2022','10:01:00',NULL,'','',0,'S ','HVIC','S1','TOC','',2.478,'MG/L','L01','DEDNREC','','','','nan',38.72917,-75.56139,'T3','2022-04-27'),(10005,621729,'NTN022','NTWQM','NTN','DEDNREC  ','DEDNREC',304191,'6/15/2022','9:45:00',NULL,'','',0,'S ','HVIC','FS2','TOC','',2.542,'MG/L','L01','DEDNREC','','','','nan',38.72917,-75.56139,'T3','2022-06-15'),(10005,621728,'NTN022','NTWQM','NTN','DEDNREC  ','DEDNREC',304191,'5/18/2022','9:47:00',NULL,'','',0,'S ','HVIC','S1','TOC','',2.553,'MG/L','L01','DEDNREC','','','','nan',38.72917,-75.56139,'T3','2022-05-18'),(10005,621725,'NTN022','NTWQM','NTN','DEDNREC  ','DEDNREC',304191,'3/21/2022','8:21:00',NULL,'','',0,'S ','HVIC','S1','TOC','',2.198,'MG/L','L01','DEDNREC','','','','nan',38.72917,-75.56139,'T3','2022-03-21'),(10005,621726,'NTN022','NTWQM','NTN','DEDNREC  ','DEDNREC',304191,'4/7/2022','9:29:00',NULL,'','',0,'S ','HVIC','FS1','TOC','',7.519,'MG/L','L01','DEDNREC','','','','nan',38.72917,-75.56139,'T3','2022-04-07'),(10005,621726,'NTN022','NTWQM','NTN','DEDNREC  ','DEDNREC',304191,'4/7/2022','9:29:00',NULL,'','',0,'S ','HVIC','FS2','TOC','',7.503,'MG/L','L01','DEDNREC','QQ','','','nan',38.72917,-75.56139,'T3','2022-04-07'),(10005,610448,'NTN021','NTWQM','NTN','DEDNREC  ','DEDNREC',304191,'2/2/2021','9:25:00',NULL,'','',0,'S ','HVIC','FS2','TP','',0.0741,'MG/L','L01','DEDNREC','','','','nan',38.72917,-75.56139,'T3','2021-02-02'),(10005,610448,'NTN021','NTWQM','NTN','DEDNREC  ','DEDNREC',304191,'2/2/2021','9:25:00',NULL,'','',0,'S ','HVIC','FS1','TP','',0.0732,'MG/L','L01','DEDNREC','','','','nan',38.72917,-75.56139,'T3','2021-02-02'),(10005,610447,'NTN021','NTWQM','NTN','DEDNREC  ','DEDNREC',304191,'1/28/2021','11:26:00',NULL,'','',0,'S ','HVIC','S1','TP','',0.0407,'MG/L','L01','DEDNREC','','','','nan',38.72917,-75.56139,'T3','2021-01-28'),(10005,610449,'NTN021','NTWQM','NTN','DEDNREC  ','DEDNREC',304191,'2/24/2021','10:10:00',NULL,'','',0,'S ','HVIC','S1','TP','',0.055,'MG/L','L01','DEDNREC','','','','nan',38.72917,-75.56139,'T3','2021-02-24'),(10005,610450,'NTN021','NTWQM','NTN','DEDNREC  ','DEDNREC',304191,'3/10/2021','8:01:00',NULL,'','',0,'S ','HVIC','FS1','TP','',0.0284,'MG/L','L01','DEDNREC','','','','nan',38.72917,-75.56139,'T3','2021-03-10'),(10005,610450,'NTN021','NTWQM','NTN','DEDNREC  ','DEDNREC',304191,'3/10/2021','8:01:00',NULL,'','',0,'S ','HVIC','FS2','TP','',0.0272,'MG/L','L01','DEDNREC','','','','nan',38.72917,-75.56139,'T3','2021-03-10'),(10005,610451,'NTN021','NTWQM','NTN','DEDNREC  ','DEDNREC',304191,'4/20/2021','10:18:00',NULL,'','',0,'S ','HVIC','S1','TP','',0.0342,'MG/L','L01','DEDNREC','','','','nan',38.72917,-75.56139,'T3','2021-04-20'),(10005,610452,'NTN021','NTWQM','NTN','DEDNREC  ','DEDNREC',304191,'5/24/2021','7:28:00',NULL,'','',0,'S ','HVIC','S1','TP','',0.0494,'MG/L','L01','DEDNREC','','','','nan',38.72917,-75.56139,'T3','2021-05-24'),(10005,610456,'NTN021','NTWQM','NTN','DEDNREC  ','DEDNREC',304191,'9/2/2021','8:32:00',NULL,'','',0,'S ','HVIC','S1','TP','',0.483,'MG/L','L01','DEDNREC','','','','nan',38.72917,-75.56139,'T3','2021-09-02'),(10005,610455,'NTN021','NTWQM','NTN','DEDNREC  ','DEDNREC',304191,'8/25/2021','9:47:00',NULL,'','',0,'S ','HVIC','S1','TP','',0.0678,'MG/L','L01','DEDNREC','','','','nan',38.72917,-75.56139,'T3','2021-08-25'),(10005,610454,'NTN021','NTWQM','NTN','DEDNREC  ','DEDNREC',304191,'7/19/2021','8:57:00',NULL,'','',0,'S ','HVIC','S1','TP','',0.0745,'MG/L','L01','DEDNREC','','','','nan',38.72917,-75.56139,'T3','2021-07-19'),(10005,610453,'NTN021','NTWQM','NTN','DEDNREC  ','DEDNREC',304191,'6/15/2021','8:37:00',NULL,'','',0,'S ','HVIC','FS2','TP','',0.0789,'MG/L','L01','DEDNREC','','','','nan',38.72917,-75.56139,'T3','2021-06-15'),(10005,610453,'NTN021','NTWQM','NTN','DEDNREC  ','DEDNREC',304191,'6/15/2021','8:37:00',NULL,'','',0,'S ','HVIC','FS1','TP','',0.0769,'MG/L','L01','DEDNREC','','','','nan',38.72917,-75.56139,'T3','2021-06-15'),(10005,610457,'NTN021','NTWQM','NTN','DEDNREC  ','DEDNREC',304191,'9/22/2021','9:44:00',NULL,'','',0,'S ','HVIC','S1','TP','',0.0301,'MG/L','L01','DEDNREC','','','','nan',38.72917,-75.56139,'T3','2021-09-22'),(10005,621726,'NTN022','NTWQM','NTN','DEDNREC  ','DEDNREC',304191,'4/7/2022','9:29:00',NULL,'','',0,'S ','HVIC','FS1','TP','',0.177,'MG/L','L01','DEDNREC','','','','nan',38.72917,-75.56139,'T3','2022-04-07'),(10005,621725,'NTN022','NTWQM','NTN','DEDNREC  ','DEDNREC',304191,'3/21/2022','8:21:00',NULL,'','',0,'S ','HVIC','S1','TP','',0.0194,'MG/L','L01','DEDNREC','','','','nan',38.72917,-75.56139,'T3','2022-03-21'),(10005,621728,'NTN022','NTWQM','NTN','DEDNREC  ','DEDNREC',304191,'5/18/2022','9:47:00',NULL,'','',0,'S ','HVIC','S1','TP','',0.036,'MG/L','L01','DEDNREC','','','','nan',38.72917,-75.56139,'T3','2022-05-18'),(10005,621726,'NTN022','NTWQM','NTN','DEDNREC  ','DEDNREC',304191,'4/7/2022','9:29:00',NULL,'','',0,'S ','HVIC','FS2','TP','',0.179,'MG/L','L01','DEDNREC','','','','nan',38.72917,-75.56139,'T3','2022-04-07'),(10005,621727,'NTN022','NTWQM','NTN','DEDNREC  ','DEDNREC',304191,'4/27/2022','10:01:00',NULL,'','',0,'S ','HVIC','S1','TP','',0.0481,'MG/L','L01','DEDNREC','','','','nan',38.72917,-75.56139,'T3','2022-04-27'),(10005,621732,'NTN022','NTWQM','NTN','DEDNREC  ','DEDNREC',304191,'9/29/2022','8:06:00',NULL,'','',0,'S ','HVIC','FS1','TP','',0.024,'MG/L','L01','DEDNREC','','','','nan',38.72917,-75.56139,'T3','2022-09-29'),(10005,621732,'NTN022','NTWQM','NTN','DEDNREC  ','DEDNREC',304191,'9/29/2022','8:06:00',NULL,'','',0,'S ','HVIC','FS2','TP','',0.0256,'MG/L','L01','DEDNREC','','','','nan',38.72917,-75.56139,'T3','2022-09-29'),(10005,621731,'NTN022','NTWQM','NTN','DEDNREC  ','DEDNREC',304191,'8/24/2022','8:45:00',NULL,'','',0,'S ','HVIC','S1','TP','',0.0374,'MG/L','L01','DEDNREC','','','','nan',38.72917,-75.56139,'T3','2022-08-24'),(10005,621730,'NTN022','NTWQM','NTN','DEDNREC  ','DEDNREC',304191,'7/27/2022','10:45:00',NULL,'','',0,'S ','HVIC','S1','TP','',0.0247,'MG/L','L01','DEDNREC','','','','nan',38.72917,-75.56139,'T3','2022-07-27'),(10005,621729,'NTN022','NTWQM','NTN','DEDNREC  ','DEDNREC',304191,'6/15/2022','9:45:00',NULL,'','',0,'S ','HVIC','FS1','TP','',0.0426,'MG/L','L01','DEDNREC','','','','nan',38.72917,-75.56139,'T3','2022-06-15'),(10005,621729,'NTN022','NTWQM','NTN','DEDNREC  ','DEDNREC',304191,'6/15/2022','9:45:00',NULL,'','',0,'S ','HVIC','FS2','TP','',0.0467,'MG/L','L01','DEDNREC','','','','nan',38.72917,-75.56139,'T3','2022-06-15'),(10005,621723,'NTN022','NTWQM','NTN','DEDNREC  ','DEDNREC',304191,'1/26/2022','8:25:00',NULL,'','',0,'S ','HVIC','S1','TP','',0.0291,'MG/L','L01','DEDNREC','','','','nan',38.72917,-75.56139,'T3','2022-01-26'),(10005,621722,'NTN022','NTWQM','NTN','DEDNREC  ','DEDNREC',304191,'12/15/2021','9:14:00',NULL,'','',0,'S ','HVIC','S1','TP','',0.0236,'MG/L','L01','DEDNREC','','','','nan',38.72917,-75.56139,'T3','2021-12-15'),(10005,621724,'NTN022','NTWQM','NTN','DEDNREC  ','DEDNREC',304191,'2/23/2022','9:37:00',NULL,'','',0,'S ','HVIC','S1','TP','',0.0233,'MG/L','L01','DEDNREC','','','','nan',38.72917,-75.56139,'T3','2022-02-23'),(10005,621721,'NTN022','NTWQM','NTN','DEDNREC  ','DEDNREC',304191,'11/8/2021','7:55:00',NULL,'','',0,'S ','HVIC','S1','TP','',0.0217,'MG/L','L01','DEDNREC','','','','nan',38.72917,-75.56139,'T3','2021-11-08'),(10005,621720,'NTN022','NTWQM','NTN','DEDNREC  ','DEDNREC',304191,'10/18/2021','10:05:00',NULL,'','',0,'S ','HVIC','S1','TP','',0.0206,'MG/L','L01','DEDNREC','','','','nan',38.72917,-75.56139,'T3','2021-10-18'),(10005,610457,'NTN021','NTWQM','NTN','DEDNREC  ','DEDNREC',304191,'9/22/2021','9:44:00',NULL,'','',0,'S ','HVIC','S1','TSS','',3.01,'MG/L','L01','DEDNREC','','','','nan',38.72917,-75.56139,'T3','2021-09-22'),(10005,610453,'NTN021','NTWQM','NTN','DEDNREC  ','DEDNREC',304191,'6/15/2021','8:37:00',NULL,'','',0,'S ','HVIC','FS1','TSS','',6.275,'MG/L','L01','DEDNREC','','','','nan',38.72917,-75.56139,'T3','2021-06-15'),(10005,610453,'NTN021','NTWQM','NTN','DEDNREC  ','DEDNREC',304191,'6/15/2021','8:37:00',NULL,'','',0,'S ','HVIC','FS2','TSS','',6.8125,'MG/L','L01','DEDNREC','','','','nan',38.72917,-75.56139,'T3','2021-06-15'),(10005,610454,'NTN021','NTWQM','NTN','DEDNREC  ','DEDNREC',304191,'7/19/2021','8:57:00',NULL,'','',0,'S ','HVIC','S1','TSS','',15.66,'MG/L','L01','DEDNREC','','','','nan',38.72917,-75.56139,'T3','2021-07-19'),(10005,610455,'NTN021','NTWQM','NTN','DEDNREC  ','DEDNREC',304191,'8/25/2021','9:47:00',NULL,'','',0,'S ','HVIC','S1','TSS','',3.97,'MG/L','L01','DEDNREC','','','','nan',38.72917,-75.56139,'T3','2021-08-25'),(10005,610456,'NTN021','NTWQM','NTN','DEDNREC  ','DEDNREC',304191,'9/2/2021','8:32:00',NULL,'','',0,'S ','HVIC','S1','TSS','',51.5,'MG/L','L01','DEDNREC','','','','nan',38.72917,-75.56139,'T3','2021-09-02'),(10005,610452,'NTN021','NTWQM','NTN','DEDNREC  ','DEDNREC',304191,'5/24/2021','7:28:00',NULL,'','',0,'S ','HVIC','S1','TSS','',6.725,'MG/L','L01','DEDNREC','','','','nan',38.72917,-75.56139,'T3','2021-05-24'),(10005,610451,'NTN021','NTWQM','NTN','DEDNREC  ','DEDNREC',304191,'4/20/2021','10:18:00',NULL,'','',0,'S ','HVIC','S1','TSS','G',2.02,'MG/L','L01','DEDNREC','','','','nan',38.72917,-75.56139,'T3','2021-04-20'),(10005,610450,'NTN021','NTWQM','NTN','DEDNREC  ','DEDNREC',304191,'3/10/2021','8:01:00',NULL,'','',0,'S ','HVIC','FS2','TSS','',2.61,'MG/L','L01','DEDNREC','','','','nan',38.72917,-75.56139,'T3','2021-03-10'),(10005,610450,'NTN021','NTWQM','NTN','DEDNREC  ','DEDNREC',304191,'3/10/2021','8:01:00',NULL,'','',0,'S ','HVIC','FS1','TSS','',2.75,'MG/L','L01','DEDNREC','','','','nan',38.72917,-75.56139,'T3','2021-03-10'),(10005,610449,'NTN021','NTWQM','NTN','DEDNREC  ','DEDNREC',304191,'2/24/2021','10:10:00',NULL,'','',0,'S ','HVIC','S1','TSS','',6.75,'MG/L','L01','DEDNREC','','','','nan',38.72917,-75.56139,'T3','2021-02-24'),(10005,610447,'NTN021','NTWQM','NTN','DEDNREC  ','DEDNREC',304191,'1/28/2021','11:26:00',NULL,'','',0,'S ','HVIC','S1','TSS','',5.54,'MG/L','L01','DEDNREC','','','','nan',38.72917,-75.56139,'T3','2021-01-28'),(10005,610448,'NTN021','NTWQM','NTN','DEDNREC  ','DEDNREC',304191,'2/2/2021','9:25:00',NULL,'','',0,'S ','HVIC','FS1','TSS','',8.8714,'MG/L','L01','DEDNREC','','','','nan',38.72917,-75.56139,'T3','2021-02-02'),(10005,610448,'NTN021','NTWQM','NTN','DEDNREC  ','DEDNREC',304191,'2/2/2021','9:25:00',NULL,'','',0,'S ','HVIC','FS2','TSS','',9.3571,'MG/L','L01','DEDNREC','','','','nan',38.72917,-75.56139,'T3','2021-02-02'),(10005,621720,'NTN022','NTWQM','NTN','DEDNREC  ','DEDNREC',304191,'10/18/2021','10:05:00',NULL,'','',0,'S ','HVIC','S1','TSS','<',2,'MG/L','L01','DEDNREC','','','','nan',38.72917,-75.56139,'T3','2021-10-18'),(10005,621721,'NTN022','NTWQM','NTN','DEDNREC  ','DEDNREC',304191,'11/8/2021','7:55:00',NULL,'','',0,'S ','HVIC','S1','TSS','G',1.39,'MG/L','L01','DEDNREC','','','','nan',38.72917,-75.56139,'T3','2021-11-08'),(10005,621724,'NTN022','NTWQM','NTN','DEDNREC  ','DEDNREC',304191,'2/23/2022','9:37:00',NULL,'','',0,'S ','HVIC','S1','TSS','',3.24,'MG/L','L01','DEDNREC','','','','nan',38.72917,-75.56139,'T3','2022-02-23'),(10005,621722,'NTN022','NTWQM','NTN','DEDNREC  ','DEDNREC',304191,'12/15/2021','9:14:00',NULL,'','',0,'S ','HVIC','S1','TSS','G',2.7,'MG/L','L01','DEDNREC','','','','nan',38.72917,-75.56139,'T3','2021-12-15'),(10005,621723,'NTN022','NTWQM','NTN','DEDNREC  ','DEDNREC',304191,'1/26/2022','8:25:00',NULL,'','',0,'S ','HVIC','S1','TSS','G',2.27,'MG/L','L01','DEDNREC','','','','nan',38.72917,-75.56139,'T3','2022-01-26'),(10005,621729,'NTN022','NTWQM','NTN','DEDNREC  ','DEDNREC',304191,'6/15/2022','9:45:00',NULL,'','',0,'S ','HVIC','FS2','TSS','',3.24,'MG/L','L01','DEDNREC','','','','nan',38.72917,-75.56139,'T3','2022-06-15'),(10005,621729,'NTN022','NTWQM','NTN','DEDNREC  ','DEDNREC',304191,'6/15/2022','9:45:00',NULL,'','',0,'S ','HVIC','FS1','TSS','',3.28,'MG/L','L01','DEDNREC','','','','nan',38.72917,-75.56139,'T3','2022-06-15'),(10005,621730,'NTN022','NTWQM','NTN','DEDNREC  ','DEDNREC',304191,'7/27/2022','10:45:00',NULL,'','',0,'S ','HVIC','S1','TSS','',3.14,'MG/L','L01','DEDNREC','','','','nan',38.72917,-75.56139,'T3','2022-07-27'),(10005,621731,'NTN022','NTWQM','NTN','DEDNREC  ','DEDNREC',304191,'8/24/2022','8:45:00',NULL,'','',0,'S ','HVIC','S1','TSS','',6.14,'MG/L','L01','DEDNREC','','','','nan',38.72917,-75.56139,'T3','2022-08-24'),(10005,621732,'NTN022','NTWQM','NTN','DEDNREC  ','DEDNREC',304191,'9/29/2022','8:06:00',NULL,'','',0,'S ','HVIC','FS2','TSS','G',4.1,'MG/L','L01','DEDNREC','','','','nan',38.72917,-75.56139,'T3','2022-09-29'),(10005,621727,'NTN022','NTWQM','NTN','DEDNREC  ','DEDNREC',304191,'4/27/2022','10:01:00',NULL,'','',0,'S ','HVIC','S1','TSS','',7.6333,'MG/L','L01','DEDNREC','','','','nan',38.72917,-75.56139,'T3','2022-04-27'),(10005,621728,'NTN022','NTWQM','NTN','DEDNREC  ','DEDNREC',304191,'5/18/2022','9:47:00',NULL,'','',0,'S ','HVIC','S1','TSS','',4.01,'MG/L','L01','DEDNREC','','','','nan',38.72917,-75.56139,'T3','2022-05-18'),(10005,621725,'NTN022','NTWQM','NTN','DEDNREC  ','DEDNREC',304191,'3/21/2022','8:21:00',NULL,'','',0,'S ','HVIC','S1','TSS','G',1.16,'MG/L','L01','DEDNREC','','','','nan',38.72917,-75.56139,'T3','2022-03-21'),(10005,621726,'NTN022','NTWQM','NTN','DEDNREC  ','DEDNREC',304191,'4/7/2022','9:29:00',NULL,'','',0,'S ','HVIC','FS1','TSS','',9.88,'MG/L','L01','DEDNREC','','','','nan',38.72917,-75.56139,'T3','2022-04-07'),(10005,621726,'NTN022','NTWQM','NTN','DEDNREC  ','DEDNREC',304191,'4/7/2022','9:29:00',NULL,'','',0,'S ','HVIC','FS2','TSS','',9.38,'MG/L','L01','DEDNREC','','','','nan',38.72917,-75.56139,'T3','2022-04-07'),(10005,621732,'NTN022','NTWQM','NTN','DEDNREC  ','DEDNREC',304191,'9/29/2022','8:06:00',NULL,'','',0,'S ','HVIC','FS1','TSS','G',3.8,'MG/L','L01','DEDNREC','','','','nan',38.72917,-75.56139,'T3','2022-09-29'),(10005,610448,'NTN021','NTWQM','NTN','DEDNREC  ','DEDNREC',304191,'2/2/2021','9:25:00',NULL,'','',0,'S ','HVIC','FS1','TURB_NTU','',11.2,'NTU','L01','DEDNREC','','','','nan',38.72917,-75.56139,'T3','2021-02-02'),(10005,610447,'NTN021','NTWQM','NTN','DEDNREC  ','DEDNREC',304191,'1/28/2021','11:26:00',NULL,'','',0,'S ','HVIC','S1','TURB_NTU','',5.62,'NTU','L01','DEDNREC','','','','nan',38.72917,-75.56139,'T3','2021-01-28'),(10005,610448,'NTN021','NTWQM','NTN','DEDNREC  ','DEDNREC',304191,'2/2/2021','9:25:00',NULL,'','',0,'S ','HVIC','FS2','TURB_NTU','',11.2,'NTU','L01','DEDNREC','','','','nan',38.72917,-75.56139,'T3','2021-02-02'),(10005,610450,'NTN021','NTWQM','NTN','DEDNREC  ','DEDNREC',304191,'3/10/2021','8:01:00',NULL,'','',0,'S ','HVIC','FS1','TURB_NTU','',3.73,'NTU','L01','DEDNREC','','','','nan',38.72917,-75.56139,'T3','2021-03-10'),(10005,610449,'NTN021','NTWQM','NTN','DEDNREC  ','DEDNREC',304191,'2/24/2021','10:10:00',NULL,'','',0,'S ','HVIC','S1','TURB_NTU','',8.67,'NTU','L01','DEDNREC','','','','nan',38.72917,-75.56139,'T3','2021-02-24'),(10005,610450,'NTN021','NTWQM','NTN','DEDNREC  ','DEDNREC',304191,'3/10/2021','8:01:00',NULL,'','',0,'S ','HVIC','FS2','TURB_NTU','',3.72,'NTU','L01','DEDNREC','','','','nan',38.72917,-75.56139,'T3','2021-03-10'),(10005,610451,'NTN021','NTWQM','NTN','DEDNREC  ','DEDNREC',304191,'4/20/2021','10:18:00',NULL,'','',0,'S ','HVIC','S1','TURB_NTU','',2.6,'NTU','L01','DEDNREC','','','','nan',38.72917,-75.56139,'T3','2021-04-20'),(10005,610456,'NTN021','NTWQM','NTN','DEDNREC  ','DEDNREC',304191,'9/2/2021','8:32:00',NULL,'','',0,'S ','HVIC','S1','TURB_NTU','',56.6,'NTU','L01','DEDNREC','','','','nan',38.72917,-75.56139,'T3','2021-09-02'),(10005,610455,'NTN021','NTWQM','NTN','DEDNREC  ','DEDNREC',304191,'8/25/2021','9:47:00',NULL,'','',0,'S ','HVIC','S1','TURB_NTU','',3.7,'NTU','L01','DEDNREC','','','','nan',38.72917,-75.56139,'T3','2021-08-25'),(10005,610454,'NTN021','NTWQM','NTN','DEDNREC  ','DEDNREC',304191,'7/19/2021','8:57:00',NULL,'','',0,'S ','HVIC','S1','TURB_NTU','',13.1,'NTU','L01','DEDNREC','','','','nan',38.72917,-75.56139,'T3','2021-07-19'),(10005,610453,'NTN021','NTWQM','NTN','DEDNREC  ','DEDNREC',304191,'6/15/2021','8:37:00',NULL,'','',0,'S ','HVIC','FS2','TURB_NTU','',9.09,'NTU','L01','DEDNREC','','','','nan',38.72917,-75.56139,'T3','2021-06-15'),(10005,610453,'NTN021','NTWQM','NTN','DEDNREC  ','DEDNREC',304191,'6/15/2021','8:37:00',NULL,'','',0,'S ','HVIC','FS1','TURB_NTU','',9.12,'NTU','L01','DEDNREC','','','','nan',38.72917,-75.56139,'T3','2021-06-15'),(10005,610452,'NTN021','NTWQM','NTN','DEDNREC  ','DEDNREC',304191,'5/24/2021','7:28:00',NULL,'','',0,'S ','HVIC','S1','TURB_NTU','',6.14,'NTU','L01','DEDNREC','','','','nan',38.72917,-75.56139,'T3','2021-05-24'),(10005,610457,'NTN021','NTWQM','NTN','DEDNREC  ','DEDNREC',304191,'9/22/2021','9:44:00',NULL,'','',0,'S ','HVIC','S1','TURB_NTU','',2.36,'NTU','L01','DEDNREC','','','','nan',38.72917,-75.56139,'T3','2021-09-22'),(10005,621725,'NTN022','NTWQM','NTN','DEDNREC  ','DEDNREC',304191,'3/21/2022','8:21:00',NULL,'','',0,'S ','HVIC','S1','TURB_NTU','',1.9,'NTU','L01','DEDNREC','','','','nan',38.72917,-75.56139,'T3','2022-03-21'),(10005,621726,'NTN022','NTWQM','NTN','DEDNREC  ','DEDNREC',304191,'4/7/2022','9:29:00',NULL,'','',0,'S ','HVIC','FS1','TURB_NTU','',16.5,'NTU','L01','DEDNREC','','','','nan',38.72917,-75.56139,'T3','2022-04-07'),(10005,621728,'NTN022','NTWQM','NTN','DEDNREC  ','DEDNREC',304191,'5/18/2022','9:47:00',NULL,'','',0,'S ','HVIC','S1','TURB_NTU','',3.89,'NTU','L01','DEDNREC','','','','nan',38.72917,-75.56139,'T3','2022-05-18'),(10005,621727,'NTN022','NTWQM','NTN','DEDNREC  ','DEDNREC',304191,'4/27/2022','10:01:00',NULL,'','',0,'S ','HVIC','S1','TURB_NTU','',4.04,'NTU','L01','DEDNREC','','','','nan',38.72917,-75.56139,'T3','2022-04-27'),(10005,621726,'NTN022','NTWQM','NTN','DEDNREC  ','DEDNREC',304191,'4/7/2022','9:29:00',NULL,'','',0,'S ','HVIC','FS2','TURB_NTU','',16.4,'NTU','L01','DEDNREC','','','','nan',38.72917,-75.56139,'T3','2022-04-07'),(10005,621731,'NTN022','NTWQM','NTN','DEDNREC  ','DEDNREC',304191,'8/24/2022','8:45:00',NULL,'','',0,'S ','HVIC','S1','TURB_NTU','',4.85,'NTU','L01','DEDNREC','','','','nan',38.72917,-75.56139,'T3','2022-08-24'),(10005,621732,'NTN022','NTWQM','NTN','DEDNREC  ','DEDNREC',304191,'9/29/2022','8:06:00',NULL,'','',0,'S ','HVIC','FS2','TURB_NTU','',3.95,'NTU','L01','DEDNREC','','','','nan',38.72917,-75.56139,'T3','2022-09-29'),(10005,621732,'NTN022','NTWQM','NTN','DEDNREC  ','DEDNREC',304191,'9/29/2022','8:06:00',NULL,'','',0,'S ','HVIC','FS1','TURB_NTU','',4.04,'NTU','L01','DEDNREC','','','','nan',38.72917,-75.56139,'T3','2022-09-29'),(10005,621730,'NTN022','NTWQM','NTN','DEDNREC  ','DEDNREC',304191,'7/27/2022','10:45:00',NULL,'','',0,'S ','HVIC','S1','TURB_NTU','',3.89,'NTU','L01','DEDNREC','','','','nan',38.72917,-75.56139,'T3','2022-07-27'),(10005,621729,'NTN022','NTWQM','NTN','DEDNREC  ','DEDNREC',304191,'6/15/2022','9:45:00',NULL,'','',0,'S ','HVIC','FS2','TURB_NTU','',4.87,'NTU','L01','DEDNREC','','','','nan',38.72917,-75.56139,'T3','2022-06-15'),(10005,621729,'NTN022','NTWQM','NTN','DEDNREC  ','DEDNREC',304191,'6/15/2022','9:45:00',NULL,'','',0,'S ','HVIC','FS1','TURB_NTU','',4.88,'NTU','L01','DEDNREC','','','','nan',38.72917,-75.56139,'T3','2022-06-15'),(10005,621723,'NTN022','NTWQM','NTN','DEDNREC  ','DEDNREC',304191,'1/26/2022','8:25:00',NULL,'','',0,'S ','HVIC','S1','TURB_NTU','',3.37,'NTU','L01','DEDNREC','','','','nan',38.72917,-75.56139,'T3','2022-01-26'),(10005,621722,'NTN022','NTWQM','NTN','DEDNREC  ','DEDNREC',304191,'12/15/2021','9:14:00',NULL,'','',0,'S ','HVIC','S1','TURB_NTU','',3.08,'NTU','L01','DEDNREC','','','','nan',38.72917,-75.56139,'T3','2021-12-15'),(10005,621724,'NTN022','NTWQM','NTN','DEDNREC  ','DEDNREC',304191,'2/23/2022','9:37:00',NULL,'','',0,'S ','HVIC','S1','TURB_NTU','',3.04,'NTU','L01','DEDNREC','','','','nan',38.72917,-75.56139,'T3','2022-02-23'),(10005,621720,'NTN022','NTWQM','NTN','DEDNREC  ','DEDNREC',304191,'10/18/2021','10:05:00',NULL,'','',0,'S ','HVIC','S1','TURB_NTU','',1.56,'NTU','L01','DEDNREC','','','','nan',38.72917,-75.56139,'T3','2021-10-18'),(10005,621721,'NTN022','NTWQM','NTN','DEDNREC  ','DEDNREC',304191,'11/8/2021','7:55:00',NULL,'','',0,'S ','HVIC','S1','TURB_NTU','',1.6,'NTU','L01','DEDNREC','','','','nan',38.72917,-75.56139,'T3','2021-11-08'),(10005,610457,'NTN021','NTWQM','NTN','DEDNREC  ','DEDNREC',304191,'9/22/2021','9:44:00',NULL,'','',0,'S ','ISM','M1','WTEMP','',19.725,'DEG C','F02','','','','','nan',38.72917,-75.56139,'T3','2021-09-22'),(10005,610453,'NTN021','NTWQM','NTN','DEDNREC  ','DEDNREC',304191,'6/15/2021','8:37:00',NULL,'','',0,'S ','ISM','M1','WTEMP','',21.512,'DEG C','F02','','','','','nan',38.72917,-75.56139,'T3','2021-06-15'),(10005,610453,'NTN021','NTWQM','NTN','DEDNREC  ','DEDNREC',304191,'6/15/2021','8:37:00',NULL,'','',0,'S ','ISM','M2','WTEMP','',21.519,'DEG C','F02','','','','','nan',38.72917,-75.56139,'T3','2021-06-15'),(10005,610454,'NTN021','NTWQM','NTN','DEDNREC  ','DEDNREC',304191,'7/19/2021','8:57:00',NULL,'','',0,'S ','ISM','M1','WTEMP','',21.303,'DEG C','F02','','','','','nan',38.72917,-75.56139,'T3','2021-07-19'),(10005,610455,'NTN021','NTWQM','NTN','DEDNREC  ','DEDNREC',304191,'8/25/2021','9:47:00',NULL,'','',0,'S ','ISM','M1','WTEMP','',23.964,'DEG C','F02','','','','','nan',38.72917,-75.56139,'T3','2021-08-25'),(10005,610456,'NTN021','NTWQM','NTN','DEDNREC  ','DEDNREC',304191,'9/2/2021','8:32:00',NULL,'','',0,'S ','ISM','M1','WTEMP','',21.326,'DEG C','F02','','','','','nan',38.72917,-75.56139,'T3','2021-09-02'),(10005,610451,'NTN021','NTWQM','NTN','DEDNREC  ','DEDNREC',304191,'4/20/2021','10:18:00',NULL,'','',0,'S ','ISM','M1','WTEMP','',13.241,'DEG C','F02','','','','','nan',38.72917,-75.56139,'T3','2021-04-20'),(10005,610452,'NTN021','NTWQM','NTN','DEDNREC  ','DEDNREC',304191,'5/24/2021','7:28:00',NULL,'','',0,'S ','ISM','M1','WTEMP','',20.912,'DEG C','F02','','','','','nan',38.72917,-75.56139,'T3','2021-05-24'),(10005,610450,'NTN021','NTWQM','NTN','DEDNREC  ','DEDNREC',304191,'3/10/2021','8:01:00',NULL,'','',0,'S ','ISM','M2','WTEMP','',11.685,'DEG C','F02','','','','','nan',38.72917,-75.56139,'T3','2021-03-10'),(10005,610449,'NTN021','NTWQM','NTN','DEDNREC  ','DEDNREC',304191,'2/24/2021','10:10:00',NULL,'','',0,'S ','ISM','M1','WTEMP','',8.269,'DEG C','F02','','','','','nan',38.72917,-75.56139,'T3','2021-02-24'),(10005,610450,'NTN021','NTWQM','NTN','DEDNREC  ','DEDNREC',304191,'3/10/2021','8:01:00',NULL,'','',0,'S ','ISM','M1','WTEMP','',11.731,'DEG C','F02','','','','','nan',38.72917,-75.56139,'T3','2021-03-10'),(10005,610448,'NTN021','NTWQM','NTN','DEDNREC  ','DEDNREC',304191,'2/2/2021','9:25:00',NULL,'','',0,'S ','ISM','M2','WTEMP','',7.41,'DEG C','F02','','','','','nan',38.72917,-75.56139,'T3','2021-02-02'),(10005,610447,'NTN021','NTWQM','NTN','DEDNREC  ','DEDNREC',304191,'1/28/2021','11:26:00',NULL,'','',0,'S ','ISM','M1','WTEMP','',3.529,'DEG C','F02','','','','','nan',38.72917,-75.56139,'T3','2021-01-28'),(10005,610448,'NTN021','NTWQM','NTN','DEDNREC  ','DEDNREC',304191,'2/2/2021','9:25:00',NULL,'','',0,'S ','ISM','M1','WTEMP','',7.419,'DEG C','F02','','','','','nan',38.72917,-75.56139,'T3','2021-02-02'),(10005,621721,'NTN022','NTWQM','NTN','DEDNREC  ','DEDNREC',304191,'11/8/2021','7:55:00',NULL,'','',0,'S ','ISM','M1','WTEMP','',10.58,'DEG C','F02','','','','','nan',38.72917,-75.56139,'T3','2021-11-08'),(10005,621720,'NTN022','NTWQM','NTN','DEDNREC  ','DEDNREC',304191,'10/18/2021','10:05:00',NULL,'','',0,'S ','ISM','M1','WTEMP','',14.823,'DEG C','F02','','','','','nan',38.72917,-75.56139,'T3','2021-10-18'),(10005,621724,'NTN022','NTWQM','NTN','DEDNREC  ','DEDNREC',304191,'2/23/2022','9:37:00',NULL,'','',0,'S ','ISM','M1','WTEMP','',14.522,'DEG C','F02','','','','','nan',38.72917,-75.56139,'T3','2022-02-23'),(10005,621722,'NTN022','NTWQM','NTN','DEDNREC  ','DEDNREC',304191,'12/15/2021','9:14:00',NULL,'','',0,'S ','ISM','M1','WTEMP','',8.04,'DEG C','F02','','','','','nan',38.72917,-75.56139,'T3','2021-12-15'),(10005,621723,'NTN022','NTWQM','NTN','DEDNREC  ','DEDNREC',304191,'1/26/2022','8:25:00',NULL,'','',0,'S ','ISM','M1','WTEMP','',5.225,'DEG C','F02','','','','','nan',38.72917,-75.56139,'T3','2022-01-26'),(10005,621729,'NTN022','NTWQM','NTN','DEDNREC  ','DEDNREC',304191,'6/15/2022','9:45:00',NULL,'','',0,'S ','ISM','M2','WTEMP','',22.369,'DEG C','F02','','','','','nan',38.72917,-75.56139,'T3','2022-06-15'),(10005,621729,'NTN022','NTWQM','NTN','DEDNREC  ','DEDNREC',304191,'6/15/2022','9:45:00',NULL,'','',0,'S ','ISM','M1','WTEMP','',22.342,'DEG C','F02','','','','','nan',38.72917,-75.56139,'T3','2022-06-15'),(10005,621730,'NTN022','NTWQM','NTN','DEDNREC  ','DEDNREC',304191,'7/27/2022','10:45:00',NULL,'','',0,'S ','ISM','M1','WTEMP','',22.546,'DEG C','F02','','','','','nan',38.72917,-75.56139,'T3','2022-07-27'),(10005,621732,'NTN022','NTWQM','NTN','DEDNREC  ','DEDNREC',304191,'9/29/2022','8:06:00',NULL,'','',0,'S ','ISM','M1','WTEMP','',15.031,'DEG C','F02','','','','','nan',38.72917,-75.56139,'T3','2022-09-29'),(10005,621732,'NTN022','NTWQM','NTN','DEDNREC  ','DEDNREC',304191,'9/29/2022','8:06:00',NULL,'','',0,'S ','ISM','M2','WTEMP','',15.035,'DEG C','F02','','','','','nan',38.72917,-75.56139,'T3','2022-09-29'),(10005,621731,'NTN022','NTWQM','NTN','DEDNREC  ','DEDNREC',304191,'8/24/2022','8:45:00',NULL,'','',0,'S ','ISM','M1','WTEMP','',21.233,'DEG C','F02','','','','','nan',38.72917,-75.56139,'T3','2022-08-24'),(10005,621727,'NTN022','NTWQM','NTN','DEDNREC  ','DEDNREC',304191,'4/27/2022','10:01:00',NULL,'','',0,'S ','ISM','M1','WTEMP','',15.134,'DEG C','F02','','','','','nan',38.72917,-75.56139,'T3','2022-04-27'),(10005,621728,'NTN022','NTWQM','NTN','DEDNREC  ','DEDNREC',304191,'5/18/2022','9:47:00',NULL,'','',0,'S ','ISM','M1','WTEMP','',18.296,'DEG C','F02','','','','','nan',38.72917,-75.56139,'T3','2022-05-18'),(10005,621726,'NTN022','NTWQM','NTN','DEDNREC  ','DEDNREC',304191,'4/7/2022','9:29:00',NULL,'','',0,'S ','ISM','M2','WTEMP','',12.425,'DEG C','F02','','','','','nan',38.72917,-75.56139,'T3','2022-04-07'),(10005,621726,'NTN022','NTWQM','NTN','DEDNREC  ','DEDNREC',304191,'4/7/2022','9:29:00',NULL,'','',0,'S ','ISM','M1','WTEMP','',12.424,'DEG C','F02','','','','','nan',38.72917,-75.56139,'T3','2022-04-07'),(10005,621725,'NTN022','NTWQM','NTN','DEDNREC  ','DEDNREC',304191,'3/21/2022','8:21:00',NULL,'','',0,'S ','ISM','M1','WTEMP','',11.56,'DEG C','F02','','','','','nan',38.72917,-75.56139,'T3','2022-03-21');
/*!40000 ALTER TABLE `clean_water_quality` ENABLE KEYS */;
UNLOCK TABLES;

--
-- Table structure for table `event`
--

DROP TABLE IF EXISTS `event`;
/*!40101 SET @saved_cs_client     = @@character_set_client */;
/*!50503 SET character_set_client = utf8mb4 */;
CREATE TABLE `event` (
  `EventId` int NOT NULL,
  `StationId` int DEFAULT NULL,
  `Cruise` varchar(50) DEFAULT NULL,
  `Program` varchar(50) DEFAULT NULL,
  `Project` varchar(50) DEFAULT NULL,
  `Agency` varchar(50) DEFAULT NULL,
  `Source` varchar(50) DEFAULT NULL,
  `TierLevel` varchar(20) DEFAULT NULL,
  PRIMARY KEY (`EventId`),
  KEY `StationId` (`StationId`),
  CONSTRAINT `event_ibfk_1` FOREIGN KEY (`StationId`) REFERENCES `station` (`StationID`)
) ENGINE=InnoDB DEFAULT CHARSET=utf8mb4 COLLATE=utf8mb4_0900_ai_ci;
/*!40101 SET character_set_client = @saved_cs_client */;

--
-- Dumping data for table `event`
--

LOCK TABLES `event` WRITE;
/*!40000 ALTER TABLE `event` DISABLE KEYS */;
INSERT INTO `event` VALUES (610432,302031,'NTN021','NTWQM','NTN','DEDNREC  ','DEDNREC','T3'),(610433,302031,'NTN021','NTWQM','NTN','DEDNREC  ','DEDNREC','T3'),(610434,302031,'NTN021','NTWQM','NTN','DEDNREC  ','DEDNREC','T3'),(610435,302031,'NTN021','NTWQM','NTN','DEDNREC  ','DEDNREC','T3'),(610436,302031,'NTN021','NTWQM','NTN','DEDNREC  ','DEDNREC','T3'),(610437,302031,'NTN021','NTWQM','NTN','DEDNREC  ','DEDNREC','T3'),(610438,302031,'NTN021','NTWQM','NTN','DEDNREC  ','DEDNREC','T3'),(610439,302031,'NTN021','NTWQM','NTN','DEDNREC  ','DEDNREC','T3'),(610440,302031,'NTN021','NTWQM','NTN','DEDNREC  ','DEDNREC','T3'),(610441,302031,'NTN021','NTWQM','NTN','DEDNREC  ','DEDNREC','T3'),(610442,302031,'NTN021','NTWQM','NTN','DEDNREC  ','DEDNREC','T3'),(610447,304191,'NTN021','NTWQM','NTN','DEDNREC  ','DEDNREC','T3'),(610448,304191,'NTN021','NTWQM','NTN','DEDNREC  ','DEDNREC','T3'),(610449,304191,'NTN021','NTWQM','NTN','DEDNREC  ','DEDNREC','T3'),(610450,304191,'NTN021','NTWQM','NTN','DEDNREC  ','DEDNREC','T3'),(610451,304191,'NTN021','NTWQM','NTN','DEDNREC  ','DEDNREC','T3'),(610452,304191,'NTN021','NTWQM','NTN','DEDNREC  ','DEDNREC','T3'),(610453,304191,'NTN021','NTWQM','NTN','DEDNREC  ','DEDNREC','T3'),(610454,304191,'NTN021','NTWQM','NTN','DEDNREC  ','DEDNREC','T3'),(610455,304191,'NTN021','NTWQM','NTN','DEDNREC  ','DEDNREC','T3'),(610456,304191,'NTN021','NTWQM','NTN','DEDNREC  ','DEDNREC','T3'),(610457,304191,'NTN021','NTWQM','NTN','DEDNREC  ','DEDNREC','T3'),(621707,302031,'NTN022','NTWQM','NTN','DEDNREC  ','DEDNREC','T3'),(621708,302031,'NTN022','NTWQM','NTN','DEDNREC  ','DEDNREC','T3'),(621709,302031,'NTN022','NTWQM','NTN','DEDNREC  ','DEDNREC','T3'),(621710,302031,'NTN022','NTWQM','NTN','DEDNREC  ','DEDNREC','T3'),(621711,302031,'NTN022','NTWQM','NTN','DEDNREC  ','DEDNREC','T3'),(621712,302031,'NTN022','NTWQM','NTN','DEDNREC  ','DEDNREC','T3'),(621713,302031,'NTN022','NTWQM','NTN','DEDNREC  ','DEDNREC','T3'),(621714,302031,'NTN022','NTWQM','NTN','DEDNREC  ','DEDNREC','T3'),(621715,302031,'NTN022','NTWQM','NTN','DEDNREC  ','DEDNREC','T3'),(621716,302031,'NTN022','NTWQM','NTN','DEDNREC  ','DEDNREC','T3'),(621717,302031,'NTN022','NTWQM','NTN','DEDNREC  ','DEDNREC','T3'),(621718,302031,'NTN022','NTWQM','NTN','DEDNREC  ','DEDNREC','T3'),(621719,302031,'NTN022','NTWQM','NTN','DEDNREC  ','DEDNREC','T3'),(621720,304191,'NTN022','NTWQM','NTN','DEDNREC  ','DEDNREC','T3'),(621721,304191,'NTN022','NTWQM','NTN','DEDNREC  ','DEDNREC','T3'),(621722,304191,'NTN022','NTWQM','NTN','DEDNREC  ','DEDNREC','T3'),(621723,304191,'NTN022','NTWQM','NTN','DEDNREC  ','DEDNREC','T3'),(621724,304191,'NTN022','NTWQM','NTN','DEDNREC  ','DEDNREC','T3'),(621725,304191,'NTN022','NTWQM','NTN','DEDNREC  ','DEDNREC','T3'),(621726,304191,'NTN022','NTWQM','NTN','DEDNREC  ','DEDNREC','T3'),(621727,304191,'NTN022','NTWQM','NTN','DEDNREC  ','DEDNREC','T3'),(621728,304191,'NTN022','NTWQM','NTN','DEDNREC  ','DEDNREC','T3'),(621729,304191,'NTN022','NTWQM','NTN','DEDNREC  ','DEDNREC','T3'),(621730,304191,'NTN022','NTWQM','NTN','DEDNREC  ','DEDNREC','T3'),(621731,304191,'NTN022','NTWQM','NTN','DEDNREC  ','DEDNREC','T3'),(621732,304191,'NTN022','NTWQM','NTN','DEDNREC  ','DEDNREC','T3');
/*!40000 ALTER TABLE `event` ENABLE KEYS */;
UNLOCK TABLES;

--
-- Table structure for table `lab`
--

DROP TABLE IF EXISTS `lab`;
/*!40101 SET @saved_cs_client     = @@character_set_client */;
/*!50503 SET character_set_client = utf8mb4 */;
CREATE TABLE `lab` (
  `LabId` int NOT NULL AUTO_INCREMENT,
  `Lab` varchar(100) DEFAULT NULL,
  PRIMARY KEY (`LabId`)
) ENGINE=InnoDB AUTO_INCREMENT=4 DEFAULT CHARSET=utf8mb4 COLLATE=utf8mb4_0900_ai_ci;
/*!40101 SET character_set_client = @saved_cs_client */;

--
-- Dumping data for table `lab`
--

LOCK TABLES `lab` WRITE;
/*!40000 ALTER TABLE `lab` DISABLE KEYS */;
INSERT INTO `lab` VALUES (1,'DEDNREC'),(2,''),(3,'USGS-KDSL');
/*!40000 ALTER TABLE `lab` ENABLE KEYS */;
UNLOCK TABLES;

--
-- Table structure for table `measure`
--

DROP TABLE IF EXISTS `measure`;
/*!40101 SET @saved_cs_client     = @@character_set_client */;
/*!50503 SET character_set_client = utf8mb4 */;
CREATE TABLE `measure` (
  `MeasureId` int NOT NULL AUTO_INCREMENT,
  `SampleId` int DEFAULT NULL,
  `ParameterId` int DEFAULT NULL,
  `MethodId` int DEFAULT NULL,
  `LabId` int DEFAULT NULL,
  `Qualifier` varchar(10) DEFAULT NULL,
  `MeasureValue` decimal(12,4) DEFAULT NULL,
  `Unit` varchar(20) DEFAULT NULL,
  `Problem` varchar(255) DEFAULT NULL,
  `PrecisionPC` decimal(6,2) DEFAULT NULL,
  `BiasPC` decimal(6,2) DEFAULT NULL,
  `Details` text,
  PRIMARY KEY (`MeasureId`),
  KEY `SampleId` (`SampleId`),
  KEY `ParameterId` (`ParameterId`),
  KEY `MethodId` (`MethodId`),
  KEY `LabId` (`LabId`),
  CONSTRAINT `measure_ibfk_1` FOREIGN KEY (`SampleId`) REFERENCES `sample` (`SampleId`),
  CONSTRAINT `measure_ibfk_2` FOREIGN KEY (`ParameterId`) REFERENCES `parameter` (`ParameterId`),
  CONSTRAINT `measure_ibfk_3` FOREIGN KEY (`MethodId`) REFERENCES `method` (`MethodId`),
  CONSTRAINT `measure_ibfk_4` FOREIGN KEY (`LabId`) REFERENCES `lab` (`LabId`)
) ENGINE=InnoDB AUTO_INCREMENT=49150 DEFAULT CHARSET=utf8mb4 COLLATE=utf8mb4_0900_ai_ci;
/*!40101 SET character_set_client = @saved_cs_client */;

--
-- Dumping data for table `measure`
--

LOCK TABLES `measure` WRITE;
/*!40000 ALTER TABLE `measure` DISABLE KEYS */;
INSERT INTO `measure` VALUES (1,2724,1,1,1,'',1.8727,'UG/L','',NULL,NULL,'nan'),(2,2693,1,1,1,'',1.8727,'UG/L','',NULL,NULL,'nan'),(3,2674,1,1,1,'',1.8727,'UG/L','',NULL,NULL,'nan'),(4,2641,1,1,1,'',1.8727,'UG/L','',NULL,NULL,'nan'),(5,2622,1,1,1,'',1.8727,'UG/L','',NULL,NULL,'nan'),(6,2587,1,1,1,'',1.8727,'UG/L','',NULL,NULL,'nan'),(7,2569,1,1,1,'',1.8727,'UG/L','',NULL,NULL,'nan'),(8,2536,1,1,1,'',1.8727,'UG/L','',NULL,NULL,'nan'),(9,2519,1,1,1,'',1.8727,'UG/L','',NULL,NULL,'nan'),(10,2490,1,1,1,'',1.8727,'UG/L','',NULL,NULL,'nan'),(11,2467,1,1,1,'',1.8727,'UG/L','',NULL,NULL,'nan'),(12,2430,1,1,1,'',1.8727,'UG/L','',NULL,NULL,'nan'),(13,2415,1,1,1,'',1.8727,'UG/L','',NULL,NULL,'nan'),(14,2379,1,1,1,'',1.8727,'UG/L','',NULL,NULL,'nan'),(15,2362,1,1,1,'',1.8727,'UG/L','',NULL,NULL,'nan'),(16,2326,1,1,1,'',1.8727,'UG/L','',NULL,NULL,'nan'),(17,2310,1,1,1,'',1.8727,'UG/L','',NULL,NULL,'nan'),(18,2277,1,1,1,'',1.8727,'UG/L','',NULL,NULL,'nan'),(19,2263,1,1,1,'',1.8727,'UG/L','',NULL,NULL,'nan'),(20,2228,1,1,1,'',1.8727,'UG/L','',NULL,NULL,'nan'),(21,2213,1,1,1,'',1.8727,'UG/L','',NULL,NULL,'nan'),(22,2188,1,1,1,'',1.8727,'UG/L','',NULL,NULL,'nan'),(23,2176,1,1,1,'',1.8727,'UG/L','',NULL,NULL,'nan'),(24,2139,1,1,1,'',1.8727,'UG/L','',NULL,NULL,'nan'),(25,2123,1,1,1,'',1.8727,'UG/L','',NULL,NULL,'nan'),(26,2087,1,1,1,'',1.8727,'UG/L','',NULL,NULL,'nan'),(27,2071,1,1,1,'',1.8727,'UG/L','',NULL,NULL,'nan'),(28,677,1,1,1,'',1.8727,'UG/L','',NULL,NULL,'nan'),(29,646,1,1,1,'',1.8727,'UG/L','',NULL,NULL,'nan'),(30,627,1,1,1,'',1.8727,'UG/L','',NULL,NULL,'nan'),(31,594,1,1,1,'',1.8727,'UG/L','',NULL,NULL,'nan'),(32,575,1,1,1,'',1.8727,'UG/L','',NULL,NULL,'nan'),(33,540,1,1,1,'',1.8727,'UG/L','',NULL,NULL,'nan'),(34,522,1,1,1,'',1.8727,'UG/L','',NULL,NULL,'nan'),(35,489,1,1,1,'',1.8727,'UG/L','',NULL,NULL,'nan'),(36,472,1,1,1,'',1.8727,'UG/L','',NULL,NULL,'nan'),(37,443,1,1,1,'',1.8727,'UG/L','',NULL,NULL,'nan'),(38,420,1,1,1,'',1.8727,'UG/L','',NULL,NULL,'nan'),(39,383,1,1,1,'',1.8727,'UG/L','',NULL,NULL,'nan'),(40,368,1,1,1,'',1.8727,'UG/L','',NULL,NULL,'nan'),(41,332,1,1,1,'',1.8727,'UG/L','',NULL,NULL,'nan'),(42,315,1,1,1,'',1.8727,'UG/L','',NULL,NULL,'nan'),(43,279,1,1,1,'',1.8727,'UG/L','',NULL,NULL,'nan'),(44,263,1,1,1,'',1.8727,'UG/L','',NULL,NULL,'nan'),(45,230,1,1,1,'',1.8727,'UG/L','',NULL,NULL,'nan'),(46,216,1,1,1,'',1.8727,'UG/L','',NULL,NULL,'nan'),(47,181,1,1,1,'',1.8727,'UG/L','',NULL,NULL,'nan'),(48,166,1,1,1,'',1.8727,'UG/L','',NULL,NULL,'nan'),(49,141,1,1,1,'',1.8727,'UG/L','',NULL,NULL,'nan'),(50,129,1,1,1,'',1.8727,'UG/L','',NULL,NULL,'nan'),(51,92,1,1,1,'',1.8727,'UG/L','',NULL,NULL,'nan'),(52,76,1,1,1,'',1.8727,'UG/L','',NULL,NULL,'nan'),(53,40,1,1,1,'',1.8727,'UG/L','',NULL,NULL,'nan'),(54,24,1,1,1,'',1.8727,'UG/L','',NULL,NULL,'nan'),(55,2713,1,1,1,'',3.7036,'UG/L','',NULL,NULL,'nan'),(56,2677,1,1,1,'',3.7036,'UG/L','',NULL,NULL,'nan'),(57,2661,1,1,1,'',3.7036,'UG/L','',NULL,NULL,'nan'),(58,2626,1,1,1,'',3.7036,'UG/L','',NULL,NULL,'nan'),(59,2608,1,1,1,'',3.7036,'UG/L','',NULL,NULL,'nan'),(60,2574,1,1,1,'',3.7036,'UG/L','',NULL,NULL,'nan'),(61,2557,1,1,1,'',3.7036,'UG/L','',NULL,NULL,'nan'),(62,2475,1,1,1,'',3.7036,'UG/L','',NULL,NULL,'nan'),(63,2473,1,1,1,'',3.7036,'UG/L','',NULL,NULL,'nan'),(64,2469,1,1,1,'',3.7036,'UG/L','',NULL,NULL,'nan'),(65,2453,1,1,1,'',3.7036,'UG/L','',NULL,NULL,'nan'),(66,2419,1,1,1,'',3.7036,'UG/L','',NULL,NULL,'nan'),(67,2400,1,1,1,'',3.7036,'UG/L','',NULL,NULL,'nan'),(68,2366,1,1,1,'',3.7036,'UG/L','',NULL,NULL,'nan'),(69,2348,1,1,1,'',3.7036,'UG/L','',NULL,NULL,'nan'),(70,2315,1,1,1,'',3.7036,'UG/L','',NULL,NULL,'nan'),(71,2266,1,1,1,'',3.7036,'UG/L','',NULL,NULL,'nan'),(72,2216,1,1,1,'',3.7036,'UG/L','',NULL,NULL,'nan'),(73,2154,1,1,1,'',3.7036,'UG/L','',NULL,NULL,'nan'),(74,2136,1,1,1,'',3.7036,'UG/L','',NULL,NULL,'nan'),(75,2101,1,1,1,'',3.7036,'UG/L','',NULL,NULL,'nan'),(76,2084,1,1,1,'',3.7036,'UG/L','',NULL,NULL,'nan'),(77,2049,1,1,1,'',3.7036,'UG/L','',NULL,NULL,'nan'),(78,666,1,1,1,'',3.7036,'UG/L','',NULL,NULL,'nan'),(79,630,1,1,1,'',3.7036,'UG/L','',NULL,NULL,'nan'),(80,614,1,1,1,'',3.7036,'UG/L','',NULL,NULL,'nan'),(81,579,1,1,1,'',3.7036,'UG/L','',NULL,NULL,'nan'),(82,561,1,1,1,'',3.7036,'UG/L','',NULL,NULL,'nan'),(83,527,1,1,1,'',3.7036,'UG/L','',NULL,NULL,'nan'),(84,510,1,1,1,'',3.7036,'UG/L','',NULL,NULL,'nan'),(85,428,1,1,1,'',3.7036,'UG/L','',NULL,NULL,'nan'),(86,426,1,1,1,'',3.7036,'UG/L','',NULL,NULL,'nan'),(87,422,1,1,1,'',3.7036,'UG/L','',NULL,NULL,'nan'),(88,406,1,1,1,'',3.7036,'UG/L','',NULL,NULL,'nan'),(89,372,1,1,1,'',3.7036,'UG/L','',NULL,NULL,'nan'),(90,353,1,1,1,'',3.7036,'UG/L','',NULL,NULL,'nan'),(91,319,1,1,1,'',3.7036,'UG/L','',NULL,NULL,'nan'),(92,301,1,1,1,'',3.7036,'UG/L','',NULL,NULL,'nan'),(93,268,1,1,1,'',3.7036,'UG/L','',NULL,NULL,'nan'),(94,219,1,1,1,'',3.7036,'UG/L','',NULL,NULL,'nan'),(95,169,1,1,1,'',3.7036,'UG/L','',NULL,NULL,'nan'),(96,107,1,1,1,'',3.7036,'UG/L','',NULL,NULL,'nan'),(97,89,1,1,1,'',3.7036,'UG/L','',NULL,NULL,'nan'),(98,54,1,1,1,'',3.7036,'UG/L','',NULL,NULL,'nan'),(99,37,1,1,1,'',3.7036,'UG/L','',NULL,NULL,'nan'),(100,2,1,1,1,'',3.7036,'UG/L','',NULL,NULL,'nan'),(101,2714,1,1,1,'',2.0336,'UG/L','',NULL,NULL,'nan'),(102,2678,1,1,1,'',2.0336,'UG/L','',NULL,NULL,'nan'),(103,2662,1,1,1,'',2.0336,'UG/L','',NULL,NULL,'nan'),(104,2625,1,1,1,'',2.0336,'UG/L','',NULL,NULL,'nan'),(105,2610,1,1,1,'',2.0336,'UG/L','',NULL,NULL,'nan'),(106,2573,1,1,1,'',2.0336,'UG/L','',NULL,NULL,'nan'),(107,2558,1,1,1,'',2.0336,'UG/L','',NULL,NULL,'nan'),(108,2486,1,1,1,'',2.0336,'UG/L','',NULL,NULL,'nan'),(109,2443,1,1,1,'',2.0336,'UG/L','',NULL,NULL,'nan'),(110,2428,1,1,1,'',2.0336,'UG/L','',NULL,NULL,'nan'),(111,2391,1,1,1,'',2.0336,'UG/L','',NULL,NULL,'nan'),(112,2367,1,1,1,'',2.0336,'UG/L','',NULL,NULL,'nan'),(113,2339,1,1,1,'',2.0336,'UG/L','',NULL,NULL,'nan'),(114,2324,1,1,1,'',2.0336,'UG/L','',NULL,NULL,'nan'),(115,2275,1,1,1,'',2.0336,'UG/L','',NULL,NULL,'nan'),(116,2226,1,1,1,'',2.0336,'UG/L','',NULL,NULL,'nan'),(117,2152,1,1,1,'',2.0336,'UG/L','',NULL,NULL,'nan'),(118,2137,1,1,1,'',2.0336,'UG/L','',NULL,NULL,'nan'),(119,2100,1,1,1,'',2.0336,'UG/L','',NULL,NULL,'nan'),(120,2085,1,1,1,'',2.0336,'UG/L','',NULL,NULL,'nan'),(121,2048,1,1,1,'',2.0336,'UG/L','',NULL,NULL,'nan'),(122,667,1,1,1,'',2.0336,'UG/L','',NULL,NULL,'nan'),(123,631,1,1,1,'',2.0336,'UG/L','',NULL,NULL,'nan'),(124,615,1,1,1,'',2.0336,'UG/L','',NULL,NULL,'nan'),(125,578,1,1,1,'',2.0336,'UG/L','',NULL,NULL,'nan'),(126,563,1,1,1,'',2.0336,'UG/L','',NULL,NULL,'nan'),(127,526,1,1,1,'',2.0336,'UG/L','',NULL,NULL,'nan'),(128,511,1,1,1,'',2.0336,'UG/L','',NULL,NULL,'nan'),(129,439,1,1,1,'',2.0336,'UG/L','',NULL,NULL,'nan'),(130,396,1,1,1,'',2.0336,'UG/L','',NULL,NULL,'nan'),(131,381,1,1,1,'',2.0336,'UG/L','',NULL,NULL,'nan'),(132,344,1,1,1,'',2.0336,'UG/L','',NULL,NULL,'nan'),(133,320,1,1,1,'',2.0336,'UG/L','',NULL,NULL,'nan'),(134,292,1,1,1,'',2.0336,'UG/L','',NULL,NULL,'nan'),(135,277,1,1,1,'',2.0336,'UG/L','',NULL,NULL,'nan'),(136,228,1,1,1,'',2.0336,'UG/L','',NULL,NULL,'nan'),(137,179,1,1,1,'',2.0336,'UG/L','',NULL,NULL,'nan'),(138,105,1,1,1,'',2.0336,'UG/L','',NULL,NULL,'nan'),(139,90,1,1,1,'',2.0336,'UG/L','',NULL,NULL,'nan'),(140,53,1,1,1,'',2.0336,'UG/L','',NULL,NULL,'nan'),(141,38,1,1,1,'',2.0336,'UG/L','',NULL,NULL,'nan'),(142,1,1,1,1,'',2.0336,'UG/L','',NULL,NULL,'nan'),(143,2724,2,2,1,'',14.6320,'MG/L','',NULL,NULL,'nan'),(144,2693,2,2,1,'',14.6320,'MG/L','',NULL,NULL,'nan'),(145,2674,2,2,1,'',14.6320,'MG/L','',NULL,NULL,'nan'),(146,2641,2,2,1,'',14.6320,'MG/L','',NULL,NULL,'nan'),(147,2622,2,2,1,'',14.6320,'MG/L','',NULL,NULL,'nan'),(148,2587,2,2,1,'',14.6320,'MG/L','',NULL,NULL,'nan'),(149,2569,2,2,1,'',14.6320,'MG/L','',NULL,NULL,'nan'),(150,2536,2,2,1,'',14.6320,'MG/L','',NULL,NULL,'nan'),(151,2519,2,2,1,'',14.6320,'MG/L','',NULL,NULL,'nan'),(152,2490,2,2,1,'',14.6320,'MG/L','',NULL,NULL,'nan'),(153,2467,2,2,1,'',14.6320,'MG/L','',NULL,NULL,'nan'),(154,2430,2,2,1,'',14.6320,'MG/L','',NULL,NULL,'nan'),(155,2415,2,2,1,'',14.6320,'MG/L','',NULL,NULL,'nan'),(156,2379,2,2,1,'',14.6320,'MG/L','',NULL,NULL,'nan'),(157,2362,2,2,1,'',14.6320,'MG/L','',NULL,NULL,'nan'),(158,2326,2,2,1,'',14.6320,'MG/L','',NULL,NULL,'nan'),(159,2310,2,2,1,'',14.6320,'MG/L','',NULL,NULL,'nan'),(160,2277,2,2,1,'',14.6320,'MG/L','',NULL,NULL,'nan'),(161,2263,2,2,1,'',14.6320,'MG/L','',NULL,NULL,'nan'),(162,2228,2,2,1,'',14.6320,'MG/L','',NULL,NULL,'nan'),(163,2213,2,2,1,'',14.6320,'MG/L','',NULL,NULL,'nan'),(164,2188,2,2,1,'',14.6320,'MG/L','',NULL,NULL,'nan'),(165,2176,2,2,1,'',14.6320,'MG/L','',NULL,NULL,'nan'),(166,2139,2,2,1,'',14.6320,'MG/L','',NULL,NULL,'nan'),(167,2123,2,2,1,'',14.6320,'MG/L','',NULL,NULL,'nan'),(168,2087,2,2,1,'',14.6320,'MG/L','',NULL,NULL,'nan'),(169,2071,2,2,1,'',14.6320,'MG/L','',NULL,NULL,'nan'),(170,677,2,2,1,'',14.6320,'MG/L','',NULL,NULL,'nan'),(171,646,2,2,1,'',14.6320,'MG/L','',NULL,NULL,'nan'),(172,627,2,2,1,'',14.6320,'MG/L','',NULL,NULL,'nan'),(173,594,2,2,1,'',14.6320,'MG/L','',NULL,NULL,'nan'),(174,575,2,2,1,'',14.6320,'MG/L','',NULL,NULL,'nan'),(175,540,2,2,1,'',14.6320,'MG/L','',NULL,NULL,'nan'),(176,522,2,2,1,'',14.6320,'MG/L','',NULL,NULL,'nan'),(177,489,2,2,1,'',14.6320,'MG/L','',NULL,NULL,'nan'),(178,472,2,2,1,'',14.6320,'MG/L','',NULL,NULL,'nan'),(179,443,2,2,1,'',14.6320,'MG/L','',NULL,NULL,'nan'),(180,420,2,2,1,'',14.6320,'MG/L','',NULL,NULL,'nan'),(181,383,2,2,1,'',14.6320,'MG/L','',NULL,NULL,'nan'),(182,368,2,2,1,'',14.6320,'MG/L','',NULL,NULL,'nan'),(183,332,2,2,1,'',14.6320,'MG/L','',NULL,NULL,'nan'),(184,315,2,2,1,'',14.6320,'MG/L','',NULL,NULL,'nan'),(185,279,2,2,1,'',14.6320,'MG/L','',NULL,NULL,'nan'),(186,263,2,2,1,'',14.6320,'MG/L','',NULL,NULL,'nan'),(187,230,2,2,1,'',14.6320,'MG/L','',NULL,NULL,'nan'),(188,216,2,2,1,'',14.6320,'MG/L','',NULL,NULL,'nan'),(189,181,2,2,1,'',14.6320,'MG/L','',NULL,NULL,'nan'),(190,166,2,2,1,'',14.6320,'MG/L','',NULL,NULL,'nan'),(191,141,2,2,1,'',14.6320,'MG/L','',NULL,NULL,'nan'),(192,129,2,2,1,'',14.6320,'MG/L','',NULL,NULL,'nan'),(193,92,2,2,1,'',14.6320,'MG/L','',NULL,NULL,'nan'),(194,76,2,2,1,'',14.6320,'MG/L','',NULL,NULL,'nan'),(195,40,2,2,1,'',14.6320,'MG/L','',NULL,NULL,'nan'),(196,24,2,2,1,'',14.6320,'MG/L','',NULL,NULL,'nan'),(197,2714,2,2,1,'',14.7050,'MG/L','',NULL,NULL,'nan'),(198,2678,2,2,1,'',14.7050,'MG/L','',NULL,NULL,'nan'),(199,2662,2,2,1,'',14.7050,'MG/L','',NULL,NULL,'nan'),(200,2625,2,2,1,'',14.7050,'MG/L','',NULL,NULL,'nan'),(201,2610,2,2,1,'',14.7050,'MG/L','',NULL,NULL,'nan'),(202,2573,2,2,1,'',14.7050,'MG/L','',NULL,NULL,'nan'),(203,2558,2,2,1,'',14.7050,'MG/L','',NULL,NULL,'nan'),(204,2486,2,2,1,'',14.7050,'MG/L','',NULL,NULL,'nan'),(205,2443,2,2,1,'',14.7050,'MG/L','',NULL,NULL,'nan'),(206,2428,2,2,1,'',14.7050,'MG/L','',NULL,NULL,'nan'),(207,2391,2,2,1,'',14.7050,'MG/L','',NULL,NULL,'nan'),(208,2367,2,2,1,'',14.7050,'MG/L','',NULL,NULL,'nan'),(209,2339,2,2,1,'',14.7050,'MG/L','',NULL,NULL,'nan'),(210,2324,2,2,1,'',14.7050,'MG/L','',NULL,NULL,'nan'),(211,2275,2,2,1,'',14.7050,'MG/L','',NULL,NULL,'nan'),(212,2226,2,2,1,'',14.7050,'MG/L','',NULL,NULL,'nan'),(213,2152,2,2,1,'',14.7050,'MG/L','',NULL,NULL,'nan'),(214,2137,2,2,1,'',14.7050,'MG/L','',NULL,NULL,'nan'),(215,2100,2,2,1,'',14.7050,'MG/L','',NULL,NULL,'nan'),(216,2085,2,2,1,'',14.7050,'MG/L','',NULL,NULL,'nan'),(217,2048,2,2,1,'',14.7050,'MG/L','',NULL,NULL,'nan'),(218,667,2,2,1,'',14.7050,'MG/L','',NULL,NULL,'nan'),(219,631,2,2,1,'',14.7050,'MG/L','',NULL,NULL,'nan'),(220,615,2,2,1,'',14.7050,'MG/L','',NULL,NULL,'nan'),(221,578,2,2,1,'',14.7050,'MG/L','',NULL,NULL,'nan'),(222,563,2,2,1,'',14.7050,'MG/L','',NULL,NULL,'nan'),(223,526,2,2,1,'',14.7050,'MG/L','',NULL,NULL,'nan'),(224,511,2,2,1,'',14.7050,'MG/L','',NULL,NULL,'nan'),(225,439,2,2,1,'',14.7050,'MG/L','',NULL,NULL,'nan'),(226,396,2,2,1,'',14.7050,'MG/L','',NULL,NULL,'nan'),(227,381,2,2,1,'',14.7050,'MG/L','',NULL,NULL,'nan'),(228,344,2,2,1,'',14.7050,'MG/L','',NULL,NULL,'nan'),(229,320,2,2,1,'',14.7050,'MG/L','',NULL,NULL,'nan'),(230,292,2,2,1,'',14.7050,'MG/L','',NULL,NULL,'nan'),(231,277,2,2,1,'',14.7050,'MG/L','',NULL,NULL,'nan'),(232,228,2,2,1,'',14.7050,'MG/L','',NULL,NULL,'nan'),(233,179,2,2,1,'',14.7050,'MG/L','',NULL,NULL,'nan'),(234,105,2,2,1,'',14.7050,'MG/L','',NULL,NULL,'nan'),(235,90,2,2,1,'',14.7050,'MG/L','',NULL,NULL,'nan'),(236,53,2,2,1,'',14.7050,'MG/L','',NULL,NULL,'nan'),(237,38,2,2,1,'',14.7050,'MG/L','',NULL,NULL,'nan'),(238,1,2,2,1,'',14.7050,'MG/L','',NULL,NULL,'nan'),(239,2713,2,2,1,'',16.7530,'MG/L','',NULL,NULL,'nan'),(240,2677,2,2,1,'',16.7530,'MG/L','',NULL,NULL,'nan'),(241,2661,2,2,1,'',16.7530,'MG/L','',NULL,NULL,'nan'),(242,2626,2,2,1,'',16.7530,'MG/L','',NULL,NULL,'nan'),(243,2608,2,2,1,'',16.7530,'MG/L','',NULL,NULL,'nan'),(244,2574,2,2,1,'',16.7530,'MG/L','',NULL,NULL,'nan'),(245,2557,2,2,1,'',16.7530,'MG/L','',NULL,NULL,'nan'),(246,2475,2,2,1,'',16.7530,'MG/L','',NULL,NULL,'nan'),(247,2473,2,2,1,'',16.7530,'MG/L','',NULL,NULL,'nan'),(248,2469,2,2,1,'',16.7530,'MG/L','',NULL,NULL,'nan'),(249,2453,2,2,1,'',16.7530,'MG/L','',NULL,NULL,'nan'),(250,2419,2,2,1,'',16.7530,'MG/L','',NULL,NULL,'nan'),(251,2400,2,2,1,'',16.7530,'MG/L','',NULL,NULL,'nan'),(252,2366,2,2,1,'',16.7530,'MG/L','',NULL,NULL,'nan'),(253,2348,2,2,1,'',16.7530,'MG/L','',NULL,NULL,'nan'),(254,2315,2,2,1,'',16.7530,'MG/L','',NULL,NULL,'nan'),(255,2266,2,2,1,'',16.7530,'MG/L','',NULL,NULL,'nan'),(256,2216,2,2,1,'',16.7530,'MG/L','',NULL,NULL,'nan'),(257,2154,2,2,1,'',16.7530,'MG/L','',NULL,NULL,'nan'),(258,2136,2,2,1,'',16.7530,'MG/L','',NULL,NULL,'nan'),(259,2101,2,2,1,'',16.7530,'MG/L','',NULL,NULL,'nan'),(260,2084,2,2,1,'',16.7530,'MG/L','',NULL,NULL,'nan'),(261,2049,2,2,1,'',16.7530,'MG/L','',NULL,NULL,'nan'),(262,666,2,2,1,'',16.7530,'MG/L','',NULL,NULL,'nan'),(263,630,2,2,1,'',16.7530,'MG/L','',NULL,NULL,'nan'),(264,614,2,2,1,'',16.7530,'MG/L','',NULL,NULL,'nan'),(265,579,2,2,1,'',16.7530,'MG/L','',NULL,NULL,'nan'),(266,561,2,2,1,'',16.7530,'MG/L','',NULL,NULL,'nan'),(267,527,2,2,1,'',16.7530,'MG/L','',NULL,NULL,'nan'),(268,510,2,2,1,'',16.7530,'MG/L','',NULL,NULL,'nan'),(269,428,2,2,1,'',16.7530,'MG/L','',NULL,NULL,'nan'),(270,426,2,2,1,'',16.7530,'MG/L','',NULL,NULL,'nan'),(271,422,2,2,1,'',16.7530,'MG/L','',NULL,NULL,'nan'),(272,406,2,2,1,'',16.7530,'MG/L','',NULL,NULL,'nan'),(273,372,2,2,1,'',16.7530,'MG/L','',NULL,NULL,'nan'),(274,353,2,2,1,'',16.7530,'MG/L','',NULL,NULL,'nan'),(275,319,2,2,1,'',16.7530,'MG/L','',NULL,NULL,'nan'),(276,301,2,2,1,'',16.7530,'MG/L','',NULL,NULL,'nan'),(277,268,2,2,1,'',16.7530,'MG/L','',NULL,NULL,'nan'),(278,219,2,2,1,'',16.7530,'MG/L','',NULL,NULL,'nan'),(279,169,2,2,1,'',16.7530,'MG/L','',NULL,NULL,'nan'),(280,107,2,2,1,'',16.7530,'MG/L','',NULL,NULL,'nan'),(281,89,2,2,1,'',16.7530,'MG/L','',NULL,NULL,'nan'),(282,54,2,2,1,'',16.7530,'MG/L','',NULL,NULL,'nan'),(283,37,2,2,1,'',16.7530,'MG/L','',NULL,NULL,'nan'),(284,2,2,2,1,'',16.7530,'MG/L','',NULL,NULL,'nan'),(285,2724,3,3,2,'',9.3700,'MG/L','',NULL,NULL,'nan'),(286,2693,3,3,2,'',9.3700,'MG/L','',NULL,NULL,'nan'),(287,2674,3,3,2,'',9.3700,'MG/L','',NULL,NULL,'nan'),(288,2641,3,3,2,'',9.3700,'MG/L','',NULL,NULL,'nan'),(289,2622,3,3,2,'',9.3700,'MG/L','',NULL,NULL,'nan'),(290,2587,3,3,2,'',9.3700,'MG/L','',NULL,NULL,'nan'),(291,2569,3,3,2,'',9.3700,'MG/L','',NULL,NULL,'nan'),(292,2536,3,3,2,'',9.3700,'MG/L','',NULL,NULL,'nan'),(293,2519,3,3,2,'',9.3700,'MG/L','',NULL,NULL,'nan'),(294,2490,3,3,2,'',9.3700,'MG/L','',NULL,NULL,'nan'),(295,2467,3,3,2,'',9.3700,'MG/L','',NULL,NULL,'nan'),(296,2430,3,3,2,'',9.3700,'MG/L','',NULL,NULL,'nan'),(297,2415,3,3,2,'',9.3700,'MG/L','',NULL,NULL,'nan'),(298,2379,3,3,2,'',9.3700,'MG/L','',NULL,NULL,'nan'),(299,2362,3,3,2,'',9.3700,'MG/L','',NULL,NULL,'nan'),(300,2326,3,3,2,'',9.3700,'MG/L','',NULL,NULL,'nan'),(301,2310,3,3,2,'',9.3700,'MG/L','',NULL,NULL,'nan'),(302,2277,3,3,2,'',9.3700,'MG/L','',NULL,NULL,'nan'),(303,2263,3,3,2,'',9.3700,'MG/L','',NULL,NULL,'nan'),(304,2228,3,3,2,'',9.3700,'MG/L','',NULL,NULL,'nan'),(305,2213,3,3,2,'',9.3700,'MG/L','',NULL,NULL,'nan'),(306,2188,3,3,2,'',9.3700,'MG/L','',NULL,NULL,'nan'),(307,2176,3,3,2,'',9.3700,'MG/L','',NULL,NULL,'nan'),(308,2139,3,3,2,'',9.3700,'MG/L','',NULL,NULL,'nan'),(309,2123,3,3,2,'',9.3700,'MG/L','',NULL,NULL,'nan'),(310,2087,3,3,2,'',9.3700,'MG/L','',NULL,NULL,'nan'),(311,2071,3,3,2,'',9.3700,'MG/L','',NULL,NULL,'nan'),(312,677,3,3,2,'',9.3700,'MG/L','',NULL,NULL,'nan'),(313,646,3,3,2,'',9.3700,'MG/L','',NULL,NULL,'nan'),(314,627,3,3,2,'',9.3700,'MG/L','',NULL,NULL,'nan'),(315,594,3,3,2,'',9.3700,'MG/L','',NULL,NULL,'nan'),(316,575,3,3,2,'',9.3700,'MG/L','',NULL,NULL,'nan'),(317,540,3,3,2,'',9.3700,'MG/L','',NULL,NULL,'nan'),(318,522,3,3,2,'',9.3700,'MG/L','',NULL,NULL,'nan'),(319,489,3,3,2,'',9.3700,'MG/L','',NULL,NULL,'nan'),(320,472,3,3,2,'',9.3700,'MG/L','',NULL,NULL,'nan'),(321,443,3,3,2,'',9.3700,'MG/L','',NULL,NULL,'nan'),(322,420,3,3,2,'',9.3700,'MG/L','',NULL,NULL,'nan'),(323,383,3,3,2,'',9.3700,'MG/L','',NULL,NULL,'nan'),(324,368,3,3,2,'',9.3700,'MG/L','',NULL,NULL,'nan'),(325,332,3,3,2,'',9.3700,'MG/L','',NULL,NULL,'nan'),(326,315,3,3,2,'',9.3700,'MG/L','',NULL,NULL,'nan'),(327,279,3,3,2,'',9.3700,'MG/L','',NULL,NULL,'nan'),(328,263,3,3,2,'',9.3700,'MG/L','',NULL,NULL,'nan'),(329,230,3,3,2,'',9.3700,'MG/L','',NULL,NULL,'nan'),(330,216,3,3,2,'',9.3700,'MG/L','',NULL,NULL,'nan'),(331,181,3,3,2,'',9.3700,'MG/L','',NULL,NULL,'nan'),(332,166,3,3,2,'',9.3700,'MG/L','',NULL,NULL,'nan'),(333,141,3,3,2,'',9.3700,'MG/L','',NULL,NULL,'nan'),(334,129,3,3,2,'',9.3700,'MG/L','',NULL,NULL,'nan'),(335,92,3,3,2,'',9.3700,'MG/L','',NULL,NULL,'nan'),(336,76,3,3,2,'',9.3700,'MG/L','',NULL,NULL,'nan'),(337,40,3,3,2,'',9.3700,'MG/L','',NULL,NULL,'nan'),(338,24,3,3,2,'',9.3700,'MG/L','',NULL,NULL,'nan'),(339,2713,3,3,2,'',11.2700,'MG/L','',NULL,NULL,'nan'),(340,2677,3,3,2,'',11.2700,'MG/L','',NULL,NULL,'nan'),(341,2661,3,3,2,'',11.2700,'MG/L','',NULL,NULL,'nan'),(342,2626,3,3,2,'',11.2700,'MG/L','',NULL,NULL,'nan'),(343,2608,3,3,2,'',11.2700,'MG/L','',NULL,NULL,'nan'),(344,2574,3,3,2,'',11.2700,'MG/L','',NULL,NULL,'nan'),(345,2557,3,3,2,'',11.2700,'MG/L','',NULL,NULL,'nan'),(346,2475,3,3,2,'',11.2700,'MG/L','',NULL,NULL,'nan'),(347,2473,3,3,2,'',11.2700,'MG/L','',NULL,NULL,'nan'),(348,2469,3,3,2,'',11.2700,'MG/L','',NULL,NULL,'nan'),(349,2453,3,3,2,'',11.2700,'MG/L','',NULL,NULL,'nan'),(350,2419,3,3,2,'',11.2700,'MG/L','',NULL,NULL,'nan'),(351,2400,3,3,2,'',11.2700,'MG/L','',NULL,NULL,'nan'),(352,2366,3,3,2,'',11.2700,'MG/L','',NULL,NULL,'nan'),(353,2348,3,3,2,'',11.2700,'MG/L','',NULL,NULL,'nan'),(354,2315,3,3,2,'',11.2700,'MG/L','',NULL,NULL,'nan'),(355,2266,3,3,2,'',11.2700,'MG/L','',NULL,NULL,'nan'),(356,2216,3,3,2,'',11.2700,'MG/L','',NULL,NULL,'nan'),(357,2154,3,3,2,'',11.2700,'MG/L','',NULL,NULL,'nan'),(358,2136,3,3,2,'',11.2700,'MG/L','',NULL,NULL,'nan'),(359,2101,3,3,2,'',11.2700,'MG/L','',NULL,NULL,'nan'),(360,2084,3,3,2,'',11.2700,'MG/L','',NULL,NULL,'nan'),(361,2049,3,3,2,'',11.2700,'MG/L','',NULL,NULL,'nan'),(362,666,3,3,2,'',11.2700,'MG/L','',NULL,NULL,'nan'),(363,630,3,3,2,'',11.2700,'MG/L','',NULL,NULL,'nan'),(364,614,3,3,2,'',11.2700,'MG/L','',NULL,NULL,'nan'),(365,579,3,3,2,'',11.2700,'MG/L','',NULL,NULL,'nan'),(366,561,3,3,2,'',11.2700,'MG/L','',NULL,NULL,'nan'),(367,527,3,3,2,'',11.2700,'MG/L','',NULL,NULL,'nan'),(368,510,3,3,2,'',11.2700,'MG/L','',NULL,NULL,'nan'),(369,428,3,3,2,'',11.2700,'MG/L','',NULL,NULL,'nan'),(370,426,3,3,2,'',11.2700,'MG/L','',NULL,NULL,'nan'),(371,422,3,3,2,'',11.2700,'MG/L','',NULL,NULL,'nan'),(372,406,3,3,2,'',11.2700,'MG/L','',NULL,NULL,'nan'),(373,372,3,3,2,'',11.2700,'MG/L','',NULL,NULL,'nan'),(374,353,3,3,2,'',11.2700,'MG/L','',NULL,NULL,'nan'),(375,319,3,3,2,'',11.2700,'MG/L','',NULL,NULL,'nan'),(376,301,3,3,2,'',11.2700,'MG/L','',NULL,NULL,'nan'),(377,268,3,3,2,'',11.2700,'MG/L','',NULL,NULL,'nan'),(378,219,3,3,2,'',11.2700,'MG/L','',NULL,NULL,'nan'),(379,169,3,3,2,'',11.2700,'MG/L','',NULL,NULL,'nan'),(380,107,3,3,2,'',11.2700,'MG/L','',NULL,NULL,'nan'),(381,89,3,3,2,'',11.2700,'MG/L','',NULL,NULL,'nan'),(382,54,3,3,2,'',11.2700,'MG/L','',NULL,NULL,'nan'),(383,37,3,3,2,'',11.2700,'MG/L','',NULL,NULL,'nan'),(384,2,3,3,2,'',11.2700,'MG/L','',NULL,NULL,'nan'),(385,2714,3,3,2,'',11.8000,'MG/L','',NULL,NULL,'nan'),(386,2678,3,3,2,'',11.8000,'MG/L','',NULL,NULL,'nan'),(387,2662,3,3,2,'',11.8000,'MG/L','',NULL,NULL,'nan'),(388,2625,3,3,2,'',11.8000,'MG/L','',NULL,NULL,'nan'),(389,2610,3,3,2,'',11.8000,'MG/L','',NULL,NULL,'nan'),(390,2573,3,3,2,'',11.8000,'MG/L','',NULL,NULL,'nan'),(391,2558,3,3,2,'',11.8000,'MG/L','',NULL,NULL,'nan'),(392,2486,3,3,2,'',11.8000,'MG/L','',NULL,NULL,'nan'),(393,2443,3,3,2,'',11.8000,'MG/L','',NULL,NULL,'nan'),(394,2428,3,3,2,'',11.8000,'MG/L','',NULL,NULL,'nan'),(395,2391,3,3,2,'',11.8000,'MG/L','',NULL,NULL,'nan'),(396,2367,3,3,2,'',11.8000,'MG/L','',NULL,NULL,'nan'),(397,2339,3,3,2,'',11.8000,'MG/L','',NULL,NULL,'nan'),(398,2324,3,3,2,'',11.8000,'MG/L','',NULL,NULL,'nan'),(399,2275,3,3,2,'',11.8000,'MG/L','',NULL,NULL,'nan'),(400,2226,3,3,2,'',11.8000,'MG/L','',NULL,NULL,'nan'),(401,2152,3,3,2,'',11.8000,'MG/L','',NULL,NULL,'nan'),(402,2137,3,3,2,'',11.8000,'MG/L','',NULL,NULL,'nan'),(403,2100,3,3,2,'',11.8000,'MG/L','',NULL,NULL,'nan'),(404,2085,3,3,2,'',11.8000,'MG/L','',NULL,NULL,'nan'),(405,2048,3,3,2,'',11.8000,'MG/L','',NULL,NULL,'nan'),(406,667,3,3,2,'',11.8000,'MG/L','',NULL,NULL,'nan'),(407,631,3,3,2,'',11.8000,'MG/L','',NULL,NULL,'nan'),(408,615,3,3,2,'',11.8000,'MG/L','',NULL,NULL,'nan'),(409,578,3,3,2,'',11.8000,'MG/L','',NULL,NULL,'nan'),(410,563,3,3,2,'',11.8000,'MG/L','',NULL,NULL,'nan'),(411,526,3,3,2,'',11.8000,'MG/L','',NULL,NULL,'nan'),(412,511,3,3,2,'',11.8000,'MG/L','',NULL,NULL,'nan'),(413,439,3,3,2,'',11.8000,'MG/L','',NULL,NULL,'nan'),(414,396,3,3,2,'',11.8000,'MG/L','',NULL,NULL,'nan'),(415,381,3,3,2,'',11.8000,'MG/L','',NULL,NULL,'nan'),(416,344,3,3,2,'',11.8000,'MG/L','',NULL,NULL,'nan'),(417,320,3,3,2,'',11.8000,'MG/L','',NULL,NULL,'nan'),(418,292,3,3,2,'',11.8000,'MG/L','',NULL,NULL,'nan'),(419,277,3,3,2,'',11.8000,'MG/L','',NULL,NULL,'nan'),(420,228,3,3,2,'',11.8000,'MG/L','',NULL,NULL,'nan'),(421,179,3,3,2,'',11.8000,'MG/L','',NULL,NULL,'nan'),(422,105,3,3,2,'',11.8000,'MG/L','',NULL,NULL,'nan'),(423,90,3,3,2,'',11.8000,'MG/L','',NULL,NULL,'nan'),(424,53,3,3,2,'',11.8000,'MG/L','',NULL,NULL,'nan'),(425,38,3,3,2,'',11.8000,'MG/L','',NULL,NULL,'nan'),(426,1,3,3,2,'',11.8000,'MG/L','',NULL,NULL,'nan'),(427,2724,4,4,2,'',109.8000,'PCT','',NULL,NULL,'nan'),(428,2693,4,4,2,'',109.8000,'PCT','',NULL,NULL,'nan'),(429,2674,4,4,2,'',109.8000,'PCT','',NULL,NULL,'nan'),(430,2641,4,4,2,'',109.8000,'PCT','',NULL,NULL,'nan'),(431,2622,4,4,2,'',109.8000,'PCT','',NULL,NULL,'nan'),(432,2587,4,4,2,'',109.8000,'PCT','',NULL,NULL,'nan'),(433,2569,4,4,2,'',109.8000,'PCT','',NULL,NULL,'nan'),(434,2536,4,4,2,'',109.8000,'PCT','',NULL,NULL,'nan'),(435,2519,4,4,2,'',109.8000,'PCT','',NULL,NULL,'nan'),(436,2490,4,4,2,'',109.8000,'PCT','',NULL,NULL,'nan'),(437,2467,4,4,2,'',109.8000,'PCT','',NULL,NULL,'nan'),(438,2430,4,4,2,'',109.8000,'PCT','',NULL,NULL,'nan'),(439,2415,4,4,2,'',109.8000,'PCT','',NULL,NULL,'nan'),(440,2379,4,4,2,'',109.8000,'PCT','',NULL,NULL,'nan'),(441,2362,4,4,2,'',109.8000,'PCT','',NULL,NULL,'nan'),(442,2326,4,4,2,'',109.8000,'PCT','',NULL,NULL,'nan'),(443,2310,4,4,2,'',109.8000,'PCT','',NULL,NULL,'nan'),(444,2277,4,4,2,'',109.8000,'PCT','',NULL,NULL,'nan'),(445,2263,4,4,2,'',109.8000,'PCT','',NULL,NULL,'nan'),(446,2228,4,4,2,'',109.8000,'PCT','',NULL,NULL,'nan'),(447,2213,4,4,2,'',109.8000,'PCT','',NULL,NULL,'nan'),(448,2188,4,4,2,'',109.8000,'PCT','',NULL,NULL,'nan'),(449,2176,4,4,2,'',109.8000,'PCT','',NULL,NULL,'nan'),(450,2139,4,4,2,'',109.8000,'PCT','',NULL,NULL,'nan'),(451,2123,4,4,2,'',109.8000,'PCT','',NULL,NULL,'nan'),(452,2087,4,4,2,'',109.8000,'PCT','',NULL,NULL,'nan'),(453,2071,4,4,2,'',109.8000,'PCT','',NULL,NULL,'nan'),(454,677,4,4,2,'',109.8000,'PCT','',NULL,NULL,'nan'),(455,646,4,4,2,'',109.8000,'PCT','',NULL,NULL,'nan'),(456,627,4,4,2,'',109.8000,'PCT','',NULL,NULL,'nan'),(457,594,4,4,2,'',109.8000,'PCT','',NULL,NULL,'nan'),(458,575,4,4,2,'',109.8000,'PCT','',NULL,NULL,'nan'),(459,540,4,4,2,'',109.8000,'PCT','',NULL,NULL,'nan'),(460,522,4,4,2,'',109.8000,'PCT','',NULL,NULL,'nan'),(461,489,4,4,2,'',109.8000,'PCT','',NULL,NULL,'nan'),(462,472,4,4,2,'',109.8000,'PCT','',NULL,NULL,'nan'),(463,443,4,4,2,'',109.8000,'PCT','',NULL,NULL,'nan'),(464,420,4,4,2,'',109.8000,'PCT','',NULL,NULL,'nan'),(465,383,4,4,2,'',109.8000,'PCT','',NULL,NULL,'nan'),(466,368,4,4,2,'',109.8000,'PCT','',NULL,NULL,'nan'),(467,332,4,4,2,'',109.8000,'PCT','',NULL,NULL,'nan'),(468,315,4,4,2,'',109.8000,'PCT','',NULL,NULL,'nan'),(469,279,4,4,2,'',109.8000,'PCT','',NULL,NULL,'nan'),(470,263,4,4,2,'',109.8000,'PCT','',NULL,NULL,'nan'),(471,230,4,4,2,'',109.8000,'PCT','',NULL,NULL,'nan'),(472,216,4,4,2,'',109.8000,'PCT','',NULL,NULL,'nan'),(473,181,4,4,2,'',109.8000,'PCT','',NULL,NULL,'nan'),(474,166,4,4,2,'',109.8000,'PCT','',NULL,NULL,'nan'),(475,141,4,4,2,'',109.8000,'PCT','',NULL,NULL,'nan'),(476,129,4,4,2,'',109.8000,'PCT','',NULL,NULL,'nan'),(477,92,4,4,2,'',109.8000,'PCT','',NULL,NULL,'nan'),(478,76,4,4,2,'',109.8000,'PCT','',NULL,NULL,'nan'),(479,40,4,4,2,'',109.8000,'PCT','',NULL,NULL,'nan'),(480,24,4,4,2,'',109.8000,'PCT','',NULL,NULL,'nan'),(481,2714,4,4,2,'',88.7000,'PCT','',NULL,NULL,'nan'),(482,2678,4,4,2,'',88.7000,'PCT','',NULL,NULL,'nan'),(483,2662,4,4,2,'',88.7000,'PCT','',NULL,NULL,'nan'),(484,2625,4,4,2,'',88.7000,'PCT','',NULL,NULL,'nan'),(485,2610,4,4,2,'',88.7000,'PCT','',NULL,NULL,'nan'),(486,2573,4,4,2,'',88.7000,'PCT','',NULL,NULL,'nan'),(487,2558,4,4,2,'',88.7000,'PCT','',NULL,NULL,'nan'),(488,2486,4,4,2,'',88.7000,'PCT','',NULL,NULL,'nan'),(489,2443,4,4,2,'',88.7000,'PCT','',NULL,NULL,'nan'),(490,2428,4,4,2,'',88.7000,'PCT','',NULL,NULL,'nan'),(491,2391,4,4,2,'',88.7000,'PCT','',NULL,NULL,'nan'),(492,2367,4,4,2,'',88.7000,'PCT','',NULL,NULL,'nan'),(493,2339,4,4,2,'',88.7000,'PCT','',NULL,NULL,'nan'),(494,2324,4,4,2,'',88.7000,'PCT','',NULL,NULL,'nan'),(495,2275,4,4,2,'',88.7000,'PCT','',NULL,NULL,'nan'),(496,2226,4,4,2,'',88.7000,'PCT','',NULL,NULL,'nan'),(497,2152,4,4,2,'',88.7000,'PCT','',NULL,NULL,'nan'),(498,2137,4,4,2,'',88.7000,'PCT','',NULL,NULL,'nan'),(499,2100,4,4,2,'',88.7000,'PCT','',NULL,NULL,'nan'),(500,2085,4,4,2,'',88.7000,'PCT','',NULL,NULL,'nan'),(501,2048,4,4,2,'',88.7000,'PCT','',NULL,NULL,'nan'),(502,667,4,4,2,'',88.7000,'PCT','',NULL,NULL,'nan'),(503,631,4,4,2,'',88.7000,'PCT','',NULL,NULL,'nan'),(504,615,4,4,2,'',88.7000,'PCT','',NULL,NULL,'nan'),(505,578,4,4,2,'',88.7000,'PCT','',NULL,NULL,'nan'),(506,563,4,4,2,'',88.7000,'PCT','',NULL,NULL,'nan'),(507,526,4,4,2,'',88.7000,'PCT','',NULL,NULL,'nan'),(508,511,4,4,2,'',88.7000,'PCT','',NULL,NULL,'nan'),(509,439,4,4,2,'',88.7000,'PCT','',NULL,NULL,'nan'),(510,396,4,4,2,'',88.7000,'PCT','',NULL,NULL,'nan'),(511,381,4,4,2,'',88.7000,'PCT','',NULL,NULL,'nan'),(512,344,4,4,2,'',88.7000,'PCT','',NULL,NULL,'nan'),(513,320,4,4,2,'',88.7000,'PCT','',NULL,NULL,'nan'),(514,292,4,4,2,'',88.7000,'PCT','',NULL,NULL,'nan'),(515,277,4,4,2,'',88.7000,'PCT','',NULL,NULL,'nan'),(516,228,4,4,2,'',88.7000,'PCT','',NULL,NULL,'nan'),(517,179,4,4,2,'',88.7000,'PCT','',NULL,NULL,'nan'),(518,105,4,4,2,'',88.7000,'PCT','',NULL,NULL,'nan'),(519,90,4,4,2,'',88.7000,'PCT','',NULL,NULL,'nan'),(520,53,4,4,2,'',88.7000,'PCT','',NULL,NULL,'nan'),(521,38,4,4,2,'',88.7000,'PCT','',NULL,NULL,'nan'),(522,1,4,4,2,'',88.7000,'PCT','',NULL,NULL,'nan'),(523,2713,4,4,2,'',87.9000,'PCT','',NULL,NULL,'nan'),(524,2677,4,4,2,'',87.9000,'PCT','',NULL,NULL,'nan'),(525,2661,4,4,2,'',87.9000,'PCT','',NULL,NULL,'nan'),(526,2626,4,4,2,'',87.9000,'PCT','',NULL,NULL,'nan'),(527,2608,4,4,2,'',87.9000,'PCT','',NULL,NULL,'nan'),(528,2574,4,4,2,'',87.9000,'PCT','',NULL,NULL,'nan'),(529,2557,4,4,2,'',87.9000,'PCT','',NULL,NULL,'nan'),(530,2475,4,4,2,'',87.9000,'PCT','',NULL,NULL,'nan'),(531,2473,4,4,2,'',87.9000,'PCT','',NULL,NULL,'nan'),(532,2469,4,4,2,'',87.9000,'PCT','',NULL,NULL,'nan'),(533,2453,4,4,2,'',87.9000,'PCT','',NULL,NULL,'nan'),(534,2419,4,4,2,'',87.9000,'PCT','',NULL,NULL,'nan'),(535,2400,4,4,2,'',87.9000,'PCT','',NULL,NULL,'nan'),(536,2366,4,4,2,'',87.9000,'PCT','',NULL,NULL,'nan'),(537,2348,4,4,2,'',87.9000,'PCT','',NULL,NULL,'nan'),(538,2315,4,4,2,'',87.9000,'PCT','',NULL,NULL,'nan'),(539,2266,4,4,2,'',87.9000,'PCT','',NULL,NULL,'nan'),(540,2216,4,4,2,'',87.9000,'PCT','',NULL,NULL,'nan'),(541,2154,4,4,2,'',87.9000,'PCT','',NULL,NULL,'nan'),(542,2136,4,4,2,'',87.9000,'PCT','',NULL,NULL,'nan'),(543,2101,4,4,2,'',87.9000,'PCT','',NULL,NULL,'nan'),(544,2084,4,4,2,'',87.9000,'PCT','',NULL,NULL,'nan'),(545,2049,4,4,2,'',87.9000,'PCT','',NULL,NULL,'nan'),(546,666,4,4,2,'',87.9000,'PCT','',NULL,NULL,'nan'),(547,630,4,4,2,'',87.9000,'PCT','',NULL,NULL,'nan'),(548,614,4,4,2,'',87.9000,'PCT','',NULL,NULL,'nan'),(549,579,4,4,2,'',87.9000,'PCT','',NULL,NULL,'nan'),(550,561,4,4,2,'',87.9000,'PCT','',NULL,NULL,'nan'),(551,527,4,4,2,'',87.9000,'PCT','',NULL,NULL,'nan'),(552,510,4,4,2,'',87.9000,'PCT','',NULL,NULL,'nan'),(553,428,4,4,2,'',87.9000,'PCT','',NULL,NULL,'nan'),(554,426,4,4,2,'',87.9000,'PCT','',NULL,NULL,'nan'),(555,422,4,4,2,'',87.9000,'PCT','',NULL,NULL,'nan'),(556,406,4,4,2,'',87.9000,'PCT','',NULL,NULL,'nan'),(557,372,4,4,2,'',87.9000,'PCT','',NULL,NULL,'nan'),(558,353,4,4,2,'',87.9000,'PCT','',NULL,NULL,'nan'),(559,319,4,4,2,'',87.9000,'PCT','',NULL,NULL,'nan'),(560,301,4,4,2,'',87.9000,'PCT','',NULL,NULL,'nan'),(561,268,4,4,2,'',87.9000,'PCT','',NULL,NULL,'nan'),(562,219,4,4,2,'',87.9000,'PCT','',NULL,NULL,'nan'),(563,169,4,4,2,'',87.9000,'PCT','',NULL,NULL,'nan'),(564,107,4,4,2,'',87.9000,'PCT','',NULL,NULL,'nan'),(565,89,4,4,2,'',87.9000,'PCT','',NULL,NULL,'nan'),(566,54,4,4,2,'',87.9000,'PCT','',NULL,NULL,'nan'),(567,37,4,4,2,'',87.9000,'PCT','',NULL,NULL,'nan'),(568,2,4,4,2,'',87.9000,'PCT','',NULL,NULL,'nan'),(569,2724,5,5,1,'',2.2030,'MG/L','',NULL,NULL,'nan'),(570,2693,5,5,1,'',2.2030,'MG/L','',NULL,NULL,'nan'),(571,2674,5,5,1,'',2.2030,'MG/L','',NULL,NULL,'nan'),(572,2641,5,5,1,'',2.2030,'MG/L','',NULL,NULL,'nan'),(573,2622,5,5,1,'',2.2030,'MG/L','',NULL,NULL,'nan'),(574,2587,5,5,1,'',2.2030,'MG/L','',NULL,NULL,'nan'),(575,2569,5,5,1,'',2.2030,'MG/L','',NULL,NULL,'nan'),(576,2536,5,5,1,'',2.2030,'MG/L','',NULL,NULL,'nan'),(577,2519,5,5,1,'',2.2030,'MG/L','',NULL,NULL,'nan'),(578,2490,5,5,1,'',2.2030,'MG/L','',NULL,NULL,'nan'),(579,2467,5,5,1,'',2.2030,'MG/L','',NULL,NULL,'nan'),(580,2430,5,5,1,'',2.2030,'MG/L','',NULL,NULL,'nan'),(581,2415,5,5,1,'',2.2030,'MG/L','',NULL,NULL,'nan'),(582,2379,5,5,1,'',2.2030,'MG/L','',NULL,NULL,'nan'),(583,2362,5,5,1,'',2.2030,'MG/L','',NULL,NULL,'nan'),(584,2326,5,5,1,'',2.2030,'MG/L','',NULL,NULL,'nan'),(585,2310,5,5,1,'',2.2030,'MG/L','',NULL,NULL,'nan'),(586,2277,5,5,1,'',2.2030,'MG/L','',NULL,NULL,'nan'),(587,2263,5,5,1,'',2.2030,'MG/L','',NULL,NULL,'nan'),(588,2228,5,5,1,'',2.2030,'MG/L','',NULL,NULL,'nan'),(589,2213,5,5,1,'',2.2030,'MG/L','',NULL,NULL,'nan'),(590,2188,5,5,1,'',2.2030,'MG/L','',NULL,NULL,'nan'),(591,2176,5,5,1,'',2.2030,'MG/L','',NULL,NULL,'nan'),(592,2139,5,5,1,'',2.2030,'MG/L','',NULL,NULL,'nan'),(593,2123,5,5,1,'',2.2030,'MG/L','',NULL,NULL,'nan'),(594,2087,5,5,1,'',2.2030,'MG/L','',NULL,NULL,'nan'),(595,2071,5,5,1,'',2.2030,'MG/L','',NULL,NULL,'nan'),(596,677,5,5,1,'',2.2030,'MG/L','',NULL,NULL,'nan'),(597,646,5,5,1,'',2.2030,'MG/L','',NULL,NULL,'nan'),(598,627,5,5,1,'',2.2030,'MG/L','',NULL,NULL,'nan'),(599,594,5,5,1,'',2.2030,'MG/L','',NULL,NULL,'nan'),(600,575,5,5,1,'',2.2030,'MG/L','',NULL,NULL,'nan'),(601,540,5,5,1,'',2.2030,'MG/L','',NULL,NULL,'nan'),(602,522,5,5,1,'',2.2030,'MG/L','',NULL,NULL,'nan'),(603,489,5,5,1,'',2.2030,'MG/L','',NULL,NULL,'nan'),(604,472,5,5,1,'',2.2030,'MG/L','',NULL,NULL,'nan'),(605,443,5,5,1,'',2.2030,'MG/L','',NULL,NULL,'nan'),(606,420,5,5,1,'',2.2030,'MG/L','',NULL,NULL,'nan'),(607,383,5,5,1,'',2.2030,'MG/L','',NULL,NULL,'nan'),(608,368,5,5,1,'',2.2030,'MG/L','',NULL,NULL,'nan'),(609,332,5,5,1,'',2.2030,'MG/L','',NULL,NULL,'nan'),(610,315,5,5,1,'',2.2030,'MG/L','',NULL,NULL,'nan'),(611,279,5,5,1,'',2.2030,'MG/L','',NULL,NULL,'nan'),(612,263,5,5,1,'',2.2030,'MG/L','',NULL,NULL,'nan'),(613,230,5,5,1,'',2.2030,'MG/L','',NULL,NULL,'nan'),(614,216,5,5,1,'',2.2030,'MG/L','',NULL,NULL,'nan'),(615,181,5,5,1,'',2.2030,'MG/L','',NULL,NULL,'nan'),(616,166,5,5,1,'',2.2030,'MG/L','',NULL,NULL,'nan'),(617,141,5,5,1,'',2.2030,'MG/L','',NULL,NULL,'nan'),(618,129,5,5,1,'',2.2030,'MG/L','',NULL,NULL,'nan'),(619,92,5,5,1,'',2.2030,'MG/L','',NULL,NULL,'nan'),(620,76,5,5,1,'',2.2030,'MG/L','',NULL,NULL,'nan'),(621,40,5,5,1,'',2.2030,'MG/L','',NULL,NULL,'nan'),(622,24,5,5,1,'',2.2030,'MG/L','',NULL,NULL,'nan'),(623,2713,5,5,1,'',6.4270,'MG/L','',NULL,NULL,'nan'),(624,2677,5,5,1,'',6.4270,'MG/L','',NULL,NULL,'nan'),(625,2661,5,5,1,'',6.4270,'MG/L','',NULL,NULL,'nan'),(626,2626,5,5,1,'',6.4270,'MG/L','',NULL,NULL,'nan'),(627,2608,5,5,1,'',6.4270,'MG/L','',NULL,NULL,'nan'),(628,2574,5,5,1,'',6.4270,'MG/L','',NULL,NULL,'nan'),(629,2557,5,5,1,'',6.4270,'MG/L','',NULL,NULL,'nan'),(630,2475,5,5,1,'',6.4270,'MG/L','',NULL,NULL,'nan'),(631,2473,5,5,1,'',6.4270,'MG/L','',NULL,NULL,'nan'),(632,2469,5,5,1,'',6.4270,'MG/L','',NULL,NULL,'nan'),(633,2453,5,5,1,'',6.4270,'MG/L','',NULL,NULL,'nan'),(634,2419,5,5,1,'',6.4270,'MG/L','',NULL,NULL,'nan'),(635,2400,5,5,1,'',6.4270,'MG/L','',NULL,NULL,'nan'),(636,2366,5,5,1,'',6.4270,'MG/L','',NULL,NULL,'nan'),(637,2348,5,5,1,'',6.4270,'MG/L','',NULL,NULL,'nan'),(638,2315,5,5,1,'',6.4270,'MG/L','',NULL,NULL,'nan'),(639,2266,5,5,1,'',6.4270,'MG/L','',NULL,NULL,'nan'),(640,2216,5,5,1,'',6.4270,'MG/L','',NULL,NULL,'nan'),(641,2154,5,5,1,'',6.4270,'MG/L','',NULL,NULL,'nan'),(642,2136,5,5,1,'',6.4270,'MG/L','',NULL,NULL,'nan'),(643,2101,5,5,1,'',6.4270,'MG/L','',NULL,NULL,'nan'),(644,2084,5,5,1,'',6.4270,'MG/L','',NULL,NULL,'nan'),(645,2049,5,5,1,'',6.4270,'MG/L','',NULL,NULL,'nan'),(646,666,5,5,1,'',6.4270,'MG/L','',NULL,NULL,'nan'),(647,630,5,5,1,'',6.4270,'MG/L','',NULL,NULL,'nan'),(648,614,5,5,1,'',6.4270,'MG/L','',NULL,NULL,'nan'),(649,579,5,5,1,'',6.4270,'MG/L','',NULL,NULL,'nan'),(650,561,5,5,1,'',6.4270,'MG/L','',NULL,NULL,'nan'),(651,527,5,5,1,'',6.4270,'MG/L','',NULL,NULL,'nan'),(652,510,5,5,1,'',6.4270,'MG/L','',NULL,NULL,'nan'),(653,428,5,5,1,'',6.4270,'MG/L','',NULL,NULL,'nan'),(654,426,5,5,1,'',6.4270,'MG/L','',NULL,NULL,'nan'),(655,422,5,5,1,'',6.4270,'MG/L','',NULL,NULL,'nan'),(656,406,5,5,1,'',6.4270,'MG/L','',NULL,NULL,'nan'),(657,372,5,5,1,'',6.4270,'MG/L','',NULL,NULL,'nan'),(658,353,5,5,1,'',6.4270,'MG/L','',NULL,NULL,'nan'),(659,319,5,5,1,'',6.4270,'MG/L','',NULL,NULL,'nan'),(660,301,5,5,1,'',6.4270,'MG/L','',NULL,NULL,'nan'),(661,268,5,5,1,'',6.4270,'MG/L','',NULL,NULL,'nan'),(662,219,5,5,1,'',6.4270,'MG/L','',NULL,NULL,'nan'),(663,169,5,5,1,'',6.4270,'MG/L','',NULL,NULL,'nan'),(664,107,5,5,1,'',6.4270,'MG/L','',NULL,NULL,'nan'),(665,89,5,5,1,'',6.4270,'MG/L','',NULL,NULL,'nan'),(666,54,5,5,1,'',6.4270,'MG/L','',NULL,NULL,'nan'),(667,37,5,5,1,'',6.4270,'MG/L','',NULL,NULL,'nan'),(668,2,5,5,1,'',6.4270,'MG/L','',NULL,NULL,'nan'),(669,2714,5,5,1,'',1.6010,'MG/L','',NULL,NULL,'nan'),(670,2678,5,5,1,'',1.6010,'MG/L','',NULL,NULL,'nan'),(671,2662,5,5,1,'',1.6010,'MG/L','',NULL,NULL,'nan'),(672,2625,5,5,1,'',1.6010,'MG/L','',NULL,NULL,'nan'),(673,2610,5,5,1,'',1.6010,'MG/L','',NULL,NULL,'nan'),(674,2573,5,5,1,'',1.6010,'MG/L','',NULL,NULL,'nan'),(675,2558,5,5,1,'',1.6010,'MG/L','',NULL,NULL,'nan'),(676,2486,5,5,1,'',1.6010,'MG/L','',NULL,NULL,'nan'),(677,2443,5,5,1,'',1.6010,'MG/L','',NULL,NULL,'nan'),(678,2428,5,5,1,'',1.6010,'MG/L','',NULL,NULL,'nan'),(679,2391,5,5,1,'',1.6010,'MG/L','',NULL,NULL,'nan'),(680,2367,5,5,1,'',1.6010,'MG/L','',NULL,NULL,'nan'),(681,2339,5,5,1,'',1.6010,'MG/L','',NULL,NULL,'nan'),(682,2324,5,5,1,'',1.6010,'MG/L','',NULL,NULL,'nan'),(683,2275,5,5,1,'',1.6010,'MG/L','',NULL,NULL,'nan'),(684,2226,5,5,1,'',1.6010,'MG/L','',NULL,NULL,'nan'),(685,2152,5,5,1,'',1.6010,'MG/L','',NULL,NULL,'nan'),(686,2137,5,5,1,'',1.6010,'MG/L','',NULL,NULL,'nan'),(687,2100,5,5,1,'',1.6010,'MG/L','',NULL,NULL,'nan'),(688,2085,5,5,1,'',1.6010,'MG/L','',NULL,NULL,'nan'),(689,2048,5,5,1,'',1.6010,'MG/L','',NULL,NULL,'nan'),(690,667,5,5,1,'',1.6010,'MG/L','',NULL,NULL,'nan'),(691,631,5,5,1,'',1.6010,'MG/L','',NULL,NULL,'nan'),(692,615,5,5,1,'',1.6010,'MG/L','',NULL,NULL,'nan'),(693,578,5,5,1,'',1.6010,'MG/L','',NULL,NULL,'nan'),(694,563,5,5,1,'',1.6010,'MG/L','',NULL,NULL,'nan'),(695,526,5,5,1,'',1.6010,'MG/L','',NULL,NULL,'nan'),(696,511,5,5,1,'',1.6010,'MG/L','',NULL,NULL,'nan'),(697,439,5,5,1,'',1.6010,'MG/L','',NULL,NULL,'nan'),(698,396,5,5,1,'',1.6010,'MG/L','',NULL,NULL,'nan'),(699,381,5,5,1,'',1.6010,'MG/L','',NULL,NULL,'nan'),(700,344,5,5,1,'',1.6010,'MG/L','',NULL,NULL,'nan'),(701,320,5,5,1,'',1.6010,'MG/L','',NULL,NULL,'nan'),(702,292,5,5,1,'',1.6010,'MG/L','',NULL,NULL,'nan'),(703,277,5,5,1,'',1.6010,'MG/L','',NULL,NULL,'nan'),(704,228,5,5,1,'',1.6010,'MG/L','',NULL,NULL,'nan'),(705,179,5,5,1,'',1.6010,'MG/L','',NULL,NULL,'nan'),(706,105,5,5,1,'',1.6010,'MG/L','',NULL,NULL,'nan'),(707,90,5,5,1,'',1.6010,'MG/L','',NULL,NULL,'nan'),(708,53,5,5,1,'',1.6010,'MG/L','',NULL,NULL,'nan'),(709,38,5,5,1,'',1.6010,'MG/L','',NULL,NULL,'nan'),(710,1,5,5,1,'',1.6010,'MG/L','',NULL,NULL,'nan'),(711,2724,6,5,1,'<',1.0000,'MG/L','',NULL,NULL,'nan'),(712,2693,6,5,1,'<',1.0000,'MG/L','',NULL,NULL,'nan'),(713,2674,6,5,1,'<',1.0000,'MG/L','',NULL,NULL,'nan'),(714,2641,6,5,1,'<',1.0000,'MG/L','',NULL,NULL,'nan'),(715,2622,6,5,1,'<',1.0000,'MG/L','',NULL,NULL,'nan'),(716,2587,6,5,1,'<',1.0000,'MG/L','',NULL,NULL,'nan'),(717,2569,6,5,1,'<',1.0000,'MG/L','',NULL,NULL,'nan'),(718,2536,6,5,1,'<',1.0000,'MG/L','',NULL,NULL,'nan'),(719,2519,6,5,1,'<',1.0000,'MG/L','',NULL,NULL,'nan'),(720,2490,6,5,1,'<',1.0000,'MG/L','',NULL,NULL,'nan'),(721,2467,6,5,1,'<',1.0000,'MG/L','',NULL,NULL,'nan'),(722,2430,6,5,1,'<',1.0000,'MG/L','',NULL,NULL,'nan'),(723,2415,6,5,1,'<',1.0000,'MG/L','',NULL,NULL,'nan'),(724,2379,6,5,1,'<',1.0000,'MG/L','',NULL,NULL,'nan'),(725,2362,6,5,1,'<',1.0000,'MG/L','',NULL,NULL,'nan'),(726,2326,6,5,1,'<',1.0000,'MG/L','',NULL,NULL,'nan'),(727,2310,6,5,1,'<',1.0000,'MG/L','',NULL,NULL,'nan'),(728,2277,6,5,1,'<',1.0000,'MG/L','',NULL,NULL,'nan'),(729,2263,6,5,1,'<',1.0000,'MG/L','',NULL,NULL,'nan'),(730,2228,6,5,1,'<',1.0000,'MG/L','',NULL,NULL,'nan'),(731,2213,6,5,1,'<',1.0000,'MG/L','',NULL,NULL,'nan'),(732,2188,6,5,1,'<',1.0000,'MG/L','',NULL,NULL,'nan'),(733,2176,6,5,1,'<',1.0000,'MG/L','',NULL,NULL,'nan'),(734,2139,6,5,1,'<',1.0000,'MG/L','',NULL,NULL,'nan'),(735,2123,6,5,1,'<',1.0000,'MG/L','',NULL,NULL,'nan'),(736,2087,6,5,1,'<',1.0000,'MG/L','',NULL,NULL,'nan'),(737,2071,6,5,1,'<',1.0000,'MG/L','',NULL,NULL,'nan'),(738,677,6,5,1,'<',1.0000,'MG/L','',NULL,NULL,'nan'),(739,646,6,5,1,'<',1.0000,'MG/L','',NULL,NULL,'nan'),(740,627,6,5,1,'<',1.0000,'MG/L','',NULL,NULL,'nan'),(741,594,6,5,1,'<',1.0000,'MG/L','',NULL,NULL,'nan'),(742,575,6,5,1,'<',1.0000,'MG/L','',NULL,NULL,'nan'),(743,540,6,5,1,'<',1.0000,'MG/L','',NULL,NULL,'nan'),(744,522,6,5,1,'<',1.0000,'MG/L','',NULL,NULL,'nan'),(745,489,6,5,1,'<',1.0000,'MG/L','',NULL,NULL,'nan'),(746,472,6,5,1,'<',1.0000,'MG/L','',NULL,NULL,'nan'),(747,443,6,5,1,'<',1.0000,'MG/L','',NULL,NULL,'nan'),(748,420,6,5,1,'<',1.0000,'MG/L','',NULL,NULL,'nan'),(749,383,6,5,1,'<',1.0000,'MG/L','',NULL,NULL,'nan'),(750,368,6,5,1,'<',1.0000,'MG/L','',NULL,NULL,'nan'),(751,332,6,5,1,'<',1.0000,'MG/L','',NULL,NULL,'nan'),(752,315,6,5,1,'<',1.0000,'MG/L','',NULL,NULL,'nan'),(753,279,6,5,1,'<',1.0000,'MG/L','',NULL,NULL,'nan'),(754,263,6,5,1,'<',1.0000,'MG/L','',NULL,NULL,'nan'),(755,230,6,5,1,'<',1.0000,'MG/L','',NULL,NULL,'nan'),(756,216,6,5,1,'<',1.0000,'MG/L','',NULL,NULL,'nan'),(757,181,6,5,1,'<',1.0000,'MG/L','',NULL,NULL,'nan'),(758,166,6,5,1,'<',1.0000,'MG/L','',NULL,NULL,'nan'),(759,141,6,5,1,'<',1.0000,'MG/L','',NULL,NULL,'nan'),(760,129,6,5,1,'<',1.0000,'MG/L','',NULL,NULL,'nan'),(761,92,6,5,1,'<',1.0000,'MG/L','',NULL,NULL,'nan'),(762,76,6,5,1,'<',1.0000,'MG/L','',NULL,NULL,'nan'),(763,40,6,5,1,'<',1.0000,'MG/L','',NULL,NULL,'nan'),(764,24,6,5,1,'<',1.0000,'MG/L','',NULL,NULL,'nan'),(765,2724,7,2,1,'',51.9062,'MG/L','',NULL,NULL,'Standard Method 2340-B (calculated from Ca and Mg)'),(766,2693,7,2,1,'',51.9062,'MG/L','',NULL,NULL,'Standard Method 2340-B (calculated from Ca and Mg)'),(767,2674,7,2,1,'',51.9062,'MG/L','',NULL,NULL,'Standard Method 2340-B (calculated from Ca and Mg)'),(768,2641,7,2,1,'',51.9062,'MG/L','',NULL,NULL,'Standard Method 2340-B (calculated from Ca and Mg)'),(769,2622,7,2,1,'',51.9062,'MG/L','',NULL,NULL,'Standard Method 2340-B (calculated from Ca and Mg)'),(770,2587,7,2,1,'',51.9062,'MG/L','',NULL,NULL,'Standard Method 2340-B (calculated from Ca and Mg)'),(771,2569,7,2,1,'',51.9062,'MG/L','',NULL,NULL,'Standard Method 2340-B (calculated from Ca and Mg)'),(772,2536,7,2,1,'',51.9062,'MG/L','',NULL,NULL,'Standard Method 2340-B (calculated from Ca and Mg)'),(773,2519,7,2,1,'',51.9062,'MG/L','',NULL,NULL,'Standard Method 2340-B (calculated from Ca and Mg)'),(774,2490,7,2,1,'',51.9062,'MG/L','',NULL,NULL,'Standard Method 2340-B (calculated from Ca and Mg)'),(775,2467,7,2,1,'',51.9062,'MG/L','',NULL,NULL,'Standard Method 2340-B (calculated from Ca and Mg)'),(776,2430,7,2,1,'',51.9062,'MG/L','',NULL,NULL,'Standard Method 2340-B (calculated from Ca and Mg)'),(777,2415,7,2,1,'',51.9062,'MG/L','',NULL,NULL,'Standard Method 2340-B (calculated from Ca and Mg)'),(778,2379,7,2,1,'',51.9062,'MG/L','',NULL,NULL,'Standard Method 2340-B (calculated from Ca and Mg)'),(779,2362,7,2,1,'',51.9062,'MG/L','',NULL,NULL,'Standard Method 2340-B (calculated from Ca and Mg)'),(780,2326,7,2,1,'',51.9062,'MG/L','',NULL,NULL,'Standard Method 2340-B (calculated from Ca and Mg)'),(781,2310,7,2,1,'',51.9062,'MG/L','',NULL,NULL,'Standard Method 2340-B (calculated from Ca and Mg)'),(782,2277,7,2,1,'',51.9062,'MG/L','',NULL,NULL,'Standard Method 2340-B (calculated from Ca and Mg)'),(783,2263,7,2,1,'',51.9062,'MG/L','',NULL,NULL,'Standard Method 2340-B (calculated from Ca and Mg)'),(784,2228,7,2,1,'',51.9062,'MG/L','',NULL,NULL,'Standard Method 2340-B (calculated from Ca and Mg)'),(785,2213,7,2,1,'',51.9062,'MG/L','',NULL,NULL,'Standard Method 2340-B (calculated from Ca and Mg)'),(786,2188,7,2,1,'',51.9062,'MG/L','',NULL,NULL,'Standard Method 2340-B (calculated from Ca and Mg)'),(787,2176,7,2,1,'',51.9062,'MG/L','',NULL,NULL,'Standard Method 2340-B (calculated from Ca and Mg)'),(788,2139,7,2,1,'',51.9062,'MG/L','',NULL,NULL,'Standard Method 2340-B (calculated from Ca and Mg)'),(789,2123,7,2,1,'',51.9062,'MG/L','',NULL,NULL,'Standard Method 2340-B (calculated from Ca and Mg)'),(790,2087,7,2,1,'',51.9062,'MG/L','',NULL,NULL,'Standard Method 2340-B (calculated from Ca and Mg)'),(791,2071,7,2,1,'',51.9062,'MG/L','',NULL,NULL,'Standard Method 2340-B (calculated from Ca and Mg)'),(792,677,7,2,1,'',51.9062,'MG/L','',NULL,NULL,'Standard Method 2340-B (calculated from Ca and Mg)'),(793,646,7,2,1,'',51.9062,'MG/L','',NULL,NULL,'Standard Method 2340-B (calculated from Ca and Mg)'),(794,627,7,2,1,'',51.9062,'MG/L','',NULL,NULL,'Standard Method 2340-B (calculated from Ca and Mg)'),(795,594,7,2,1,'',51.9062,'MG/L','',NULL,NULL,'Standard Method 2340-B (calculated from Ca and Mg)'),(796,575,7,2,1,'',51.9062,'MG/L','',NULL,NULL,'Standard Method 2340-B (calculated from Ca and Mg)'),(797,540,7,2,1,'',51.9062,'MG/L','',NULL,NULL,'Standard Method 2340-B (calculated from Ca and Mg)'),(798,522,7,2,1,'',51.9062,'MG/L','',NULL,NULL,'Standard Method 2340-B (calculated from Ca and Mg)'),(799,489,7,2,1,'',51.9062,'MG/L','',NULL,NULL,'Standard Method 2340-B (calculated from Ca and Mg)'),(800,472,7,2,1,'',51.9062,'MG/L','',NULL,NULL,'Standard Method 2340-B (calculated from Ca and Mg)'),(801,443,7,2,1,'',51.9062,'MG/L','',NULL,NULL,'Standard Method 2340-B (calculated from Ca and Mg)'),(802,420,7,2,1,'',51.9062,'MG/L','',NULL,NULL,'Standard Method 2340-B (calculated from Ca and Mg)'),(803,383,7,2,1,'',51.9062,'MG/L','',NULL,NULL,'Standard Method 2340-B (calculated from Ca and Mg)'),(804,368,7,2,1,'',51.9062,'MG/L','',NULL,NULL,'Standard Method 2340-B (calculated from Ca and Mg)'),(805,332,7,2,1,'',51.9062,'MG/L','',NULL,NULL,'Standard Method 2340-B (calculated from Ca and Mg)'),(806,315,7,2,1,'',51.9062,'MG/L','',NULL,NULL,'Standard Method 2340-B (calculated from Ca and Mg)'),(807,279,7,2,1,'',51.9062,'MG/L','',NULL,NULL,'Standard Method 2340-B (calculated from Ca and Mg)'),(808,263,7,2,1,'',51.9062,'MG/L','',NULL,NULL,'Standard Method 2340-B (calculated from Ca and Mg)'),(809,230,7,2,1,'',51.9062,'MG/L','',NULL,NULL,'Standard Method 2340-B (calculated from Ca and Mg)'),(810,216,7,2,1,'',51.9062,'MG/L','',NULL,NULL,'Standard Method 2340-B (calculated from Ca and Mg)'),(811,181,7,2,1,'',51.9062,'MG/L','',NULL,NULL,'Standard Method 2340-B (calculated from Ca and Mg)'),(812,166,7,2,1,'',51.9062,'MG/L','',NULL,NULL,'Standard Method 2340-B (calculated from Ca and Mg)'),(813,141,7,2,1,'',51.9062,'MG/L','',NULL,NULL,'Standard Method 2340-B (calculated from Ca and Mg)'),(814,129,7,2,1,'',51.9062,'MG/L','',NULL,NULL,'Standard Method 2340-B (calculated from Ca and Mg)'),(815,92,7,2,1,'',51.9062,'MG/L','',NULL,NULL,'Standard Method 2340-B (calculated from Ca and Mg)'),(816,76,7,2,1,'',51.9062,'MG/L','',NULL,NULL,'Standard Method 2340-B (calculated from Ca and Mg)'),(817,40,7,2,1,'',51.9062,'MG/L','',NULL,NULL,'Standard Method 2340-B (calculated from Ca and Mg)'),(818,24,7,2,1,'',51.9062,'MG/L','',NULL,NULL,'Standard Method 2340-B (calculated from Ca and Mg)'),(819,2724,8,5,1,'<',2.4000,'MG/L','',NULL,NULL,'nan'),(820,2693,8,5,1,'<',2.4000,'MG/L','',NULL,NULL,'nan'),(821,2674,8,5,1,'<',2.4000,'MG/L','',NULL,NULL,'nan'),(822,2641,8,5,1,'<',2.4000,'MG/L','',NULL,NULL,'nan'),(823,2622,8,5,1,'<',2.4000,'MG/L','',NULL,NULL,'nan'),(824,2587,8,5,1,'<',2.4000,'MG/L','',NULL,NULL,'nan'),(825,2569,8,5,1,'<',2.4000,'MG/L','',NULL,NULL,'nan'),(826,2536,8,5,1,'<',2.4000,'MG/L','',NULL,NULL,'nan'),(827,2519,8,5,1,'<',2.4000,'MG/L','',NULL,NULL,'nan'),(828,2490,8,5,1,'<',2.4000,'MG/L','',NULL,NULL,'nan'),(829,2467,8,5,1,'<',2.4000,'MG/L','',NULL,NULL,'nan'),(830,2430,8,5,1,'<',2.4000,'MG/L','',NULL,NULL,'nan'),(831,2415,8,5,1,'<',2.4000,'MG/L','',NULL,NULL,'nan'),(832,2379,8,5,1,'<',2.4000,'MG/L','',NULL,NULL,'nan'),(833,2362,8,5,1,'<',2.4000,'MG/L','',NULL,NULL,'nan'),(834,2326,8,5,1,'<',2.4000,'MG/L','',NULL,NULL,'nan'),(835,2310,8,5,1,'<',2.4000,'MG/L','',NULL,NULL,'nan'),(836,2277,8,5,1,'<',2.4000,'MG/L','',NULL,NULL,'nan'),(837,2263,8,5,1,'<',2.4000,'MG/L','',NULL,NULL,'nan'),(838,2228,8,5,1,'<',2.4000,'MG/L','',NULL,NULL,'nan'),(839,2213,8,5,1,'<',2.4000,'MG/L','',NULL,NULL,'nan'),(840,2188,8,5,1,'<',2.4000,'MG/L','',NULL,NULL,'nan'),(841,2176,8,5,1,'<',2.4000,'MG/L','',NULL,NULL,'nan'),(842,2139,8,5,1,'<',2.4000,'MG/L','',NULL,NULL,'nan'),(843,2123,8,5,1,'<',2.4000,'MG/L','',NULL,NULL,'nan'),(844,2087,8,5,1,'<',2.4000,'MG/L','',NULL,NULL,'nan'),(845,2071,8,5,1,'<',2.4000,'MG/L','',NULL,NULL,'nan'),(846,677,8,5,1,'<',2.4000,'MG/L','',NULL,NULL,'nan'),(847,646,8,5,1,'<',2.4000,'MG/L','',NULL,NULL,'nan'),(848,627,8,5,1,'<',2.4000,'MG/L','',NULL,NULL,'nan'),(849,594,8,5,1,'<',2.4000,'MG/L','',NULL,NULL,'nan'),(850,575,8,5,1,'<',2.4000,'MG/L','',NULL,NULL,'nan'),(851,540,8,5,1,'<',2.4000,'MG/L','',NULL,NULL,'nan'),(852,522,8,5,1,'<',2.4000,'MG/L','',NULL,NULL,'nan'),(853,489,8,5,1,'<',2.4000,'MG/L','',NULL,NULL,'nan'),(854,472,8,5,1,'<',2.4000,'MG/L','',NULL,NULL,'nan'),(855,443,8,5,1,'<',2.4000,'MG/L','',NULL,NULL,'nan'),(856,420,8,5,1,'<',2.4000,'MG/L','',NULL,NULL,'nan'),(857,383,8,5,1,'<',2.4000,'MG/L','',NULL,NULL,'nan'),(858,368,8,5,1,'<',2.4000,'MG/L','',NULL,NULL,'nan'),(859,332,8,5,1,'<',2.4000,'MG/L','',NULL,NULL,'nan'),(860,315,8,5,1,'<',2.4000,'MG/L','',NULL,NULL,'nan'),(861,279,8,5,1,'<',2.4000,'MG/L','',NULL,NULL,'nan'),(862,263,8,5,1,'<',2.4000,'MG/L','',NULL,NULL,'nan'),(863,230,8,5,1,'<',2.4000,'MG/L','',NULL,NULL,'nan'),(864,216,8,5,1,'<',2.4000,'MG/L','',NULL,NULL,'nan'),(865,181,8,5,1,'<',2.4000,'MG/L','',NULL,NULL,'nan'),(866,166,8,5,1,'<',2.4000,'MG/L','',NULL,NULL,'nan'),(867,141,8,5,1,'<',2.4000,'MG/L','',NULL,NULL,'nan'),(868,129,8,5,1,'<',2.4000,'MG/L','',NULL,NULL,'nan'),(869,92,8,5,1,'<',2.4000,'MG/L','',NULL,NULL,'nan'),(870,76,8,5,1,'<',2.4000,'MG/L','',NULL,NULL,'nan'),(871,40,8,5,1,'<',2.4000,'MG/L','',NULL,NULL,'nan'),(872,24,8,5,1,'<',2.4000,'MG/L','',NULL,NULL,'nan'),(873,2714,8,5,1,'<',2.4000,'MG/L','',NULL,NULL,'nan'),(874,2678,8,5,1,'<',2.4000,'MG/L','',NULL,NULL,'nan'),(875,2662,8,5,1,'<',2.4000,'MG/L','',NULL,NULL,'nan'),(876,2625,8,5,1,'<',2.4000,'MG/L','',NULL,NULL,'nan'),(877,2610,8,5,1,'<',2.4000,'MG/L','',NULL,NULL,'nan'),(878,2573,8,5,1,'<',2.4000,'MG/L','',NULL,NULL,'nan'),(879,2558,8,5,1,'<',2.4000,'MG/L','',NULL,NULL,'nan'),(880,2486,8,5,1,'<',2.4000,'MG/L','',NULL,NULL,'nan'),(881,2443,8,5,1,'<',2.4000,'MG/L','',NULL,NULL,'nan'),(882,2428,8,5,1,'<',2.4000,'MG/L','',NULL,NULL,'nan'),(883,2391,8,5,1,'<',2.4000,'MG/L','',NULL,NULL,'nan'),(884,2367,8,5,1,'<',2.4000,'MG/L','',NULL,NULL,'nan'),(885,2339,8,5,1,'<',2.4000,'MG/L','',NULL,NULL,'nan'),(886,2324,8,5,1,'<',2.4000,'MG/L','',NULL,NULL,'nan'),(887,2275,8,5,1,'<',2.4000,'MG/L','',NULL,NULL,'nan'),(888,2226,8,5,1,'<',2.4000,'MG/L','',NULL,NULL,'nan'),(889,2152,8,5,1,'<',2.4000,'MG/L','',NULL,NULL,'nan'),(890,2137,8,5,1,'<',2.4000,'MG/L','',NULL,NULL,'nan'),(891,2100,8,5,1,'<',2.4000,'MG/L','',NULL,NULL,'nan'),(892,2085,8,5,1,'<',2.4000,'MG/L','',NULL,NULL,'nan'),(893,2048,8,5,1,'<',2.4000,'MG/L','',NULL,NULL,'nan'),(894,667,8,5,1,'<',2.4000,'MG/L','',NULL,NULL,'nan'),(895,631,8,5,1,'<',2.4000,'MG/L','',NULL,NULL,'nan'),(896,615,8,5,1,'<',2.4000,'MG/L','',NULL,NULL,'nan'),(897,578,8,5,1,'<',2.4000,'MG/L','',NULL,NULL,'nan'),(898,563,8,5,1,'<',2.4000,'MG/L','',NULL,NULL,'nan'),(899,526,8,5,1,'<',2.4000,'MG/L','',NULL,NULL,'nan'),(900,511,8,5,1,'<',2.4000,'MG/L','',NULL,NULL,'nan'),(901,439,8,5,1,'<',2.4000,'MG/L','',NULL,NULL,'nan'),(902,396,8,5,1,'<',2.4000,'MG/L','',NULL,NULL,'nan'),(903,381,8,5,1,'<',2.4000,'MG/L','',NULL,NULL,'nan'),(904,344,8,5,1,'<',2.4000,'MG/L','',NULL,NULL,'nan'),(905,320,8,5,1,'<',2.4000,'MG/L','',NULL,NULL,'nan'),(906,292,8,5,1,'<',2.4000,'MG/L','',NULL,NULL,'nan'),(907,277,8,5,1,'<',2.4000,'MG/L','',NULL,NULL,'nan'),(908,228,8,5,1,'<',2.4000,'MG/L','',NULL,NULL,'nan'),(909,179,8,5,1,'<',2.4000,'MG/L','',NULL,NULL,'nan'),(910,105,8,5,1,'<',2.4000,'MG/L','',NULL,NULL,'nan'),(911,90,8,5,1,'<',2.4000,'MG/L','',NULL,NULL,'nan'),(912,53,8,5,1,'<',2.4000,'MG/L','',NULL,NULL,'nan'),(913,38,8,5,1,'<',2.4000,'MG/L','',NULL,NULL,'nan'),(914,1,8,5,1,'<',2.4000,'MG/L','',NULL,NULL,'nan'),(915,2713,8,5,1,'<',2.4000,'MG/L','',NULL,NULL,'nan'),(916,2677,8,5,1,'<',2.4000,'MG/L','',NULL,NULL,'nan'),(917,2661,8,5,1,'<',2.4000,'MG/L','',NULL,NULL,'nan'),(918,2626,8,5,1,'<',2.4000,'MG/L','',NULL,NULL,'nan'),(919,2608,8,5,1,'<',2.4000,'MG/L','',NULL,NULL,'nan'),(920,2574,8,5,1,'<',2.4000,'MG/L','',NULL,NULL,'nan'),(921,2557,8,5,1,'<',2.4000,'MG/L','',NULL,NULL,'nan'),(922,2475,8,5,1,'<',2.4000,'MG/L','',NULL,NULL,'nan'),(923,2473,8,5,1,'<',2.4000,'MG/L','',NULL,NULL,'nan'),(924,2469,8,5,1,'<',2.4000,'MG/L','',NULL,NULL,'nan'),(925,2453,8,5,1,'<',2.4000,'MG/L','',NULL,NULL,'nan'),(926,2419,8,5,1,'<',2.4000,'MG/L','',NULL,NULL,'nan'),(927,2400,8,5,1,'<',2.4000,'MG/L','',NULL,NULL,'nan'),(928,2366,8,5,1,'<',2.4000,'MG/L','',NULL,NULL,'nan'),(929,2348,8,5,1,'<',2.4000,'MG/L','',NULL,NULL,'nan'),(930,2315,8,5,1,'<',2.4000,'MG/L','',NULL,NULL,'nan'),(931,2266,8,5,1,'<',2.4000,'MG/L','',NULL,NULL,'nan'),(932,2216,8,5,1,'<',2.4000,'MG/L','',NULL,NULL,'nan'),(933,2154,8,5,1,'<',2.4000,'MG/L','',NULL,NULL,'nan'),(934,2136,8,5,1,'<',2.4000,'MG/L','',NULL,NULL,'nan'),(935,2101,8,5,1,'<',2.4000,'MG/L','',NULL,NULL,'nan'),(936,2084,8,5,1,'<',2.4000,'MG/L','',NULL,NULL,'nan'),(937,2049,8,5,1,'<',2.4000,'MG/L','',NULL,NULL,'nan'),(938,666,8,5,1,'<',2.4000,'MG/L','',NULL,NULL,'nan'),(939,630,8,5,1,'<',2.4000,'MG/L','',NULL,NULL,'nan'),(940,614,8,5,1,'<',2.4000,'MG/L','',NULL,NULL,'nan'),(941,579,8,5,1,'<',2.4000,'MG/L','',NULL,NULL,'nan'),(942,561,8,5,1,'<',2.4000,'MG/L','',NULL,NULL,'nan'),(943,527,8,5,1,'<',2.4000,'MG/L','',NULL,NULL,'nan'),(944,510,8,5,1,'<',2.4000,'MG/L','',NULL,NULL,'nan'),(945,428,8,5,1,'<',2.4000,'MG/L','',NULL,NULL,'nan'),(946,426,8,5,1,'<',2.4000,'MG/L','',NULL,NULL,'nan'),(947,422,8,5,1,'<',2.4000,'MG/L','',NULL,NULL,'nan'),(948,406,8,5,1,'<',2.4000,'MG/L','',NULL,NULL,'nan'),(949,372,8,5,1,'<',2.4000,'MG/L','',NULL,NULL,'nan'),(950,353,8,5,1,'<',2.4000,'MG/L','',NULL,NULL,'nan'),(951,319,8,5,1,'<',2.4000,'MG/L','',NULL,NULL,'nan'),(952,301,8,5,1,'<',2.4000,'MG/L','',NULL,NULL,'nan'),(953,268,8,5,1,'<',2.4000,'MG/L','',NULL,NULL,'nan'),(954,219,8,5,1,'<',2.4000,'MG/L','',NULL,NULL,'nan'),(955,169,8,5,1,'<',2.4000,'MG/L','',NULL,NULL,'nan'),(956,107,8,5,1,'<',2.4000,'MG/L','',NULL,NULL,'nan'),(957,89,8,5,1,'<',2.4000,'MG/L','',NULL,NULL,'nan'),(958,54,8,5,1,'<',2.4000,'MG/L','',NULL,NULL,'nan'),(959,37,8,5,1,'<',2.4000,'MG/L','',NULL,NULL,'nan'),(960,2,8,5,1,'<',2.4000,'MG/L','',NULL,NULL,'nan'),(961,2724,9,5,1,'',0.0299,'MG/L','QQ',NULL,NULL,'nan'),(962,2693,9,5,1,'',0.0299,'MG/L','QQ',NULL,NULL,'nan'),(963,2674,9,5,1,'',0.0299,'MG/L','QQ',NULL,NULL,'nan'),(964,2641,9,5,1,'',0.0299,'MG/L','QQ',NULL,NULL,'nan'),(965,2622,9,5,1,'',0.0299,'MG/L','QQ',NULL,NULL,'nan'),(966,2587,9,5,1,'',0.0299,'MG/L','QQ',NULL,NULL,'nan'),(967,2569,9,5,1,'',0.0299,'MG/L','QQ',NULL,NULL,'nan'),(968,2536,9,5,1,'',0.0299,'MG/L','QQ',NULL,NULL,'nan'),(969,2519,9,5,1,'',0.0299,'MG/L','QQ',NULL,NULL,'nan'),(970,2490,9,5,1,'',0.0299,'MG/L','QQ',NULL,NULL,'nan'),(971,2467,9,5,1,'',0.0299,'MG/L','QQ',NULL,NULL,'nan'),(972,2430,9,5,1,'',0.0299,'MG/L','QQ',NULL,NULL,'nan'),(973,2415,9,5,1,'',0.0299,'MG/L','QQ',NULL,NULL,'nan'),(974,2379,9,5,1,'',0.0299,'MG/L','QQ',NULL,NULL,'nan'),(975,2362,9,5,1,'',0.0299,'MG/L','QQ',NULL,NULL,'nan'),(976,2326,9,5,1,'',0.0299,'MG/L','QQ',NULL,NULL,'nan'),(977,2310,9,5,1,'',0.0299,'MG/L','QQ',NULL,NULL,'nan'),(978,2277,9,5,1,'',0.0299,'MG/L','QQ',NULL,NULL,'nan'),(979,2263,9,5,1,'',0.0299,'MG/L','QQ',NULL,NULL,'nan'),(980,2228,9,5,1,'',0.0299,'MG/L','QQ',NULL,NULL,'nan'),(981,2213,9,5,1,'',0.0299,'MG/L','QQ',NULL,NULL,'nan'),(982,2188,9,5,1,'',0.0299,'MG/L','QQ',NULL,NULL,'nan'),(983,2176,9,5,1,'',0.0299,'MG/L','QQ',NULL,NULL,'nan'),(984,2139,9,5,1,'',0.0299,'MG/L','QQ',NULL,NULL,'nan'),(985,2123,9,5,1,'',0.0299,'MG/L','QQ',NULL,NULL,'nan'),(986,2087,9,5,1,'',0.0299,'MG/L','QQ',NULL,NULL,'nan'),(987,2071,9,5,1,'',0.0299,'MG/L','QQ',NULL,NULL,'nan'),(988,677,9,5,1,'',0.0299,'MG/L','QQ',NULL,NULL,'nan'),(989,646,9,5,1,'',0.0299,'MG/L','QQ',NULL,NULL,'nan'),(990,627,9,5,1,'',0.0299,'MG/L','QQ',NULL,NULL,'nan'),(991,594,9,5,1,'',0.0299,'MG/L','QQ',NULL,NULL,'nan'),(992,575,9,5,1,'',0.0299,'MG/L','QQ',NULL,NULL,'nan'),(993,540,9,5,1,'',0.0299,'MG/L','QQ',NULL,NULL,'nan'),(994,522,9,5,1,'',0.0299,'MG/L','QQ',NULL,NULL,'nan'),(995,489,9,5,1,'',0.0299,'MG/L','QQ',NULL,NULL,'nan'),(996,472,9,5,1,'',0.0299,'MG/L','QQ',NULL,NULL,'nan'),(997,443,9,5,1,'',0.0299,'MG/L','QQ',NULL,NULL,'nan'),(998,420,9,5,1,'',0.0299,'MG/L','QQ',NULL,NULL,'nan'),(999,383,9,5,1,'',0.0299,'MG/L','QQ',NULL,NULL,'nan'),(1000,368,9,5,1,'',0.0299,'MG/L','QQ',NULL,NULL,'nan'),(1001,332,9,5,1,'',0.0299,'MG/L','QQ',NULL,NULL,'nan'),(1002,315,9,5,1,'',0.0299,'MG/L','QQ',NULL,NULL,'nan'),(1003,279,9,5,1,'',0.0299,'MG/L','QQ',NULL,NULL,'nan'),(1004,263,9,5,1,'',0.0299,'MG/L','QQ',NULL,NULL,'nan'),(1005,230,9,5,1,'',0.0299,'MG/L','QQ',NULL,NULL,'nan'),(1006,216,9,5,1,'',0.0299,'MG/L','QQ',NULL,NULL,'nan'),(1007,181,9,5,1,'',0.0299,'MG/L','QQ',NULL,NULL,'nan'),(1008,166,9,5,1,'',0.0299,'MG/L','QQ',NULL,NULL,'nan'),(1009,141,9,5,1,'',0.0299,'MG/L','QQ',NULL,NULL,'nan'),(1010,129,9,5,1,'',0.0299,'MG/L','QQ',NULL,NULL,'nan'),(1011,92,9,5,1,'',0.0299,'MG/L','QQ',NULL,NULL,'nan'),(1012,76,9,5,1,'',0.0299,'MG/L','QQ',NULL,NULL,'nan'),(1013,40,9,5,1,'',0.0299,'MG/L','QQ',NULL,NULL,'nan'),(1014,24,9,5,1,'',0.0299,'MG/L','QQ',NULL,NULL,'nan'),(1015,2724,10,5,1,'',0.0274,'MG/L','',NULL,NULL,'nan'),(1016,2693,10,5,1,'',0.0274,'MG/L','',NULL,NULL,'nan'),(1017,2674,10,5,1,'',0.0274,'MG/L','',NULL,NULL,'nan'),(1018,2641,10,5,1,'',0.0274,'MG/L','',NULL,NULL,'nan'),(1019,2622,10,5,1,'',0.0274,'MG/L','',NULL,NULL,'nan'),(1020,2587,10,5,1,'',0.0274,'MG/L','',NULL,NULL,'nan'),(1021,2569,10,5,1,'',0.0274,'MG/L','',NULL,NULL,'nan'),(1022,2536,10,5,1,'',0.0274,'MG/L','',NULL,NULL,'nan'),(1023,2519,10,5,1,'',0.0274,'MG/L','',NULL,NULL,'nan'),(1024,2490,10,5,1,'',0.0274,'MG/L','',NULL,NULL,'nan'),(1025,2467,10,5,1,'',0.0274,'MG/L','',NULL,NULL,'nan'),(1026,2430,10,5,1,'',0.0274,'MG/L','',NULL,NULL,'nan'),(1027,2415,10,5,1,'',0.0274,'MG/L','',NULL,NULL,'nan'),(1028,2379,10,5,1,'',0.0274,'MG/L','',NULL,NULL,'nan'),(1029,2362,10,5,1,'',0.0274,'MG/L','',NULL,NULL,'nan'),(1030,2326,10,5,1,'',0.0274,'MG/L','',NULL,NULL,'nan'),(1031,2310,10,5,1,'',0.0274,'MG/L','',NULL,NULL,'nan'),(1032,2277,10,5,1,'',0.0274,'MG/L','',NULL,NULL,'nan'),(1033,2263,10,5,1,'',0.0274,'MG/L','',NULL,NULL,'nan'),(1034,2228,10,5,1,'',0.0274,'MG/L','',NULL,NULL,'nan'),(1035,2213,10,5,1,'',0.0274,'MG/L','',NULL,NULL,'nan'),(1036,2188,10,5,1,'',0.0274,'MG/L','',NULL,NULL,'nan'),(1037,2176,10,5,1,'',0.0274,'MG/L','',NULL,NULL,'nan'),(1038,2139,10,5,1,'',0.0274,'MG/L','',NULL,NULL,'nan'),(1039,2123,10,5,1,'',0.0274,'MG/L','',NULL,NULL,'nan'),(1040,2087,10,5,1,'',0.0274,'MG/L','',NULL,NULL,'nan'),(1041,2071,10,5,1,'',0.0274,'MG/L','',NULL,NULL,'nan'),(1042,677,10,5,1,'',0.0274,'MG/L','',NULL,NULL,'nan'),(1043,646,10,5,1,'',0.0274,'MG/L','',NULL,NULL,'nan'),(1044,627,10,5,1,'',0.0274,'MG/L','',NULL,NULL,'nan'),(1045,594,10,5,1,'',0.0274,'MG/L','',NULL,NULL,'nan'),(1046,575,10,5,1,'',0.0274,'MG/L','',NULL,NULL,'nan'),(1047,540,10,5,1,'',0.0274,'MG/L','',NULL,NULL,'nan'),(1048,522,10,5,1,'',0.0274,'MG/L','',NULL,NULL,'nan'),(1049,489,10,5,1,'',0.0274,'MG/L','',NULL,NULL,'nan'),(1050,472,10,5,1,'',0.0274,'MG/L','',NULL,NULL,'nan'),(1051,443,10,5,1,'',0.0274,'MG/L','',NULL,NULL,'nan'),(1052,420,10,5,1,'',0.0274,'MG/L','',NULL,NULL,'nan'),(1053,383,10,5,1,'',0.0274,'MG/L','',NULL,NULL,'nan'),(1054,368,10,5,1,'',0.0274,'MG/L','',NULL,NULL,'nan'),(1055,332,10,5,1,'',0.0274,'MG/L','',NULL,NULL,'nan'),(1056,315,10,5,1,'',0.0274,'MG/L','',NULL,NULL,'nan'),(1057,279,10,5,1,'',0.0274,'MG/L','',NULL,NULL,'nan'),(1058,263,10,5,1,'',0.0274,'MG/L','',NULL,NULL,'nan'),(1059,230,10,5,1,'',0.0274,'MG/L','',NULL,NULL,'nan'),(1060,216,10,5,1,'',0.0274,'MG/L','',NULL,NULL,'nan'),(1061,181,10,5,1,'',0.0274,'MG/L','',NULL,NULL,'nan'),(1062,166,10,5,1,'',0.0274,'MG/L','',NULL,NULL,'nan'),(1063,141,10,5,1,'',0.0274,'MG/L','',NULL,NULL,'nan'),(1064,129,10,5,1,'',0.0274,'MG/L','',NULL,NULL,'nan'),(1065,92,10,5,1,'',0.0274,'MG/L','',NULL,NULL,'nan'),(1066,76,10,5,1,'',0.0274,'MG/L','',NULL,NULL,'nan'),(1067,40,10,5,1,'',0.0274,'MG/L','',NULL,NULL,'nan'),(1068,24,10,5,1,'',0.0274,'MG/L','',NULL,NULL,'nan'),(1069,2714,10,5,1,'',0.0563,'MG/L','',NULL,NULL,'nan'),(1070,2678,10,5,1,'',0.0563,'MG/L','',NULL,NULL,'nan'),(1071,2662,10,5,1,'',0.0563,'MG/L','',NULL,NULL,'nan'),(1072,2625,10,5,1,'',0.0563,'MG/L','',NULL,NULL,'nan'),(1073,2610,10,5,1,'',0.0563,'MG/L','',NULL,NULL,'nan'),(1074,2573,10,5,1,'',0.0563,'MG/L','',NULL,NULL,'nan'),(1075,2558,10,5,1,'',0.0563,'MG/L','',NULL,NULL,'nan'),(1076,2486,10,5,1,'',0.0563,'MG/L','',NULL,NULL,'nan'),(1077,2443,10,5,1,'',0.0563,'MG/L','',NULL,NULL,'nan'),(1078,2428,10,5,1,'',0.0563,'MG/L','',NULL,NULL,'nan'),(1079,2391,10,5,1,'',0.0563,'MG/L','',NULL,NULL,'nan'),(1080,2367,10,5,1,'',0.0563,'MG/L','',NULL,NULL,'nan'),(1081,2339,10,5,1,'',0.0563,'MG/L','',NULL,NULL,'nan'),(1082,2324,10,5,1,'',0.0563,'MG/L','',NULL,NULL,'nan'),(1083,2275,10,5,1,'',0.0563,'MG/L','',NULL,NULL,'nan'),(1084,2226,10,5,1,'',0.0563,'MG/L','',NULL,NULL,'nan'),(1085,2152,10,5,1,'',0.0563,'MG/L','',NULL,NULL,'nan'),(1086,2137,10,5,1,'',0.0563,'MG/L','',NULL,NULL,'nan'),(1087,2100,10,5,1,'',0.0563,'MG/L','',NULL,NULL,'nan'),(1088,2085,10,5,1,'',0.0563,'MG/L','',NULL,NULL,'nan'),(1089,2048,10,5,1,'',0.0563,'MG/L','',NULL,NULL,'nan'),(1090,667,10,5,1,'',0.0563,'MG/L','',NULL,NULL,'nan'),(1091,631,10,5,1,'',0.0563,'MG/L','',NULL,NULL,'nan'),(1092,615,10,5,1,'',0.0563,'MG/L','',NULL,NULL,'nan'),(1093,578,10,5,1,'',0.0563,'MG/L','',NULL,NULL,'nan'),(1094,563,10,5,1,'',0.0563,'MG/L','',NULL,NULL,'nan'),(1095,526,10,5,1,'',0.0563,'MG/L','',NULL,NULL,'nan'),(1096,511,10,5,1,'',0.0563,'MG/L','',NULL,NULL,'nan'),(1097,439,10,5,1,'',0.0563,'MG/L','',NULL,NULL,'nan'),(1098,396,10,5,1,'',0.0563,'MG/L','',NULL,NULL,'nan'),(1099,381,10,5,1,'',0.0563,'MG/L','',NULL,NULL,'nan'),(1100,344,10,5,1,'',0.0563,'MG/L','',NULL,NULL,'nan'),(1101,320,10,5,1,'',0.0563,'MG/L','',NULL,NULL,'nan'),(1102,292,10,5,1,'',0.0563,'MG/L','',NULL,NULL,'nan'),(1103,277,10,5,1,'',0.0563,'MG/L','',NULL,NULL,'nan'),(1104,228,10,5,1,'',0.0563,'MG/L','',NULL,NULL,'nan'),(1105,179,10,5,1,'',0.0563,'MG/L','',NULL,NULL,'nan'),(1106,105,10,5,1,'',0.0563,'MG/L','',NULL,NULL,'nan'),(1107,90,10,5,1,'',0.0563,'MG/L','',NULL,NULL,'nan'),(1108,53,10,5,1,'',0.0563,'MG/L','',NULL,NULL,'nan'),(1109,38,10,5,1,'',0.0563,'MG/L','',NULL,NULL,'nan'),(1110,1,10,5,1,'',0.0563,'MG/L','',NULL,NULL,'nan'),(1111,2713,10,5,1,'',0.1878,'MG/L','',NULL,NULL,'nan'),(1112,2677,10,5,1,'',0.1878,'MG/L','',NULL,NULL,'nan'),(1113,2661,10,5,1,'',0.1878,'MG/L','',NULL,NULL,'nan'),(1114,2626,10,5,1,'',0.1878,'MG/L','',NULL,NULL,'nan'),(1115,2608,10,5,1,'',0.1878,'MG/L','',NULL,NULL,'nan'),(1116,2574,10,5,1,'',0.1878,'MG/L','',NULL,NULL,'nan'),(1117,2557,10,5,1,'',0.1878,'MG/L','',NULL,NULL,'nan'),(1118,2475,10,5,1,'',0.1878,'MG/L','',NULL,NULL,'nan'),(1119,2473,10,5,1,'',0.1878,'MG/L','',NULL,NULL,'nan'),(1120,2469,10,5,1,'',0.1878,'MG/L','',NULL,NULL,'nan'),(1121,2453,10,5,1,'',0.1878,'MG/L','',NULL,NULL,'nan'),(1122,2419,10,5,1,'',0.1878,'MG/L','',NULL,NULL,'nan'),(1123,2400,10,5,1,'',0.1878,'MG/L','',NULL,NULL,'nan'),(1124,2366,10,5,1,'',0.1878,'MG/L','',NULL,NULL,'nan'),(1125,2348,10,5,1,'',0.1878,'MG/L','',NULL,NULL,'nan'),(1126,2315,10,5,1,'',0.1878,'MG/L','',NULL,NULL,'nan'),(1127,2266,10,5,1,'',0.1878,'MG/L','',NULL,NULL,'nan'),(1128,2216,10,5,1,'',0.1878,'MG/L','',NULL,NULL,'nan'),(1129,2154,10,5,1,'',0.1878,'MG/L','',NULL,NULL,'nan'),(1130,2136,10,5,1,'',0.1878,'MG/L','',NULL,NULL,'nan'),(1131,2101,10,5,1,'',0.1878,'MG/L','',NULL,NULL,'nan'),(1132,2084,10,5,1,'',0.1878,'MG/L','',NULL,NULL,'nan'),(1133,2049,10,5,1,'',0.1878,'MG/L','',NULL,NULL,'nan'),(1134,666,10,5,1,'',0.1878,'MG/L','',NULL,NULL,'nan'),(1135,630,10,5,1,'',0.1878,'MG/L','',NULL,NULL,'nan'),(1136,614,10,5,1,'',0.1878,'MG/L','',NULL,NULL,'nan'),(1137,579,10,5,1,'',0.1878,'MG/L','',NULL,NULL,'nan'),(1138,561,10,5,1,'',0.1878,'MG/L','',NULL,NULL,'nan'),(1139,527,10,5,1,'',0.1878,'MG/L','',NULL,NULL,'nan'),(1140,510,10,5,1,'',0.1878,'MG/L','',NULL,NULL,'nan'),(1141,428,10,5,1,'',0.1878,'MG/L','',NULL,NULL,'nan'),(1142,426,10,5,1,'',0.1878,'MG/L','',NULL,NULL,'nan'),(1143,422,10,5,1,'',0.1878,'MG/L','',NULL,NULL,'nan'),(1144,406,10,5,1,'',0.1878,'MG/L','',NULL,NULL,'nan'),(1145,372,10,5,1,'',0.1878,'MG/L','',NULL,NULL,'nan'),(1146,353,10,5,1,'',0.1878,'MG/L','',NULL,NULL,'nan'),(1147,319,10,5,1,'',0.1878,'MG/L','',NULL,NULL,'nan'),(1148,301,10,5,1,'',0.1878,'MG/L','',NULL,NULL,'nan'),(1149,268,10,5,1,'',0.1878,'MG/L','',NULL,NULL,'nan'),(1150,219,10,5,1,'',0.1878,'MG/L','',NULL,NULL,'nan'),(1151,169,10,5,1,'',0.1878,'MG/L','',NULL,NULL,'nan'),(1152,107,10,5,1,'',0.1878,'MG/L','',NULL,NULL,'nan'),(1153,89,10,5,1,'',0.1878,'MG/L','',NULL,NULL,'nan'),(1154,54,10,5,1,'',0.1878,'MG/L','',NULL,NULL,'nan'),(1155,37,10,5,1,'',0.1878,'MG/L','',NULL,NULL,'nan'),(1156,2,10,5,1,'',0.1878,'MG/L','',NULL,NULL,'nan'),(1157,2724,11,5,1,'',3.5130,'MG/L','QQ',NULL,NULL,'nan'),(1158,2693,11,5,1,'',3.5130,'MG/L','QQ',NULL,NULL,'nan'),(1159,2674,11,5,1,'',3.5130,'MG/L','QQ',NULL,NULL,'nan'),(1160,2641,11,5,1,'',3.5130,'MG/L','QQ',NULL,NULL,'nan'),(1161,2622,11,5,1,'',3.5130,'MG/L','QQ',NULL,NULL,'nan'),(1162,2587,11,5,1,'',3.5130,'MG/L','QQ',NULL,NULL,'nan'),(1163,2569,11,5,1,'',3.5130,'MG/L','QQ',NULL,NULL,'nan'),(1164,2536,11,5,1,'',3.5130,'MG/L','QQ',NULL,NULL,'nan'),(1165,2519,11,5,1,'',3.5130,'MG/L','QQ',NULL,NULL,'nan'),(1166,2490,11,5,1,'',3.5130,'MG/L','QQ',NULL,NULL,'nan'),(1167,2467,11,5,1,'',3.5130,'MG/L','QQ',NULL,NULL,'nan'),(1168,2430,11,5,1,'',3.5130,'MG/L','QQ',NULL,NULL,'nan'),(1169,2415,11,5,1,'',3.5130,'MG/L','QQ',NULL,NULL,'nan'),(1170,2379,11,5,1,'',3.5130,'MG/L','QQ',NULL,NULL,'nan'),(1171,2362,11,5,1,'',3.5130,'MG/L','QQ',NULL,NULL,'nan'),(1172,2326,11,5,1,'',3.5130,'MG/L','QQ',NULL,NULL,'nan'),(1173,2310,11,5,1,'',3.5130,'MG/L','QQ',NULL,NULL,'nan'),(1174,2277,11,5,1,'',3.5130,'MG/L','QQ',NULL,NULL,'nan'),(1175,2263,11,5,1,'',3.5130,'MG/L','QQ',NULL,NULL,'nan'),(1176,2228,11,5,1,'',3.5130,'MG/L','QQ',NULL,NULL,'nan'),(1177,2213,11,5,1,'',3.5130,'MG/L','QQ',NULL,NULL,'nan'),(1178,2188,11,5,1,'',3.5130,'MG/L','QQ',NULL,NULL,'nan'),(1179,2176,11,5,1,'',3.5130,'MG/L','QQ',NULL,NULL,'nan'),(1180,2139,11,5,1,'',3.5130,'MG/L','QQ',NULL,NULL,'nan'),(1181,2123,11,5,1,'',3.5130,'MG/L','QQ',NULL,NULL,'nan'),(1182,2087,11,5,1,'',3.5130,'MG/L','QQ',NULL,NULL,'nan'),(1183,2071,11,5,1,'',3.5130,'MG/L','QQ',NULL,NULL,'nan'),(1184,677,11,5,1,'',3.5130,'MG/L','QQ',NULL,NULL,'nan'),(1185,646,11,5,1,'',3.5130,'MG/L','QQ',NULL,NULL,'nan'),(1186,627,11,5,1,'',3.5130,'MG/L','QQ',NULL,NULL,'nan'),(1187,594,11,5,1,'',3.5130,'MG/L','QQ',NULL,NULL,'nan'),(1188,575,11,5,1,'',3.5130,'MG/L','QQ',NULL,NULL,'nan'),(1189,540,11,5,1,'',3.5130,'MG/L','QQ',NULL,NULL,'nan'),(1190,522,11,5,1,'',3.5130,'MG/L','QQ',NULL,NULL,'nan'),(1191,489,11,5,1,'',3.5130,'MG/L','QQ',NULL,NULL,'nan'),(1192,472,11,5,1,'',3.5130,'MG/L','QQ',NULL,NULL,'nan'),(1193,443,11,5,1,'',3.5130,'MG/L','QQ',NULL,NULL,'nan'),(1194,420,11,5,1,'',3.5130,'MG/L','QQ',NULL,NULL,'nan'),(1195,383,11,5,1,'',3.5130,'MG/L','QQ',NULL,NULL,'nan'),(1196,368,11,5,1,'',3.5130,'MG/L','QQ',NULL,NULL,'nan'),(1197,332,11,5,1,'',3.5130,'MG/L','QQ',NULL,NULL,'nan'),(1198,315,11,5,1,'',3.5130,'MG/L','QQ',NULL,NULL,'nan'),(1199,279,11,5,1,'',3.5130,'MG/L','QQ',NULL,NULL,'nan'),(1200,263,11,5,1,'',3.5130,'MG/L','QQ',NULL,NULL,'nan'),(1201,230,11,5,1,'',3.5130,'MG/L','QQ',NULL,NULL,'nan'),(1202,216,11,5,1,'',3.5130,'MG/L','QQ',NULL,NULL,'nan'),(1203,181,11,5,1,'',3.5130,'MG/L','QQ',NULL,NULL,'nan'),(1204,166,11,5,1,'',3.5130,'MG/L','QQ',NULL,NULL,'nan'),(1205,141,11,5,1,'',3.5130,'MG/L','QQ',NULL,NULL,'nan'),(1206,129,11,5,1,'',3.5130,'MG/L','QQ',NULL,NULL,'nan'),(1207,92,11,5,1,'',3.5130,'MG/L','QQ',NULL,NULL,'nan'),(1208,76,11,5,1,'',3.5130,'MG/L','QQ',NULL,NULL,'nan'),(1209,40,11,5,1,'',3.5130,'MG/L','QQ',NULL,NULL,'nan'),(1210,24,11,5,1,'',3.5130,'MG/L','QQ',NULL,NULL,'nan'),(1211,2724,12,5,1,'',3.4970,'MG/L','',NULL,NULL,'nan'),(1212,2693,12,5,1,'',3.4970,'MG/L','',NULL,NULL,'nan'),(1213,2674,12,5,1,'',3.4970,'MG/L','',NULL,NULL,'nan'),(1214,2641,12,5,1,'',3.4970,'MG/L','',NULL,NULL,'nan'),(1215,2622,12,5,1,'',3.4970,'MG/L','',NULL,NULL,'nan'),(1216,2587,12,5,1,'',3.4970,'MG/L','',NULL,NULL,'nan'),(1217,2569,12,5,1,'',3.4970,'MG/L','',NULL,NULL,'nan'),(1218,2536,12,5,1,'',3.4970,'MG/L','',NULL,NULL,'nan'),(1219,2519,12,5,1,'',3.4970,'MG/L','',NULL,NULL,'nan'),(1220,2490,12,5,1,'',3.4970,'MG/L','',NULL,NULL,'nan'),(1221,2467,12,5,1,'',3.4970,'MG/L','',NULL,NULL,'nan'),(1222,2430,12,5,1,'',3.4970,'MG/L','',NULL,NULL,'nan'),(1223,2415,12,5,1,'',3.4970,'MG/L','',NULL,NULL,'nan'),(1224,2379,12,5,1,'',3.4970,'MG/L','',NULL,NULL,'nan'),(1225,2362,12,5,1,'',3.4970,'MG/L','',NULL,NULL,'nan'),(1226,2326,12,5,1,'',3.4970,'MG/L','',NULL,NULL,'nan'),(1227,2310,12,5,1,'',3.4970,'MG/L','',NULL,NULL,'nan'),(1228,2277,12,5,1,'',3.4970,'MG/L','',NULL,NULL,'nan'),(1229,2263,12,5,1,'',3.4970,'MG/L','',NULL,NULL,'nan'),(1230,2228,12,5,1,'',3.4970,'MG/L','',NULL,NULL,'nan'),(1231,2213,12,5,1,'',3.4970,'MG/L','',NULL,NULL,'nan'),(1232,2188,12,5,1,'',3.4970,'MG/L','',NULL,NULL,'nan'),(1233,2176,12,5,1,'',3.4970,'MG/L','',NULL,NULL,'nan'),(1234,2139,12,5,1,'',3.4970,'MG/L','',NULL,NULL,'nan'),(1235,2123,12,5,1,'',3.4970,'MG/L','',NULL,NULL,'nan'),(1236,2087,12,5,1,'',3.4970,'MG/L','',NULL,NULL,'nan'),(1237,2071,12,5,1,'',3.4970,'MG/L','',NULL,NULL,'nan'),(1238,677,12,5,1,'',3.4970,'MG/L','',NULL,NULL,'nan'),(1239,646,12,5,1,'',3.4970,'MG/L','',NULL,NULL,'nan'),(1240,627,12,5,1,'',3.4970,'MG/L','',NULL,NULL,'nan'),(1241,594,12,5,1,'',3.4970,'MG/L','',NULL,NULL,'nan'),(1242,575,12,5,1,'',3.4970,'MG/L','',NULL,NULL,'nan'),(1243,540,12,5,1,'',3.4970,'MG/L','',NULL,NULL,'nan'),(1244,522,12,5,1,'',3.4970,'MG/L','',NULL,NULL,'nan'),(1245,489,12,5,1,'',3.4970,'MG/L','',NULL,NULL,'nan'),(1246,472,12,5,1,'',3.4970,'MG/L','',NULL,NULL,'nan'),(1247,443,12,5,1,'',3.4970,'MG/L','',NULL,NULL,'nan'),(1248,420,12,5,1,'',3.4970,'MG/L','',NULL,NULL,'nan'),(1249,383,12,5,1,'',3.4970,'MG/L','',NULL,NULL,'nan'),(1250,368,12,5,1,'',3.4970,'MG/L','',NULL,NULL,'nan'),(1251,332,12,5,1,'',3.4970,'MG/L','',NULL,NULL,'nan'),(1252,315,12,5,1,'',3.4970,'MG/L','',NULL,NULL,'nan'),(1253,279,12,5,1,'',3.4970,'MG/L','',NULL,NULL,'nan'),(1254,263,12,5,1,'',3.4970,'MG/L','',NULL,NULL,'nan'),(1255,230,12,5,1,'',3.4970,'MG/L','',NULL,NULL,'nan'),(1256,216,12,5,1,'',3.4970,'MG/L','',NULL,NULL,'nan'),(1257,181,12,5,1,'',3.4970,'MG/L','',NULL,NULL,'nan'),(1258,166,12,5,1,'',3.4970,'MG/L','',NULL,NULL,'nan'),(1259,141,12,5,1,'',3.4970,'MG/L','',NULL,NULL,'nan'),(1260,129,12,5,1,'',3.4970,'MG/L','',NULL,NULL,'nan'),(1261,92,12,5,1,'',3.4970,'MG/L','',NULL,NULL,'nan'),(1262,76,12,5,1,'',3.4970,'MG/L','',NULL,NULL,'nan'),(1263,40,12,5,1,'',3.4970,'MG/L','',NULL,NULL,'nan'),(1264,24,12,5,1,'',3.4970,'MG/L','',NULL,NULL,'nan'),(1265,2714,12,5,1,'',4.2840,'MG/L','',NULL,NULL,'nan'),(1266,2678,12,5,1,'',4.2840,'MG/L','',NULL,NULL,'nan'),(1267,2662,12,5,1,'',4.2840,'MG/L','',NULL,NULL,'nan'),(1268,2625,12,5,1,'',4.2840,'MG/L','',NULL,NULL,'nan'),(1269,2610,12,5,1,'',4.2840,'MG/L','',NULL,NULL,'nan'),(1270,2573,12,5,1,'',4.2840,'MG/L','',NULL,NULL,'nan'),(1271,2558,12,5,1,'',4.2840,'MG/L','',NULL,NULL,'nan'),(1272,2486,12,5,1,'',4.2840,'MG/L','',NULL,NULL,'nan'),(1273,2443,12,5,1,'',4.2840,'MG/L','',NULL,NULL,'nan'),(1274,2428,12,5,1,'',4.2840,'MG/L','',NULL,NULL,'nan'),(1275,2391,12,5,1,'',4.2840,'MG/L','',NULL,NULL,'nan'),(1276,2367,12,5,1,'',4.2840,'MG/L','',NULL,NULL,'nan'),(1277,2339,12,5,1,'',4.2840,'MG/L','',NULL,NULL,'nan'),(1278,2324,12,5,1,'',4.2840,'MG/L','',NULL,NULL,'nan'),(1279,2275,12,5,1,'',4.2840,'MG/L','',NULL,NULL,'nan'),(1280,2226,12,5,1,'',4.2840,'MG/L','',NULL,NULL,'nan'),(1281,2152,12,5,1,'',4.2840,'MG/L','',NULL,NULL,'nan'),(1282,2137,12,5,1,'',4.2840,'MG/L','',NULL,NULL,'nan'),(1283,2100,12,5,1,'',4.2840,'MG/L','',NULL,NULL,'nan'),(1284,2085,12,5,1,'',4.2840,'MG/L','',NULL,NULL,'nan'),(1285,2048,12,5,1,'',4.2840,'MG/L','',NULL,NULL,'nan'),(1286,667,12,5,1,'',4.2840,'MG/L','',NULL,NULL,'nan'),(1287,631,12,5,1,'',4.2840,'MG/L','',NULL,NULL,'nan'),(1288,615,12,5,1,'',4.2840,'MG/L','',NULL,NULL,'nan'),(1289,578,12,5,1,'',4.2840,'MG/L','',NULL,NULL,'nan'),(1290,563,12,5,1,'',4.2840,'MG/L','',NULL,NULL,'nan'),(1291,526,12,5,1,'',4.2840,'MG/L','',NULL,NULL,'nan'),(1292,511,12,5,1,'',4.2840,'MG/L','',NULL,NULL,'nan'),(1293,439,12,5,1,'',4.2840,'MG/L','',NULL,NULL,'nan'),(1294,396,12,5,1,'',4.2840,'MG/L','',NULL,NULL,'nan'),(1295,381,12,5,1,'',4.2840,'MG/L','',NULL,NULL,'nan'),(1296,344,12,5,1,'',4.2840,'MG/L','',NULL,NULL,'nan'),(1297,320,12,5,1,'',4.2840,'MG/L','',NULL,NULL,'nan'),(1298,292,12,5,1,'',4.2840,'MG/L','',NULL,NULL,'nan'),(1299,277,12,5,1,'',4.2840,'MG/L','',NULL,NULL,'nan'),(1300,228,12,5,1,'',4.2840,'MG/L','',NULL,NULL,'nan'),(1301,179,12,5,1,'',4.2840,'MG/L','',NULL,NULL,'nan'),(1302,105,12,5,1,'',4.2840,'MG/L','',NULL,NULL,'nan'),(1303,90,12,5,1,'',4.2840,'MG/L','',NULL,NULL,'nan'),(1304,53,12,5,1,'',4.2840,'MG/L','',NULL,NULL,'nan'),(1305,38,12,5,1,'',4.2840,'MG/L','',NULL,NULL,'nan'),(1306,1,12,5,1,'',4.2840,'MG/L','',NULL,NULL,'nan'),(1307,2713,12,5,1,'',3.4320,'MG/L','QQ',NULL,NULL,'nan'),(1308,2677,12,5,1,'',3.4320,'MG/L','QQ',NULL,NULL,'nan'),(1309,2661,12,5,1,'',3.4320,'MG/L','QQ',NULL,NULL,'nan'),(1310,2626,12,5,1,'',3.4320,'MG/L','QQ',NULL,NULL,'nan'),(1311,2608,12,5,1,'',3.4320,'MG/L','QQ',NULL,NULL,'nan'),(1312,2574,12,5,1,'',3.4320,'MG/L','QQ',NULL,NULL,'nan'),(1313,2557,12,5,1,'',3.4320,'MG/L','QQ',NULL,NULL,'nan'),(1314,2475,12,5,1,'',3.4320,'MG/L','QQ',NULL,NULL,'nan'),(1315,2473,12,5,1,'',3.4320,'MG/L','QQ',NULL,NULL,'nan'),(1316,2469,12,5,1,'',3.4320,'MG/L','QQ',NULL,NULL,'nan'),(1317,2453,12,5,1,'',3.4320,'MG/L','QQ',NULL,NULL,'nan'),(1318,2419,12,5,1,'',3.4320,'MG/L','QQ',NULL,NULL,'nan'),(1319,2400,12,5,1,'',3.4320,'MG/L','QQ',NULL,NULL,'nan'),(1320,2366,12,5,1,'',3.4320,'MG/L','QQ',NULL,NULL,'nan'),(1321,2348,12,5,1,'',3.4320,'MG/L','QQ',NULL,NULL,'nan'),(1322,2315,12,5,1,'',3.4320,'MG/L','QQ',NULL,NULL,'nan'),(1323,2266,12,5,1,'',3.4320,'MG/L','QQ',NULL,NULL,'nan'),(1324,2216,12,5,1,'',3.4320,'MG/L','QQ',NULL,NULL,'nan'),(1325,2154,12,5,1,'',3.4320,'MG/L','QQ',NULL,NULL,'nan'),(1326,2136,12,5,1,'',3.4320,'MG/L','QQ',NULL,NULL,'nan'),(1327,2101,12,5,1,'',3.4320,'MG/L','QQ',NULL,NULL,'nan'),(1328,2084,12,5,1,'',3.4320,'MG/L','QQ',NULL,NULL,'nan'),(1329,2049,12,5,1,'',3.4320,'MG/L','QQ',NULL,NULL,'nan'),(1330,666,12,5,1,'',3.4320,'MG/L','QQ',NULL,NULL,'nan'),(1331,630,12,5,1,'',3.4320,'MG/L','QQ',NULL,NULL,'nan'),(1332,614,12,5,1,'',3.4320,'MG/L','QQ',NULL,NULL,'nan'),(1333,579,12,5,1,'',3.4320,'MG/L','QQ',NULL,NULL,'nan'),(1334,561,12,5,1,'',3.4320,'MG/L','QQ',NULL,NULL,'nan'),(1335,527,12,5,1,'',3.4320,'MG/L','QQ',NULL,NULL,'nan'),(1336,510,12,5,1,'',3.4320,'MG/L','QQ',NULL,NULL,'nan'),(1337,428,12,5,1,'',3.4320,'MG/L','QQ',NULL,NULL,'nan'),(1338,426,12,5,1,'',3.4320,'MG/L','QQ',NULL,NULL,'nan'),(1339,422,12,5,1,'',3.4320,'MG/L','QQ',NULL,NULL,'nan'),(1340,406,12,5,1,'',3.4320,'MG/L','QQ',NULL,NULL,'nan'),(1341,372,12,5,1,'',3.4320,'MG/L','QQ',NULL,NULL,'nan'),(1342,353,12,5,1,'',3.4320,'MG/L','QQ',NULL,NULL,'nan'),(1343,319,12,5,1,'',3.4320,'MG/L','QQ',NULL,NULL,'nan'),(1344,301,12,5,1,'',3.4320,'MG/L','QQ',NULL,NULL,'nan'),(1345,268,12,5,1,'',3.4320,'MG/L','QQ',NULL,NULL,'nan'),(1346,219,12,5,1,'',3.4320,'MG/L','QQ',NULL,NULL,'nan'),(1347,169,12,5,1,'',3.4320,'MG/L','QQ',NULL,NULL,'nan'),(1348,107,12,5,1,'',3.4320,'MG/L','QQ',NULL,NULL,'nan'),(1349,89,12,5,1,'',3.4320,'MG/L','QQ',NULL,NULL,'nan'),(1350,54,12,5,1,'',3.4320,'MG/L','QQ',NULL,NULL,'nan'),(1351,37,12,5,1,'',3.4320,'MG/L','QQ',NULL,NULL,'nan'),(1352,2,12,5,1,'',3.4320,'MG/L','QQ',NULL,NULL,'nan'),(1353,2724,13,3,2,'',6.9500,'SU','',NULL,NULL,'nan'),(1354,2693,13,3,2,'',6.9500,'SU','',NULL,NULL,'nan'),(1355,2674,13,3,2,'',6.9500,'SU','',NULL,NULL,'nan'),(1356,2641,13,3,2,'',6.9500,'SU','',NULL,NULL,'nan'),(1357,2622,13,3,2,'',6.9500,'SU','',NULL,NULL,'nan'),(1358,2587,13,3,2,'',6.9500,'SU','',NULL,NULL,'nan'),(1359,2569,13,3,2,'',6.9500,'SU','',NULL,NULL,'nan'),(1360,2536,13,3,2,'',6.9500,'SU','',NULL,NULL,'nan'),(1361,2519,13,3,2,'',6.9500,'SU','',NULL,NULL,'nan'),(1362,2490,13,3,2,'',6.9500,'SU','',NULL,NULL,'nan'),(1363,2467,13,3,2,'',6.9500,'SU','',NULL,NULL,'nan'),(1364,2430,13,3,2,'',6.9500,'SU','',NULL,NULL,'nan'),(1365,2415,13,3,2,'',6.9500,'SU','',NULL,NULL,'nan'),(1366,2379,13,3,2,'',6.9500,'SU','',NULL,NULL,'nan'),(1367,2362,13,3,2,'',6.9500,'SU','',NULL,NULL,'nan'),(1368,2326,13,3,2,'',6.9500,'SU','',NULL,NULL,'nan'),(1369,2310,13,3,2,'',6.9500,'SU','',NULL,NULL,'nan'),(1370,2277,13,3,2,'',6.9500,'SU','',NULL,NULL,'nan'),(1371,2263,13,3,2,'',6.9500,'SU','',NULL,NULL,'nan'),(1372,2228,13,3,2,'',6.9500,'SU','',NULL,NULL,'nan'),(1373,2213,13,3,2,'',6.9500,'SU','',NULL,NULL,'nan'),(1374,2188,13,3,2,'',6.9500,'SU','',NULL,NULL,'nan'),(1375,2176,13,3,2,'',6.9500,'SU','',NULL,NULL,'nan'),(1376,2139,13,3,2,'',6.9500,'SU','',NULL,NULL,'nan'),(1377,2123,13,3,2,'',6.9500,'SU','',NULL,NULL,'nan'),(1378,2087,13,3,2,'',6.9500,'SU','',NULL,NULL,'nan'),(1379,2071,13,3,2,'',6.9500,'SU','',NULL,NULL,'nan'),(1380,677,13,3,2,'',6.9500,'SU','',NULL,NULL,'nan'),(1381,646,13,3,2,'',6.9500,'SU','',NULL,NULL,'nan'),(1382,627,13,3,2,'',6.9500,'SU','',NULL,NULL,'nan'),(1383,594,13,3,2,'',6.9500,'SU','',NULL,NULL,'nan'),(1384,575,13,3,2,'',6.9500,'SU','',NULL,NULL,'nan'),(1385,540,13,3,2,'',6.9500,'SU','',NULL,NULL,'nan'),(1386,522,13,3,2,'',6.9500,'SU','',NULL,NULL,'nan'),(1387,489,13,3,2,'',6.9500,'SU','',NULL,NULL,'nan'),(1388,472,13,3,2,'',6.9500,'SU','',NULL,NULL,'nan'),(1389,443,13,3,2,'',6.9500,'SU','',NULL,NULL,'nan'),(1390,420,13,3,2,'',6.9500,'SU','',NULL,NULL,'nan'),(1391,383,13,3,2,'',6.9500,'SU','',NULL,NULL,'nan'),(1392,368,13,3,2,'',6.9500,'SU','',NULL,NULL,'nan'),(1393,332,13,3,2,'',6.9500,'SU','',NULL,NULL,'nan'),(1394,315,13,3,2,'',6.9500,'SU','',NULL,NULL,'nan'),(1395,279,13,3,2,'',6.9500,'SU','',NULL,NULL,'nan'),(1396,263,13,3,2,'',6.9500,'SU','',NULL,NULL,'nan'),(1397,230,13,3,2,'',6.9500,'SU','',NULL,NULL,'nan'),(1398,216,13,3,2,'',6.9500,'SU','',NULL,NULL,'nan'),(1399,181,13,3,2,'',6.9500,'SU','',NULL,NULL,'nan'),(1400,166,13,3,2,'',6.9500,'SU','',NULL,NULL,'nan'),(1401,141,13,3,2,'',6.9500,'SU','',NULL,NULL,'nan'),(1402,129,13,3,2,'',6.9500,'SU','',NULL,NULL,'nan'),(1403,92,13,3,2,'',6.9500,'SU','',NULL,NULL,'nan'),(1404,76,13,3,2,'',6.9500,'SU','',NULL,NULL,'nan'),(1405,40,13,3,2,'',6.9500,'SU','',NULL,NULL,'nan'),(1406,24,13,3,2,'',6.9500,'SU','',NULL,NULL,'nan'),(1407,2713,13,3,2,'',6.1300,'SU','',NULL,NULL,'nan'),(1408,2677,13,3,2,'',6.1300,'SU','',NULL,NULL,'nan'),(1409,2661,13,3,2,'',6.1300,'SU','',NULL,NULL,'nan'),(1410,2626,13,3,2,'',6.1300,'SU','',NULL,NULL,'nan'),(1411,2608,13,3,2,'',6.1300,'SU','',NULL,NULL,'nan'),(1412,2574,13,3,2,'',6.1300,'SU','',NULL,NULL,'nan'),(1413,2557,13,3,2,'',6.1300,'SU','',NULL,NULL,'nan'),(1414,2475,13,3,2,'',6.1300,'SU','',NULL,NULL,'nan'),(1415,2473,13,3,2,'',6.1300,'SU','',NULL,NULL,'nan'),(1416,2469,13,3,2,'',6.1300,'SU','',NULL,NULL,'nan'),(1417,2453,13,3,2,'',6.1300,'SU','',NULL,NULL,'nan'),(1418,2419,13,3,2,'',6.1300,'SU','',NULL,NULL,'nan'),(1419,2400,13,3,2,'',6.1300,'SU','',NULL,NULL,'nan'),(1420,2366,13,3,2,'',6.1300,'SU','',NULL,NULL,'nan'),(1421,2348,13,3,2,'',6.1300,'SU','',NULL,NULL,'nan'),(1422,2315,13,3,2,'',6.1300,'SU','',NULL,NULL,'nan'),(1423,2266,13,3,2,'',6.1300,'SU','',NULL,NULL,'nan'),(1424,2216,13,3,2,'',6.1300,'SU','',NULL,NULL,'nan'),(1425,2154,13,3,2,'',6.1300,'SU','',NULL,NULL,'nan'),(1426,2136,13,3,2,'',6.1300,'SU','',NULL,NULL,'nan'),(1427,2101,13,3,2,'',6.1300,'SU','',NULL,NULL,'nan'),(1428,2084,13,3,2,'',6.1300,'SU','',NULL,NULL,'nan'),(1429,2049,13,3,2,'',6.1300,'SU','',NULL,NULL,'nan'),(1430,666,13,3,2,'',6.1300,'SU','',NULL,NULL,'nan'),(1431,630,13,3,2,'',6.1300,'SU','',NULL,NULL,'nan'),(1432,614,13,3,2,'',6.1300,'SU','',NULL,NULL,'nan'),(1433,579,13,3,2,'',6.1300,'SU','',NULL,NULL,'nan'),(1434,561,13,3,2,'',6.1300,'SU','',NULL,NULL,'nan'),(1435,527,13,3,2,'',6.1300,'SU','',NULL,NULL,'nan'),(1436,510,13,3,2,'',6.1300,'SU','',NULL,NULL,'nan'),(1437,428,13,3,2,'',6.1300,'SU','',NULL,NULL,'nan'),(1438,426,13,3,2,'',6.1300,'SU','',NULL,NULL,'nan'),(1439,422,13,3,2,'',6.1300,'SU','',NULL,NULL,'nan'),(1440,406,13,3,2,'',6.1300,'SU','',NULL,NULL,'nan'),(1441,372,13,3,2,'',6.1300,'SU','',NULL,NULL,'nan'),(1442,353,13,3,2,'',6.1300,'SU','',NULL,NULL,'nan'),(1443,319,13,3,2,'',6.1300,'SU','',NULL,NULL,'nan'),(1444,301,13,3,2,'',6.1300,'SU','',NULL,NULL,'nan'),(1445,268,13,3,2,'',6.1300,'SU','',NULL,NULL,'nan'),(1446,219,13,3,2,'',6.1300,'SU','',NULL,NULL,'nan'),(1447,169,13,3,2,'',6.1300,'SU','',NULL,NULL,'nan'),(1448,107,13,3,2,'',6.1300,'SU','',NULL,NULL,'nan'),(1449,89,13,3,2,'',6.1300,'SU','',NULL,NULL,'nan'),(1450,54,13,3,2,'',6.1300,'SU','',NULL,NULL,'nan'),(1451,37,13,3,2,'',6.1300,'SU','',NULL,NULL,'nan'),(1452,2,13,3,2,'',6.1300,'SU','',NULL,NULL,'nan'),(1453,2714,13,3,2,'',6.3900,'SU','',NULL,NULL,'nan'),(1454,2678,13,3,2,'',6.3900,'SU','',NULL,NULL,'nan'),(1455,2662,13,3,2,'',6.3900,'SU','',NULL,NULL,'nan'),(1456,2625,13,3,2,'',6.3900,'SU','',NULL,NULL,'nan'),(1457,2610,13,3,2,'',6.3900,'SU','',NULL,NULL,'nan'),(1458,2573,13,3,2,'',6.3900,'SU','',NULL,NULL,'nan'),(1459,2558,13,3,2,'',6.3900,'SU','',NULL,NULL,'nan'),(1460,2486,13,3,2,'',6.3900,'SU','',NULL,NULL,'nan'),(1461,2443,13,3,2,'',6.3900,'SU','',NULL,NULL,'nan'),(1462,2428,13,3,2,'',6.3900,'SU','',NULL,NULL,'nan'),(1463,2391,13,3,2,'',6.3900,'SU','',NULL,NULL,'nan'),(1464,2367,13,3,2,'',6.3900,'SU','',NULL,NULL,'nan'),(1465,2339,13,3,2,'',6.3900,'SU','',NULL,NULL,'nan'),(1466,2324,13,3,2,'',6.3900,'SU','',NULL,NULL,'nan'),(1467,2275,13,3,2,'',6.3900,'SU','',NULL,NULL,'nan'),(1468,2226,13,3,2,'',6.3900,'SU','',NULL,NULL,'nan'),(1469,2152,13,3,2,'',6.3900,'SU','',NULL,NULL,'nan'),(1470,2137,13,3,2,'',6.3900,'SU','',NULL,NULL,'nan'),(1471,2100,13,3,2,'',6.3900,'SU','',NULL,NULL,'nan'),(1472,2085,13,3,2,'',6.3900,'SU','',NULL,NULL,'nan'),(1473,2048,13,3,2,'',6.3900,'SU','',NULL,NULL,'nan'),(1474,667,13,3,2,'',6.3900,'SU','',NULL,NULL,'nan'),(1475,631,13,3,2,'',6.3900,'SU','',NULL,NULL,'nan'),(1476,615,13,3,2,'',6.3900,'SU','',NULL,NULL,'nan'),(1477,578,13,3,2,'',6.3900,'SU','',NULL,NULL,'nan'),(1478,563,13,3,2,'',6.3900,'SU','',NULL,NULL,'nan'),(1479,526,13,3,2,'',6.3900,'SU','',NULL,NULL,'nan'),(1480,511,13,3,2,'',6.3900,'SU','',NULL,NULL,'nan'),(1481,439,13,3,2,'',6.3900,'SU','',NULL,NULL,'nan'),(1482,396,13,3,2,'',6.3900,'SU','',NULL,NULL,'nan'),(1483,381,13,3,2,'',6.3900,'SU','',NULL,NULL,'nan'),(1484,344,13,3,2,'',6.3900,'SU','',NULL,NULL,'nan'),(1485,320,13,3,2,'',6.3900,'SU','',NULL,NULL,'nan'),(1486,292,13,3,2,'',6.3900,'SU','',NULL,NULL,'nan'),(1487,277,13,3,2,'',6.3900,'SU','',NULL,NULL,'nan'),(1488,228,13,3,2,'',6.3900,'SU','',NULL,NULL,'nan'),(1489,179,13,3,2,'',6.3900,'SU','',NULL,NULL,'nan'),(1490,105,13,3,2,'',6.3900,'SU','',NULL,NULL,'nan'),(1491,90,13,3,2,'',6.3900,'SU','',NULL,NULL,'nan'),(1492,53,13,3,2,'',6.3900,'SU','',NULL,NULL,'nan'),(1493,38,13,3,2,'',6.3900,'SU','',NULL,NULL,'nan'),(1494,1,13,3,2,'',6.3900,'SU','',NULL,NULL,'nan'),(1495,2724,14,5,1,'G',0.0054,'MG/L','',NULL,NULL,'nan'),(1496,2693,14,5,1,'G',0.0054,'MG/L','',NULL,NULL,'nan'),(1497,2674,14,5,1,'G',0.0054,'MG/L','',NULL,NULL,'nan'),(1498,2641,14,5,1,'G',0.0054,'MG/L','',NULL,NULL,'nan'),(1499,2622,14,5,1,'G',0.0054,'MG/L','',NULL,NULL,'nan'),(1500,2587,14,5,1,'G',0.0054,'MG/L','',NULL,NULL,'nan'),(1501,2569,14,5,1,'G',0.0054,'MG/L','',NULL,NULL,'nan'),(1502,2536,14,5,1,'G',0.0054,'MG/L','',NULL,NULL,'nan'),(1503,2519,14,5,1,'G',0.0054,'MG/L','',NULL,NULL,'nan'),(1504,2490,14,5,1,'G',0.0054,'MG/L','',NULL,NULL,'nan'),(1505,2467,14,5,1,'G',0.0054,'MG/L','',NULL,NULL,'nan'),(1506,2430,14,5,1,'G',0.0054,'MG/L','',NULL,NULL,'nan'),(1507,2415,14,5,1,'G',0.0054,'MG/L','',NULL,NULL,'nan'),(1508,2379,14,5,1,'G',0.0054,'MG/L','',NULL,NULL,'nan'),(1509,2362,14,5,1,'G',0.0054,'MG/L','',NULL,NULL,'nan'),(1510,2326,14,5,1,'G',0.0054,'MG/L','',NULL,NULL,'nan'),(1511,2310,14,5,1,'G',0.0054,'MG/L','',NULL,NULL,'nan'),(1512,2277,14,5,1,'G',0.0054,'MG/L','',NULL,NULL,'nan'),(1513,2263,14,5,1,'G',0.0054,'MG/L','',NULL,NULL,'nan'),(1514,2228,14,5,1,'G',0.0054,'MG/L','',NULL,NULL,'nan'),(1515,2213,14,5,1,'G',0.0054,'MG/L','',NULL,NULL,'nan'),(1516,2188,14,5,1,'G',0.0054,'MG/L','',NULL,NULL,'nan'),(1517,2176,14,5,1,'G',0.0054,'MG/L','',NULL,NULL,'nan'),(1518,2139,14,5,1,'G',0.0054,'MG/L','',NULL,NULL,'nan'),(1519,2123,14,5,1,'G',0.0054,'MG/L','',NULL,